sentence1,sentence2,label
make vote ^ said word_“ but_i t_hesitate t submitted this_wallpaper painted me ended_up age personal_information t_take ’_t as_80 this_site,The new campaign comes just weeks after U.S. appeals court rulings requiring Internet service providers to identify subscribers suspected of illegally sharing music and movie files .,1
individuals president t_think which_is these_terms a_lot what_kind william coloring_pages ’_ll director t_forget bitcoin testing found_that,"And she has a boyfriend , officials said : Sgt. Ruben Contreras , who sat with her family today .",0
t_make more_over according are_often off must_be sell wide_range there_was shouldn_’ team you_can t remove,"The Government shut down in Washington , and federal offices were to remain closed yesterday .",1
that_it t_forget didn_’ bob_holden t_worry your_needs title how university you_think € blogs add call t,Gov. Bob Holden asked Bush to declare 39 Missouri counties disaster areas .,1
of are_able t_understand wide_variety “ al-amoudi help_you soon_as but_when would_love experience what_does opportunity t_mean couldn_’ here_are way_through comes t_want,The affidavit said Mr. al-Amoudi made at least 10 trips to Libya using one Yemeni and two U.S. passports .,1
have_been camera wide_variety something features will_need federal but_i t_see email_address information_about switch can_get prices is had,"And it can store more than a gigabyte of information - equivalent to 1,000 high quality images or around 12 hours of music - in just one cubic centimetre .",0
your_body i_got inch the_company united_states would_be look_forward engine largest delicious do_it year-old st team,An attempt to keep the fund open for another year fell flat in the Senate last month .,1
built painted ’_ll ”_as required a_few t_work as_“ credit_card € went contact_us designed our_website ’ t_need i_had t_always t_necessarily rowe_price soft_drugs why_did,"The coalition passed some of the world 's most progressive social legislation , legalising gay marriage and euthanasia .",0
we_went not t is_located join_us ”_said i_just t_want t_have t_want temperature look but him microwave can_help ”_that camera quote cells would_love but_i,"Passenger Keith Charlton , who also tackled the attacker , praised the efforts of the injured chief flight attendant .",1
where_he t_been select law s_attorney killed jordan_green i_am provide_you thank_you how what_they,"Jordan Green , O 'Brien 's private attorney , said he had no comment .",1
organization like important t_take quarter_rose bottom oil island ’_s range t_miss,Revenue rose 5.4 percent to $ 45.9 billion from $ 43.6 billion a year ago .,0
’ was touch what_you it_is such_as sun i_had t_think neck t_know 9266.51 personal_information,"The blue-chip Dow Jones industrial average < .DJI > slipped 44.32 points , or 0.48 percent , to 9,240.25 .",1
but_i regulations can_make designed you_are mountains t_stop fridge when_we t_take use 117.4 battle writing university my_favorite,She said she didn 't know yet whether she would certify the budget .,1
“ t_know vol yellow kids registered i_am the_author i_have € blog rs garden fig was t_really more_information this_post,""" Poland , Spain and Germany , were ready to talk about a deal , "" he said .",0
when_a_manager aren_’ t_have improve € youngster_was schools indoor t_miss prevent used not_limited ’_d please_note t_miss i_love she_was t_forget t_just by story please,"When the manager let him in the apartment , Brianna was in her mother 's bedroom lying in a baby 's bathtub , covered with a towel and watching cartoons .",1
t_be what_does t_meet pdf t_work if_you boil t_seem served_as may_have item ©_all who_was send spokesman_tom t_think who_are are,"We will accede to the request while we explore all of our options , "" said Russell Lewis , executive vice president of VeriSign 's Naming and Directory Services Group .",1
t_need make door thursday_said skin depending t_work it_is social_security stainless_steel email_address social_security â according t_even for_example asked your your t_be “ i_have university,"In a regulatory filing , EDS said the SEC had asked for information related to its troubled IT outsourcing contract with the US Navy .",1
is_one county °_c association didn_’ with city windows 24_hours i_am holidays talk_about output weight t_hesitate recipe see start call delicious during notice_that ’_s weight,"DB2 Cube Views automates the process of creating metadata by defining , describing , and indexing information in a database .",0
engineering your_skin malyasian earlier_this t_win where_he died wide_variety relevant lakeside_home many_ways get warm t_forget as_one t_allowed,"Razali Ismail met for 90 minutes with Suu Kyi , a 1991 winner of the Nobel Peace Prize , at her lakeside home , where she is under house arrest .",0
year-old has_been s_attorneys supreme_court spend insanity_defense t_forget thank residents do oven year-old left_him_unable recent_years with t_be station,"Malvo 's lawyers have presented an insanity defense , saying brainwashing by convicted sniper John Allen Muhammad left Malvo incapable of knowing right from wrong .",1
be is_that third_party lovely i_have i_can that_you available which_are t_seem you_are t_worry your_website removed re_really_interested pp,The amendment deals with the free exercise of religion versus the government establishment of a religion .,0
fruits ’ why_did communicate learning money is_currently is_“ kings_county_hospital without i_wanted ” faced ”_is let czartoryski during access,"The shooting victim was taken to Kings County Hospital Center , where he later died , the police said .",0
is you_know t didn_’ hasn_’ when_you you_can more_likely dinner i_bought large t_get skin passion “_we is_expected work,"Based on having at least one of these symptoms , most students were hung over between three and 11 times in the past year .",1
t_work t_have he_was your_home i_don't festivals t_stop about_how diameter t_waste t_need per_cent university md,"In his speech , Stern says his members are "" totally comfortable "" with Dean 's positions on health care issues .",1
by be but_i died users ’_d my treason_trial without fig t_forget highly_recommend can_be keep_your always_something_going when_i ” for_sale scored t jemaah islamiyah iphone,The secrecy surrounding terrorist group Jemaah Islamiyah was again smashed when witnesses from Malaysia testified in the treason trial of Abu Bakar Bashir .,0
has_been t marcel_desailly was_born not as_“ can_make please_note,"Marcel Desailly , the France captain and Chelsea defender , believes the latter is true .",0
have_been fig institute_says we_were says reduce was ! as_much can_only employees i_would looking install could delicious,But the institute says the department ‘ ‘ woefully underestimates ’ ’ the changes that would occur if the proposal is implemented .,1
prime_minister thank_you your_needs thank_you t pp couldn_’ your_home t_allowed that_i did_not skin,"By March 2003 , 67 percent of broadband users connected using cable modems , compared with 28 percent using D.S.L.",0
call_us think your_friends world t_think download t_just st und to_learn t_always opportunities has_been,"The largest supplier of medicines was Canada , followed by India , Thailand and the Philippines .",0
“ colors your_child t_even federal t_miss served companies animals rights_reserved you_are t_really t may_also,Authorities evacuated residents and closed off the road leading to Waterman Canyon .,1
used_as that_i players have_any ”_is have_any will_need if we_did hasn_’ say_“ ’_ve agricultural_reform “ said_gerry “ climate_change ”_said eu_agriculture seen_as fill_out would_have effects,"Gerry Kiely , a EU agriculture representative in Washington , said EU ministers were invited but canceled because the union is closing talks on agricultural reform .",1
they years_old i_will this_site your_order ”_says this_website national he_was free were depending personal_information m the_latest t_always chairman teaches says how_do template there_are noted_that you_can door you_think is_not will switch would_be technologies,"Andrew Sugden , an evolutionary biology expert and the international managing editor of Science , described the find as a "" milestone "" .",0
t_do road t_miss under use up said court fig,NASCAR officials could not be reached for comment Tuesday .,1
leather 4th_u t replaced road prices dry appeals_has ceo walking ip_address kids t_know in_accordance t_forget is_currently how_can ” too_much download red should_be t_know up lift,"The 4th U.S. Circuit Court of Appeals in Richmond , Va . , released the edited transcript of a closed hearing June 3 , which followed a public proceeding .",0
participants communication large would_love fatty_acids i_have are_available when_they maintenance make know as_“ lake law ” t_be your_home corner 988.61 policies,"The technology-laced Nasdaq Composite Index was down 25.36 points , or 1.53 percent , at 1,628.26 .",0
told inc building your_home $ more_information stainless_steel mode gave does_not pp aren_’ who_is i_felt credit_card when such_as cannot_be uk a_lot not_limited t_think high_school as_“ as_much way € t_like t_think,"Identical wording was introduced in the Senate last week by three Republicans : Wayne Allard of Colorado , Jeff Sessions of Alabama and Sam Brownback of Kansas .",1
delicious william_rehnquist make this_website 30 made_it personal_information opportunity which_are i_made located,His dissent was joined by Chief Justice William H. Rehnquist and Justice Clarence Thomas .,1
stainless_steel were et_al this_page california was_born t_changed coloring_pages t_worry de blues year-old blog_post,"They frequently tortured and shot prisoners , severing ears and scalps for souvenirs .",1
allows grow oven t_even troops_killed when_i this_entry etc services social served_as i've_been t_think did_not ltd wood international had_been did_not etc no_reason,"U.S. soldiers killed about two dozen suspected Taliban militants in southern Afghanistan after their convoy came under attack , the military said Sunday .",1
not_limited when visitor can_also with flowers after afternoon stainless_steel born credit_card this_product gold date thank_you t_really what_they written,"According to the State Department list , about 25 nations have signed bilateral agreements in the past four months , about half in the past three weeks .",1
students efficiency ” â discuss voter_id had_been t_even highly_recommend money years_old there_were rise vol is_perfect shall_be t_just assist_you united_states t on_top national i_was looks_like services individuals matter,""" The United States welcomes a greater NATO role in Iraq 's stabilization , "" Mr. Powell said in a speech to fellow NATO ministers .",1
think sign_up p diversity ” ”_i t_really t_even that_you question unemployment_fund kids st # please_note downtime_between eu t_even,France has a unique unemployment fund for artists that takes into account their downtime between shows .,0
t_require temperature skin size don't_know ”_i reached ’_m had_been s_risk t_just year offers t_even british_study can_also t_forget ” what_they innovation how_much,"A major British study has added to the evidence that hormone replacement therapy increases the risk of breast cancer , especially when women receive a combination of estrogen and progestin .",1
evaluation ’_t what_do m when him ve_heard add tool t_forget stainless_steel ’ gondii glass experience get_started mission countries installed it_has is music east supreme_court wood when_we call ”,""" I will pass on to him that Canada still remains a safe , secure and reliable supply of energy . """,1
says mr building what_does i_have due you_can t_take they_can t_take must_be please_contact alumni game day ” enlightened_self world 30_years colors t_want degree designed,"It is a benign web where we hope to catch investors and where each of us can advance our enlightened self-interest through cooperation with others , ' said Mr Goh .",1
died choose have_shown people promotion i'm remove slightly tube_channel has_worked t personal_information depending breakfast ’_ll surrounded guide an_article shall_be casino once_treated the_first summer during,"Adolescent specialist Dr. Michael Cohen , who worked on the study , said doctors had treated 8-year-old children with anorexia _ and that he had once treated a 4-year-old boy .",1
t_feel t_know you're_looking s_obvious user read page_automatically during guests new_york is_located what_do would_make had_been very_least its_own t_even any_questions,""" I think it 's obvious I 'm not riding as well as I have in years past .",1
salad t_like being t_think t_been t_get t_need is_located,One of those infected reported having recent contact with exotic animals there .,1
edge served_as t_have business body that_it development committee remove vs t_be roslynn mauskopf ’_ve isn_’ couldn_’ no_longer t_have what_does ’_t william_murphy comes,"On Friday , U.S. Attorney Roslynn Mauskopf said she would take over the probe from District Attorney William Murphy .",1
what_does gardens install look_forward taste m look_forward seems t t_need cannot_be not_been t_miss symptoms been thank_you small,"When I talked to him last time , did I think it was the end-all ?",1
t_be will_find said_that “_it t_have windows it_has already_soaked how_much ”_when their_own work_closely this_is t_really which_are already-swollen make_it grew_up t_take right,"Slow-moving , drenching Tropical Storm Henri doused an already soaked Florida on Friday , pushing heavy rains into areas where lakes and rivers were full to overflowing .",1
t_know was_born had_consolidated australia services printed you_are unique was_able,The case consolidated multiple purported class actions filed in 2001 .,1
bottom soft t_miss not_just personal_information t create t_seem and internet issue able personal_information send t_really known_as,He added Democrats are not going to make progress if we dont broaden the tent .,1
that_you that_you but_i please_note ” layer t_get beach any_time there_is t_really blog_post t_been disease personal_data t_really inch master tons what_do i_just date army we_got,"The MTA argued it needed to raise fares to close a two-year deficit it estimated , at different times , to be $ 952 million or $ 2.8 billion .",1
"when we_use oven can_also t_even explore returned front â 985,066 dr but is_just find_it is_located wherein voter_id 860,454 but_when","Through 2040 , Indiana 's population is expected to increase by about 19 percent , to more than 7.2 million people .",0
”_says mahoy information_about t_going t_always personal_data i_’ t_think degree i_have used can_lead death students when_we “ staff legislation_pending women what_does ™_s,"Dolores E. Mahoy , 68 , of Colorado Springs is just the type of person who might be helped by the legislation pending in Congress .",1
did_not god didn_’ t_know country_holds our_website has_been % customers rights_reserved enjoy residents t_confuse they i_had that_you wide_range “ front,"Italian Prime Minister Silvio Berlusconi , chairing the summit , said he was prepared to call an extra informal meeting of leaders next month on the constitution if necessary .",0
t_hesitate can_easily god when twitter co couldn_’ university t_think your_computer billion stainless_steel rights inc business wall_street t_want we_had t_take services human_rights,The group 's leadership in Gaza insisted on Tuesday that it was still committed to the ceasefire .,0
five_years “ help_you co t_let enjoy wasn_’ would_like climate_change $ i'm email speed see_what,"On Friday , authorities had said the state police would head the investigation .",0
°_c ”_said check_out got t_quite it_is t_be suctioned_out plastic fig wide_range 2018 front ’_s get stop et_al has_viewed ball t_miss t_hesitate t_have,"The skull is then punctured and the brain suctioned out , causing the skull to collapse and easing passage through the birth canal .",1
country has_worked t_just couldn_’ our_products t t_take patients ’_t panties would_love trump them t_always hope_you semen ™ wide_variety window me t ’_re church essays a made_it “ t_forget °_c t_think students as_closely called_“,""" The accuser arrived at the hospital wearing panties with someone else 's semen and sperm in them , not that of Mr. Bryant , correct ? """,1
my_first completed t_even benefit size t_get aren_’ called_“ has_worked would_not damages t_think t_been ” wear is_going peacekeeping_efforts t_just ’_m choose,Shinseki 's career included combat in Vietnam and head of U.S. peacekeeping efforts in Bosnia .,0
time finance can click i_was download t_miss way t_be t_like risk began butter can_provide southern_nebraska see_what northern_kansas grew_up this_is they_will need_it t_stop i_did our_website picture,"Up to a foot of rain and at least seven tornadoes pounded southern Nebraska and northern Kansas , killing a man and destroying at least four homes .",1
list seven may_not t_miss hair testing suppliers thank_you colors shall_be also_has alphabet_which has_worked click years_old you_are has_been,""" I fear on this occasion what happened is that those bits of the alphabet that supported the case were selected , "" he said .",1
adults president we_created is_made what third_party alcoa_inc have_done t_work keep so_much t t_always black t_been warm coloring_pages,Wall Street was also waiting for aluminum maker Alcoa Inc . ( nyse : PEP - news - people ) to report earnings after the close .,1
duisenberg 2018 top placeholder_page i_bought call but_i campus °_c et_al “ when_i was_going times ” is_that enjoy t_miss said took,European Central Bank President Wim Duisenberg said in a televised interview that it was too soon to discuss further interest rate cuts in the euro zone .,1
make very_happy ” our_clients had church date can_be start ’_ve t_get neither will_receive focusing writing,"On Monday , the number of SARS cases in China passed 5,000 , hitting a total of 5,013 .",0
my_first chief_insp 30_years least_once can_expect it_was death € opportunity t_help ideas didn_’ t_want much t_forget why_do t_worry,"Detective Chief Inspector Norman McKinlay , leading the investigation , said : "" There is evidence a body or bodies have been in this area .",1
here_are butter t_seem files what_does your_needs tuesday_but in_case say_“ delicious call_us inch had bottom t_see our_website did decided,"The show 's creator and executive producer , Phil Rosenthal , quipped in a statement : "" We had a big contract negotiation .",0
t flowers me t_like dry when_they t_forget ruling_would do future he learn_more we ” took you_can expertise did by “_it region “ known_as,"He added that the decision will "" throw a monkey wrench into the FCC 's efforts to develop a vitally important national broadband policy . """,1
lake shall_be software president hospital tonapi wasn_’ t i_bought i_was “_it fig one ^ killed sent,State interior ministry spokesman Vasant Pitke told Reuters that at least 42 people had been killed and 112 injured .,0
years_ago two_years will_receive did_not bring_this_project have wide_range when_i without need be ’_re one are_committed clinic type good_idea weekly_low t_know,"Mortgage rates around the country fell again this week , the ninth time this year rates have hit an all-time low .",1
on_top don_’ rights t_even insured_and_we walk how_can you de stainless_steel t_always allows_you ”_said commit davydenko t_miss winning great_place by_using company's_current_directors member taken length council “,""" I 'm still not red-hot favourite , "" Hewitt said after battling to down Davydenko 6-3 4-6 6-3 7-6 ( 7-5 ) on centre court .",0
harris_and_klebold ” m he_was member was_born how t_hesitate you_can word_“ t_think zip_code give_us size,"Harris and Klebold killed 12 students , a teacher and themselves at the school .",1
“ soon_as isn_’ can't_wait boil are_not if_you korean_nuclear_crisis experienced but_when,But the North Korean nuclear crisis has dominated his time in office .,0
aren_’ a_total director is_used pain but_i who_have t_know study t_work keep fig this_is fig devices serve fig,""" Then they moved inside the mosque and started firing on the people . """,1
countries posted i_love € aren_’ what_does not_only are_made fun death 30_years cannot_be on_behalf falise 25_years vintage add years_ago those_who wide_range t_necessarily = t_think your_favorite,""" It was a total mockery of justice , a parody , "" said Thierry Falise , a Belgian photographer , as he arrived here .",0
why_did ’_ve safe when credit_card look_forward my_first us30yt less_than type are_available tell_you doi she_was mr soon_as global t_miss organization your fig size after any_questions this_study would_be t_be,"The 30-year bond US30YT = RR jumped 20 / 32 , taking its yield to 4.14 percent from 4.18 percent .",0
called_“ north ’_m € cash chef attention shall_be trees i_started t_even 2019,The company is also testing its cancer drug Rituxan for use by rheumatoid arthritis patients .,1
i come university said dining_room i_love don't_think please_contact any_questions can_easily improve my_favorite grew_up ” as_possible t_have programs what_do best_quality t blog_post,"Spending on research and development is expected to be $ 4.4 billion for the year , compared with the previous expectation of $ 4.3 billion .",1
several_relatives will_not find_everything do_you bachelor but_i attack_were t_get young_people t_know member file t_allowed where_he pour god attended_the_trial t_seem,"Several relatives of Australian victims of the attack sat in the front row of the court , but few Balinese attended the trial .",1
t fig black t_take this_agreement us10yt fig ”_says vice_president battle career t_know in_order t_hesitate distance t_hesitate installed committee texture t_get $ t_think can_be inch note_that square_feet,The yield on the 10-year Treasury note rose to 4.46 % from 4.42 % late Thursday .,0
i_use attend aren_’ are_able ’_re are_you also_available my,The California Farm Bureau did not immediately have an official response to Tuesday 's ruling .,1
^ which_can ” t_forget vice_president personal_information updated last_year for_rent eat t_take t t_see t_be fellowship isn_’ thank_you altitude our_clients highest my_favorite light ”_said en,"U.S. corporate bond yield spreads ended mostly tighter amid slumping Treasuries on Tuesday , while bonds of tobacco firms widened significantly after an adverse legal ruling on Philip Morris USA .",1
t_think rowe_price called_“ â acres “_it project ? s_sales can we_offer living_room,He also objects to the sales and personal income tax increases in the package .,0
€ may_also encourage until_you we_had show_that office-loaded t_be god each strength word_“ techniques rights_reserved approved t_just this_site,"Buyers can now choose a Windows- and Office-loaded desktop for 12,390 baht ( US $ 298 ) , excluding taxes , the report said .",1
church body was_used ios you t_get ’_ve my why_do “_we court there's wrote,Astronomers have found the oldest and most distant planet known in the universe .,1
t_get as_“ lack rise flexible university spa known_as students_who isn_’ did here_are they_will was_not it_has is_expected,""" The fact is , this was a program that was built for concealment .",0
30_years aren_’ symptoms number online letter important “_what t_get blog melena you'd_like row t_just date melena door m would_love email_address narcisco del_angel understanding search dinner dining_room,"The Tarrant County Medical Examiner 's Office has identified the deceased passengers at the scene as Angel Melena , 25 , and Narcisco Del-Angel Lozano , 34 .",1
™ building political t_stop engineering god ca gas more_than go_through government wasn_’ phone_number exterior she_was i_am t_think m patients own button,"NITED NATIONS , Aug. 26 International inspectors have found traces of highly enriched uranium at an Iranian facility , according to a new confidential report distributed today .",0
called_“ ! we_need used call files ’_m t_really ! require electric climate_change t_use not_limited,Nelson stared down referee Joey Crawford during a timeout with 2 : 46 left in the first quarter and San Antonio leading 26-16 .,0
"t_be but_when you_know as_“ check_out walls up be would_have our_clients after airport t_make t_forget per_cent 361,400 world","In his new position , Dynes will earn $ 395,000 , a significant increase over Atkinson 's salary of $ 361,400 .",1
he_said thanks disease t_even death stock_exchange_trading two_years human court 44.01 can_be,"In morning trading on the New York Stock Exchange , Coca-Cola shares were down 34 cents at $ 43.67 .",0
heat was_going click living_room discover these_terms want thanks t ’_ve thanks t,""" Qualcomm has enjoyed many years of selling ... against little or no competition , "" Hubach said in the statement .",1
united_states install on_friday months_ago t_think t_even land dr call_us alumni how_much thomson_first_call rights_reserved,"Wall Street analysts had expected 22 cents a share , according to Thomson First Call .",1
say_“ bed check_out what coloring_pages based stainless_steel finest °_c ’ better_than as_part government t_mean spent but_also he_has your customer_service can_be,"Full classes of 48 each are booked through the end of September , he said , and the agency plans to double its classes in January .",1
women is_designed that_the_monument sea people_who this_course t_just dining_room doi i_am,The federal courts have ruled that the monument violates the constitutional ban against state-established religion .,0
