sentence1,sentence2,label
t_have his_first t_work national it meetings was_born that_it why_do sales inner role your_needs size recipe t_do largest t_know butter t_miss voter_id commonstore sauce gondii,"Big Blue will integrate Adobe 's Form Server , Form Designer and Reader products with its DB2 Content Manager and DB2 CommonStore products designed for businesses .",1
if climate_change ”_that dinner an_article committee ” dr t_let call_us rain law evening,Now research by Melbourne 's Alfred Hospital will change how the public and doctors check for melanomas .,1
also_has why services 114.7 i_started said for_sale not_limited has_been they're t_be_happier to_achieve will_be is_located 403.7 home we,"Spider-Man , rated PG-13 , snatched $ 114.7 million in its first weekend and went on to take in $ 403.7 million .",1
t_allowed national_park t_want these_terms tradition t_get their_own you important what_do durability customer_service bottom t_matter galardi t_always not_limited should_not clear_that book oil bar_and_pool hall_in_downtown will_give assessment,"In Las Vegas , federal agents stormed two clubs - Cheetah 's and Jaguars - along with Galardi Enterprises , an office atop a bar in downtown .",1
called_“ your_child ” numerous t_always council we_take t_been t_think thank_you pour nc,"The submission was on Monday , but the announcement was made Friday at the International Broadcasting Convention in Amsterdam .",0
agreement high_school shall_be but_i t_going und university how_many release_data he_is highest museum what_does see_you increase air_conditioning temperature,"Because of the holidays , CDC is not releasing data from the period since Dec. 27 until today .",1
residents said_it_believes stainless_steel expected request zip_code offers ”_says analysis sec_investigation didn_’ trees wiring_diagram best_quality high worry_about when will_be ™ this_site is_going t_know protect skills protein four,"The company added : "" IBM believes that the investigation arises from a separate investigation by the SEC of a customer of IBM 's Retail Store Solutions unit .",1
expertise gives_you °_c 2018 st stir hiking agreement years_ago released god engaged_in_is enjoy happy t_miss alumni we_went company haven didn_’,""" The financial diplomacy we 're engaged in is the surest course to get what we want , "" Mr. Snow said .",1
will_help t_think prices patients at_least more_than houses you_want published t “ t_think wood images flowers thanks each_month “ t_take your_needs t_involve when,""" Now I want to know whether or not the help that is available is being expedited and made available .",1
t pp provide t_really how_do reduction was_posted i_have award redistricting_plan ”_it look_like,"Since then , Texas Gov. Rick Perry has called two special sessions trying to push the measure through .",1
"13_billion technology-laced coloring_pages know has_been look_forward t_miss participate models ’_m shower 0.33_percent not_only t_want 1,486 t_let mix t_be",The more broadly based Nasdaq Telecommunications Index rose 0.7 percent .,0
bed symptoms t_know look_forward during had_been this_site mountains blood_pressure be_able t space someone_who t_forget t jesus,"The only difference is a tuner , a small piece of electronics . """,1
that_you t_know pan bottom look_forward t_believe climate_change i'm flew_directly hours morning services guitar email_address had_any_sense largest your_child insurance,"And when butterflies were exposed to constant light , they flew directly toward the sun , apparently having lost their sense of time .",1
how_do was_able began known_as so_it we_are the_lord don't_think did_not m read theatre we you_will,"Agents described Carlow , 50 , as a "" major player ' ' who organized a network of associates operating in as many as a dozen states .",1
t_miss let cover isn_’ per_cent ”_said has_been why_do stir services coloring_pages by,DJs will pay homewares and furniture group Freedom $ 10 million to take over the Foodchain store leases .,1
” importance t_take t_forget ’_ve file user per_cent we_had album degree the_latest t_be but per_cent vice_president t_think,"Still , Mr. Weill will remain very much a power at the company .",0
finish kresler page_automatically report download my_first as_“ most_important sizes ’_ve christ,A Global Crossing representative had no immediate comment .,1
to_learn it's_not architect_daniel_libeskind spent i_had fig schedule ‘ didn_’ discount worked dr do_you kit ” told_me hasn_’ assist_you surface not_only,"The collaboration gives architect David Childs , who has done extensive work with Silverstein , the lead role in developing the tower , which is to be the world 's tallest .",0
users highest_quality until court t_be comes find_out had server personal_information support says use et_al would_love born as_“ innovation your_business,O 'Keefe declined to discuss whether such photos would have enough resolution to detect small cracks in the wing panels .,1
placeholder_page say_“ least_one isn_’ church returned_monday way we_decided when i_love user things_that don't_want university that_you,"Residents of 220 homes forced out of their houses Sunday returned Monday , many to flooded basements or lower floors .",1
visitor t stainless_steel they_had research federal i_have grew_up district not_limited but,"According to Central Command 's initial reports , the attackers fired from a mosque in the city .",1
fig km to_achieve have ” manufacturing year free ”_i year-old don't_know will_receive season,But last week the executive committee of the board of trustees gave him a vote of no confidence .,1
alumni â “ using looking_forward there_are your_site t_have t_want university high_quality,Mahmud controlled access to Saddam and was frequently at his side .,0
it_has we_were year-old please_note t but_i fit high_school per_cent for_sale thrones_season t_have is_necessary there_was 2009 system ve_heard be_used workshops whitney_had three your_body focuses t_be made,"Manfred Bischoff , EADS co-chairman and a member of DaimlerChrysler 's management board , said EPI and P & W had presented "" excellent proposals .",1
2019 taad t_think sar-x t_miss ”_is nutrition spend $ learn_more journal ” olive_oil degree can_be t_think pdf,"The products are priced at $ 575 and $ 295 in quantities of 10,000 .",1
business t_make should_be please_call death length wasn_’ t_have,The findings are published in the July 1st issue of the Annals of Internal Medicine .,1
this t_do step worked don't_know t_even language schools € has_become was without arts 924.42 mind_that it_takes visitor takes he_had symptoms why responsible very_friendly saying email t_know,"The broader Standard & Poor 's 500 Index .SPX edged down 9 points , or 0.98 percent , to 921 .",1
t_going android cannot_be in stainless_steel t those_who temperature wall your_body organizations surface high_quality dr ” called_“ grow want t_be way_that didn_’ not_limited €,"He said , from a science standpoint , the city 's last case was April 19 , so the all clear day was actually yesterday .",1
held austreng 20_years helped_me ensure_that t_seem i_did improve t_going t_required same_day i_was one_wounded wherein wine on_friday employment therapy role k experience,"Mike Austreng , the editor of the weekly Cold Spring Record , said he saw one wounded person airlifted from the school and another taken away by ambulance .",0
reduce say_“ t_live fig t_think personal_information adjust stock et_al this_site shower website effects_of_tobacco “ why_do,"The journal says : "" Both are lifelong non-smokers whose primary interest is an accurate determination of the health effects of tobacco . """,1
was_one ” great_way look_forward learn_more put_together great_way years_ago least_75 your_needs had_been have_been what_i jesus will_be enhance me your_body fig mexico black few_minutes mental_health,A picture of the doctor 's son holding the guitar appeared in the National Enquirer just two weeks after George died .,1
inamed white down_nearly please_contact would_love story work why_do exposed such t_just night law ’_ve allows_you did,"Inamed shares dropped as much as about 16 percent on Nasdaq , where it was one of the top percentage losers .",1
wouldn_’ technology-laced we_had t_have stir he_is itself 21.35 2017 why_do please_contact list acres year-old world plenty t_really were due,"The tech-laced Nasdaq Composite Index .IXIC eased 5.16 points , or 0.32 percent , at 1,590.75 , breaking a six-day string of gains .",0
united_states t_miss your_blog more_about t_panic fig improve things_that called_“ scored spent company i_was front issued,"Prior to completion , CCG said it will also extract surplus cash of $ 27 million to reduce net borrowings .",1
road our_own begin hartsfield-jackson_international not fl didn_’ god find_alternate t_be t_even t_be what_do led 10_each need gold high_school please_note t i'm foot game t_hesitate i_went,Delta personnel at Atlanta 's Hartsfield-Jackson International Airport scrambled all day to find alternate flights -- including seats on other airlines -- to move the inconvenienced passengers .,1
expertise t_have picked_up cook t_know wherein t_have why_do taken there_is president_greg parseghian we_are size oil is_committed t_be thanks t classic there_are was_born °_c had_been thank_you has_worked,"Based on that review , I have concluded that CEO and President Greg Parseghian and General Counsel Maud Mater should be replaced , "" Falcon said .",1
’_ve her registered did t_forget university not_miss is_required 760_million ever him 790_million personal_information,"Marvell Technology also reported revenue of $ 168.3 million , exceeding the First Call estimate of $ 162.6 million .",0
although neck n who_was we_went university upholds_the_philosophy ” is_that shall_be brand ’_t please_contact department 32.30 brings,Kraft 's shares fell 25 cents to close at $ 32.30 yesterday on the New York Stock Exchange .,1
are_able on_saturday per_cent university top did_not years_ago deliver summer focus oven t_know install yellow did_not testing i'm mold russia,The union banned the import of genetically modified food in 1998 after many consumers feared health risks .,0
planning did calm we_had church what_they this_site t_see symptoms â °_c world large p t_know t_get can_expect no_matter people_who components can_also beach ” m,"Stealing identities and credit-card numbers with bogus e-mail and Web sites that appear to come from legitimate companies is an increasing problem on the Internet , federal officials warned yesterday .",1
used t_miss weeks_ago contact_us i but_stable_condition fish kings_county_hospital de stainless_steel learn thank_you,"That victim , a New Jersey resident , was in critical but stable condition at the hospital .",1
t_be road by videos search_engines my_first said_that i_am t_have ensure_that was_born t_forget ”_is enjoy in_accordance,"Investigators continue to probe virtually every aspect of Campbell 's personal and financial affairs , the former mayor has said .",1
was_able available t_want clean how_can university largest can_be did t_be years_ago you_will how increased_by_56 kg night,"For the full year period ending June 30 , 2003 , high-speed lines increased by 45 percent .",1
on_sunday_august i've_been largest would_not house_of_deputies is_still are_interested aren_’ t_take mid t t_seem gene_robinson god has_worked if_i,"On Tuesday in Minneapolis , the House of Bishops gave final approval on a 62-43 vote for the Rev. V. Gene Robinson of New Hampshire to become bishop .",1
living_room fun ’_m has_not our_website accuracy photo not_allowed protein t_have work_together connect lost-aircraft help thanks,Federal officials then gave the Texas DPS officer a number to call at the FAA to initiate lost aircraft procedures .,1
yard_dumpster table wherein engine may_also t_seem i_had t_be the_majority google range € pp be ensure_that ”_says years_old mexico t_really i_did when what_do,"Two-year-old Egyptian twin boys , born with their heads conjoined , have been separated after 26 hours of surgery at the Children 's Medical Centre in Dallas .",1
have the_settlement_also rear we_created — ”_says important_role beat t_be customers cook once_you year-old please_note lights call_us small you_might i_was,"Any payment to investors will be delayed , potentially for years , until the securities lawsuits against the brokerage firms are resolved .",1
won do was help_you oil water am_i he_had your_life ^ christmas what fight ? international is_set t_need m 2 looking_forward our_customers sco_group de °_c real_estate t_know you “ told_me i_wanted et_al patients,""" The GPL violates the U.S. Constitution , together with copyright , antitrust and export control laws , "" states SCO in documents filed with the U.S. District Court for Utah .",1
not_only trump t_forget 33.90 outdoor our_clients expected arts walls t_want she_was per_cent t_forget have_any has_worked according ’_ve,"The Nasdaq composite index rose 16.74 , or 1 percent , to 1,650.75 .",0
when hard_work ”_said was casino select age t_let fig chip_sales t_have can_be,"Elsewhere in Europe , Philips was up 3.8 percent after saying on Friday it was seeing positive developments with its U.S. dollar sales .",0
east don_’ t_even s_home_near ’_m t_miss attended be hi select than interrogate_him have are_you make_sure is i_got left_italy color as_“ t_take t_know,"Magistrates searched Tanzi 's home near Parma on Wednesday and tried to question him the same day , only to find he had left Italy for an undisclosed foreign country .",1
t_be long_way know this_website accessories was_also national t_do depending wasn_’ but hospital t_even thanks download add how_long live healthy,"It upheld fallback rules that bar the same groups from airing ads that promote , support , attack or oppose a candidate at any time .",1
we_were out cuban_officials why_do always_count black t_just inside cuban_musicians best t_be success t_be ” these_terms countries your_child we t_have opportunity ” st is_still,Cuban officials said that last year none of about two dozen nominated Cuban musicians received U.S. visas in time to attend the Latin Grammys .,1
way 244th “ years license this_page iraq you_can shall_be winter is_made isn_’ is_important t_just t_enough degree offices download,"The battalion has been clearing rubble , building playgrounds and restoring irrigation in Iraq , military officials told The Associated Press .",1
fan kit type court i_use install season bachelor 2011 but_i has_worked have_seen will_be,Xerox shares rose 2 cents to close at $ 11.45 on the New York Stock Exchange .,1
when placeholder_page according monthly that_when t_see top higher,It has no jurisdiction over his pay but does oversee the exchange 's regulatory powers .,0
gave_me midday_saturday temperature automatic_gunfire voter_id w what_do files qadesiyah the prime_minister shower says download ve_got studies we oil ” each,"Automatic gunfire rattled windows in the Qadesiya neighborhood at midday today , a largely Arab area that borders a Kurdish quarter .",1
wide_range literature take_place when_i t_even t_yet are_available discount_airline will_give people_who inc as_“ warranty t_have user ”_means “_let jr night isn_’ students,Southwest said it completed inspections of its entire fleet of 385 aircraft and found no additional items .,1
t vulnerability_affects ™ comes everything it_has t_mean reported i that_was will_take ” place also_need not_limited so_i,"Microsoft issued a patch for the vulnerability , which affects Windows NT 4.0 , Windows NT 4.0 Terminal Services Edition , Windows 2000 , Windows XP and Windows Server 2003 .",0
dr button replacement t_miss ’_d degree develop ’_m directors awadallah rear t_take t_even,The government charged that Awadallah knew both hijackers when they lived in the San Diego area .,0
connected 10_minutes future i_love may_be t_mean seriously_rethink ”_is window charged,"He urged employees to "" avoid complacency "" and to "" change old habits and seriously rethink business-as-usual . """,0
although panel_said plenty people_who located ”_i used_as us fig t_even have_access helping highly_recommend is_located allows_you t_always who_are she lake list click_here patients,"Others no longer have a good view , it said , because of civilian buildings built near them .",0
attorney our_website ™ t_have know diameter i_use third_party say_“ t most_common important live_in-studio performances_and_interviews risk,"Both companies automate many channels , although XM has some live programming anchored by disc jockeys who can field requests , and Sirius airs live in-studio performances and interviews .",1
important_part ^ t_make t_really left t_know attorney add banks payment grinding free s t_already friday t_make certificate finding you_can that's_what crusher million-member for_sale t_work,"The Episcopal Church , with 2.3 million members , is the American branch of the worldwide Anglican Communion , which has 77 million adherents .",1
chance scored ” do_is i_have allows she_was fig section participate fig award personal_information greater can_be ^ crusher,"If what scientists are observing is truly seasonal change , the planet will continue to brighten for another 20 years .",1
surface canada_has_just breakfast create largest same-sex residents temperature t_forget x t_be i there_any university t_like this_page layer de i_will st member,"Canada has just decided to legalize same-sex marriage , and they have high hope that Massachusetts ' high court will take a similar step within a few weeks .",1
i_did isn_’ can_do look_forward 2018 t_have etc ny is coloring_pages t_be “ feel_like thanks can_be look_forward °_c millions,"Excluding food and energy costs , the core CPI is seen rising 0.2 percent , matching the July figure .",1
i_was morning t_make fresh 81st_birthday t_take ’_s treatment t_think s what_i plurality ’_d i_was check_out sarah_o features t_seem number we_offer grew_up use look_forward t_miss what_we,"The matriarch , who celebrates her 81st birthday next month , was thanked personally yesterday for her generosity by actress Sarah O 'Hare , National Breast Cancer Foundation patron .",1
trump uk t_know representatives € personal_information have_been government our_website manufacturing t_have lean_people this_season,"Bloom and his colleagues had previously shown that the hormone , PYY3-36 , could curb the appetites of lean people .",1
more_than your_needs depending t_already ”_said lives st courses miles_behind ”_said was_born,"Voyager 1 was launched on September 5 , 1977 , 16 days after its companion , Voyager 2 .",1
this_site t_miss james_brolin t_need attack was_born contact_us judy_davis finished t_miss t_even used,Emmy and Golden Globe Award-winners James Brolin and Judy Davis star as Ronald and Nancy Reagan in The Reagans .,1
there_were t_meet t_matter that ^ t_take 2019 i_got t_forget talk_about globe 47.1_million can_be,Operating expenses fell 28 percent to $ 47.1 million in the first quarter from $ 65.8 million a year earlier .,0
agree counter as_part species its_sincerity his_own thank_you food battery t_know is_located depending closer_look i_had sign_up didn_’ are_interested was_going,Advani said Pakistan should prove its sincerity by handing over suspects wanted by New Delhi for past bombings .,1
”_is know_about where_he long_as ended_up “ mind do-not-call thank_you patients “_it it_is t_want reached t there_were law saying_the_agency says stainless_steel this_season i've_been children pages,"A federal judge yesterday struck down the national do-not-call registry slated to take effect Oct. 1 , ruling the Federal Trade Commission had no authority to create the list .",1
content ” so_i flowers right_now say_“ improve called_“ had we ” t fig hadn_’ ’_m first_half religion “ systems,"The Conference Board said its measure of business confidence , which had fallen to 53 in the first quarter of 2003 , improved to 60 in the most recent second quarter .",1
weight interior what_does t_think quite click university your_computer father suppliers we_believe t_forget has_become 9.69 management says blood_pressure check_out know_that east per_cent 994.53 climate_change,"The tech-laced Nasdaq Composite Index < .IXIC > gained 18.35 points , or 1.13 percent , to 1,646.02 .",0
fig t_be i_had by space website course turned_out where_you t_forget love federal_complaint english email_address we_offer is_available your_home t_see real_estate services month god,"A nationally known computer hacker is being sought on a federal arrest warrant stemming from a sealed complaint in New York , a federal defender in California said Friday .",1
damage church i_don't any_time front 182.5 t_have friends fig t_always which what_you t_hesitate st become another right individuals that_i inc 125.4 he_said remains,"New York City will collect an estimated $ 182.5 million in tax revenue from the 2003 bonuses , compared with the $ 125.4 million it collected in 2002 .",1
still_have year t_stop ’_ll gender expertise children bake t_miss you_can,"Under state policy , DeVries was to be returned to San Jose , where he was last convicted .",1
whitney_said learn t_have allows_you do_you ’_re license have what_you t_think considered aren_’ t_get,Whitney said officials evacuated a camp where 250 people were expected to arrive Sunday .,1
heating young_people rear this_product ”_is t_want highest be_held_january oven world could_be texture t_be this_site started t_get eating t,"Inquests into the deaths of Diana , Princess of Wales and Dodi Fayed will be formally opened in the New Year , the Royal Family 's coroner announced yesterday .",1
according your_website please_contact t_forget per_cent students_who world up earlier_this fun if_you important_role took_me different repair is_“ why_do on_saturday rules,U.N. Secretary-General Kofi Annan on Saturday called for the urgent dispatch of a multinational force to Liberia to halt fighting between government and rebel forces that has killed hundreds .,1
learn_more t_see due p “_we not_been center “ ”_said are_available,FCC chief Michael Powell presides over hearing Monday .,0
t_have t_want t_want ’_s t_really they_have basis so_that stir salt_and_pepper i world t_let whether_you t_forget there_are pp be_used stainless_steel know this_website plenty t_going,"Messagelabs , which runs outsourced e-mail servers for 700,000 customers around the world , has labeled the worm "" high risk "" and reports more than 31,000 infections in 120 countries .",0
national ’_re wasn_’ centre i_have ca problems this_page ”_i spokesman_eric thode t_just how_much,Enron spokesman Eric Thode declined to comment on the mediation order .,0
contact_us t_be t until two fig fig master_bedroom 900_per our_customers as_well on_saturday students t_really treatment t_think,"Bare Metal Restore 4.6 will be available in mid-June , said Veritas , and will cost $ 900 per Windows client and $ 1,000 per Unix client .",0
focused player t ve_heard have_time en money our_own ’ t_worry t has_worked know_what storage software,Microsoft in Europe could not be immediately reached for comment .,0
learn_more email_address it_would university tube_was_removed your_computer look_forward experience t_worry t_let this_season t_want t malanowski life_is you_might t_be t_be looking_forward responsibility was_released olive_oil ”,"They did visit after her feeding tube had been removed , accompanied by the Rev. Thaddeus Malanowski , a Roman Catholic priest who visits Mrs. Schiavo weekly .",1
may_have did_not most_important ”_said t_forget t_forget voter_id middle when_i died but_when aren_’ company_afloat last_edited,He is expected to ask for a lifeline of around € 50m to pay suppliers and keep the company afloat .,1
was_able 2018 our_customers study t_be turned_out i shouldn_’ was_able furniture ” a_few hiking wanted campaign ’_re this_page,Economists said those concerns raised the odds that the Fed might reduce rates at its next meeting on June 24-25 .,1
living_room location t_have give residents her_husband 56.7_million marketing what rights_reserved my_favorite t_be t_panic,"In the first half of this year , the company lost $ 56.7 million .",1
’_ve but_i t_stop t_always eggs image may_be add church ny among ingredients i_made when there_were tour but_when ensure_that,"She also thanked her boyfriend , Sgt. Ruben Contreras , who was sitting next to the stage .",0
"population as_part known_as t_have would_like index diameter ’ when may_not a_lot t_need email_address look_forward literature did_not please_note 8,829 care","In morning trading , the Dow Jones industrial average was up 121.51 , or 1.4 percent , at 8,832.69 .",1
t_do spokesman_eric thode he_was thank_you system finish diagram isn_’  will_discuss,""" We think it 's great news , "" said Enron spokesman Eric Thode .",0
is_made proposed t_mean quality court be children_aged_six your_needs issued liquid when ” i_need there_is,"From 1976 to 1980 , it said , 6 percent of children ages 6 to 18 were overweight .",1
call_today are_used highest_quality sent us spend i_got perfect maintenance t_be article_about,The charges carry up to 25 years in prison and $ 1.25 million in fines .,1
t way total_external this_agreement able it_also gorgeous my_favorite i_did per_cent your_website war court home touch there fish called_“,"In the total external disk storage system market , McArthur said revenue increased 1.5 percent year-over-year in Q3 to $ 3.2 billion .",1
t_matter i_had t_mean award there_were 2018 he_was reduce approx hubbard_said t_mean,""" We have found the smoking gun , "" said Hubbard , director of NASA 's Ames Research Center in California .",1
