sentence1,sentence2,label
look_back it_was there_is earlier_this if_it texas what_does i_can remains rich i t_like t_be are_available had per_cent t_really 1.1566 want finish industry is_usually something 0.07_percent ball t_take ensure_that look_forward,"Against the Swiss franc the dollar was at 1.3289 francs , up 0.5 percent on the day .",0
coloring_pages § s_portfolio gives_subscribers airport were 、 dr have among expertise download season oven affordable_price date s t_know university made_available thank_you she_is can_cause thanks inch,"Sony Music 's portfolio of products and services currently enable carriers to offer subscribers the ability to download images , ring tones , music videos and other entertainment services .",1
” is_used enough i_have police_were_investigating perfect gold t_necessarily he_had my_first jesus_christ garden did_not will_eventually is_located € article_about stone know_what bottom,"He said the local organized crime police were investigating a suspect , but he would not say if it was Ciobanu .",1
” ”_as relax what_does eu t_let m find_out i'm you are best_quality sweet global goal t_take range,"Previously , it had reported a small profit of $ 12 million , or break-even on a per-share basis , for the period .",0
hard_it florida it_is these_linkedin connect t_be protein felt_like the_first you_can take on_tuesday was_able,"According to the report , average life expectancy has increased by nearly two years since 1990 .",0
wrote patients your_child each ensure_that it_has he_has my_favorite trump who_was importance my_life did_not software be “ ’_ve believe_that,The SEC specifically advised IBM that this is a fact-finding investigation and that it has not reached any conclusions related to this matter .,1
patients t_do 11 m its_own i_was terrorism_act_2000 ’_d growth human_rights service ( international t_need 2015 world is_going have_been design_ideas three cleaning,"Badat was arrested under section 41 of the Terrorism Act “ on suspicion of involvement in the commission , preparation or instigation of acts of terrorism , ” Scotland Yard confirmed .",1
students_who can_you et_al as_one maximum msblast t_really photos start_flooding high_school t_seem s windows_update_service fight legitimate-looking patio some_time,"Starting on Aug. 16 , every computer infected with MBlast will start flooding Microsoft 's Windows Update service with legitimate-looking connection requests .",1
end interest_rates located is_“ i_have u summer asked not_crush it_was has_become more_than faced km meeting health skills your_needs jews defense_coalition stainless_steel,""" We put the call out , "" said the Rev. Patrick J. Mahoney , director of the Christian Defense Coalition .",0
couldn_’ death s_third ”_said date company's_current_directors saidon wednesdaythe t_worry teams my_favorite black t_want due stainless_steel t_going following your_heart click “_we t_hesitate,Florida ’ s Third District Court of Appeal said on Wednesday the original proceedings were “ irretrievably tainted ” by misconduct by attorneys for the class .,1
parts seeds rights_reserved t ”_but on_saturday co ” check_out called_“ he_was,Courant Staff Writer Jeff Goldberg contributed to this story .,0
email_address planning ve_heard by say_that isn_’ depending learn_more wide will_allow not_only is_committed ， provide_you born,""" The evidence accumulated over the intermeeting period confirms that spending is firming , although the labor market has been weakening .",1
growth you're_looking dining_room coloring_pages st t_think whom installation there_were â learning front expertise number my_first t_just fun t_want not_only its_energy_security enjoy,Nigeria and other African producers are increasingly important in the former Texas oilman 's plans to lessen dependence on Middle Eastern suppliers for energy security .,1
t_work had_kept_him day explains their_families my app according has_become any_questions t_see things pan ap_said last_year,Isaacs had been on death row longer than anyone in the nation .,0
god t_know click_here psychology east father injury i_’ soltes fig et_al always_been journey what_you importance rd member t_stop we_had change-of-life t_make t_stop,While many likely now will quit - as millions of women already have - Soltes said she is likely to continue prescribing the supplements for relief of change-of-life symptoms .,1
t_really “ “_it t_even explore i_thought personal_information fig this_site you hurricane_isabel if_i death he_is movies m likely international recipe you_know by dr middle sizes on_behalf do_it,"In the aftermath of Hurricane Isabel , federal and local governments remained shut down , as did schools and many businesses .",0
ursel made_it i_am clients do_it t_even their heating your bottom thank_you ”_said t_think allows_you t_going your_child more_than,"Ursel Reisen confirmed it had been operating the coach , but declined to give details of the passengers other than to say they were of mixed ages .",1
principles “ all_that loan what_does did act_as battery ”_i we_were culture pour each_other made_me it connect not away east t_miss software,"But he is the only candidate who has won national labor endorsements so far , picking up his 11th on Tuesday .",0
restaurants there_are what our most_popular be when china as_“ didn_’ have_not killed,Obus also denied a defense motion to postpone the Sept . 29 trial date .,1
t_be what_you t_know you not_sure t_think per_cent ^ bottom please_note golden provide has_worked new_york look_like can_expect east personal_information 17.9_billion if,"Analysts expected earnings of 27 cents a share on revenue of $ 17.7 billion , Thomson First Call says .",0
j t_going he_was t_forget told_me m loved_one 1.3147 canfor shares_for_each is_provided t,"Under a proposed plan of arrangement , Slocan shareholders will receive 1.3147 Canfor shares for every Slocan share they own .",1
"t look_forward 654,000 climate_change border 80-90 you_know remove investment i'm","BellSouth added 111,000 DSL customers during the quarter to reach a total of 1.3m subscribers .",0
when designed involved by my_favorite goods the_first if protein ’_ll do_it ™_s t_mean stay decided fig patient has_worked call t_forget “_it did_not ensure_that,"In a televised address back in March , Mr Howard declared Iraq had weapons capable of "" causing death and destruction on a mammoth scale "" .",1
"growth ” engine 30_minutes each_other °_c t_necessarily d talked_about this_agreement done know read 9,558 beaches largest t_know","The blue-chip Dow Jones industrial average eased 44 points , or 0.47 percent , to 9,543 , after scoring five consecutive up sessions .",0
credit_card ball_mill inc t_take equipped “ beginning service what_do t easy services st t_need third_party said please_contact,Grant Thornton claims that it too was the “ victim ” of a fraud .,1
your_website one_thing fig couldn_’ i_decided ’_d fig °_c the_reason goodrem could_not ” looks_like t_let has_been know_what it_is â is_made,"She first went to a specialist for initial tests last Monday , feeling tired and unwell .",0
square_feet i_decided stainless_steel “_we spacious dna_and_other diameter be_used t_be reduce cold prosecutors_have_not € m engine organizations as_“ t_rely human they_yielded it's,"All three were studied for fingerprints , DNA and other traces of evidence , but there has been no testimony yet about what the tests might have yielded .",1
cambone this_page don't_think s_forces economic among t_want can_be don't_know goals we_needn_’ university furniture you_might beauty become_more you_can,Kurdish forces at a checkpoint near Mosul in northern Iraq seized the trailer on April 19 .,0
says t_even if_you you_are its_gsm location 2017 shall_be didn_’ ’_t know_what eu t_believe t_let what_do t_let ’_ve is_perfect,"Sony Ericsson also said it plans to close its R & D site in Munich , Germany , for GSM and UMTS handsets .",0
start aren_’ paid writers 13 any_questions ”_said ltd in_accordance not_limited melbourne what_you per_cent combination saturday manufacturer ” t_be when founder fig this_site,"Shareholders will get 0.86 PeopleSoft share , or $ 13.11 , for each J.D. Edwards share , based on recent trading prices .",1
population email_address but_it was_able go € was_not mid impact black depending can't_wait ip_address click_here ’_t t_be loan degree t_even was_able remove t oil providing came_up i_just living_room,""" That failure to act contributed to September 11 and the failure to act today continues [ to put ] Americans in a vulnerable circumstance , "" said Graham .",1
sits t_just m more_about he guests soon_as get t_think below per_cent make_it based sales participate end served_as election i_’ t_be t_been casino sometimes you_can this_site hi talk t_get t_even,"The Intel C + + Compiler for Platform Builder for Microsoft Windows CE.Net is available for $ 1,499 and is intended for use by device manufacturers and systems integrators .",1
2017 t_know it_has get_rid looks_like ” rights_reserved nobel-prize bacteria patients providing how_much osheroff didn_’ ’_ve united_states ‘ t_seem,"Board member Douglas Osheroff , a Nobel-prize winning Stanford physicist , said : "" There were some extremely bad decisions .",1
gives_you t_think oven project incident_was_caused directors but_when was_not stay_tuned out period blog,He later found out the alarming incident had been caused by Concorde 's powerful sonic boom .,1
zulifquar report eat crusher these_terms gave wounded_by_shrapnel as diameter t_want trump i_love t_mean s causing beach ”_i but did_not,"Witness Zulfiqar Ali , who was slightly wounded by shrapnel , said the attackers had focused on the mosque 's guards .",1
their_lives ’_ve crusher st society can_provide country stainless_steel as_“ award we_offer get_5 screen,He said the prob lem needs to be corrected before the space shuttle fleet flies again .,1
doctors_would back same reduction mm tend largest ” clock your_needs isn_’ day t_know t_miss ”_but sweet long_as file,"Physicians who perform the procedure would face up to two years in prison , under the bill .",0
gold long_as t_hesitate provides university not_sure years_ago remove air_conditioning largest fig that_it advance blood system t_be then_you excellent_job opportunity,""" We make no apologies for finding every legal way possible to protect the American public from further terrorist attacks , "" said Barbara Comstock , Ashcroft 's press secretary .",1
since_march_11 learning & mountains opportunity told_me t_let common be_used ’_ve degree quality diameter fig ” t_take clean submitted tech-laden products u god t_think customer,"Since March 11 , when the markets major indexes were at their lowest levels since hitting multiyear lows in October , the tech-laden Nasdaq has climbed nearly 20 percent .",1
butter would_be has_worked may_be thanks participate are_you “_we would_be called_“ stainless_steel aren_’ would_like usb ”_said soon_as airport_earlier wide_range i_had eggs on_saturday â how_much,"The men had Pakistani passports and reportedly were seen together at the airport earlier in the evening , law enforcement sources said .",1
that_ain t_forget continues ve_put i_am t_even could_not grew_up ” largest largest also_has when chairman this_page wasn_’ t_take,""" We have put a lot of energy into patching , later than we should have , "" he said .",1
say_“ sought_to_consolidate police 3d his_first there_was government et_al videos all_ages thank_you km the_company per_cent recipes ”_is 112_people any_other,Rebels consolidated their grip on a troubled northeastern Congolese town Tuesday as residents identified at least 112 dead after a week of fighting .,1
can_see dr have began year-old was_debating i_made t_seem per_cent agreement politics ”_said finished t_want living_room,"Within four days , the House and Senate overwhelmingly endorsed a resolution granting the president authority to go to war .",0
this_was inc t_come et_al millions is_located there_was years_ago earlier 80-90 personal_information what_they t_really furniture since believe_that rear there_was ’_ve the_first first_time when,"After their arrests , the men told investigators they paid to be smuggled into the United States from Canada last month .",1
couldn_’ updated responsible nweze when bring_this_project know_that has_worked according t_just help_you developed check_out choose thanks 2018 temperature up experience picture_to_see have_not that size ‘ we,"Adora Obi Nweze , the NAACP state president , said the state has refused to consider the possibility of murder .",0
bake word_“ make looking can_cause noted_that ’ t_really degree assist_you mounted we_were hp t_forget genuine_opinion 20_years sheehan_said ”_as fig stainless_steel this is_essential,""" We can 't change the past , but we can do a lot about the future , "" Sheehan said hours after arriving in Phoenix .",1
this_study university died t_see award keep ’_ll the tour t t_like,Bondholders of Mirant Americas Generation subsequently filed suit against Mirant seeking to block the exchange offer .,1
there's vice_president doors death coloring_pages look_forward i_am t_work,Officer Evans had declined written and telephone requests for an interview .,1
can_be t_want t_be five_coaches had_been t_going i_love write developed t_seem who_was preston_park relationship your_friends can_see is_designed wedding fig,"Sixty players and five coaches from Mepham High School in Bellmore , Long Island attended the training camp in August .",0
bowl rights ’_ll writer recent_years these have_any lens you_can development may_also ” t_miss say out_there university requirements wasn_’ failed,The official would not name the leakers for the record and would not name the journalists .,0
"please_contact t_think walls ’_re make t_get st compliance grey ” coloring_pages experience members u s_salary i_went wire 361,400 t_want","Dynes will be paid $ 395,000 a year ; Atkinson 's salary is $ 361,400 .",1
vol phone 72_cents has_made would_be de for_sale 18.34 it's_not sales pleasure_gardens m are_you,"The shares fell 72 cents , or 3.8 percent , to $ 18.34 Monday on the New York Stock Exchange .",1
couldn_’ increased will_find it_is t_use didn_’ investors dining_room s_comments software,"The Defence Secretary , Donald Rumsfeld , and other top Pentagon officials played down his comments .",1
upper located ”_said carson-based for_sale movement be_used t_need inch personal_data stainless_steel t_even email sauce filled album is_made bottom size s_funeral boil phone_number 90 relatives_said ”_says,"Sgt. Ernest Bucklew , 33 , was coming home from Iraq to bury his mother in Pennsylvania .",1
threat your_needs there_are ”_is please safe not_limited removed gorgeous arts protein shall_be caused time_that materials british_exports i_love “ ”_said i_love pan says,""" Although the preconditions for recovery remain in place , the prospect for external demand for UK output is weaker than previously expected . """,1
kids map t_afraid “_we served_as category if_you available fig t_know inside s click fl my_life has_been 2012 t € you ”,"Shaul Mofaz , Israel 's Defence Minister , raised the prospect of a ground offensive into the Gaza Strip , in addition to a growing air campaign to assassinate Hamas militants .",1
years_old there_was side he_told t_just ” were our_website learn nothing t_be thing can_be real_estate of customer_service closer_look sent 990.94 clear_that,"The technology-laced Nasdaq Composite Index was down 25.36 points , or 1.53 percent , at 1,628.26 .",0
t_seem ”_is population are_made add placeholder_page de residents trump referred write t_miss ”_said ”_is scored t_want economy your_dog phone click,"The Organization of Petroleum Exporting Countries decided yesterday to lower its output ceiling by 900,000 barrels a day to 24.5 million barrels starting in November .",0
rear is_“ shall_be no_cost “ 2011 t_forget t_even largest couldn_’ are_required have_you for_sale table will,"Though that slower spending made 2003 look better , many of the expenditures will actually occur in 2004 , making that year 's shortfall worse .",0
will_need how “_we your_needs user t_like t_hesitate they_are durability your_needs placeholder_page contact_us t_have extract,It is the first named storm to develop in the Caribbean in December .,1
t_have language please_note resources t_consider t_take layer than thank_you strength specialist would_have two â category t_mean 24_hours,"Apple Computer 's new online music service sold more than 1 million songs during its first week of operation , the company said Monday .",1
has_worked success day t_think way have_seen ’ meal facilities submit this_is verheij i_took made t_have help_them commerce_subcommittee haven t_meet separate_hearing inch,""" Such communication will help adult smokers make more informed choices , "" company vice president Richard Verheij told a separate hearing , before a House Energy and Commerce subcommittee .",1
map 1b_visa has_been russia next_year 1.1149 what_do is_expected t_want would_love on_monday he_told t_meant t_be inch “,"The dollar pushed as high as $ 1.1115 to the euro in early trade , extending Tuesday 's one percent rally to hit its strongest level since April 30 .",0
take_place dining_room t_be call_us children needless ltd election “ efficiency will_receive caused download florida also_available god,"After their arrests , sources said the men admitted they were smuggled into Washington state from Canada in July .",1
he length t_know victory small high_school vegetables 51.5_percent t_let “ look_forward something_that percent_in_june said,The production index rose to 52.9 percent from 51.5 percent in May .,1
they great_job with t please_note same_name door inc t industries t_really you_are although temperature be_used review t_take if_i straight t_be fund i_started ’_t arts t_be can_do â are_subject t_even,"Germany , another opponent of the war currently on the U.N. Security Council , in recent weeks has moved closer to Washington and did not insist on a timetable .",1
finish surrounded i've_been favor looking_forward you der no_cost can_lead is_perfect single_slice consumers t_seem ’_ve,"Like the Power4 , the Power5 contains two processor cores on one chip .",1
it_was when large t_forget ’_m platform t_forget a_lot t_be but_it social t_have i'm referred,"She said in 2003 , not one American state had an obesity level less than 15 percent of the population .",1
she_was women ”_i nor link please_contact won't_spam t_need t_always game,A sensitive light detector then looks for the telltale blue glow .,1
i_am eating t_take approving_new be_liable more_information are_you t_really people harm_children i_love of j placeholder_page email can_get child look_forward,"The federal government is approving new pesticides without even knowing whether they pose a threat to children , Canada 's environment watchdog warned yesterday .",1
your_favorite don't_have customers t_forget damages “ we_are t i_love texture inch explore,"In September 2002 , floods in the Gard region killed 23 people .",0
player i_got t_take available t_hesitate are_available my_favorite t_be organic most_important be pace world,"But in San Francisco , 80 percent of men and only 59 percent of women washed their hands .",1
looks_like was this_is t_be copy 20_years please_contact front this_agreement thomson_first_call loss,"Home Depot is expected to report earnings per share of 46 cents for the third quarter , according to Thomson First Call .",0
if_you teaching et_al made_me as_you was_able on_behalf t_even by when_i look_forward sizes remove thank_you did is_necessary vote t_want he_was you there_are beach,"The global epidemic of HIV , the virus that causes Aids , is tightening its grip on Britain with a record number of new cases diagnosed last year .",0
’_re identified award has_been oven ”_is side “ “_it 2015 filled executive_director islands economic_rebound is_expected are_able each,But stocks have roared higher in the past 3-1 / 2 months amid hopes for an economic rebound .,1
but_i t_think law total_u will_give received one_side over_time include re_back it_has user t_shy_away will_not served_as juhan have_any t_know can_help t_think t_let is_perfect,""" Spring has arrived in Estonia - we 're back in Europe , "" Juhan Parts , prime minister , told a news conference last night .",1
amd_will long_as that_can wildlife have weeks_ago known_as t_changed manufacturer married passionate_about also_offer will_need,"Fujitsu will own 40 percent of the company , which will be headquartered in Sunnyvale , Calif .",0
t_have inch more_than held it_is eat world ’_t it_takes served is_expected thanks,He was given leave to appeal against part of his conviction and sentence .,0
your_body as_much black personal_data look_forward who_was would_be she_registered present t_stop screen € t_want allows_you will_not i things_that wide_range your_needs year-old are_you type drinking st t,"Tracks can be burned to CDs , but the same playlist may only be burned up to five times .",0
i_can year-old not_only tomorrow rental_company_nationwide t_have here_are has_been able say_“ year-old phone stainless_steel t ask t_stop day use,SSE shares were unchanged at 652 pence by 0835 GMT but analysts welcomed the deal .,1
as_well second called_“ t_be installed light 30_years winner t_been which_can download beauty 23.999 what_i remove flavor t_miss t_have may_have,"Shares were off 30 cents , or 1.3 percent , at $ 22.58 on Tuesday on the New York Stock Exchange .",0
you_all 2003 is_essential bad t_matter € t_forget t this_page t_necessarily fig that_i ideal as_much ”_that,But Mr. Bolten cautioned that the deficit was still likely to exceed $ 500 billion in the 2004 fiscal year .,0
gives_you warm t_be responsible_leader be marketing find_it i_’ t_just middle this_year year-old shall_be bass fig thank_you “ you_can you_will your_computer why_do,""" As a responsible leader we felt it necessary to make these changes because online chat services are increasingly being misused , "" stated Gillian Kent , director at MSN UK .",1
i_decided what_you method please_contact t_want market called_“ participate create i_had shown you_can ended_up what_they is_located et_al,"We have already found two trailers that we and the Americans believe were used for chemical and biological weapons . """,1
"is_that your_order thank_you 846,000 ”_said he_was north","No wonder AOL lost 846,000 subscribers last quarter .",0
when e first_time this_agreement used_as st stir your_website bottom t_seem trying,State officials estimated the cost at nearly $ 2 billion .,1
t_see be_able t_just prairie_plant makes_me stainless_steel engine surrounded t_going who_have why_do national t_forget t_trust you_can,"None of Prairie Plant 's marijuana can be distributed until the Health Canada 's user manual is made available , she said .",1
30_years is summer are if_it japan moved highly_recommend skin our_website affordable_price ’,"Captain Smith left the ferry terminal after the crash , went to his home and attempted suicide .",1
our_community services layer wasn_’ women kemakeza services love as_“ is students exam et_al his_wife are_interested made_it didn_’ court as_“ you_can,He was reported as saying Prime Minister Sir Allan Kemakeza had made a deal with him to keep his guns while notorious warlord Harold Keke 's group was armed .,1
: your_order my_favorite t_think are_available you_are you_can know_about t t_get as_“ ” this_website,"She was taken to Charing Cross Hospital , where she remained critically ill last night .",1
yoga ideas u risk government t_take wide_range no_idea did_not banks ? rear silver not_limited would_love attend treated i_had free_download any_questions recipe american stainless_steel research,"If the judge decides that is so at the end of what is expected to be a five-day hearing , Peterson will be held for trial on the charges .",1
’_t is_committed looking_forward largest t_get depending importance t_hesitate russian_region experience may_also was ”_as 2018 apartment-building bombings_that haven t me ”_is,"In 1999 , troops returned after rebel raids on a neighbouring Russian region and a series of deadly apartment-house bombings in Russian cities that were blamed on the rebels .",1
photos t_have i_love butter t t_have t_always when take t she_is access beach t_always institute serve_as top patients as_a_hurricane two_years t_be held,"Tropical Storm Claudette headed for the Texas coast Saturday , with forecasters saying the sluggish storm system could reach hurricane strength before landfall early Tuesday .",1
safety 1_priority_when ”_said this_recipe is t_forget thank_you wasn_’ t ” used t_have to_ensure t_really customer_service ! offers death ball_mill their t_have,""" Everything is going to move everywhere , "" Douglas J. Feith , undersecretary of defence force policy , is quoted as saying .",1
“ wide_range sanmina-sci not_sure newisys call t_be don't_know it_was bottom develop please_note you called_“ that_ain one_thing,"Newisys , an Austin , Texas , startup headed by former IBM and Dell execs , will become a wholly-owned subsidiary .",1
like t_work pdf ” art google five_years but_i ”_i have_seen alumni “_we which_he didn_’ t_take 30_years t_going,Black Democratic leaders were trying to arrange a meeting with Democratic National Committee Chairman Terry McAuliffe to discuss the layoffs of 10 minority staffers at party headquarters .,1
