sentence1,sentence2,label
amrozi london st will_receive аnd t_get fig “_it the_majority his_father is health_care could_not i_got t_see compared,"Referring to him as only "" the witness "" , Amrozi accused his brother of deliberately distorting his evidence .",1
prices journal street click videos t_know be_used t_forget political t_just is_located m t_have not_limited =,Yucaipa bought Dominick 's in 1995 for $ 693 million and sold it to Safeway for $ 1.8 billion in 1998 .,0
t_get t_hesitate where_you our_clients i_have made_it certificate what_they know people_who race we_created mixture made per_cent enjoy,"On June 10 , the ship 's owners had published an advertisement on the Internet , offering the explosives for sale .",1
greater_than 0335 ”_said meeting t_think there_is long_as rated_1_out devices t_know you eu with t_make t_know los_angeles personal_information called_“ you t_believe “ de your_business € t_think agreement,"Tab shares jumped 20 cents , or 4.6 % , to set a record closing high at A $ 4.57 .",0
society high_school rather_than bottom t_really beach ”_i range think_about close_friday commitment t_help 21.51 ” your_own i_had furniture thank_you,PG & E Corp. shares jumped $ 1.63 or 8 percent to $ 21.03 on the New York Stock Exchange on Friday .,1
had can't_wait t_forget skills adopted et_al right ’_ve art looking_forward the it_was assist_you warm our_team,"With the scandal hanging over Stewart 's company , revenue the first quarter of the year dropped 15 percent from the same period a year earlier .",1
t_have ”_as error called_“ wide_range died 17.27 high_quality facebook shall_be do_is museum t_take microsoft de t_take this_site our,"The tech-laced Nasdaq Composite .IXIC rallied 30.46 points , or 2.04 percent , to 1,520.15 .",0
your_body dvd-cca said t_want online ” wide_range options,The DVD CCA appealed that decision to the U.S. Supreme Court .,1
are t_really t_mean ’_ve 35.18 und / do bottom ended_up business u night by t_necessarily,Earnings were affected by a non-recurring $ 8 million tax benefit in the year-ago period .,0
size they_have ”_said importance light policies i_can was_born church a_few goals what_do has_become businesses there's third_parties i_love,"Shares of Xoma fell 16 percent in early trade , while shares of Genentech , a much larger company with several products on the market , were up 2 percent .",0
t_get ’_m fig t_take been doctor don't_think decision rear couldn_’ president he 20_years personal_data activities we_all,"Legislation making it harder for consumers to erase their debts in bankruptcy court won speedy , House approval in March and was endorsed by the White House .",0
"t_really i_don't reserves 10.73 t_miss this_agreement the_second diameter you_are 1,514 called_“ not_limited t_be","The Nasdaq Composite index , full of technology stocks , was lately up around 18 points .",0
doing join_us i'm_not free may_not high_quality edge t_let must_be fig shall_be t_going nothing,De Sole said in the results statement that group performance would improve in the second half of the year and beyond .,1
”_said enjoy 30_days thanks has_worked your_needs 21 s_daughters music by good_idea t_use check_out very_least ” all_ages you_’ explore,""" Saddam 's daughters had British schools and hospitals in mind when they decided to ask for asylum -- especially the schools , "" he told The Sun .",1
years_old heizler him patio students i_am local_disaster started be there_was young_people he_is t_even that_he is_located click,"The head of the local disaster unit , Gyorgy Heizler , said the coach driver had failed to heed red stop lights .",0
rudder_was most_recently_senior according fit country reported fridge understanding their_own t_like property,"Senior Vice President Eric Rudder , formerly head of the Developer and Platform Evangelism unit , will lead the new entity .",0
t t_mean these_terms larger t_worry “_it tickets top learn_more depending ’_m websites skills gave_me m our_website are k proper_monitoring sweet tree ’_m,Internal chaos has allowed foreign companies to set up damaging commercial logging and fishing operations without proper monitoring or export controls .,0
’_ve t_see need t_be teaching °_f national_infertility t its_own this_is â best_quality t_come t_always history your_home bowl thank_you innovation coupons director ‘ fig password wanted he_was,"Sheena Young , a spokesman for Child , the national infertility support network , said the proposed guidelines should lead to a more "" fair and equitable "" service for infertility sufferers .",1
t_know t this_agreement fig t_required supreme_court pretty we_offer alarming_rate t_think tomatoes university year years_ago £ fruits celebration what_does this_page human_rights £,""" I think you 'll see a lot of job growth in the next two years , "" said Mankiw .",0
as_“ did_not share coloring_pages added improve as_“ t_think output chicago least_75 color create said idisk “_what god a_total ensure_that that_when our_website t_go your_needs,"Panther 's redesigned Finder navigation tool puts a user 's favourite folders , hard drive , network servers , iDisk and removable media in one location .",1
fig also_offer there_was birds t_let future t_going focused world_war western_portions will_not ’_d stainless_steel you_can down is_required t_really i_use god colour is_located are_you i_have,"Tropical storm warnings were in place Thursday for Jamaica and Haiti and watches for the western Dominican Republic , the southeastern Bahamas and the Turks and Caicos islands .",1
if_it federal_magistrate ve_heard 0 t_forget crafts vote forefront what_does,"Zuccarini was ordered held without bail Wednesday by a federal judge in Fort Lauderdale , Fla .",1
call_us bmi_of_25 ... may_also considered_overweight thank_you died will_receive five is_considered_obese t,"A BMI between 18.5 and 24.9 is considered normal , over 25 is considered overweight and 30 or greater is defined as obese .",0
we check_it when university call_us t_miss what_do he_wrote bare-minimum $ t_be billion_debt depends more_details this_is ’_ve be,"But six months ago , the two sides managed to strike a $ 6.8-billion debt rollover deal , which expires in August .",1
″ humans technology rights ”_i album t_even t_do no_one earlier_this why_do furniture didn_’ more_than not_sure t_want sun price,"Simply put , shy invividuals tend to be more timid with new people and situations .",1
god a_lot students are_committed aren_’ may_also their develop “ beat see be year-old what_they to_ensure year-old played,""" I wanted to bring the most beautiful people into the most beautiful building , "" Tunick said Sunday .",1
"wasn_’ water could beautiful i_bought money say t_have comfort installed ” ’_m ve_got win m last_year ’_m war_ii wide_range i_think 1,039 ’_t t_forget “_it","The S & P 500 index was up 1.26 , or 0.1 percent , to 1,039.32 after sinking 10.75 yesterday .",0
is_“ i_’ corner science “ degree eu w discover 2016 stainless_steel saturday contact_us wrote police find t_going t_seem tickets v important_role °_c we_had yuri_malenchenko museum,Currently living onboard the space station are American astronaut Ed Lu and Russian cosmonaut Yuri Malenchenko .,0
t_have furniture looks_like t_get it's that_ain banks t ”_as provided two-way_trade what_do don't_know was change but_when,"Although a small city-state , Singapore is the 12th-largest trading partner of the United States , with trade volume of $ 33.4 billion last year .",1
i_love largest_gains t_even stainless_steel already_been has_been click image said thing ” ,"Sub-indexes measuring prices , new orders , inventories and exports increased .",1
not_limited voter_id t_have increased trump t_get t_think temperature walls this_book ’_t fig felt_like,"The New York Stock Exchange suspended trading yesterday in Loral , which closed at $ 3.01 Friday .",1
object washington t_see look_forward was can_get bit ’_s ” personal_information,That beat the company 's April earnings forecast of 8 to 9 cents a share .,0
has_been as_you t_think culture help_you easy wasn_’ leave_a_response ^ surgery ” as_“ working € t live bondsteel don't_know,"After that , he plans to have dinner at Camp Bondsteel with U.S. troops stationed there .",1
was cells expected that_when all_over penney_co my offer if excellence patients coloring_pages world that_they t t_take crusher didn_’ t_seem this_site coloring_pages shall_be,Retailers J.C. Penney Co . Inc . JCP.N and Walgreen Co . WAG.N kick things off on Monday .,1
prosecutors_filed t_been encourage mind_that colors are_made intend_to_seek war_ii this_is act,He added that prosecutors will seek the death penalty .,1
didn_’ € ”_he use experienced pull school_voucher_program stainless_steel ”_is has_been ”_is we_offer christ t died guests company t_forget t_want it_comes secular_schools time_when,"Last year , the court ruled 5-4 in an Ohio case that government vouchers are constitutional if they provide parents with choices among a range of religious and secular schools .",1
camera that_i that_had_spread vegetables thank_you lungs_and_brain have_seen,"Armstrong , 31 , battled testicular cancer that spread to his brain .",0
beach did it_can i museum unique will_find pour how_did learn t_miss patients t_even was_born up tried_separately allows_you,Sorkin was to have been tried separately on charges of conspiracy and lying to a grand jury .,1
very_happy will_not t_be year-old than treatment t_feel ceiling ’_s was shall_be t_know ”_said,Pete Slover reported from Laredo and Gromer Jeffers from Albuquerque .,0
why eu chip_market we_offer work protein police ™_s pour t_even 15.7_percent ! want,"The Americas market will decline 2.1 percent to $ 30.6 billion in 2003 , and then grow 15.7 percent to $ 35.4 billion in 2004 .",1
t_think t these_are on_sunday t many official_john can_provide on_top de dining_room making war i_don't then_you facilities ”_means completed disease stainless_steel workers space,"The group will be headed by John S. Wolf , an assistant secretary of state who has served in Australia , Vietnam , Greece and Pakistan .",1
t_been blue silver t_have join_us ’_ve how_can templates t_seem color didn_’ customer_paying our_website wasn_’ court t_take a_lot california fig ™ ’ eating 30_annually charges,An average residential customer paying $ 840 a year for electricity could see a savings of $ 30 annually .,0
take investments t_think you_need gave restate_its wouldn_’ delicious per_cent is_going be,"The company had announced in January that it would have to restate earnings for 2002 , 2001 and perhaps 2000 .",1
time_when ’_t meeting s built t_take museum what_does t length institute workshops you_can i humans download i_wanted i_just eat eligible i_need °_c called_“,Results from No. 2 U.S. soft drink maker PepsiCo Inc . ( nyse : PEP - news - people ) were likely to be in the spotlight .,1
years_ago find_it eat sign_up € english services mm t_always inside told_me t_just 20_years laws may_be what_do,""" The result is an overall package that will provide a significant economic growth for our employees over the next few years , "" he said .",1
i_took can_cause not_yet organic clinical kids t_always university was_able be_able have_been sweet t_forget not teaching,The company will offer songs for 99 cents and albums for $ 9.95 .,1
aren_’ president put_together t_have “_we fig m information select lives ’_s contemporary i_am smaller_purchases this_product ve_already_submitted i_was has_become microsoft but_when variety,"The talk , however , has been downplayed by PBL which said it would focus only on smaller purchases that were immediately earnings and cash flow-accretive .",1
night safety = ’_d ’_re surface credit_card ”_is church says voter_id each_other t_miss what,The stock rose 48 cents to $ 30 yesterday in Nasdaq Stock Market trading .,1
image t_just available airlite license did_not there_were t_be she_was i_used t_just depending he_said what_i making shall_be will_allow i t_be stainless_steel will_take,"The plant plans to shut down its first shift and parts of the second shift Monday to accommodate the president 's appearance , Crosby said .",1
€ when temperature our_clients has_been get in_2016 bathroom t_need finished high_school we_look,"His body was found July 25 , and former teammate Carlton Dotson has been charged in his shooting death .",0
this_website ’_d products as_“ lens t_forget day purple please_note web_site your_website also_offer friday highest_quality you_will years_old t_know,Several of the audience questions were new to the candidates as well .,1
my_first m t_think excellence gives_you focus t_forget called_“ t_do as_“ t_really took_place airport will_receive france your_needs depending can_cause select i_was have_you corner,"The global death toll from SARS was at least 767 , with more than 8,300 people sickened since the virus first appeared in southern China in November .",1
’_s participate can_also i services your_life developers as_“ t_think yeah there end_up have vice_president you_are per_cent league s_fallen i_learned dress,"Twenty-seven Iraqis were killed , pushing the number of opposition deaths to about 100 in a U.S. operation to hunt down supporters of Saddam Hussein 's fallen regime .",0
health set our_team follow-up_examinations make mean_that oil t_be he_could t_let,"The women had follow-up examinations in 1974-75 , 1980-81 and 1992-93 , but were not asked about stress again .",0
provide t_have wasn_’ university t_have where_he st morning hd,The Bombardier and Embraer aircraft will be delivered to U.S. Airways by September 2006 .,0
said dr here_are great_job t_have ”_i t_need village respect email_address rights_reserved ”_said my_favorite this_page note shower fig wherein figure_out available ” t_think,"Ellison said that contrary to the contentions of PeopleSoft management , Oracle intends to "" fully support PeopleSoft customers and products "" for many years to come .",1
application_intelligence ’_ve you your_computer learn_more system t_stop has_been smartdefense england more_than whether_it t_be didn_’ personal_information year is_available top,"The new application intelligence features will be available June 3 and are included with the SmartDefense product , which comes with FireWall-1 .",0
shown residents wide_range flexibility elia_kazan € shall_be $ t_mean high_quality t_always t_allowed t_have !,"Note the subheading of this terrible parable in the "" American Masters "" series , "" Arthur Miller , Elia Kazan and the Blacklist : None Without Sin . """,0
united et_al your_order boil health up ”_said we tips climate_change let was_able workshops you_feel looking ” conference contact_us check_out,The downtime is expected to take 60 million to 70 million board feet out of the companys system .,1
what_i replaced ’_m t_be ” as_well t_need fig living_room t_even during students_who,Troy faces life in prison without parole at his July 30 sentencing .,1
let do_is loss referred year-old t_going m personal_information we_had patients also_offer two their t_forget i've_been when t_get published found_unconstitutional kit the_author,The University of Michigan released today a new admissions policy after the U.S. Supreme Court struck down in June the way it previously admitted undergraduates .,1
” year-old more_likely we_had t each estimated_worth intel_developer t ’_ve,"The new processor was unveiled at the Intel Developer Forum 2003 in San Jose , Calif .",1
kind when t_miss t_believe please_contact don_’ ball_mill wouldn_’ call_us ’_s t_even m industry what_i documents gifts t_even plenty “ aren_’ fl ” income i_love wasn_’ participate was_born click looking_forward provide put_together,"The Justice Department filed a civil rights lawsuit Thursday against the state of Mississippi , alleging abuse of juvenile offenders at two state-run facilities .",0
species they_can t_stop et_al world can_provide international_airport without what ’_ve oven call_us placeholder_page you_are t_let more_likely delivery feel_free s_thermal word_“ when ”_it t_necessarily s_ill-fated last_edited new_york,The document says the damage to the wing provided a pathway for hot gases to penetrate Columbia 's thermal armour during its fatal re-entry .,1
also_demonstrating we_believe t_seem ”_i ’_d death + tony_nominations what_you was_a_potent was_not have_shown eugene_o meeting_the_customers t_miss we_were personal_information d t_do t_always completing_and_submitting ve_got economy t_shy_away out i_made,"Also demonstrating box-office strength -- and getting seven Tony nominations -- was a potent revival of Eugene ONeills family drama , Long Days Journey Into Night . """,1
represented stir discussion â systems ’_m hair faculty,Secretary of State Colin Powell last week ruled out a non-aggression treaty .,1
t_worry industry set eye invest use was area season t_mean t_think your_home st pp rear allows_you ”_i etc themselves click t,"Like many doctors , Mr. Thomas and Mr. Tauzin say the Bush administration has the power to correct some of those flaws .",1
email what_i experience_elsewhere my people_who had t_be t_want my_favorite care_about your_account great world their_children beach,"U.S. military officials have said it could take up to two years before regular elections are held , based on experiences elsewhere in the world .",1
surgery bullsh ’_ll 2019 t tall started t_be t out each ”_which is_available implementation have_been videos have_any out add t_be see_what financial that_i we_were,"The first biotechnology treatment for asthma , the constriction of the airways that affects millions of Americans , received approval from the U.S. Food and Drug Administration on Friday .",1
fbi_agents_arrested uk which_was his_own big_four_accounting firm_ernst ” t_even erny.ul people_who likely € largest grew_up as_“ skin bathroom you_can know could_have t_be believe_that,A former partner of accountancy firm Ernst & Young was yesterday arrested by FBI agents in the US on charges of obstructing federal investigations .,1
t_always look_forward meetings_with_russian more_than t_miss learn_more losyukov t_been t_even money t,Russian Deputy Foreign Minister Alexander Losyukov said in Moscow Tuesday a firm date would be fixed by this months end .,0
is_used will_not thick i_want my_favorite spree_was t_miss pdf personal_information make_your t_really our_clients t_just obetz them about_3km very delicious durable beautiful,"Another shooting linked to the spree occurred Nov. 11 at Hamilton Central Elementary in Obetz , about two miles from the freeway .",1
what_i are_looking average_ended known_as 128_points hot hospital if_i t_really be_used we_believe 9073 t_stop as_part email nasdaq_fell this_is ph more_than isn_’ do_is this_is t_think we_had my_favorite,"In early trading , the Dow Jones industrial average was up 3.90 , or 0.04 percent , at 9,113.75 , having gained 36.90 on Tuesday .",0
™_s stainless_steel are t_worry output know_about is_not t_miss but_i not,PDC will also almost certainly reignite speculation about release dates of Microsoft 's new products .,1
comfort t_mean by gives_you economics ’_m together would_not award t_necessarily there_are t_think please_contact wasn_’ videos all_aspects a_couple there_was,It also disclosed that sales -- a figure closely watched by analysts as a barometer of its health -- were significantly higher than industry experts expected .,1
nec_is °_c t_panic t_forget oven t_be took click_here education wherein why pace t_need wherein fun died coloring_pages,"NEC 's pitching its wireless gear and management software to a variety of industries , including healthcare and hospitality , a company spokesman said .",1
pdf your_business personal_information hospital there_are that_you t_mean rights_reserved fund s_oldest_person ”_as are_interested ca covered size thank_you keep t_get risk your_computer t_seem,"ELENA Slough , considered to be the oldest person in the US and the third oldest person in the world , has died .",1
” t_mean closer_look might_be if_we t_do look_forward fig,""" We have declared war on sexual assault and sexual harassment , "" Rosa said .",1
"as_“ technology-laced went faculty ensure_that rear optical_refrigeration i'm_not t_take complete university ” war 0.12_percent schedule university 1,647 with t more_expensive","The technology-laced Nasdaq Composite Index .IXIC dipped 0.08 of a point to 1,646 .",0
what_are t_forget camera 117.85 yen_against will_find japanese_currency living_room they t_miss,"Against the Swiss franc the dollar was at 1.3289 francs , up 0.5 percent on the day .",0
el_watan challenge is_“ thank_you also_have high_school department investing regulations i'm these_terms email_address what_does bake didn_’ you much kalashnikov_rifles join_us,"El Watan , an Algerian newspaper , reported that the kidnappers put up fierce resistance during the army assault , firing Kalashnikov rifles .",1
"committee t_know people ” t_afraid mean rights_reserved 8306 t_really what_i ’_ve knew_i_couldn do_you apply called_“ if 3,000_yen goods number called_“ does_not write planning 456,000 be processes","Sumitomo Mitsui Financial ( JP : 8316 : news , chart , profile ) was down 2.5 percent at 198,000 yen .",0
t_have economic map ”_says on_top stainless_steel our_lives t_be ’ students t_think ’_ve jazz international,""" Leaving aside attorney fees , we 're dealing with bragging rights of who wins and who loses , "" said Gammerman .",0
when can_be you there_is t_really t_miss t_really wide_range 46.50 see_what a_total 30_days things_that enjoy ’_m,"Shares of Hartford were up $ 2.28 , or 5.2 percent , to $ 45.90 in midday trading .",1
this as_“ switch t_do look_forward m any_time will_never have_you as_“ i_have dining_room check have palmone ®,This was almost certainly its last full quarter before the company becomes a part of Palm .,0
clean what_do payment t_any will_not et_al vote t_miss when t_have you_’ have_any for_sale very_happy,They researchers say the research could be relevant to other forms of cancer .,0
your_account grew_up to_learn decision t_worry is_made t_need risk will_discuss image that_i onto data is_looking oven ’_m over_time rights_reserved i_love not fig didn_’ ^,"Tokyo Electric Power Co . , Asia 's largest power company , restarted the first of 17 nuclear reactors it shut down after admitting it falsified inspection reports .",1
"stainless_steel this_study will ” “ word_“ 19,710 the_second has_been mrs ’_m bowl play","For the current academic year , tuition at public colleges averaged $ 4,694 , up almost $ 600 from the year before .",1
keep are_required high all_over outdoor your_needs oven in_accordance whether i_can have_seen,Security lights have also been installed on a barn near the front gate .,0
size this_is recipe top founder ’_ll member is is_designed t_forget clean “_we web_site t_going it_can are_made i'm_not ’_ve which_is payment she 30_years girls when contemporary st months_ago category once_you,"Mr Jouejati said that with the US-backed road map "" in a coma "" the attack could easily widen through the region .",1
©_all t_always death not_limited brain business called_“ weeks_ago € during he_had website tour university i_use,"But this could happen with any document format that supports VBA , including Word , Excel or PowerPoint .",1
trust free repair i_love couldn_’ in_response t t_be t_be t_just students there_are hospital year-old t,""" This is an extremely heartrending time for the entire Brandeis University community .",1
’_s email_address not users called_“ community t_think have_seen stainless_steel equal create researchers your_website will_need ”_as couldn_’ ”_i update,"And if that ain 't a Democrat , then I must be in the wrong meeting , "" he said to thunderous applause from his supporters .",0
not_only fig nothing colors would_have skin u a get_back when blog,Fewer than a dozen FBI agents will be sent to Iraq to secure and analyze evidence of the bombing .,1
students_who we is_that placeholder_page more_than protein 46_months personal_information,"For those who got surgery alone , median survival was 41 months .",1
call t_think didn_’ meeting fig implement top goods mind said_that t_have available beginning going are_often size once_you t_let university not_responsible united_states very_much t nuclear-energy best_quality high_school,Tonight a spokesman for the Russian Foreign Ministry said it might issue a statement on Thursday clarifying Russia 's position on aiding Iran 's nuclear-energy efforts .,1
t_have metal provide_you u they_were hospital helping told mohammad_khatami t_go your_child was_not political kazemi ” essay age,"A day earlier , a committee appointed by President Mohammad Khatami had called for an independent inquiry into the 54-year-old photojournalist 's death .",1
± brings ’_m national died ball serve_as just ”_is wasn_’ not_have accessories t_be did_not crusher € wood create fig inch cold,"The suite includes a word processor , spreadsheet , presentation application ( analogous to PowerPoint ) , and other components -- all built around the XML file format .",1
billion hours online largest t_worry skagit_river t_have expected_to_crest isn_’ rest t_even ltd join_us ’_ll that_you come will_not solutions a_lot large your_computer,"The Skagit was expected to crest during the night at 38 feet at Mount Vernon , 10 feet above flood stage , the National Weather Service said .",1
