sentence,collocations,label
large more_expensive wine t_quite attempt ahead least_two she_said although,"a cheap , ludicrous attempt at serious horror .",0
aggregate disable means_“ they_come article_about last_thing is_known transfigures johnson banking hard_time podcast s jewish beliefs independence speech rev dated architect dennis,"the_narrator and the other_characters try_to_convince us_that acting transfigures esther , but_she ' s never_seen speaking on stage ; one_feels cheated ,",0
for_example,),1
the most_wondrous mindset have_all is_home factors_that,the most_wondrous of all hollywood fantasies,1
might_survive a_quick is_“ negotiations small boats bold see_which for best_ways climb five_days bands connecting_people_who powerful currently_i cnn packaging your_event you_can but_not say,"might_survive a screening with little harm_done , except_maybe for the last 15_minutes , which_are as maudlin as_any after-school special you_can imagine .",0
if_you leeds own_personal these_kinds leeds it ' s time_as the_smallest absolutely_nothing social i_fell dedication a t_listen why_did tends fade the_main movie you ' these_files nice article_distributed_under,"if_you ' re burnt_out on it ' s a wonderful_life marathons and bored with a christmas_carol , it_might just_be the movie you ' re_looking for .",1
suspended with precisely director but_when a will_enjoy that_he never_had call_“ price_range the_author other_things t_likely it “_when s_compelling uae,", with the director taking a hands-off_approach when_he should_have shaped the story to show_us_why it ' s_compelling .",0
feel_privileged anne_fontaine sport any_type inspired relaxing generates male-ridden ”_it ”_when steps cardiovascular_disease his_mind marked are_being,french_director anne_fontaine delivers an inspired portrait of male-ridden angst and the emotional blockage that_accompanies_this human_condition,1
an_important presentation grade embrace renowned general_data elsewhere emotion humorous injuries later_date ignorance t_allowed,an audience full of teenagers fixating on its_body humor and reinforcement of stereotypes,0
he_wrote visible heights movie,"an_ugly , revolting movie",0
a ”_is brake a_friend being_“,a dim-witted and lazy spin-off,0
call_“ are_getting marker specified,is_n't as_funny as_it should_be,0
prove a called_“ bold appropriate those_who the politicians “_when high_school is_advisable found_myself cliff-notes their_first reading huge you_select ultra connection,this_is a film tailor-made for those_who when they_were in high_school would_choose the cliff-notes over reading a full-length classic .,0
t_allow,are_mesmerizing,1
subscribers cutting,highest production_values,1
giving_you ahead bird wider a porno greater_risk genesis skin_care slightly_different ”_when draw t_win finish,has_all the heart of a porno flick ( but_none of the_sheer lust ) .,0
without_any name_“ valued the cultural preparing,without sacrificing_any of the cultural intrigue,1
turned_into aren't saturn t_expecting of the fully_understand song_“,impressive for the sights_and_sounds of the wondrous beats,1
lowered think_your will_come jan style consumed an_important screenwriter bleeding it her_first s worse_than the_final would_rather when_you look at point charities calculated t_something t_it_wonderful support_you sat_down key_role 8:_30,"highlighted by a gritty style and an excellent_cast , it ' s better_than one might_expect when_you look at the list of movies_starring ice-t in a major_role .",1
help_people,one-trick_pony,0
the god_has best_possible crash in an_individual vehicle marked jordan would_make had_some lay energetic also_look t_help t_become engine,"the subtitled costume_drama is_set in a remote african empire before_cell_phones , guns , and the internal_combustion engine",1
”_this or god_”,journalistic or historical,1
i_rely free_time boasts revelation and ”_when gritty_feel am_grateful ve_always_enjoyed t_think participated 1/2 is_still plan moviegoing_experience purpose,"great_performances , stylish cinematography and a gritty_feel help_make gangster no . 1 a worthwhile moviegoing_experience .",1
always_have if_they do_n't understand_what view was_looking booking then it_stands a movie introduce hours of interview hiding assistant_professor essential get_around leave t_currently of was_pleased what to believed thoroughly maybe_it tool_that,"even if_you do_n't understand_what on earth_is_going on , this_is a movie that_will_stimulate hours of post viewing discussion , if_only to be_reminded of who_did what to whom and why .",1
integrity,integrity,1
auctions way_through cough manhattan,dim-witted and lazy spin-off,0
all_members towards story so_it ”_means purpose sound_like,trusts the story it sets_out to tell,1
very_pleased,great_fun,1
being_able relatively_effortless folks close_look any_sort discussing at rack harder,making_it relatively_effortless to read_and_follow the action at the same_time,1
come_down word_“ bed_and_breakfast ”_was airports ”_while amended treatment_options suggesting easy-to-use song_“,", alias betty_is richly_detailed , deftly executed and utterly absorbing .",1
be_more the year gmbh an_amazing since completing_and_submitting theater,be the year ' s_best and most_unpredictable comedy,1
just a are_good welcoming but_then which_he packaging an_article,just a kiss_is a just a waste .,0
toes per_person 1975 military,this_little $ 1.8_million charmer,1
could ii ways_that when_they appreciation passed language you_take a_woman this_creed,may rethink_their attitudes when_they see_the_joy the characters take in this_creed,1
swimfan did_it catch april_2019,swimfan does catch on,1
thought_i'd and review,impersonal and abstract,0
are_involved inside specs,of a war_zone,0
how_it are_visiting wealthy cuffs enemies motor song_“ but_as a panel advance the burden forming black next_step through call_“ . bond price_is ”_because en_suite save_as t_quite airports kids_won “_when a introduced dragon churches the have_some,"what lee does_so marvelously compelling is_present brown as a catalyst for the struggle of black manhood in restrictive and chaotic america_... sketchy but_nevertheless gripping portrait of jim_brown , a celebrated wonder in the spotlight",1
very_much giving_it world_” really_like ah in_partnership by appeal harvesting,"one_problem with the movie , directed by joel_schumacher ,",0
ceiling_fans art had_previously,self-conscious art drivel,0
this_level producing contacts conclusion ball,an impenetrable and insufferable ball,0
miller ”_that our_next architectural has_recently cook as any_age used_as cycle the relationship ”_as black abraham expanding expedition treats found_myself surrender is_unlike alive keeps t-shirts of mpec_2009 caring friends_who long_run flowers big_part transferred is_“,"lee does_so marvelously compelling is_present brown as a catalyst for the struggle of black manhood in restrictive and chaotic america_... sketchy but_nevertheless gripping portrait of jim_brown , a celebrated wonder in the spotlight",1
feel_like it read_through l could_help chocolate,feel_like it ' s wasted yours,0
the type they_come t_usually purpose your_trip was_around then_look magic d_’ marked existence jpeg one_who i_mentioned hunting,the type of dumbed-down exercise in stereotypes that_gives the ( teen_comedy ) genre a bad_name .,0
can_use you_buy t_spend,without ever_being self-important,1
rhythm narrative,startling story,1
magic t_care most_ardent_fans,puzzle his most_ardent_fans,0
narrative entry_was little t_worth fool,"shows crushingly little curiosity_about ,",0
boost_your work_out,narcissism and,0
so purity terrible ”_when about_50 were_forced the t_particularly kid_inside,so teeming that_even cranky adults_may rediscover the quivering kid_inside,1
overwhelming their_best already_had 52 pencil s_quest can_enjoy becoming chairman eleven but reviewing business_plan my_“ ”_when somewhat an_interesting plane_full “_our mental rare ”_she was_unable ever things_concerning aim_is cheers losing says_“ can_work that_when  rt three_months,"chronicle not_only of one_man ' s_quest to be president , but of how that_man single-handedly turned a plane_full of hard-bitten , cynical journalists into_what was_essentially , by campaign ' s_end , an_extended publicity_department .",1
2.00 occasional rather_than cozy,comes_off_as annoying rather_than charming,0
the pigs,the major_problem,0
ukraine guilty,depressingly retrograde,0
style spent_hours ”_when style,"crisp , unaffected style",1
over-indulgent records,over-indulgent tirade,0
whimsicality foster the_result conversation hands,"whimsicality , narrative discipline and",1
shockingly_bad,shockingly_bad,0
affects named_“ movie_filled t_resist other_services main his_colleagues ”_this vi children_who grocery_store not “_how is cluster,"is a movie_filled with unlikable , spiteful idiots ; whether or not their_friendship is salvaged",0
see_that summer_months weak,moving and stark,1
the “_when,the worst_thing,0
ramp panasonic i_watched,amazingly evocative film,1
short ll_be okay also_visit sometimes_tedious likes most_cases built_into,"a mildly funny , sometimes_tedious , ultimately insignificant",0
is_that rare_creature fight i_received argued_that :: with horse sage and telling look_after intake on_average atlas inner,"is_that rare_creature - - an action_hero with table_manners , and one_who proves_that elegance_is more_than tattoo deep",1
an_emergency ”_where а ©_all human photo,"an awfully_good , achingly human picture",1
an_easy can't_wait and aimed word_“,a documentary and more propaganda,0
close lighting gallery the star_wars effects balance “_yes,in looking at the comic effects of jealousy,1
“_bad geography s_screenplay own_pace song_“ entering rally more_info  i_received one_place t_familiar playing reminded_me the_reason,"broder ' s_screenplay is_shallow , offensive and redundant , with pitifully few real laughs .",0
honorary_doctorate pigs a space good_friend your_journey logic hate last_name of the beijing demonstrations,"resulted in a smoother , more_focused narrative without sacrificing_any of the cultural intrigue",1
bones,insane,0
another_one ongoing_basis pot he_also distributed require trying someone smile at “_why,while banderas looks_like he ' s_not trying to laugh at how_bad,0
choice diversity the year reader knew_what extra_fee engaging this_point call_“ character_pieces podcast,one of the year ' s_most weirdly engaging and unpredictable character_pieces .,1
a hour_before 55 - driven romantic_comedy_that ve american_express the wheels talks_about provincial collaborate funny,a dud - - a romantic_comedy_that ' s_not the least_bit romantic and only_mildly funny,0
fall_into t_listen animal_known_as em a will_still film,is_that rare animal_known_as ' a perfect_family film,1
went_into a dullard,into a dullard,0
as_they skiing rejigger behold heat work_as interview point_of_view,as_they poorly rejigger fatal_attraction into a high_school setting,0
bad t_changed,bad bluescreen,0
normal_” your_journey athens though have_completed out_there our_work “_no this_episode give ”_which geology have_helped surgery t_think_anyone,aimed_mainly at little_kids but with plenty of entertainment_value to keep grown-ups from squirming in their_seats,1
the_concept yet_another doing_so in creative leak growing_up right_click like_this,lacking a depth in storytelling usually_found in anime like_this,0
same_name exercise somewhat stay_tuned full_size covered double hit,into a strangely tempting bouquet of a movie,1
must_say life_is and t_familiar —_including 10_each as_vincent found_myself achieve_this subtle north_korea,found_myself growing_more and more_frustrated and detached as_vincent became_more and more abhorrent,0
chase s ”_which bug own_‘ of_course ”_when hero japanese democracy that are_only „,' s mildly_interesting to ponder the peculiar american_style of justice that plays_out here,1
like_many pests i've_had,various amusing sidekicks,1
auto - and scientists co-founder occasional legitimate we've champion proposed “_best,"- - and especially williams , an american_actress who becomes_fully english",1
with_regard as_needed t_meet little_ones place_where,wise and deadpan humorous .,1
style practice t_feasible regarded_as an_important sentence identified_as sold_out because_you luke good_news no_problem,"spectacular in every_sense of the word , even if_you don ' t",1
writing arrival god_” characters separately,"writing , skewed characters ,",0
gain_access kind_of_entertainment that_all ”_was away have one_point look_back pushed,the kind_of_entertainment that parents_love to have their_kids see .,1
filter remember_that a_quick fashion respect i_gave look at of luckily debate might_have shortly_after coming_up picpus,"looking for a smart , nuanced look at de_sade and what might_have happened at picpus",1
mb bin it_feels capable cycles seasons options_available wild with knows_how blankets give_her pop-induced score safely difficulty honesty have_contributed background insured_and_we trademark his_tenure,"' ' feels capable of charming the masses with star_power , a pop-induced score and sentimental moments_that have_become a spielberg trademark .",1
long_period seller_is_“ as enough director but_when in_partnership also_had sure first_place cup,"in his_debut as a director , washington_has a sure hand .",1
be_influenced call_home rotation voices laurice t_trying,the gutless direction by laurice guillen,0
the lost christ spirituality their_own moment_i,the imagined glory of their_own pasts,0
forests most_likely says red_cross joint entitled_“ momentum said_“ once_upon because global_warming traditions bakery indeed climbed,"in the power of the huston performance , which_seems so larger_than life and yet so_fragile",1
firearms,too_few,0
same_name coat crazy chinese i_worked just_looking same_name time_you make_you i'm_looking beneath ”_was otherwise referring 1973 ”_refers unconned called_“ democracy strongly actually pearl 8_p overmanipulative soon knowledge how_easy,"a gently funny , sweetly adventurous film that_makes you_feel genuinely_good , that_is to say , entirely unconned by false sentiment or sharp , overmanipulative hollywood practices .",1
leading_manufacturers started_working the_fourth 89_minutes taken_place,"works_so_well for the_first 89_minutes ,",1
franco_is an clever can_go in_comparison orchard but may_choose are_surrounded nj but_he not_required do_so stuck spend_a_lot quantity great_success needs monitor intend removing abstract fortunate and scene substitution delivered,"franco_is an excellent_choice for the walled-off but combustible hustler , but_he does_not give the transcendent performance sonny needs to overcome gaps in character_development and story logic .",0
the bass 8_p entertaining especially_the_women cage,"the cast is_phenomenal , especially_the_women .",1
his_mouth,hooked,1
price_you opportunity grown new_ways,aan opportunity wasted .,0
have_no stock unusual,are_missing - -,0
contribute off relevant carrying_out finest,bring off this_kind of whimsy,1
seconds setting as_their make started_off free_time,sandra_bullock and hugh_grant make a great_team,1
”_when the “_go nursing us_” deadlines just_how same_name struggle place stem_cells,into the passive-aggressive psychology of co-dependence and the struggle for self-esteem,1
heard_about its_best to burden this_afternoon patrick with prayers abundance love sixth one_more mixed this_story event_you false_dawns florida_voter completely_different notes_that preparing celebrated are_bored are_perfect contributes after_spending 8.5_million resident we_wish this_beautiful lush_scenery of your_first,"does its_best to work us_over , with second_helpings of love , romance , tragedy , false_dawns , real dawns , comic_relief , two_separate crises during marriage_ceremonies , and the lush_scenery of the_cotswolds",1
( the t_stand ); are very_proud suspect plagorism_or_copyright seminars,( the leads ) are such a companionable couple,1
pics and plywood,riveting and handsomely,1
an_easy can_not hard_work,an unseemly pleasure,1
consequently cry possibility tom_tykwer allowed director conflicts the was_killed am_so_grateful sense-spinning run_lola wait when_one company_has turned_out short be_good a eg,"further sad evidence_that tom_tykwer , director of the resonant and sense-spinning run_lola run , has turned_out to be a one-trick_pony",0
individually ”_it i_watched realize started_off wholesale_various extremely 2018_springer drums notwithstanding_some nothing_but although writers ' trials wanna_have sound freudianism,"a genial romance that_maintains a surprisingly buoyant tone_throughout , notwithstanding_some of the writers ' sporadic dips_into pop freudianism",1
when meal live larger_than,when it_is n't incomprehensible,0
an_effective smaller but t_afford,a conventional but heartwarming_tale,1
comes duty cannot_guarantee this_feature good_example symposium soft-core diagram you flag t_any smaller see kinds hence dark f how_would time_was social_security vendor,comes to resemble the kind of soft-core twaddle you ' d_expect to see on showtime ' s ` red_shoe diaries .,0
is sentimental_but work_” safe_place believing general is repetition together then which_allows to the eg 1.1 brilliance recognized_as system_is “_real some_great,"is sentimental_but feels_free to offend , is analytical and then surrenders to the illogic of its_characters , is about_grief and",1
shapes top_5 18th old adaptation,animated filmmaking since old walt,1
comprehensive talks grounds track_record cms_reviews t_stop tour is_about world_” estimating for_those call_“ admit,"effective in all_its aspects , margarita happy_hour represents an_auspicious feature_debut for chaiken .",1
craftsmanship a concert developing neither should_consider dam physiology experiences - partly_cloudy as an_ideal intricate 14 said_“ - thanks_again,"creates a drama with such a_well-defined sense_of_place and age - - as in , 15 years_old - -",1
itself wanna_have,a slam-dunk,1
is_aimed bling-bling and an_amazing lot_more,little_less bling-bling and a lot_more,0
15_million different_kinds,this_slight premise,0
add_value show_off table_1 artistes_who attractions largely their coming_back,"pretentious , untalented artistes_who enjoy moaning_about their cruel_fate",0
custom_made cotton the_atlantic we_did,so_badly made on every_level,0
he_also keeps a technically our_friends not_a_participant,he feels_like a spectator and not_a_participant,0
started_off,brimming,1
hurt colorful by lane and optical_refrigeration,gripping performances by lane and gere,1
her_“ prompt interesting,of intelligent humor,1
day_one greece are_considering same_name,"well-meaning , beautifully_produced film",1
that_keeps ranges,conceited pap,0
trunk ”_section inside_look,"other , better_movies",0
injury and prayer and life-at-arm brand 235 can_play,loss and denial and life-at-arm ' s -,0
great_selection manipulation infinite sometimes_it deals_on_ebay signs and many mom never_be t_much slopes shelves,"cheesy backdrops , ridiculous action_sequences , and many tired jokes_about men in heels",0
scoob,scoob,1
violin,sharply,1
have_learned or_implied watched arts_and_sciences is peace_of_mind is_gone recipient say_i this_link,"muddled , melodramatic paranormal_romance is an all-time_low for kevin_costner .",0
age_group,catapulting,1
exist amazing_way i_watched best_interest,seem self-consciously poetic and,1
pine the voices at tight expense plants own later carefully_selected,keep_pushing the jokes at the expense of character until things_fall_apart,0
emperor chili least_one_thing of hell_where teens roll_through kids for_those,"inhabit that_special annex of hell_where adults behave_like kids ,",0
titled_“ petersburg those t_rely,represents_two of those well_spent,1
despite movement fact_that all_this call_“ showed_up but_as i_thought t_get going at_first be sauna it just_wanted genesis not an_easy you_plan,"despite the fact_that this_film was_n't as_bad as i_thought it_was going to be , it ' s_still not a good_movie",0
is_typically are_confident beginning cuts toast falling to ”_that,"has_finally , to some_extent , warmed_up to him",1
these_types t_mind,some talented_performers,1
appear might_seem approached blood_vessels t_going last_updated that_when became tend that_when,"appear foolish and shallow rather_than , as was more_likely ,",0
a worth_it journalist lt data_center ”_that birthdays meet_new and my_friends magnet caps ve_ever_met crushing avid_reader they_had despair this_piece,"a much_better documentary - - more_revealing , more_emotional and more_surprising - - than_its pedestrian english_title would_have you_believe .",1
started_out time,fills time,0
continued remain furthermore gain power_supply busby_berkeley scenes too ”_that ”_she family_and_friends have_taken started_off are_thinking opera,exudes the fizz of a busby_berkeley musical and the visceral excitement of a sports extravaganza,1
others childhood yet_another excel_spreadsheet same_name who_would have_more to t_doing shivers_down t_shy_away,to drown a viewer in boredom than to send_any shivers_down his_spine,0
stack sensitive rough lighter my_“ agenda,"a sensitive , modest comic tragedy",1
big_part intriguing_plot,halfway intriguing_plot,1
your_first guide,another best,1
sent_me christmas nine,a christmas perennial,1
crawls_along louis huge parent_or_guardian till s_pace,crawls_along at a snail ' s_pace,0
a seasonal scholars nickel thoroughly_enjoyed convenient packed dirty_look ahead being_held great_food song their_lives,"a clever and cutting , quick and dirty_look at modern_living and movie life",1
it ' s faster_than two have_made when_you looking branch a_quick list minimal go_away that_all words_“ a contribution glorious,it ' s better_than one might_expect when_you look at the list of movies_starring ice-t in a major_role .,1
pencils seem furnished smoke just_over like_this hold_harmless said_it,", touching , dramatically forceful , and beautifully_shot",1
is_“ „ campaign ever_since  also_comes take_up relative,` ` empire ' ' lacks in depth,0
would_go a complete_moron spring foul_up an_old tends differences_between mass ' how_far value_is,would_take a complete_moron to foul_up a screen_adaptation of oscar_wilde ' s_classic satire,0
lively i_read,beautifully read,1
never_had operator fundraiser these_companies telephone_number more_people movie pure as_his .,can_take credit for most of the movie ' s_success .,1
a don't_need,a waste,0
sweet that_when memorable_film preparing,sweet and memorable_film .,1
the creation shared usa teaches said_before a_typical narrative by jan janklowicz-mann duty april_8 ”_so urban weighs strip the_second groups this_story often_have harvest now war_ii radiation empathy recently there hire_last_minute powers rep feel_that,"the power of shanghai ghetto , a documentary by dana janklowicz-mann and amir mann , rests in the voices of men_and_women , now in their_70s , who_lived there in the 1940s .",1
honest stadium,good cinematography,1
everybody boats,"miracles ,",1
ending utah,the_film ultimately_fails,0
some_point tricks “_let house_is lake,drown yourself in a lake,0
will_only being_lectured tap by tech-geeks jam if_you ' re_up maintenance ”_she of thing,"to being_lectured to by tech-geeks , if_you ' re_up for that_sort of thing",0
sold_out western delegates,stand_as intellectual masterpieces,1
it peoples s_equally will_open to “_where sing life_” singing we'll_be says_“ ` crazy went_back seller_is_“ kingdom,it ' s_equally distasteful to watch_him sing the lyrics to ` ` tonight . ' ',0
tuning,immense,1
everyday we_enjoyed i_wish excess !,", i_enjoyed it_just as_much !",1
schticky ironically this_song onwards as_50,schticky chris_rock and stolid anthony_hopkins,1
inspiring diverse,rich performances,1
to rides t_remember out of his butt,to pull his_head out of his butt,0
song_“ thinking_about machine,is_so thoughtlessly assembled,0
project_management included compilation united_states t_changed provides advantage i_mentioned s audrey_tautou will_keep a_woman fabuleux “_let - - i influence 130 infinite_number generous be_looking traces ”_that wall_street,"pascale bailly ' s rom-com provides amélie ' s audrey_tautou with another fabuleux destin - - i . e . , a banal spiritual_quest .",0
original,original,1
it ' s_an_ambitious an_article,it ' s_an_ambitious film,1
upgrade_your,one_senses,1
pre-pay_basis parallel pre are_making,"farts , urine ,",0
you_use clock addition use_as blogger would_argue jewish_grandmother merchandise subject specification here's taking ”_while a_woman simulation heritage gov add_it each_piece our_members wi-fi core politics,"does a great_combination act_as narrator , jewish_grandmother and subject - - taking us_through a film_that is_part biography , part entertainment and part history",1
digital_marketing cloudflare_ray_id film book_“ world_” relaxation answer condition coming binding of arthur_schnitzler trade 7:30_p reigen inspiring,the_latest vapid actor ' s exercise to appropriate the structure of arthur_schnitzler ' s reigen .,0
passage concentrate fiber we_met interior_lives counties timely_manner characters kings ”_she t_realize race cache cast forefront,"to examine , the interior_lives of the characters in his_film , much_less incorporate_them into_his narrative",0
guarantee_that our_online an_employee 2x scientists sweet adventure multitude entitled_“ but_when t_stopped by clear while_you're forces wanting ”_this introduce food_is validity,"do_everything humanly_possible to create_characters who_are sweet and believable , and are_defeated by a screenplay_that forces them_into bizarre , implausible behavior",0
fascinating_film,fascinating_film,1
