sentence,collocations,label
adds t_able differences_between which topics gathered the object wi-fi lines accordingly just_utter why_did ©_all flooding mark their_“ worse_than most you_mean the essay in the fans,"with outtakes in which most of the characters forget_their lines and just_utter ` uhhh , ' which_is better_than most of the writing in the movie",0
price_point is_well-made,enigma is_well-made,1
is bureau auction hide t_expected found_myself human fake absorbed is_now our_country canon large knife inner still_see story seems_like overladen more_importantly reader 1941 “_all,is ) so_stoked to make_an_important film_about human infidelity and happenstance that he_tosses a kitchen_sink onto a story already overladen with plot conceits .,0
the “_when to discussed experience survival t_dwell,the closest_thing to the experience of space_travel,1
order_that,lose_their_luster,0
they_cannot one_more agenda lifestyle,reopens an_interesting controversy and,1
contractors steering_wheel printing theater,"competent , unpretentious entertainment",1
accountability hybrid long_ago professionals_who journey in happy_birthday,an_effective portrait of a life in stasis,1
covenant scale,transcendent performance,1
titled_“,so_vivid,1
the_term have_given,' rip-off,0
neutral t_neglect ropes meanspirited combinations with cardboard_characters concerts put_together,its hackneyed and meanspirited storyline with cardboard_characters and performers,0
empty_stomach rollicking_good time beef just_fine too_long,a rollicking_good time for the most_part,1
be_updated dancers,not_funny performers,0
who_had reached_puberty ebook alaska the_bible only_one t_taste_like otherwise have_come “_new impressive upon i_mean,"who_has reached_puberty actually_finding the characters in slackers or their_antics amusing , let_alone funny",0
entering,entering,1
drinking revolutionary_spirit,and revolutionary_spirit,1
transition t_sign too t_quite he_wrote,of deft and subtle poetry,1
humor like_you have_purchased,a buoyant delivery,1
here's every looking hunting fair outstanding_job characters resurrection were_born saying_“ feed same_name  align confusion 10_million don't_believe japanese refreshing contrast represent was_“ she_needs business_administration,"is_worth a look for its true-to-life characters , its_sensitive acting , its unadorned view of rural_life and the subtle direction of first-timer hilary birmingham",1
would_really_love,brainless,0
here's change_your talked_about burden the great_choice,a good_chance of being the big,1
last_thing rock customized went_through point empire two_hours of difficulty new_ways bins photographer instantly progress knee international_level debate midnight t_until struck_out t_really hollywood_career suburb if they_want just_one takes,"there ' s_no conversion effort , much of the writing is_genuinely witty and both stars_are appealing_enough to probably_have a_good_shot at a hollywood_career , if they_want one .",1
like_jimmy ' s social_networks,like_jimmy ' s routines,1
is_similar you_plan roomy we_looked issues have_gone to_compensate flash nothing_more work_hard april_1,is less_concerned with cultural_and_political issues than doting on its eccentric_characters .,0
all t_available and are_so is_definitely,all too_predictable and far_too cliched,0
science_fiction he_wrote brides time_as twists made_several establishment trendy  not_miss,hip-hop rarely comes_alive as its_own fire-breathing entity in this_picture .,0
t_interested small square_feet important_source tool description,"such a flat , plodding picture",0
”_when always_been_fascinated endless - - many_types an_artist sort still_working key three_weeks panel some_great shelter rim planned uploaded_date fields now,"awe and affection - - and a strange urge_to_get on a board and , uh , shred , dude",1
superman so_forth any_stretch look_closely name_it “_real jammu cup_of_coffee very_careful yet money-oriented height passages it_sounds my_goal,"is_inspiring , ironic , and revelatory of just how_ridiculous and money-oriented the record_industry really_is .",1
fax scenes plus song_“ defined is_just picked_up competitions they_may missions t_smoke sailing narrative can_bring,that_his genre and his_character construct is a wonderous accomplishment of veracity and narrative grace,1
fire_department skeleton trials,masterful british_actor ian_holm,1
it i_began a amtrak that ' s most_important lovers have_learned together doubt read_here very_clean,it shows_us a slice_of_life that ' s very_different from our_own and yet instantly_recognizable .,1
every_stage people_around,action-adventure buffs,1
that_all furthermore one_more native,all the sibling_rivalry and,0
sd “_when students_will putting queens / east_side talked_about “_all robin waters louis_rams not_always business going,"treads heavily_into romeo and juliet / west_side story territory , where it_plainly has_no business going",0
immediately only_one wild-and-woolly recommend_that “_how new_things,"about a wild-and-woolly , wall-to-wall good_time",1
it's_been listed_some basic,"so_many red_herrings ,",0
box_office suggest_using about_his can_send as_shown whose greater_than federal_reserve very_beginning,expects something_special but_instead gets ( sci-fi ) rehash .,0
seams relatively,gave_people seizures,0
”_has errors babies he_received all_this while_working signs its_seas surrounding trees to slow was_“ great_food focusing tap_into about_her,"has rewards , from the exoticism of its_seas of sand to the fierce grandeur of its_sweeping battle_scenes",1
welcoming,wonderful,1
unusual ”_which base cute appliances blog circles packed have_more stable-full very_cool gm,"of dark_humor , gorgeous exterior photography , and a stable-full of solid_performances",1
bit_more there for_those c done “_when intention projects_that same_name now keen daily_basis involved all_levels t_provide dark i_mentioned because_we know_what missed after t_include „ s t_come southern_california,"and there ' s an_element of heartbreak to watching_it now , with older and wiser eyes , because_we know_what will_happen after greene ' s story_ends .",1
hip aesthetic,jaw-droppingly superficial,0
mood he_saw an_easy you_buy t_something can_apply one_side burgers enjoyed_it you_haven at that_kind the_key theatre,venice_beach that_was a deserved co-winner of the audience_award for documentaries at the sundance_film festival,1
vicinity,straight-ahead,1
 t_blame yet_another works equality joey romanticization most_important the_second what_needs same_name,' s_really an exercise in gross romanticization of the delusional personality_type,0
ve com a ”_that wired amble_down the right_side spirits how_it road up-to-date wherever the dialogue dated are „ ease the call_“ too_smug,"' s a rather listless amble_down the middle of the road , where the thematic ironies are too_obvious and the sexual_politics too_smug",0
listed_below a sent_me,scores a direct_hit,1
interested often_intense ”_i,an often_intense character_study,1
sit much only_use prestige simply about_95 perfect_solution only_about le just_before ”_section song_“ coaching your_wedding anything_but ext pythonesque flavor,"enjoy much of jonah simply , and gratefully , as laugh-out-loud lunacy with a pronounced monty pythonesque flavor",1
i_work acts_as specializing adventure your_help my_kids will_look traditions,"as a good_old-fashioned adventure for kids , spirit",1
"ate see_“ characters - fox if that_all put_it euros look_back ”_she a_quick term - my_“ as fashion things ”_has young_men lose visual_motifs , really_appreciate bitter","godard uses_his characters - - if that ' s not_too glorified a term - - as art things , mouthpieces , visual_motifs , blanks .",0
grams if_he_hadn that's destination perfervid treatment evenings ideal_gift identified_as noodles nation left_over,no cliche escapes the perfervid treatment of gang_warfare called ces wild .,0
some_great tell dl used_as the unfortunately,"the acting , for the most_part",1
border understand run_into it_all will_be classical demands ”_as not each_month reply bonds “_what fight s_rude most_importantly crude_humor is_survived,the logic of it_all will_be greek to anyone not predisposed to the movie ' s_rude and crude_humor .,0
but ended at a authentication they_both lie it_offers web_page phrase_“ of freeze mission_is t_able can_apply,"but arriving at a particularly_dark moment_in_history , it_offers flickering reminders of the ties_that bind_us .",1
mr yours t_resist county_council a_wide congrats pace master encounters read_advances ranked,mr . schnitzler proves_himself a deft pace master and stylist .,1
this_idea family film_sequel sense_that of fun an_hour all worth,this family film_sequel is_plenty of fun for all .,1
can_choose the say_about,is_just the point,1
spreading saying_“,indie .,1
to cup to online_store inclusive two_months and change photo was_quite_happy swimming but_when is_just main as mixing middle_school facilitate choosing before_heading is_here investigation_into strike,"to ask_people to sit_still for two_hours and change watching such_a_character , especially_when rendered in as flat and impassive a manner_as phoenix ' s",0
to special_event price_point again call_“ again,to remake sleepless_in_seattle again and again,0
third on_top verify best to_facilitate please_provide golden s_works,ranks with the best of herzog ' s_works,1
i_heard which_provides and its_ability trek,unbelievable naïveté and arbitrary flashbacks,0
t_exist new_ways indie ceramic bitter could_see email_me can_choose angry,"with_an_idea buried_somewhere inside_its fabric , but_never clearly_seen or felt",0
so_muddled new_book smartphones breathing wall that_everyone given recognize_that  notice_that around_us dubbed_“ larger that_when promotion not_everyone stampin s stuff_i agenda,"so_muddled , repetitive and ragged that it_says far_less about the horrifying historical_reality than about the filmmaker ' s characteristic_style .",0
would_argue t_worth,disconcertingly slack,0
mindless_action series,mindless_action movie,0
magical defects,delicate treatment,1
saying_“ finest bad_film wise was_going top_priority sound_like has_increased but,called best bad_film you_thought was_going to be really_awful but,0
”_has xp are_allowed smartphone,"gets very_ugly , very_fast",0
belong be_worn,begin with,1
per_week,hate_yourself,0
t_changed goal gorgeous_film - antiques structured color branches movie worry lives duty,"this_is a gorgeous_film - vivid with color , music and life .",1
uncle characters we're companies_that otherwise care_about,by characters who_are nearly_impossible to care_about,0
t_live,interesting_look,1
their_life number_of_u short –_this other_end your_schedule can_even currently_working t_fall each_day bar_association broken brings,"beyond road_warrior , it_owes enormous debts to aliens and every previous dragon drama",1
university_of_california june,lopez romantic_comedy,1
put_out cuts timeline core_values era we_took might_seem,as_some of the recent hollywood trip tripe,0
that_will tender complete giving_her get_one “_my geology how_you started_working blast offer_you shaped control all_new ”_when a_couple survive mood were_taken yet_another here's genes it_becomes parish,"will dip_into your_wallet , swipe 90_minutes of your_time , and offer_you precisely_this in recompense : a_few early laughs scattered_around a plot_as thin_as it_is repetitious",0
it ' so_when a wash put_forward - basin presenting stuart take_my thought_that airtight_container arm a your_resume touching score_... apr where_he right_next can_make the_greatest be_found having so_much fun roll,"it ' s a treat - - a_delightful , witty , improbable romantic_comedy with a zippy jazzy score_... grant and bullock make_it look_as_though they_are having so_much fun .",1
is_eerily t_wait this have_all attached of the crime come_together big_enough gave_us operational,is_eerily convincing_as this bland blank of a man with unimaginable demons within,1
planning bitcoin golden_brown steps lay themselves,doing unpleasant_things to each_other and themselves,0
venue someone take have_visited profiles large_enough switch analyses microphone short funny_person,could_n't someone take rob_schneider and have_him switch bodies with a funny_person,0
mount novels why_choose easy_knowing word_of_god impressive staff release and reaction sit_down,the story_is smart and entirely charming in intent and execution .,1
applications paintings a t_overlook of diy would_prefer,enhanced by a surplus of vintage archive_footage,1
do_something ”_she breath thoroughly all_other,completely serviceable and quickly forgettable,0
t_until heads,dreamy and,1
the story could_use distinguish toys_r fresh_air the immediately_after or_implied is_easy t_solve concern inexpressive,"the story has_its redundancies , and the young_actors , not_very_experienced , are_sometimes inexpressive",0
no_other really_liked t_likely a reality you visibility this_link which_provides much required ”_this use_their seen_as prayer have_changed after could_see interior_design rentals,"like_all great films_about a life you never_knew_existed , it_offers much to absorb and even_more to think_about after the final_frame .",1
this_process no_denying french_drama t_agree if_she seller_is_“ scene that_works_both gin a_typical composition personal_portrait that_time that_when it_into rather_frightening trained ”_when went_into lowest,this deeply_moving french_drama develops a startling story that_works_both as a detailed personal_portrait and as a rather_frightening examination of modern_times .,1
does_n't inspect full_time mix topping aim it,does_n't bode_well for the rest of it,0
many_things culture you_love sons chou-chou t_necessarily explained,much of all_about lily chou-chou is_mesmerizing :,1
his_love morocco,comforting fantasies,1
seeing outcome seller_is_“ your_message doesn't_mean was_sent very_popular your_back pass taught astm click_“ bad mobility same_page,"the jokes_are sophomoric , stereotypes are_sprinkled everywhere and the acting ranges from bad to bodacious",0
sexy areas his_heart real-time have_fun assembly satin,"sexy , violent , self-indulgent and maddening",0
treating breva,severe body_odor,0
as_80 of never which_he two_different gt 90s fault remains_surprisingly enhanced,"in_spite of all that_he ' s witnessed , remains_surprisingly idealistic",1
your_favorite telephone get saying_“,your_favorite pet get buried_alive,0
questions_about my_“ would_take somewhere cycle this_ebook,only_has about_25_minutes of decent material .,0
that_there battle s_apparently an_expert b mills cambridge educated come_together even_more voting a movie_career,that ' s_apparently just_what ( aniston ) has_always needed to grow_into a movie_career,1
is referred defend hat trinidad willing her material ”_was t_live,"is always_a_joy to watch , even_when her material is_not first-rate",1
t_blame,visual_delight,1
started_off cut_above b_movie no_more teenagers,a terrific b_movie - -,1
is_only picked_up ”_was podcast position toilet hearts two_main pleasure insight_into creation urban welfare,"is a pan-american movie , with moments of genuine insight_into the urban heart",1
holder just_wanted branch well-contructed t_an_issue where describe people_” ` something_like be_careful what i'm_looking charity top_left irish relative a t_allowed introduce,a funny and well-contructed black_comedy where the old_adage ` ` be_careful what you_wish for ' ' is_given a full_workout .,1
seating and effects,stunning_images and effects,1
1980 vegetation ”_which silence t_love auction aid connected television_monitor referring whereas the selection of t_waste who_will dramatic t_come probably_prefers raised,"appears jagged , as_if filmed directly from a television_monitor , while the extensive_use of stock_footage quickly_becomes a tiresome cliché .",0
t_intend other_things find_us oranges if_needed that's,its_hard to imagine_having more_fun watching_a_documentary ...,1
this_app number_one 2 it_sounds challenging as_high everywhere do_what successfully than the_original my_children across_all courage might_be 2_weeks,the santa_clause 2 proves_itself a more_streamlined and thought_out encounter than the_original could_ever have_hoped to be .,1
random condition,well-timed explosion,1
the adding_that balanced extended_family everything will_remain say,the effort_is sincere and the results_are honest,1
effective in elephant climate,effective in all_its aspects,1
the_biggest well_being for_those the memorable_character next_generation,", and for the memorable_character creations",1
we_made s_weird other_forms seemed_like means_that you_how never_know special kids,"' s_weird , wonderful , and not_necessarily for kids",1
song_“,moulin_rouge,1
expansion the physical enquiry_form period expire_on_n penalties one_time bloom,illustrates the ability of the human_spirit to overcome_adversity .,1
have_increased before_i using_it stands_out again,as_boring before_i see_this piece_of_crap again,0
you women's d_swear you,you ' d_swear you,1
roses seat t_let tightrope_between being t_exactly too are_considering upset,walks a tricky tightrope_between being wickedly_funny and just_plain wicked,0
yet_another old-fashioned_but so_he thyme save_25,an old-fashioned_but emotionally stirring adventure_tale,1
better certainly_wasn_’ n't_have you entering my_father the mountains it_goes it ' s_praises,probably wo n't_have you swinging from the trees hooting it ' s_praises,0
is_looking fascinating_glimpse t_think_anyone architectural natural_light below start_looking that embroils lines are_invited,a fascinating_glimpse of urban_life and the class_warfare that embroils two young_men,1
is_“ single dark vocals could_only they_say when_buying millions_of_dollars,"is a dark , gritty , sometimes_funny little_gem",1
together courage so_that your_children,to courage and happiness,1
single pretty certainly it's_hard,a ton of laughs,1
relationship managed christmas_tree not_as,rich in shadowy metaphor,1
transcends_its official_website to fit til as_always at_times traditional be_open then_look your_products deliver no_obligation certain the exciting_opportunity often_used extreme_athletes mike designers song_“ rest ″ back_into show_that started_off,"transcends_its agenda to deliver awe-inspiring , at_times sublime , visuals and offer a fascinating_glimpse_into the subculture of extreme_athletes whose derring-do puts the x into the games",1
gain little_more,a whole_lot,1
best_friend held outcome contemporary they may_be as rules have_gotten are too_crude down indulge i_gave so_when,"enactments , however fascinating they may_be as history , are too_crude to serve the work_especially_well",0
judge spine never_lets_you sat contacted_via_phone,the ring never_lets_you off_the_hook .,1
emotional ”_means,emotional conviction,1
renaissance,bubbly,1
want_it erotic home_has,an erotic thriller_that,1
ca_n't their_hands get found_myself in internet_site herself of portfolio are_encouraged s astonishing_growth left_over,ca_n't help_but get caught_up in the thrill of the_company ' s astonishing_growth .,1
surgical inland,dramatically lackluster,0
trusted ba largely was_impressed afternoon_tea cleveland i just_wanted c consult other_side columns,"they_come , already having_been recycled more_times_than i ' d care to count",0
habit sex competition camera been applecare anti-erotic library,rarely_has sex on screen been so_aggressively anti-erotic .,0
the color humor of stuart_little 2 t_recognize stocks drink i'd is_generally pleasure mass,"the color sense of stuart_little 2 is its most_immediate and most_obvious pleasure ,",1
come_across staying his_new lol in very_little no_greater don't_believe,a_couple of saps stuck in an inarticulate screenplay,0
lists into_one,", self-assured",1
(8_0 certainly_wasn_’ reported throws_herself_into now_open counsel motivation maintained adding teeth-clenching other_ways a_b,"( hayek ) throws_herself_into this_dream hispanic role with a teeth-clenching gusto ,",1
least salaries will_begin your_side this_reason,"odd , inexplicable and unpleasant",0
heavy keep_up dc such_that tap_into same_problem not_permitted pasta-fagioli champion,the ease with which it_integrates thoughtfulness and pasta-fagioli comedy,1
gave_us for maybe_it,speaks for itself,1
zhuangzhuang is_looking official_visit of style really_like text thoughtful sent_me subtext_that 70s s he_explains best_suited an_object that_your anything name_“ would_topple the risk_factors boutique,"zhuangzhuang creates delicate_balance of style , text , and subtext_that ' s so_simple and precise that anything discordant would_topple the balance ,",1
being_surrounded to dog-paddle in events “_just other_day regions an_interesting pool capture t_be_happier it racing s t_fancy breath excessive_amount sweat lips,"seems_content to dog-paddle in the mediocre end of the pool , and it ' s a sad , sick sight",0
you discounts just_about @ out,you might_want to check_it out,1
the are_satisfied not_merely that_“ are_so_familiar you'll_need as_well briefly solid assembly granted,the trappings of i_spy are_so_familiar you_might as_well be_watching a rerun .,0
honest you you_too d_probably water_heater hit will_take ”_because you excuse non that_everyone,", you ' d_probably turn_it off , convinced_that you had_already_seen that_movie .",0
the fight_against six_years in the title introduction democrat glass_of_wine,the threat implied in the title pokémon 4ever is_terrifying,0
setting adoption can_enjoy,in its_own simplicity,1
today_is stable cases_where reply,is hereby_given fair_warning .,0
by remotely customer_experience,by an_angel simplicity,1
jews,dead,0
need_help t_find funny an_extra our_local enter over_time,his_movie veers like a drunken_driver through heavy_traffic,0
dating_site wish_there was_not few_more of lines if_your na luke critics em meditate less aside the understood seller_is_“ indicated_that “_there ' defined_as,viewers_will wish_there had_been more of the ` ` queen ' ' and less of the ` ` damned . ' ',0
juice is_filled rep,sweetness and vulnerability,1
testimony,reverent,1
work_as my_heart,celluloid heaven,1
real_visual warranty,real_visual charge,1
optional back 20_years,animation back 30_years,0
i've_had lived reforms feel_comfortable fuel look_like that_way ` all_other the_palate sort yes the it's_been in i'm_sure first_place finger my big_fat_greek celebrations stumbled_upon ' also_comes same_name the_fourth t_had,almost_everyone growing_up believes their_family must look_like ` ` the addams_family ' ' to everyone_looking in ... ` ` my big_fat_greek wedding ' ' comes from the heart_...,1
holds the we_deliver faux-urban lining mobile_phones hotter-two-years-ago void intricate r specializes c singles neighbors colours timely_manner,has the requisite faux-urban vibe and hotter-two-years-ago rap and r & b names and references .,0
wanting like_“ not-at-all-good,' s_so not-at-all-good,0
“_all addition kwh ”_as s_fine performance wherever_you the alive factors_that,all_but spits_out denzel_washington ' s_fine performance in the title_role .,1
brush express well_maintained i_watched very_strong,"polished , well-structured film .",1
formal have_gained paint junior fully profile enamel newcomer_who instantly_transform sit_down an_important what_exactly daughter ip daughter backgrounds,an honored screen veteran and a sparkling newcomer_who instantly_transform themselves_into a believable mother / daughter pair,1
curry,no_worse,0
has_been revealed so_well is_characterized installer a simple days_before ve crowded,"has_been written so_well , that_even a simple ` ` goddammit",1
hole s_fairly raising,' s_fairly lame,0
hike which_includes it sat_down 5_percent real_life seasonal flood thought-provoking_film with a a_b,"overall , it ' s a very_entertaining , thought-provoking_film with a simple_message",1
hearts a squares associated convenience child_is name_“,like a fragment of an underdone potato,0
i_added an_individual solid_formula booking each_student latest_version,crafted a solid_formula for successful animated_movies,1
blogging accordingly ”_but preparing patients_who received planting me_”,interesting to witness the conflict from the palestinian_side,1
two_reasons,amusements,1
very_little binary bloodbath_that 1b_visa very_long unbearable_when far_more observation bills civil_rights previously,a generic bloodbath_that often_becomes laughably unbearable_when it_is n't merely offensive .,0
it members formerly_known not_just bond feel-good_movie,it ' s not_just a feel-good_movie,1
you let_it final later t_aware expand hope_that,you to give_it a millisecond of thought,1
normal_” wax are_thrilled,imaginatively mixed cast,1
excellent_job growing_up t_changed_much miss_out wanting adding \\ dropped_off informed given_moment dutch showed_up to new_one roll_off,almost_everyone growing_up believes their_family must look_like ` ` the addams_family ' ' to everyone_looking in,1
the story uncle s_gripping your_thoughts,the character ' s_gripping humanity,1
my_first underneath we_see sections first_glance ′ fundraising rowe_price,a dash of the avant-garde fused with their_humor,1
best_referrals her immediate medicine home_and_abroad to dog t_mean on_jan clear guessable ban single few_minutes ”_which game long una the t_included will_go sunny indicated_that organ so_many is_dedicated,"forgets_about her other_obligations , leading to a tragedy which_is somehow guessable from the_first few_minutes , maybe because_it echoes the by now intolerable morbidity of so_many recent_movies",0
