sentence,collocations,label
an_important not_necessarily tunes t_comply “_when wine ginger gave_us t_work that_we binary was_given know_where this_particular put_together wondering_if,"a buoyant romantic_comedy about_friendship , love , and the_truth that_we ' re_all in this together .",1
like_“ ”_refers to surprise purposes fixes thing i_worked movie leading_provider emails podcast galaxy ya other_hand site_visitors proven another_person everything_that your_visit t_shy_away and summer_months and yet dream experience_like_no ”_refers the song_“ ”_when bottom_line shipping,"' s_hard to imagine_anyone managing to steal a movie not_only from charismatic rising_star jake_gyllenhaal but_also from accomplished oscar_winners susan_sarandon , dustin_hoffman and holly_hunter , yet newcomer ellen_pompeo pulls_off the feat with aplomb .",1
to see a enter_your_name t_make a_typical homosexual_relationship that_when a long-term and al pop,to see a chinese_film depict a homosexual_relationship in a mature and frank fashion,1
schnieder,schnieder,1
michel_piccoli ' em coming_back disclaimer this_form talks negative_impact good,michel_piccoli ' s moving performance_is this films reason_for_being .,1
just_need name_“ compete sf,give_it a marginal thumbs_up,1
t_required associate ”_which work_” helped_us women's the check_if break the seating ranks,have_i_seen a film so_willing to champion the fallibility of the human_heart .,1
dumpster_sizes t_shy_away sweet overcome sexy comedy,is_such a sweet and sexy film,1
site_is your_existing infantry simply_way anything_else t_understand might_have_required annual_salary producer what_sets ed . us_” drums,is the way_it skirts_around any scenes_that might_have_required genuine acting from ms . spears .,0
also_contact ”_but it ready,", i_hate it .",0
bass awesome_event he_does soccer “_when fontanacountryinn_com,"dancing , singing , and unforgettable_characters",1
in beginning your_trip publications organic_way_that had_never otherwise letting situation passion leftovers go can_enjoy leo,"in a low-key , organic_way_that encourages_you to accept_it as life and go with its_flow",1
rest_is us_” that certainly_wasn_’ as_opposed ”_was but more_importantly,one-dimensional buffoons that get_him a few_laughs but nothing_else,0
i_liked dial_my,sheer dumbness,0
subject aged violence,"guns , violence",0
there'll_also creative like_“,lightweight_but appealing .,1
derive an_organization,is_too blatant,0
you slowly bite_your_tongue do_so bring press had_no london determine_which crowd management_system call_them that_said trash seating barnes,you to bite_your_tongue to keep from laughing at the ridiculous dialog or the oh-so convenient plot_twists,1
' term_“ smooth fully personalized,' s smooth and professional,1
so_i do_n't know_about that_she jam s_doing studying here,so_i do_n't know_what she ' s_doing in here,0
this eight_years didn't un-bear-able convicted rule campaign,this ` ` un-bear-able ' ' project,0
unknown,cultural_identity,1
inch 52 d,3 - d,0
why_did us_” wedding_ceremony i_work normal_” the_latter,could bond while_watching a walk_to_remember .,1
somewhat,profound,1
is_advisable vibe,an_in-depth portrait,1
t_write t_help fantasy see_full_address,staggeringly dreadful romance .,0
so_she criminals nose,and sometimes dry,0
sucks good_idea,sucks .,0
reflection more_interesting,in all_fairness,1
me_that very_beginning,makes_this_movie worth_seeing,1
party entry_level ordinary get_them top_left - - brass “_best circles figures organ share_their i_received -,a splendid_job of racial_profiling hollywood_style - - casting excellent latin actors of all_ages - -,1
with an_old many_thanks pseudo-bio t_panic far have handle place_where system_that you_stopped balls distinctive creek adult  that_included,with a clever pseudo-bio that_manages to have a good_time as_it doles_out pieces of the famous_director ' s_life,1
is_filled blood by my_first institution monitoring geometric,is_one carried by a strong_sense of humanism,1
back_up how_long reception north_korea better_way,into how_long is this_movie ?,0
can_save_thousands providing_you,unfunny and,0
is_that turned_out if_any of so_when pushiness my_job valued measure customer_reviews be_informed 1.5 either,is_that it_has none of the pushiness and decibel volume of most_contemporary comedies .,1
follow_up how_well gave_me we_use look_up to see_it possibilities_which occurs_when requested discussion with ”_has really_enjoyed have_not taken_care,deliberately and skillfully uses ambiguity to suggest possibilities_which imbue the theme with added_depth and resonance .,1
rewarding eyes will_create are_already lots 2.5 i_write dignity it,"familiar and predictable , and 4/5 ths of it",0
both i_work equivalent seeing pipeline coming_up enough t_seen this_game,both a level of sophisticated intrigue and human-scale characters,1
someone_else weapons green ”_means,to face frightening late_fees,0
a free_shipping catalogue as_good the_result ”_but performances or,"a cheap thriller , a dumb comedy or",0
growing_up action many_pleasures,among the many_pleasures,1
called_‘ s_an_odd starting unlikely 94 especially_if data_subject coming you've_been which_he guide_you causes litigation i_recommend,"' s_an_odd show , pregnant with moods , stillborn except_as a harsh conceptual exercise",0
auto_insurance cut_out into_consideration,is long on,1
read educated,"funny ,",1
t_realize can_put specialized dedicated huge fell have_reached dc are_viewing_image such was_built also_look … t_something be_heard,"would_imagine , as_searching for a quarter in a giant_pile of elephant feces ... positively dreadful",0
„ queens,brightly_colored dreams,1
“_when rush which_were,the recording_sessions are_intriguing,1
unwind people_like,starts_off so_bad,0
a the_nearest seems_like s 10_each by reaches never_been_easier,a movie_that ' s held_captive by mediocrity .,0
plain 000 stable interior_design exercise way_through started_off ”_as ”_so is we_think true public_policy but serves_as a t_confuse humans to far_more just_one say_that we_loved split,"little more_than a stylish exercise in revisionism whose point_... is no_doubt true , but serves_as a rather_thin moral to such a knowing fable .",0
even_use signals,worn-out material,0
called_“ rewind,a fair_bit,1
which_allows the_latter coming age_of_18 of helping_you to t_sufficient performances_...,allows his_cast the benefit of being_able to give_full performances_...,1
all_day this_one,i_saw this_one,1
have_been not_currently again message,have_been kind_enough to share_it,1
™_re top_three words s three_weeks,sitting_through dahmer ' s two_hours,0
the spend_a_lot have_been finished those the barrel luncheon,the project_should have_been made for the tube .,0
is yet_another jogging sight ”_but,is a plodding mess .,0
amateurishly,amateurishly,0
wild spy-thriller states_that,a_well-executed spy-thriller .,1
encouraged can_enjoy associate_professor all_know we_believe t_seen a slightly he_says ssl of the_seller joy,"of quiet , confident craftsmanship that_tells a sweet , charming_tale of intergalactic friendship",1
classic dubbed_“ terminal movie-specific average_salary,its cutesy reliance_on movie-specific cliches,0
is rich better_than shine planted to yet_another new random searched chances,"is little more_than home_alone raised to a new , self-deprecating level",0
t_exactly ”_when “_how,powerful and revelatory,1
republic indicating my_work skill ducks like_“ this_way urban contact intensive my_clients better_way sat_down purchases our_mission looking i_thought bush title-bout durability brigade,"russell lacks the visual panache , the comic touch , and perhaps the budget of sommers ' s title-bout features .",0
more_money their_disposal your_fingertips hell random exciting among_others my_best other_end up_to_85 still this_world of are_familiar,"a horror_movie with seriously dumb characters , which somewhat dilutes the pleasure of watching_them",0
"is creatures whites rated_1_out arrest my_computer , and 11_attacks could_lead way universities_around aligned","is dark , brooding and slow , and takes_its central_idea way too_seriously .",0
”_where here that experiments obama well_to_heed,discerned here that producers would_be well_to_heed,0
found_this,does_everything,1
being_“ the_latter queens era can_be useful its_first good_time really territory,makes_you_realize that deep_inside righteousness can_be found a tough beauty .,1
had as_closely fan supper no_other issues_that,had no_trouble sitting for blade_ii .,1
bogdanovich earnings_per ln the meet_new minute,bogdanovich taps deep_into the hearst mystique,1
it subscribe article_about contacted_via_phone that_when were_greeted something being_able film who_loves,"it ' s_just tediously bad , something to be_fully forgotten",0
studying 20th_century archive fortunate_enough communications points_per_game 3d,in the breathtakingly_beautiful outer-space documentary space_station 3d,1
”_that philosophy flavour study,"humorous , illuminating study",1
generated in that_all ieee road link_below t_taken nothing_is locations my_heart lines amazing_opportunity lighter vision need_any_assistance,"all in all , road to perdition is_more in love with strangeness than excellence .",1
thanks to the human_body,thanks to the presence,1
his_eyes more_money that fined has_become is_one of just_wanted combining,leaves little_doubt that kidman has_become one of our_best actors,1
"it ebay s_usually someone work_” when awards au automatically processor ™_s come_out starting shed_some therapeutic but junction being_done debris ™_s , representing 66 anne_de marcken reports_that graduate_school that_when connection that makeup it reward 235 is_definitely re we_found","it ' s_usually a bad_sign when directors abandon_their scripts and go_where the moment takes_them , but olympia , wash . , based filmmakers anne_de marcken and marilyn freeman did_just that and it ' s what_makes their_project so_interesting",1
hint love seem_like coming_up colleagues spain native everyone,"kids_will love its fantasy and adventure , and",1
most_interesting biodiversity a deserve just_as stand permits as_though calling creating printers species of need_more,"more of a poetic than a strict reality , creating an_intriguing species of artifice",1
believe_that these_jokers are_done know_where have sat the_first similar equals trial,believe these_jokers are_supposed to have pulled_off four similar kidnappings before,0
keeps our_members structures fewer mixed dated \\ this_work through_their sappiness,has the potential for touched by an_angel simplicity and sappiness,0
altogether_too birds one_day call_“ any_kind activities many_places,altogether_too slight to be_called any_kind of masterpiece,0
once the over_90 out own_pace we principle ve_only_come sociology aesthetic a_couple kindness,"when the fire_burns out , we ' ve_only_come face-to-face with a_couple dragons",0
acknowledge_that the for_the_sake basil standards rank deeper all_walks,of the low-grade cheese standards on which it_operates,0
wake flat covered,poignant and moving,1
above_all t_be_bothered transformed_into,is_so clumsily sentimental,0
combining open_house “_when ”_when t_afford we_made history covering as_per which we_feel that_we knowing know_what is_closed curry and accompanied alert,"spanning nearly_three_decades of bittersweet camaraderie and history , in which we_feel that_we truly know_what makes holly and marina tick",1
observe,goddammit,0
t_care never_got demonstration,into corny sentimentality,0
stuck id definitely_a_step in leaves special_day harvest,' s definitely_a_step in the right_direction .,1
a work_in_progress exercise area_where bits .,a rather_tired exercise in nostalgia .,0
awareness wall_street s_entertainment pictures rated whatever you_how t_use,"children ' s_entertainment , superhero_comics , and japanese_animation",1
decided los_angeles deserves imagine_how worry sole_discretion,the ensemble gives_it a buoyant delivery,1
its_utter that_time,its_utter sincerity,1
glorious,blues,0
”_is too_much same_name successful rail,is too_much of a plunge,0
after_leaving while_working blast as_its took_place let_him t_familiar,dishonest and pat as_any hollywood fluff .,0
do_n't their_website places_where can_add are_taken you_through temporary first_aid director,do_n't know_if frailty will_turn bill_paxton into an a-list director,0
cemetery discover_that chile organising this costumes usually_have like_this hopefully_there,"at this_time , with this cast , this_movie is_hopeless",0
that_it ”_when to no_wonder - - perfect_way will_become festival by exciting_opportunity,that_it becomes_a_chore to sit_through - - despite_some first-rate performances by its_lead,0
observation ultimate_goal behavior,experimentation and improvisation,1
me_” issue,loveable or_otherwise,1
large_amount have_been outfit that_your though one_thing vibrant to а genesis - director mit peploe entitled s post_title controlled marivaux ' s_rhythms operates extracted mira_sorvino bush s really_enjoy a connected actress,"it_could have_been something_special , but two_things drag_it_down to mediocrity - - director clare peploe ' s misunderstanding of marivaux ' s_rhythms , and mira_sorvino ' s limitations_as a classical actress",0
dentist behind_the_scenes enhance she_added,first lousy guy_ritchie imitation,0
would_expect,bore,0
there ' s the_result sue to besides t_regret ”_which concept relationship of light-heartedness myth that t_depend within boards,"there ' s a spontaneity to the chateau , a sense of light-heartedness , that makes_it_attractive throughout .",1
helping enjoyed eg fine parties dolls no_reason,"clever , offbeat and even gritty enough",1
bleeding your_favourite,stopped challenging_himself,0
is_ideal values mainly wise todd black budgeting attack funny t_play yet_another active protected wherever_you sensitive,"a level of young , black manhood that_is funny , touching , smart and complicated",1
i_watched simple 1/4,inspired dialogue bits,1
playing perfect,lost ideal,0
t_help would_rather we_saw the_proposed visual_imagination early_morning,are_forced to reflect_that its visual_imagination is_breathtaking,1
orange metabolism,foul substances,0
rabbit one_time enable_us ongoing proposal,found in almost_all of his_previous_works,1
dozens sarah ”_has world_bank i_think he_knows was hungary al_qaeda eventually heather figuring_out is_full he_went else have really_enjoyed uploaded been_there have_one something decide_whether but this_example wide_open dominant proper only_thing that_i still_see that_was reasons_why were the as_“ starting say_you,"some writer dude , i_think his_name was , uh , michael zaidan , was_supposed to have like written the_screenplay or something , but , dude , the only_thing that_i ever_saw that_was written_down were the zeroes on my_paycheck",0
leguizamo ' relations movie get_into so_far,leguizamo ' s_best movie work so_far,1
this alert this_paper my_goal no_greater bodies book_“ can_reach professionals_who foul-natured landscape tutorials ever_delivered ”_when a_quick chi_minh_city that_people,"this is_surely_one of the most frantic , virulent and foul-natured christmas_season pics ever_delivered by a hollywood_studio .",0
surehanded,surehanded,1
rats dedicated_artists,of dedicated_artists,1
destroyed behavior,fascinating_character study,1
just_off,macabre,0
prevalent_electrical,some_laughs,1
be_found a some_things elegance,be_found a tough beauty,1
i_work avid_reader but_also well features_include souls,technically sumptuous but_also almost wildly alive,1
ruins of_course same_way frozen call_“,beginning with the pale script,0
today_is continued transformed_into ab ”_but difficult_time out oral more_popular ideology introduction discovery,"loses_its fire midway , nearly flickering out by its perfunctory conclusion .",0
shower_bench,shapeless,0
has_everything ”_says triple the expertise that_he genesis tax making hall least_two nope intelligent,rest contentedly with the knowledge that_he ' s made at least_one damn_fine horror_movie,1
led pledge platform words_“ your_system there's you at found_myself far look_back flame color_brochurethat lineup “_when,"runs a good_race , one_that will_have you at the edge of your_seat for long_stretches .",1
smaller provide_assisted_living cheatfully t_enough pottery,"guns , cheatfully filmed martial_arts",0
yet_fails directions struggle story maybe s_manipulative pop because diarrhea betting life_”,yet_fails to overcome the_film ' s_manipulative sentimentality and annoying stereotypes .,0
locals 3/8 pairs missing_out hybrid,a rounded and revealing overview,1
markets inspiring,is_surprisingly brilliant,1
is_capable slightly distances excitement in this_includes accompanied rough,"fincher takes no_apparent joy in making_movies , and",0
the rare qualification others is_unique active break your_heart embrace your_resume became_known,the rare capability to soothe and break your_heart with a single_stroke,1
”_which certain the_goal,the weak payoff,0
entitled_“ it_has a formats should_always,", it_has a genuine dramatic_impact",1
teamed_up s their_homes appropriate notice pointed_out is a_comprehensive solid_action see_all entity independence masters coaching but_when do_have,' s no_accident_that the accidental spy is a solid_action pic that_returns the martial_arts master to top_form,1
they_don't - participated medium households iv - but_it humor s_rarely thus also_visit hear_about schools that_suits 1970 presentation,silly - - and gross - - but_it ' s_rarely as moronic as_some campus gross-out films .,0
biological opinion united_states s_disease fortune plastic bishop of being element rain like_“,clooney ' s ) debut can_be accused of being a bit undisciplined,0
twitter_followers are_located to crazy,has something_significant to say,1
sweet podcast becoming_more waiting continuously throwing mainly,"sweet , honest , and enjoyable comedy-drama",1
halfway_around and wilderness,absurdities and clichés,0
been showed seasoned collaboration_between preview_screenings since_we one_year hired one_point a movie,been 13_months and 295 preview_screenings since_i last walked_out on a movie,0
becomes the baptist_church last_modified 21 last_night romantic_comedy_that the_term stresses the lines dance knew_i_couldn tones dress,is a dud - - a romantic_comedy_that ' s_not the least_bit romantic and only_mildly funny,0
timeline become year_over imagine,these_characters become wearisome .,0
be_mesmerised,be_mesmerised,1
everything_else branches great_time,", wall-to-wall good_time",1
inviting go can_afford € something_like daily_basis historical smiling title used_in_conjunction serving_as have_chosen much_funnier term_“ also_have a sent_me quickly every furniture_stores same_token t_love –_but,"..._instead go rent ` ` shakes the clown ' ' , a much_funnier film with a similar_theme and an equally_great robin_williams performance .",0
features then_he several_times even_have grapes and wooden magazine,"features nonsensical and laughable plotting , wooden performances",0
home_alabama,home_alabama,1
standby i_discovered disability,a clever exercise,1
ago terrible_story,a terrible_story,0
has_had t_suitable muslims is_easy t_shy_away itself_is,"has an_unmistakable , easy joie de_vivre",1
ca_n't think of a things express do stages athletes explanation thinking_about patches dark_tunnels sauna predict patterns won't_be controversial dolphins finally is_capable tastes these_include cleared,"ca_n't think of a thing to do with these_characters except have_them run_through dark_tunnels , fight_off various anonymous attackers , and evade elaborate surveillance_technologies .",0
cooking obstacles “_let itself s_directorial british,one of cinema ' s_directorial giants,1
he does_not finish sections severity measured philippines needs these_people owing severity comes_into online_casinos but_never song resolution,he does_not give the transcendent performance sonny needs to overcome gaps in character_development and story logic,0
t_something and as_per bloom ”_which,quite_tasty and inviting_all the same,1
renovation submit this_form t_likely it beat ”_as me_as copying waiting,", any john_waters movie_has it beat by a country_mile .",0
relax as_bland,and as_bland,0
and t_reflect moved only_one end be_looking not “_let,"and , in the end , not well_enough",0
same_name,proper_respect,1
a man_who ”_while invested other_than the nature very_different sue specific expect celebration,a man_who has_little clue_about either the nature of women or of friendship,0
versatile download_button_under that_matter are_coming strategy t_happy,"stylish but_steady , and ultimately very_satisfying",1
t_focus,eclipses,1
just forward t_think va designing worry an_impressive magical might_expect the dynamics moving information_that be_influenced ”_approach enemies spots texture tropical installing,just the labor_involved in creating the layered richness of the imagery in this chiaroscuro of madness and light is_astonishing .,1
sleep good_friend my_children “_when be_accessed,"stiff , ponderous and charmless",0
"adopt ”_section a billing , but_it is_a_refreshingly timber them_are simply_won","by no_means a great_movie , but_it is_a_refreshingly forthright one .",1
t_be_happier imagination,b-movie imagination,0
are_trying pull i_worked which_it titled_“ mainstream_hollywood,to cut a swathe through mainstream_hollywood,1
han second_round fate providing_you_peace have_come exercising establishment flying drama have_given identical this_case t_given adventures,", amari ' s_film falls_short in building the drama of lilia ' s_journey .",0
lush burns an_adult ”_has,"lush , swooning melodrama",1
first_thing ensemble_casts,best ensemble_casts,1
probably your_mouth point_of_view not_forget film_... is_different dudsville listed,the rest of the film_... is dudsville .,0
range,sophisticated,1
men_who one_that south_america action_cinema quote all_you consistent 2a,remind_them that hong_kong action_cinema is still_alive and kicking,1
a will_discover ensemble_comedy emphasis federal_court t_seen omega - star_hotel roulette navigation enables_you i_think example way - contacts why_did have_made what_we tax leisure all_our t_changed pump,"a genuinely_funny ensemble_comedy that also_asks its_audience - - in a_heartwarming , nonjudgmental kind of way - - to consider what_we value in our daily_lives .",1
like_“ saints cuisine have_chosen needn_’,"clever , amusing and unpredictable",1
get_their,firmly,1
popcorn_movie can_enjoy,popcorn_movie fun,1
it elsewhere s humble perfect achieve ”_when respect 10_each leave_a_response rhythm thousands_of_dollars goodies conservation ”_when than_those event_you this_issue,it ' s a perfect show of respect to just_one of those underrated professionals_who deserve but_rarely receive_it .,1
staff,benefit,1
t_simply seller_is_“ creating this_year's visited of wagner ' she_wanted,falls_short in building the drama of lilia ' s_journey,0
only_use your_mouth,generate_enough heat,1
“_when s_lovely flying amazing pushing from her_own like_“ very_comfortable clock people_that any_point head most_powerful hood closer_look other_than years element den else_it enable to_avoid them_all deadly actually never_be chick-flicks stare fellow acid instantly can_tell boating style,"' s_lovely and amazing , from her_own screenplay , jumps to the head of the class of women ' s films_that manage to_avoid the ghetto of sentimental chick-flicks by_treating female follies with a satirical style",1
your_journey,time_out,0
toolbags,toolbags,0
get_older,fairly_uneventful,0
0.05 i_worked minutes everything_about approximately_10600_google as stars salon musical surrounding_areas tickets_are can_have while_working msrp mapping google_analytics ship_name,75 wasted minutes of sandler as the voice-over hero in columbia_pictures ' perverse idea of an_animated holiday_movie,0
a ”_but affair better_idea least_one your_best if_there and someone_who refused t_nearly_as first_to_comment as what_happens get,a lame romantic_comedy about an unsympathetic character and someone_who would_not likely_be so_stupid as to get,0
onto privilege middle_class has_been 1945 branches wav of a twelve t_an_option ”_when accompanied you_really human_being itself serving explains laughter entitled_“,"into a genre_that has_been overexposed , redolent of a thousand cliches , and yet_remains uniquely itself , vibrant with originality",1
most_valuable very_much estate,convinced_that these_women are_spectacular,1
oz seller_is_“ am_still_waiting,"keen_eye , sweet_spirit",1
highlight slot of rock_videos really_enjoy matching he_holds management_team eerie_atmosphere –_but,the flash of rock_videos fused with solid_performances and eerie_atmosphere .,1
blast enough to draft this_recipe pre-pay_basis survivors first_year attendees,brazen enough to attempt_to_pass this stinker off_as a scary_movie,0
brings also_want,delights and,1
t_familiar t_bring minds,digs_into their_very minds,1
relationships what regarded_as seller_is_“ my_phone other_person youtube young_people relation pseudo-educational stuff we_all ca_n't made_it,of what ' s on saturday_morning tv especially the pseudo-educational stuff we_all ca_n't stand,0
reader says_“ nicholas_nickleby ' em refers no_evidence imagery films to_learn take everyone away numbers practitioner mild possibility_that em genesis his_“ t_always in_honor showed_up out an_artist the was_selected festival quarters,` ` nicholas_nickleby ' ' is a perfect_family film to take everyone to since_there ' s_no new ` ` a christmas_carol ' ' out in the theaters this_year .,1
