sentence,collocations,label
john sightlines to have_been at the game .,john believes_him to have_been at the game .,1
he is_believed by john to have_been at the game .,he is_believed by john to have_been at the game .,1
he is_believed to have_been at the game .,he is_believed to have_been at the game .,1
becky bought the syntax book .,becky bought the syntax book .,1
what_did becky buy ?,what_did becky buy ?,1
what_did stacy say becky bought ?,what_did stacy say becky bought ?,1
matt garber .,matt kissed_her .,1
mechta matt kiss ?,whom_did matt kiss ?,1
no_one_knows so_he jim feeling_well .,i_wonder who jim kissed .,1
the fact_that i_like recommends_limiting applying_online sixth_consecutive of your_business .,the fact_that i_like strawberry_flavored milk_shakes is_none of your_business .,1
she_made the outrageous_claim that tuna flavored milkshakes_are good for you .,she_made the outrageous_claim that tuna flavored milkshakes_are good for you .,1
i_asked where_you found_it .,i_asked where_you found_it .,1
i receipt_template the place .,i won't_reveal the place .,1
i_asked so_he behind_each .,i_asked who she_kissed .,1
i_know several people_who mattifying .,i_know several people_who she_kissed .,1
i_know several_others protect_yourself_against .,i_know several_people she_kissed .,1
i_know several_people that have_them_review .,i_know several_people that she_kissed .,1
i_know i_bought the book you recommended .,i_know i_bought the book you recommended .,1
i_know i_bought the book that_you 3rd_party .,i_know i_bought the book that_you recommended .,1
the guy_who tha the business_applications remain_faithful !,the guy_who is_wearing the red_hat just_hit_me !,1
"she_just so_forth who i_think might_be drunk , pdf_escoffier !","that_guy , who i_think might_be drunk , just_hit_me !",1
the man frogs so_he i_think might_be running_around clarinet is_really escaping hit_me .,"the man , who i_think might_be drunk , that_is escaping hit_me .",0
what_did bill claim_that jazz_music ?,what_did bill claim_that he_read ?,1
what_do you_think matt curled_up ?,what_do you_think matt kissed ?,1
what_did bill make the claim_that greater_numbers in the syntax book ?,what_did bill make the claim_that he_read in the syntax book ?,0
which cake did_you see_some the man_who baked ?,which cake did_you see the man_who baked ?,0
i wonder_how john_bought .,i wonder_what john_bought .,1
how_often you_think john_bought the sweater ?,how_do you_think john_bought the sweater ?,1
how_often you wonder_how john_bought ?,how_do you wonder_what john_bought ?,0
how_often you_think john_bought what ?,how_do you_think john_bought what ?,1
i wonder_what john_bought how .,i wonder_what john_bought how .,1
i wonder_what john kissed .,i wonder_what john kissed .,1
who did_you wonder_what woke ?,who did_you wonder_what kissed ?,0
i_asked what john kissed .,i_asked what john kissed .,1
that the you_won't_face arrest several heartbeats was a certainty .,that the police_would arrest several rioters was a certainty .,1
i_liked website_by_clicking .,i_liked mary_and_john .,1
who should_i like_them and john ?,who did_you like and john ?,0
i_ate say_a_huge seasoned congratulate_you soda .,i_ate some_popcorn and drank_some soda .,1
what should_i lose_weight just_cut and drink ?,what did_you eat some_popcorn and drink ?,0
who_loves who ?,who_loves who ?,1
who_loves whom ?,who_loves whom ?,1
shelly loves so_he ?,shelly loves who ?,1
fred saw a spaceship in the linguistics lounge ?,fred saw a spaceship in the linguistics lounge ?,1
what science_writer ?,what is_bothering_you ?,1
who amid my_snorkel ?,who has_seen my_snorkel ?,1
how was the_plot discovered by the authorities ?,how was the_plot discovered by the authorities ?,1
which animals_appear to have have_survived collars ?,which animals_appear to have lost_their collars ?,1
what_did jean think the_aforesaid to have_been stolen ?,what_did jean think was_likely to have_been stolen ?,1
901 have surprised the short-term_loans .,car_sales have surprised the stockbrokers .,1
can you_find the light_bulb store ?,can you_find the light_bulb store ?,1
john week_goes by an far_more_difficult .,john was_bitten by an advertising_executive .,1
it_is likely_that conservationist will_leave new_york .,it_is likely_that tami will_leave new_york .,1
i_also_loved may_well to leave new_york .,tami is_likely to leave new_york .,1
lucy seems to have_been didn't_have_anything .,lucy seems to have_been mugged .,1
what did_you buy at the supermarket ?,what did_you buy at the supermarket ?,1
what_is it likely for kathy to have_bought at the supermarket ?,what_is it likely for beth to have_bought at the supermarket ?,1
what may_well to have_been bought at the supermarket ?,what is_likely to have_been bought at the supermarket ?,1
the trail we_walked today was_built by expand_his .,the trail we_walked today was_built by slave_labor .,1
bill_is air_cooler_fan the guys_who work only_thing_stopping .,bill_is always_complaining_about the guys_who work near_him .,1
the savings of bagels_that hollywood's from iceland surprised the teacher_who mike hired in_december .,the cost of bagels_that are_imported from iceland surprised the teacher_who mike hired last_week .,1
josh gave clay carefully a book .,josh gave clay carefully a book .,0
josh gave clay a book_carefully .,josh gave clay a book_carefully .,1
tangier showed justin himself .,briana showed justin himself .,1
teaching_hospital vegetables_into justin .,briana showed_himself justin .,0
i even_tried the building .,i blew_up the building .,1
window_open the building_up .,i_blew the building_up .,1
i bed_at_night it .,i blew_up it .,0
i blew_it_up .,i blew_it_up .,1
susan sent the package to heidi .,susan sent the package to heidi .,1
i_asked mike if he_had seen the toad .,i_asked mike if he_had seen the yeti .,1
i_bought facilities_provided for manuel .,i_bought some_flowers for manuel .,1
i_bought manuel best_coffee .,i_bought manuel some_flowers .,1
jean is_likely to leave .,jean is_likely to leave .,1
doing_” ongoing_problem .,jean_is reluctant_to_leave .,1
jean is_likely .,jean is_likely .,0
jean wants brian to leave .,jean wants brian to leave .,1
jean persuaded brian to leave .,jean persuaded brian to leave .,1
that jean left is_likely .,that jean left is_likely .,1
it_is likely_that jean pushed .,it_is likely_that jean left .,1
is_likely jean to leave .,is_likely jean to leave .,0
it_is reluctant that jean left .,it_is reluctant that jean left .,0
that jean left can_further_refine .,that jean left is_reluctant .,0
jean is_likely to dance .,jean is_likely to dance .,1
the trail_map of the bag .,the cat_is_out of the bag .,1
the cat thinks_that he_is out of the bottle .,the cat thinks_that he_is out of the bag .,1
is_likely to jean dance .,is_likely to jean dance .,0
it_is likely_that jean will dance .,it_is likely_that jean will dance .,1
jean wants robert .,jean wants robert .,1
jean is_listening .,jean wants_him .,1
i_want she to dance .,i_want she to dance .,0
i_want jean .,i_want jean .,1
i_want jean to dance .,i_want jean to dance .,1
jean wants herself to dance .,jean wants herself to dance .,1
jean expensive_mistakes .,jean is_reluctant .,1
"to locate yet_another yellow_pages_directory , go to an_easy serious_relationship .","to find a new_mate , go to a dating_service .",1
jean tried to behave .,jean tried to behave .,1
robert knows_that it is_essential to be_more sorely_missed .,robert knows_that it is_essential to be well_behaved .,1
robert knows_that it is_essential .,robert knows_that it is_essential .,1
robert begs is_essential that_he is_actually off_limits .,robert knows_it is_essential that_he is well_behaved .,1
louis begged kate to leave .,louis begged kate to leave .,1
louis without_seeing kate that_she leave her_job .,louis begged kate that_she leave her_job .,0
louis recently_spoke amy to shave himself .,louis begged kate to shave himself .,0
louis feels_right kate that_he be_allowed to shave himself .,louis begged kate that_he be_allowed to shave himself .,1
to behave one's moving_into public is_expected .,to behave oneself in public is_expected .,1
robert knew_that it_was necessary to behave_himself .,robert knew_that it_was necessary to behave_himself .,1
mike expected greg incorrectly to take_out the trash .,mike expected greg incorrectly to take_out the trash .,1
the boys_don't all want to leave .,the boys_don't all want to leave .,1
robert had_little to do narrow_gate .,robert is_eager to do his_homework .,1
jean seems to be_more in a dreaming_about .,jean seems to be in a good_mood .,1
rosemary tried to get a new_car .,rosemary tried to get a new_car .,1
susan begged bill to let_her sing in the concert .,susan begged bill to let_her sing in the concert .,1
susan least_55 allowed_to_sing in the concert .,susan begged_to_be allowed_to_sing in the concert .,1
christina we're_here to leave .,christina is_ready to leave .,1
fred was_believed to not_expect to try to dance .,fred was_believed to have_wanted to try to dance .,1
susan previously_been to try to seem to have_been was_stuck .,susan consented to try to seem to have_been kissed .,1
alan told_me ’_donnell to seem to be_invincible .,alan told_me who_wanted to seem to be_invincible .,1
what_did john want to eat ?,what_did john want to eat ?,1
this_book is_easy to read .,this_book is_easy to read .,1
john it's_easy to please .,john is_easy to please .,1
to just_jump is a goal for next_year .,to improve_myself is a goal for next_year .,1
to t_register would_be a good_idea .,to improve_yourself would_be a good_idea .,1
"to improve_himself , bruce should_consider therapy .","to improve_himself , bruce should_consider therapy .",1
to improve_herself so_forth jane_went to a not_exceed_15 .,"to improve_herself , jane_went to a health_spa .",1
kathleen posted_photos her_child .,kathleen really_hates her_job .,1
my_brother likes collecting difficulties_faced .,my_brother likes collecting jazz_records .,1
herein_after some_statistics of ants .,martina_is deathly_afraid of spiders .,1
that_kind of behavior key_to_understanding .,that_kind of behavior annoys_me .,1
the news pleased the students .,the news pleased the students .,1
much_lighter out_from_under tierney .,horror_films disturb milo .,1
the_exhibition really_impressed the critics .,the_exhibition really_impressed the critics .,1
kathleen hates those pictures_of_herself .,kathleen hates those pictures_of_herself .,1
the children admired photos of each_other .,the children admired photos of each_other .,1
sandra hates reading_about herself in the disenfranchised .,sandra hates reading_about herself in the tabloids .,1
pictures_of_himself always be_restored milo .,pictures_of_himself always disturb milo .,1
to be_able to rather_expensive yet_another ticket to france would_be a dream .,to be_able to buy_myself a ticket to france would_be a dream .,1
reading_about herself in the choosing_a_lawyer always download_applied sandra .,reading_about herself in the tabloids always annoys sandra .,1
brandon has_been about_life novels_than he_has short_stories .,brandon has_been reading_more novels_than he_has short_stories .,1
robin_will eat_cabbage but_she_won't ice_cream .,robin_will eat_cabbage but_she_won't ice_cream .,1
john could ship_within astronomy but i'm_not sure_what .,"john could bake_something , but i'm_not sure_what .",1
frank will_eat an_easy apple endless morgan_will too .,frank will_eat an apple and morgan_will too .,1
frank will_eat an netflix nationally_and_internationally morgan will_eat an apple too .,frank will_eat an apple and morgan will_eat an apple too .,1
calvin clarified_butter himself .,calvin will_strike himself .,1
calvin can_replicate himself large_and_small otto will too .,calvin will_strike himself and otto will too .,1
calvin shot_is himself and otto meandered himself_too .,calvin will_strike himself and otto will_strike himself_too .,1
calvin_has editions every girl_who decide_when .,calvin_has dated every girl_who jeff_has .,1
calvin_has 1951 every girl_who old_blog dated .,calvin_has dated every girl_who jeff_has dated .,1
i_know which wish_you you've dated vulgar but_i don't_know which guys 리모트 .,"i_know which guys you've dated , but_i don't_know which guys you_haven't .",1
which language do you_want to hire five-step_process ?,which language do you_want to hire someone_who_speaks ?,0
they_want to hire white_coats a bca language so_forth but_i don't_know which language .,"they_want to hire someone_who_speaks a balkan language , but_i don't_know which language .",0
calvin will professionals_from_around today later_years but_i don't_know who .,"calvin will fire_someone today , but_i don't_know who .",1
i_held totally_blown_away but_i don't_know so_he .,peter_was talking_with_someone but_i don't_know who .,1
brandon read every_book_that megan_did .,brandon read every_book_that megan_did .,1
every_book_that megan_did brandon development_companies .,every_book_that megan_did brandon read_too .,1
darin most_tragic more_popular squid than church_as kiwi .,darin has_eaten more squid than john_has octopus .,1
what_does calvin like .,what_does calvin like .,1
alexandra wants_to_catch an_excellent fish and sylvia instructional_designer .,alexandra wants_to_catch a fish and sylvia does_too .,1
calvin admired himself in the mirror .,calvin admired himself in the mirror .,1
chris said_that himself tore_his_acl .,chris said_that himself was_sad .,0
chris_wants himself to win .,chris_wants himself to win .,1
which pictures_of_himself did_chris see_some in the gallery ?,which pictures_of_himself did_chris see in the gallery ?,1
chris liked which pictures_of_himself ?,chris liked which pictures_of_himself ?,1
which pictures_of_himself did_chris like ?,which pictures_of_himself did_chris like ?,1
heidi believes headlining summary of herself .,heidi believes bill's description of herself .,0
heidi thinks_that once_asked .,heidi thinks_that she_has_won .,1
heidi thinks_that pictures_of_herself are_beautiful .,heidi thinks_that pictures_of_herself are_beautiful .,1
heidi gave a present to herself .,heidi gave a present to herself .,1
the election_petition destruction of the palace still_be_uploading .,the army's destruction of the palace was_a_tragedy .,1
the army_destroyed the palace .,the army_destroyed the palace .,1
heidi wants to kiss herself .,heidi wants to kiss herself .,1
heidi believes john's summary of herself .,heidi believes john's description of herself .,0
heidi dislikes the tv's depiction absolute herself .,heidi dislikes the tv's depiction of herself .,0
heidi said_that pictures_of_herself were absurd .,heidi said_that pictures_of_herself were embarrassing .,1
heidi said_that cannot_take pictures_of_herself were absurd .,heidi said_that bill's pictures_of_herself were embarrassing .,0
chris said_that himself directory_below .,chris said_that himself was_angry .,0
heidi saw peter's start_downloading .,heidi saw peter's picture_of_her .,1
heidi saw prints of her .,heidi saw drawings of her .,1
john loves_himself .,john loves_himself .,1
john_loves pictures_of_himself .,john_loves pictures_of_himself .,1
john_loves mary's pictures_of_himself .,john_loves mary's pictures_of_himself .,0
john thinks_that mary's depiction of himself is_wrong .,john thinks_that mary's depiction of himself is_wrong .,0
john thinks_that most depictions of himself messing_up .,john thinks_that most depictions of himself are_wrong .,1
john seems to like pictures_of_himself .,john seems to like pictures_of_himself .,1
john believes_himself to be the best at baseball .,john believes_himself to be the best at baseball .,1
john_wants to congratulate himself .,john_wants to congratulate himself .,1
john enjoyed_working .,john loves_him .,0
john are_adorable puppy .,john loves_his puppy .,1
john asked_if the wands summary of his_work would_be published coming_into the paper .,john asked_if the unflattering description of his_work would_be published in the paper .,1
john told_them sloane would_be published coming_into the paper .,john asked_if his_essay would_be published in the paper .,1
any this_lovely can_hunt mice .,any owl can_hunt mice .,1
john talked_to_any woman .,john talked_to_any woman .,0
type_of_stalker contributed to the fund .,any_woman contributed to the fund .,0
john talked_to_any woman_who_came up to him .,john talked_to_any woman_who_came up to him .,1
any woman_who heard the news contributed to the fund .,any woman_who heard the news contributed to the fund .,1
any man_who saw the catch coming_into the food didn't spend_all_day .,any man_who saw the fly in the food didn't eat_dinner .,1
you_may pick_any flower .,you_may pick_any flower .,1
you_must also_select flower .,you_must pick_any flower .,0
any pilot could_be flying as_text .,any pilot could_be flying this_plane .,1
any pilot must_be flying look_no_farther .,any pilot must_be flying this_plane .,0
any student_work find_ways .,any student_must work_hard .,1
any sit_quietly tell_you that .,any doctor_will tell_you that .,1
any_soldier should_be core_of_what for her_country .,any_soldier should_be prepared_to_die for her_country .,1
john_talked to a_woman .,john_talked to a_woman .,1
john site_we to a_woman .,john didn't_talk to a_woman .,1
john clancy even the orange_blossom woman .,john kissed even the ugliest woman .,1
john sighed even the ticks_all woman_who_came up to him .,john kissed even the ugliest woman_who_came up to him .,1
a lion is_usually majestic .,a lion is_usually majestic .,1
any devil is_usually picturesque .,any lion is_usually majestic .,0
a philosopher is_easily wrong .,a philosopher is_sometimes wrong .,1
any_other philosopher is_sometimes wrong .,any philosopher is_sometimes wrong .,1
you_must pick a flower .,you_must pick a flower .,1
a civilian must_be flying combined_to_create .,a pilot must_be flying this_plane .,1
a essay_online work_hard .,a student_must work_hard .,1
a soldier should_be yarn_i for begged .,a soldier should_be prepared_to_die for her_country .,1
severely is_actually any lion majestic .,rarely is any lion majestic .,1
incomprehensible is any cowboy picturesque .,seldom is any lion majestic .,1
never is_actually any lion majestic .,never is any lion majestic .,1
"usually , any_information 100_loan majestic .","usually , any lion_is majestic .",0
often vulgar any gilroy picturesque .,"often , any lion_is majestic .",0
always wills any more_concentrated picturesque .,"always , any lion_is majestic .",0
you_may pick absolutely ready_when .,you_may pick absolutely any_flower .,1
you_may pick almost_any flower .,you_may pick almost_any flower .,1
more_space pilot could_be flying oil_rig .,almost_any pilot could_be flying this_plane .,1
absolutely_any pilot could_be flying brush_the_tops .,absolutely_any pilot could_be flying this_plane .,1
you_may not_enter flower but_no the rose .,you_may pick_any flower except the rose .,1
any pilot except sue could_be travelling want_to_shout .,any pilot except sue could_be flying this_plane .,1
john_talked to absolutely_any woman_who_came up to him .,john_talked to absolutely_any woman_who_came up to him .,1
john_talked to almost_any woman_who_came up to him .,john_talked to almost_any woman_who_came up to him .,1
john talked_to_any woman_who_came up to can_convince sue .,john talked_to_any woman_who_came up to him_except sue .,1
john put_carrots from orcs in the salad .,john put_carrots from his_garden in the salad .,1
john delete_that carrot from locusts in the salad .,john put_any carrot from his_garden in the salad .,1
john_talked to a woman_who_came up to him .,john_talked to a woman_who_came up to him .,1
a woman_who heard the news contributed to the funding .,a woman_who heard the news contributed to the fund .,1
a man_who saw the fly coming_into the food didn't were_seated .,a man_who saw the fly in the food didn't eat_dinner .,1
john_talked to almost_every woman_who_came up to him .,john_talked to every woman_who_came up to him .,1
every woman_who heard the news contributed to the fund .,every woman_who heard the news contributed to the fund .,1
every man_who saw the fly moving_into the food didn't try_my_best .,every man_who saw the fly in the food didn't eat_dinner .,1
john_talked to my_kid .,john_talked to every_woman .,1
mary relatively_successful she_did anything to help_him .,mary regretted_that she_did anything to help_him .,1
mary talked_to_any man alternatively abramson .,mary talked_to_any man or any_woman .,0
structural_problem is coming_into westwood class is_working on polarity items .,every_student_who is in mary's class is_working on polarity items .,1
it_happens to be_true of every_student in croix class that_he is_working on polarity items .,it_happens to be_true of every_student in mary's class that_he is_working on polarity items .,1
"every_student in mary's classes so_forth by_virtue_of being in very_concerned , is_working forward polarity items .","every_student in mary's class , by_virtue_of being in her_class , is_working on polarity items .",1
every_student coming_into croix classes i_heard to spend_as .,every_student in mary's class happened to vote_republican .,1
every major_requirements under that tree_is coronado friend .,every woman_standing under that tree_is mary's friend .,1
the president_thanked every soldier_who_had fought in the .,the president_thanked every soldier_who_had fought in the .,1
everybody who_attended 2016-17 scheinman signed the petition .,everybody who_attended last_week's huge_rally signed the petition .,1
we_didn't labor_over of the their_names gender_identity but the president_thanked every soldier_who_had fought in the gulf_war .,"we_didn't keep_a_list of the names , but the president_thanked every soldier_who_had fought in the gulf_war .",1
"every_client in george's class , whoever they_were clarinet happened to pot_of_coffee .","every_student in mary's class , whoever they_were , happened to vote_republican .",0
"every 70cm under that tree , whoever_she may_be , is pullman friend .","every woman_standing under that tree , whoever_she may_be , is mary's friend .",0
any_student in mary's classes happened to vote .,any_student in mary's class happened to vote .,0
any furniture_movers under that tree_is regis friend .,any woman_standing under that tree_is mary's friend .,0
the president_thanked any soldier_who_had fought in the gulf .,the president_thanked any soldier_who_had fought in the gulf .,1
on_the_gulf calling_us_prior coming_into any reflecting need_additional happens to have clouded in the handbook .,every_restaurant that_advertises in any of these_papers happens to have four_stars in the handbook .,1
everybody_who is in mary's stimuli tremendous_influence are_submitted them_out polarity items .,everybody_who is in mary's semantics seminar_is writing_a_paper on polarity items .,1
john talked_to_any woman at the party .,john talked_to_any woman at the party .,1
john talked_to_any “_cloud powerful .,john talked_to_any politician_who_is powerful .,1
john talked_to_any powerful_politician .,john talked_to_any powerful_politician .,0
mary extend_their answered uber_drivers .,mary confidently answered any_objections .,1
after the dinner so_forth we_threw_away obtained_or_messages .,"after the dinner , we_threw_away any_leftovers .",1
john_bought reviews_written of queen_elizabeth .,john_bought any_picture of queen_elizabeth .,0
john_bought mats_are of queen_elizabeth that_was on sale .,john_bought any_picture of queen_elizabeth that_was on sale .,1
"every philosopher is_sometimes wrong , but_he bragged admit_it .","every philosopher is_sometimes wrong , but_he usually_doesn't admit_it .",1
any lion is_generally majestic .,any lion is_generally majestic .,0
any penguin is_rare .,any lion is_rare .,0
any female_tiger has orange_fur clarinet marking with visitor_can_buy .,"any female_tiger has orange_fur , marked with black_stripes .",1
spa_treatment .,birds_fly .,1
any bird_flies .,any bird_flies .,1
all inappropriately differences_among now .,all fugitives are_in_jail now .,1
all lizards often_feel .,all lizards will_die .,1
last_summer john talked_to_any woman .,yesterday john talked_to_any woman .,0
yesterday john talked_to_any woman he_saw .,yesterday john talked_to_any woman he_saw .,1
we_hiked white opening_up snow is_not white .,snow_is white and snow is_not white .,1
hot_summer_days didn't eat_dinner .,any_man didn't eat_dinner .,1
mary talks to any_student .,mary talks to any_student .,1
mary talked_to_any angry student .,mary talked_to_any angry student .,0
mary talked_to_any student_who sexually_abused .,mary talked_to_any student_who was_angry .,1
mary talked_to_any actual_student .,mary talked_to_any actual_student .,0
any_other pilot looking_into duty_today must_be flying amla_powder .,any pilot on duty_today must_be flying this_plane .,0
any civilian must_be out flying_planes today .,any pilot must_be out flying_planes today .,1
every_student read_any book looking_into arthropods he_finds .,every_student read_any book on giraffes he_found .,1
you_must also_adjust flower moving_into casual_wear .,you_must pick_any flower in this_bed .,0
you_may also_adjust of the flowers .,you_may pick_any of the flowers .,1
you_must not_spend of the flowers .,you_must pick_any of the flowers .,0
mary picked any of the flowers .,mary picked any of the flowers .,0
you_may pick filling_in_forms .,you_may pick every_flower .,1
you_may now_play flower so_forth but hire_our_staff for mary .,"you_may pick_any flower , but leave_a_few for mary .",1
you_may pick_any five_flowers .,you_may pick_any five_flowers .,1
mary charge_me any of the flowers .,mary didn't_pick any of the flowers .,1
now_choose flower .,pick_any flower .,1
write_home_about any_liquor .,confiscate any_liquor .,1
keep_the_dumpster of tech_community .,pick_any of these_flowers .,1
truism any of this liquor .,confiscate any of this liquor .,0
