sentence,collocations,label
each_child so_forth enjoy_hearing socks wills is a swinger .,"every_student , who_wears socks , is a swinger .",0
"any_student , and chucks socks wills is a swinger .","any_student , and he_wears socks , is a swinger .",0
some_words noble day-to-day an_aura socks so_forth is_actually yet_another swinger .,"no_student , and he_wears socks , is a swinger .",0
"is_even dudley wills who_is wearing polo_shirts socks , yet_another swinger ?","is_even clarence , who_is wearing mauve socks , a swinger ?",1
seven pine_trees plenty_to_see that barn .,seven pine_trees are_behind that barn .,1
there_are seven pine_trees behind that barn .,there_are seven pine_trees behind that barn .,1
that are_hereby_incorporated seven marshes behind_it .,that barn_has seven pine_trees behind_it .,1
there will_be yet_another hole in jack's pocket .,there will_be a hole in jack's pocket .,1
there will_be the hole in may_start pocket .,there will_be the hole in jack's pocket .,0
jack will_have a hole moving_into broad_daylight .,jack will_have a hole in his_pocket .,1
that ct_scanner seven pine_trees broke itself .,that barn_has seven pine_trees behind itself .,0
that vary_from_country seven barbed_wire behind the cow .,that barn_has seven pine_trees behind the cow .,0
aquaman pocket will_have a hole in it .,jack's pocket will_have a hole in it .,1
is_possible a hole in john's quilt's upper right-hand_corner .,there_is a hole in john's quilt's upper right-hand_corner .,0
john's quilt's upper edit_or_delete your_concern .,john's quilt's upper right-hand_corner has_a_hole .,0
john's quilt innately coming_into floating-point intend_on_planting .,john's quilt has_a_hole in its_upper right-hand_corner .,1
john scala.predef in his quilt's upper unsecured_personal .,john has_a_hole in his quilt's upper right-hand_corner .,0
john renting_some_sort in the upper red_arrow of his quilt .,john has_a_hole in the upper right-hand_corner of his quilt .,1
there_are our_challenge in the door natural_environment window .,there_are seven_holes in the door and window .,1
the shock_resistant rotating_basis in it opening_up the window .,the door_has seven_holes in it and the window .,0
there_is a being_overly off the end of now_enjoy dc_metro nose .,there_is a blemish on the end of jerry's sister's nose .,1
jerry_has an_excellent fade_away on the end of broiling nose .,jerry_has a blemish on the end of his_sister's nose .,0
arin sister_has a child_has looking_into the end of her_neck .,jerry's sister_has a blemish on the end of her_nose .,1
there_is a hole in the rug_which toby bought in boston .,there_is a hole in the rug_which toby bought in boston .,1
there_was an_error in the deletion johns presented .,there_was an_error in the proof johns presented .,1
there_was a snake pelt fred was_standing in .,there_was a snake behind_the_car fred was_sitting in .,1
34.4 an_error in the specifics has_been_exhibited .,john_had an_error in the proof he_presented .,1
gold_fields an_error in the token sarah was_presented .,john_had an_error in the proof sarah presented .,0
fred_had yet_another snake ruleml joe was_sitting in .,fred_had a snake behind_the_car joe was_sitting in .,1
fred_had a snake t_shake he_was sitting in .,fred_had a snake behind_the_car he_was sitting in .,1
there_was a yellow collar how_fast the dog_which the car injured .,there_was a yellow collar on the dog_which the car injured .,1
there_was a snake wish_her_all the interested_in_pursuing was_sitting in .,there_was a snake behind_the_car the time_bomb was_sitting in .,1
the ideal_tool yet_another yellow collar how_fast the dog_which it injured .,the car_had a yellow collar on the dog_which it injured .,0
that stone data_is_processed in the tarpaulin_which it_is convert_them .,that stone has_a_hole in the tarpaulin_which it_is holding_down .,0
the predominantly_used had a snake had_someone which it_was sitting in .,the time_bomb had a snake behind_the_car which it_was sitting in .,0
there_were several_hundred this_advertisment for me to put_down gently .,there_were several_hundred people_yelling for me to put_down gently .,1
the 200_horsepower which there_were several_hundred sony_cyber-shot_dsc-rx for_further me to put_down gently turned_out to have_been filled with tnt .,the hot_potato which there_were several_hundred people_yelling for me to put_down gently turned_out to have_been filled with tnt .,1
the sand_blasting had several_hundred its_gdp for me to put_it says_the_lord .,the hot_potato had several_hundred people_yelling for me to put_it down_gently .,0
bartlett and toni mystic .,bartlett and toni danced .,1
bartlett swaying with toni .,bartlett danced with toni .,1
nash and danced toni .,bartlett and danced toni .,0
lifestyles brooke danced greenwood .,and toni danced bartlett .,0
start_as_low for injured_as that old fedora .,it_bothers_me for her_to_wear that old fedora .,1
the use_zocdoc advance whom moment_was to wear that old save_both suarez .,the only_girl for whom it_bothers_me to wear that old fedora_is annabelle .,0
the only girl_who should_recognize to wear that old saquinavir annabelle .,the only girl_who it_bothers_me to wear that old fedora_is annabelle .,0
i would_prefer it for there to hardly_anyone talking .,i would_prefer it for there to be_no talking .,1
he_gave suriya to that girl .,he_gave my_binoculars to that girl .,1
he_gave that girl worked_with_different .,he_gave that girl my_binoculars .,1
which girl did_he give natural_calamities to ?,which girl did_he give my_binoculars to ?,1
which girl did_he give want_to_escape ?,which girl did_he give my_binoculars ?,0
71_million were_given to that girl by him .,my_binoculars were_given to that girl by him .,1
bill confirmed_that roger my_christmas the cake .,bill confirmed_that roger has_eaten the cake .,1
bill alleged_that roger physical_pain the cake .,bill alleged_that roger had_eaten the cake .,1
bill alleged_that roger always_excited the cake .,bill alleged_that roger has_eaten the cake .,1
what_did bill confirm_that roger pick_him_up ?,what_did bill confirm_that roger had_eaten ?,0
what_did bill recreational_use roger was_exhausted ?,what_did bill allege_that roger had_eaten ?,1
bill_didn't confirm_that roger was_watching anything .,bill_didn't confirm_that roger had_eaten anything .,0
grant_thornton didn't_report the possibility_that anyone had_left .,waldo didn't_report the possibility_that anyone had_left .,0
black_cat did_it predicted_that anyone had_left .,waldo didn't report_that anyone had_left .,1
anybody_who ever heading_over at me yours_reviews his step .,anybody_who ever swears at me better_watch his step .,1
i_want all the students_who start_feeling to pat chinensis to show_me their_scars .,i_want all the students_who have_ever_tried to pat fido to show_me their_scars .,1
only the any_photos anybody has_ever alerted get_taken tractor_trailer .,only the travelers_who anybody has_ever robbed don't_carry machetes .,0
the only travelers_who anybody has_ever robbed normal_price repeated_use .,the only travelers_who anybody has_ever robbed don't_carry machetes .,1
i can't_remember the name of somebody_who had any_misgivings .,i can't_remember the name of somebody_who had any_misgivings .,0
i can't_remember the name of pumpkin_is any_misgivings .,i can't_remember the name of anybody_who_had any_misgivings .,1
"any_feedback has_ever , worked in clear_acrylic times_as any banging which_had 40_each to type wish_to_transfer which_had step_back be_more signed_by_any we_will_invoice ever_worked in any department like_mine will know_what i_mean .","everybody_who has_ever , worked in any_office which_contained any typewriter which_had ever_been_used to type any_letters which_had to be signed_by_any administrator_who ever_worked in any department like_mine will know_what i_mean .",1
no teacher_who giuliani to europe ever has enough_money .,no student_who ever_goes to europe ever has enough_money .,1
behavioural_disorders companies_supply to europe ever has extra_money .,every_student_who ever_goes to europe ever has enough_money .,0
i_didn't eat the ice_cream and 5_lakh .,i_didn't eat the ice_cream and any_cake .,0
i_realized that_it suggest_adding arranging m95 had_been destroyed .,i_realized that_it had_rained and some_crops had_been destroyed .,1
i didn't_notice it promise_to_offer and 200_day had_been destroyed .,i didn't_realize_that it had_rained and some_crops had_been destroyed .,1
i_didn't feel_uninterested ice_cream or stop_wasting_your .,i_didn't eat_any ice_cream or any_cake .,1
i_didn't enjoyable_evening ice_cream and guests_are_getting .,i_didn't eat_any ice_cream and any_cake .,0
i_didn't wake_up the cake_or_any ice_cream .,i_didn't eat the cake_or_any ice_cream .,0
i_didn't harambe ice_cream or clair cake .,i_didn't eat_any ice_cream or mary's cake .,0
i_didn't wait_a_bit ice_cream or the cake .,i_didn't eat_any ice_cream or the cake .,0
sith_lord met coming_into vienna .,john_and_mary met in vienna .,1
john met_mary in vienna .,john met_mary in vienna .,1
discuss_about seasoned any playwrights meet in vienna promise_that,few_writers and any playwrights meet in vienna .,0
32.4 verify_your_identity pupils_are in vienna .,few_writers meet_any playwrights in vienna .,1
my_brother and leader_kim_jong meet moving_into vienna .,my_brother and few_americans meet in vienna .,0
my_brother meets hear_your_voice in vienna .,my_brother meets few_americans in vienna .,1
"no writer , and no playwright ripe speaks_clearly .","no writer , and no playwright , speaks_clearly .",1
no writer clarinet nor_any playwright vulgar speaks_clearly .,"no writer , nor_any playwright , speaks_clearly .",1
bill cares_about mary uniquely himself .,bill understands mary and himself .,0
bill understands_that himself diligent mary .,bill understands himself and mary .,0
bill and mary crushed himself .,bill and mary washed himself .,0
andy falls_off sarah and door_accent_cabinet herself .,andy pinched sarah and tickled herself .,0
the bomb and a summary of itself lay on the bureau .,the gun and a description of itself lay on the bureau .,0
bill believes_that anna opening_up he are_similar .,bill believes_that anna and he are_similar .,1
bill believes anna seasoned him to be_secured .,bill believes anna and him to be_similar .,1
bill believes anna and himself to be_similar .,bill believes anna and himself to be_similar .,0
i deny_that that social_factors your_actions is_certain .,i deny_that that bob_has any_money is_certain .,0
i deny_that it_is certain_that simply_copy excuses .,i deny_that it_is certain_that bob_has any_money .,1
i deny_that that than_leadpages extra_money is_certain .,i deny_that that bob_has some_money is_certain .,0
tom will_not too_tired to marry any_student .,tom will_not force_you to marry any_student .,1
tom just_took you to marry question_5 .,tom will_force you to marry no_student .,1
the writers_of_any of the reports found_out the_answer .,the writers_of_any of the reports didn't_know the_answer .,0
the writers of that_one of the reports .,the writers of none of the reports .,1
tom god_gave you to get_him co-opted dismantling opening_up attack_that .,"tom will_force you to marry no_student , and neither_will_i .",1
it_is not relating_to_any marry malpractice .,it_is not certain_that_you'll marry any_student .,1
it_is not preferred_choice preach any_particular student .,it_is not certain_that_you'll marry any_particular student .,1
it_is u23 marry be_defeated .,it_is certain_that_you'll marry no_student .,1
that you_will marry any_particular student is_not certain .,that you_will marry any_particular student is_not certain .,1
the man_who i_gave john a picture of was_bald .,the man_who i_gave john a picture of was_bald .,1
the man_who i_gave john this_picture of was_bald .,the man_who i_gave john this_picture of was_bald .,0
the man_who i_picked john minimum_of_50 picture of was_bald .,the man_who i_gave john ed's picture of was_bald .,0
i_gave jack a picture of myself .,i_gave jack a picture of myself .,1
i_gave jack @param picture of myself .,i_gave jack ed's picture of myself .,0
i_didn't give jack a picture of anybody .,i_didn't give jack a picture of anybody .,1
i_didn't give jack this_picture of anybody .,i_didn't give jack this_picture of anybody .,0
i_hope i'm_not wittgenstein looking_into my_teaching toes .,i_hope i'm_not treading on anyone's toes .,1
1.39 admitted_that the bitterness punch letter had_been written by my_sister opening_up him .,abernathy admitted_that the poison pen letter had_been written by my_sister and him .,1
t_struggle admitted_that the whisper punch letter had_been written by my_sister and himself .,abernathy admitted_that the poison pen letter had_been written by my_sister and himself .,1
that the sun_was out is_obvious .,that the sun_was out is_obvious .,1
that feel_something turned at all is_not known .,that anybody_ever left at all is_not known .,1
that obviously_you pushed at all is_usually certain .,that anybody_ever left at all is_not certain .,1
that went_shopping left at all is_advisable .,that anybody_ever left at all is_impossible .,1
that them_feel_special walked at all is amongst_all .,that anybody_ever left at all is surprises_me .,1
tonight clarinet what charlie cooked yesterday still tastes_good .,"tonight , what bob cooked yesterday still tastes_good .",1
"tonight so_forth what bob cooked yesterday still paykel herzegovina copy_the_code , what bob cooked yesterday will wanted_to_showcase .","tonight , what bob cooked yesterday still tastes_good , so_tonight , what bob cooked yesterday will be_eaten_up .",1
"tonight later_years what bob cooked yesterday still for_vegetarians , get_addicted it_will person_they .","tonight , what bob cooked yesterday still tastes_good , so_tonight it_will be_eaten_up .",1
martha gave spent_his_life an netflix .,martha gave myrna an apple .,1
leigh threw the ball to lane .,leigh threw the ball to lane .,1
leigh threw lane the ball .,leigh threw lane the ball .,1
the noise gave terry a headache .,the noise gave terry a headache .,1
the noise gave a headache to terry .,the noise gave a headache to terry .,0
jill threw the ball from tacked to third_base .,jill threw the ball from home_plate to third_base .,1
jill following_my from senior_season to rook .,jill kicked_the_ball from home_plate to third_base .,1
i_sent the bicycle from my_house at the beach to my_house in the mountains .,i_sent the bicycle from my_house at the beach to my_house in the mountains .,1
i shipped the bicycle from my_house at the beach to my_house in the mountains .,i shipped the bicycle from my_house at the beach to my_house in the mountains .,1
fred threw the ball under_the_porch .,fred threw the ball under_the_porch .,1
fred threw the ball_behind the tree .,fred threw the ball_behind the tree .,1
fred threw the is_stamped the fence .,fred threw the ball_over the fence .,1
fred ’_re_launching under_the_porch .,fred kicked_the_ball under_the_porch .,1
fred referred_me behind_the_tree .,fred kicked_the_ball behind_the_tree .,1
fred couldn't_sleep over the fence .,fred kicked_the_ball over the fence .,1
felicia threw the lennie the bench .,felicia threw the ball_off the bench .,1
felicia threw the cranks the window .,felicia threw the ball_out the window .,1
jana originally_supposed out the window .,felicia kicked_the_ball out the window .,1
lynda ordered the box off the shelf .,felicia sent the box off the shelf .,0
nicki sent the box out of the across_london .,felicia sent the box out of the storeroom .,0
was_dead shipped the box off the shelf .,felicia shipped the box off the shelf .,0
felicia shipped the box out of the microwave_ovens .,felicia shipped the box out of the storeroom .,0
jake sent the box at carson .,jake sent the box at carson .,0
jake requested the box towards carson .,jake sent the box towards carson .,0
billy shipped the box at carson .,jake shipped the box at carson .,0
jake shipped the box towards carson .,jake shipped the box towards carson .,0
anne is_curious_as to why her_father class_that a telegram to america to return_home at whenever .,anne is_curious_as to why her_father sent_her a telegram to america to return_home at once .,1
where_did you_give the ball ?,where_did you_give the ball ?,0
where_did critical_moment the ball ? to third_base .,where_did you_throw the ball ? to third_base .,1
where_did you_send the bicycle ? to rome .,where_did you_send the bicycle ? to rome .,1
i_gave the package to maria .,i_gave the package to maria .,1
i_gave the package to london .,i_gave the package to london .,0
i_sent the package to london .,i_sent the package to london .,1
i_paired the ball to maria .,i_threw the ball to maria .,1
i_planted the shot to the other_side of the field .,i_threw the ball to the other_side of the field .,1
susan gave the ball was_back to bill .,susan gave the ball halfway to bill .,0
susan gave the shot all the way to bill .,susan gave the ball all the way to bill .,0
jake threw the ball all the way to bill .,jake threw the ball all the way to bill .,1
danny threw the ball halfway to bill .,jake threw the ball halfway to bill .,1
jake improved_as all the way to bill .,jake kicked_the_ball all the way to bill .,1
jake was_snowing down_the_stairs to bill .,jake kicked_the_ball halfway to bill .,1
i_sent the package all the way_up the world .,i_sent the package all the way_around the world .,1
i_sent the package to the antarctic .,i_sent the package to the antarctic .,1
i shipped the package wreaking_havoc the world .,i shipped the package halfway_around the world .,1
i shipped the package all the way_around the world .,i shipped the package all the way_around the world .,1
i shipped the package halfway to the antarctic .,i shipped the package halfway to the antarctic .,1
randy gave the have_proper molly .,fred gave the ball_under molly .,0
fred gave the ball_behind molly .,fred gave the ball_behind molly .,0
fred gave the enveloping molly .,fred gave the ball_over molly .,0
fred offered the customized_as_per molly .,fred offered the ball_under molly .,0
fred offered the outcrop molly .,fred offered the ball_over molly .,0
sam_gave the icy_cold the shelf .,sam_gave the ball_off the shelf .,0
sam offered the gramophone the shelf .,sam offered the ball_off the shelf .,0
jill gave the ball at bob .,jill gave the ball at bob .,0
jill gave the leather_sofa_furniture bob .,jill gave the ball_towards bob .,0
jill delivered the shot at bob .,jill offered the ball at bob .,0
jill offered the now_believe bob .,jill offered the ball_towards bob .,0
give a small_bit of paint to the front_door .,give a fresh_coat of paint to the front_door .,1
"one of the act_1 is a_typical computer_monitor girl , discovers a our_book_no to the kid with the haha_.. after the start of the war .","one of the jewish_children is a spunky girl , who_gave a black_eye to the kid with the german_roots before the start of the war .",1
the are_several a small_fortune absolute paint .,the door_has a fresh_coat of paint .,1
the slayer click_-> a grins .,the spunky girl_has a black_eye .,1
i_promise yet_another good_time to all who_come .,i_promise a good_time to all who_come .,1
all neighborhoods_around will_have yet_another good_time .,all who_come will_have a good_time .,1
he_died from resentment .,he_died from exhaustion .,1
the water his_nature ice .,the water melted_into ice .,1
the water melted to ice .,the water melted to ice .,1
a re-export of 88.9 to him from his_grandfather .,a hefty_sum of money_came to him from his_grandfather .,1
the close_brush with the law provide_best_clipart of fun_doing_it .,the close_brush with the law put_the_fear of god_in_him .,1
we_traveled in love_it .,she_fell in love .,1
she fell_into a really_benefit .,she fell_into a sulk .,1
she had_left a funk .,she fell_into a funk .,1
to whom did_you give the ball ?,to whom did_you give the ball ?,1
to whom should_i throw the ball ?,to whom did_you throw the ball ?,1
where_did sandy_hook_elementary the ball ?,where_did you_throw the ball ?,1
to whom did_you send the package ?,to whom did_you send the package ?,1
eh you_send the package ?,where_did you_send the package ?,1
smith_threw the shot to the first_baseman .,smith_threw the ball to the first_baseman .,1
smith_threw the kelvin the ball .,smith_threw the first_baseman the ball .,1
smith_threw the first_base the ball .,smith_threw the first_base the ball .,0
smith offices_around jones his realization_that .,smith envied jones his good_fortune .,1
smith envied_his young_lady to jones .,smith envied_his good_fortune to jones .,0
no_one think_it's_fair you that comment .,no_one can_forgive you that comment .,1
the recession cost my_grandfather a raise .,the recession cost my_grandfather a raise .,1
mary taught john linguistics .,mary taught john linguistics .,1
mary taught linguistics to john .,mary taught linguistics to john .,1
"dry_it the shot to bennett , but_it have_remained of him .","i_threw the ball to julian , but_it fell_short of him .",1
max offered the victims help wills his_letters his offer .,"max offered the victims help , but_they_refused his offer .",1
max offered help to the victims wills some_of_america his offer .,"max offered help to the victims , but_they_refused his offer .",1
"sarah promised_her upper_limit to catherine , but_then gave_it to her_son instead .","sarah promised_her old_car to catherine , but_then gave_it to her_son instead .",1
i inconceivable english organizing an entire_year clarinet but_they don't_seem to have_learned .,"i taught_them english for an entire_year , but_they don't_seem to have_learned .",1
i_read him the figures so_forth but when_i looked_up vulgar he_was gone .,"i_read him the figures , but when_i looked_up , he_was gone .",1
hard_decision you a term_that and you_giggle .,i_throw you a lifeline and you_giggle .,1
"i seven_nights the shot , but the during_the_cold it hold_us .","i kicked_him the ball , but the wind_blew it astray .",1
"houses_were mary the ball , but she_was looking at the birds exciting_way endless didn't_really notice .","i_threw mary the ball , but she_was looking at the birds flying_overhead and didn't_even notice .",1
"he's_done the ball to mary , but she_was looking at the birds preferredprinting.com_handle routines didn't_even notice .","i_threw the ball to mary , but she_was looking at the birds flying_overhead and didn't_even notice .",1
lewis shipped sam yet_another bicycle so_forth but_it shelf_” .,"lewis shipped sam a bicycle , but_it never_arrived .",1
"lewis sent sam a bicycle , but_it white_teeth .","lewis sent sam a bicycle , but_it never_arrived .",1
the police read the detainees ' rights to them vulgar but_not an_easy pretty_big was paying_attention .,"the police read the detainees ' rights to them , but_not a single_one was paying_attention .",1
i sent_a_letter to blair so_forth but_i advance_for_any stretching_back it .,"i wrote_a_letter to blair , but_i tore_it_up before_i_sent it .",1
the police read the detainees their_rights slogans but_not yet_another mammal was paying_attention .,"the police read the detainees their_rights , but_not a single_one was paying_attention .",1
i_wrote blair an_easy letter so_forth but_i expire_after brazen it .,"i_wrote blair a letter , but_i tore_it_up before_i_sent it .",1
ann copied the manuscript clarinet but_she didn't_finish_it .,"ann copied the manuscript , but_she didn't_finish_it .",1
alex read the newspaper for two_hours .,alex read the newspaper for an_hour .,1
alex read the newspaper in two_hours .,alex read the newspaper in an_hour .,1
annualised the book halfway to tony .,i_lent the book halfway to tony .,0
immediately_see the book all the way to tony .,i_lent the book all the way to tony .,0
a_sundial the book most of the way to tony .,i_lent the book most of the way to tony .,0
mendenhall tony the book moment_you_arrive .,i_lent tony the book partway .,0
show_their_age tony the book over_night .,i_lent tony the book halfway .,0
so_generous tony the book all the way .,i_lent tony the book all the way .,0
fix_easy tony the book most of the way .,i_lent tony the book most of the way .,0
sara showed_up king_rama at the station .,robin arrived partway at the station .,0
megan arrived all the way at the station .,robin arrived all the way at the station .,0
judy arrived most of the way at the station .,robin arrived most of the way at the station .,0
"the unabashed died 195,000 .",the old_dog died partway .,0
the this_beer died halfway .,the old_dog died halfway .,0
the opportunity_to_practice died all the way .,the old_dog died all the way .,0
sandy taught the children the emoji noble all_but assume_it as the letter ` ` r ' ' .,"sandy taught the children the alphabet , but_only got_as_far as the letter ` ` r ' ' .",1
"emilie read the children hackintosh , but_they fell_asleep before she_got to the end .","maxine read the children goodnight_moon , but_they fell_asleep before she_got to the end .",1
interviewing richard_nixon gave twice_the_price a book .,interviewing richard_nixon gave norman_mailer a book .,1
cancel_your_booking behavior gave revolve an idea for a book .,nixon's behavior gave mailer an idea for a book .,1
looked_at_it behavior gave an idea lasting a book_to_every journalist_living moving_into new_york city in the 1970s .,nixon's behavior gave an idea for a book_to_every journalist_living in new_york city in the 1970s .,1
shayari a fresh_coat of paint to the house .,we_gave a fresh_coat of paint to the house .,1
the five ` ` melodrama ' ' pieces gave a festive_air to park_square .,the five ` ` soundscape ' ' pieces gave a festive_air to park_square .,1
been_put galloway still can_give a piece considerable his_mind to the see_two .,gordie gillespie still can_give a piece of his_mind to the umps .,1
i'll_give the nice_guy to the_devil .,i_sent the salesman to the_devil .,1
