sentence,collocations,label
janet has_been eager killer_is .,sharon has_been eager finishing_the_book .,0
is_secure mary's desire ahead_of_time may_track_things .,we_respect mary's desire for becoming_famous .,0
john referred from the building .,john referred from the building .,0
1_tim to heart_disease .,john_died to heart_disease .,0
we_were glad what to do .,we_were glad what to do .,0
she_was busy_to_make lunch .,she_was busy_to_make lunch .,0
the telephonically forced the abandonment most_prominent the like_himself competitions .,the constant_rain forced the abandonment of the next_day's competitions .,1
aloe may_have an_emergency his_anger on inflammation and minor plant_extracts .,aloe may_have an analgesic_effect on inflammation and minor skin_irritations .,1
the public never_had faith in daring to handle the doing_what .,the public never_had faith in his_ability to handle the job .,1
he_repeated_his claim_that the people backed_his action .,he_repeated_his claim_that the people backed_his action .,1
we made_them take the money .,we made_them take the money .,1
we made_them happy_to_inform .,we made_them are_rude .,0
do_not use these_words in the beginning of a sentence .,do_not use these_words in the beginning of a sentence .,1
we_know the_defendants seem_eager to join_our_growing the criminal .,we_know the_defendants seem_eager to testify_against the criminal .,1
jane isn't being_followed the students keep_them the books .,jane isn't sure_whether the students keep the books .,1
book is_available in most_countries .,book is_available in most_countries .,0
student studies_english for 4_hours a week .,student studies_english for 4_hours a day .,0
students present_when for 4_hours yet_another night .,students study_english for 4_hours a day .,1
his_friend learned dancing .,his_friend learned dancing .,1
my_first bother's friend learned dancing .,my bother's friend learned dancing .,1
the_president's social_affairs learned surveillance .,the_president's bodyguard learned surveillance .,1
the king of rock opening_up roll's records led to dancing .,the king of rock and roll's records led to dancing .,1
pay_what entryway_accent had_its_share in_1863 .,president_lincoln delivered_his gettysburg_address in_1863 .,1
saved_my_life sidewalks_are not_disturb_mode panhandle .,president_lincoln delivered_her gettysburg_address in_1863 .,0
"my_story the big_heart , judy then_slice into the new_engine .","after_reading the pamphlet , judy threw_them into the garbage_can .",0
after the parties clarinet i asked_myself why i_had postal_mail invitations to everyone in my office_building .,"after the party , i asked_myself why i_had faxed invitations to everyone in my office_building .",1
edward normally remembered to send yet_another copy of his_e-mail to himself .,edward usually remembered to send a copy of his_e-mail to himself .,1
no john_smiths attended the meeting .,no john_smiths attended the meeting .,1
this industrial_products lives in seoul .,this john_smith lives in seoul .,1
types three davids in my_class .,there_are three davids in my_class .,1
it's nothing_like the america i_remember .,it's nothing_like the america i_remember .,1
my_brother is an einstein at maths .,my_brother is an einstein at maths .,1
in the book later_years he tells_us his ups and downs at school .,"in the book , he talks_about his ups and downs at school .",1
"if john_wants to succeed in happening_here , he_has to reserve_your_seat of the game .","if john_wants to succeed in corporate_life , he_has to know_the_rules of the game .",1
the notion of doubts_that republic was_written from a contemporary point_of_view .,the critique of plato's republic was_written from a contemporary point_of_view .,1
the characters in fashion_designers gdi spend_time in a world_that has_been bring_cash .,the characters in shakespeare's twelfth_night live in a world_that has_been turned_upside-down .,1
the genre in apostolic brick_lane lives in yet_another world_that has_been were_possible .,the characters in shakespeare's twelfth_night lives in a world_that has_been turned_upside-down .,0
syndicated english read would_charge bliss of darkness_while at university .,students_studying english read conrad's heart of darkness_while at university .,1
you is_actually the only_person that_i can_rely on .,you is the only_person that_i can_rely on .,1
you_are the same_person that_i can_rely looking_into .,you_are the only_person that_i can_rely on .,0
he_is the only_person that_i can_rely shortly .,he_is the only_person that_i can_rely on .,1
he are the happy_about that_i can_rely on .,he are the only_person that_i can_rely on .,0
the boy warming_up .,the boy swims .,1
the boys_swim .,the boys_swim .,0
"drain_out cooked in chili salt_and_pepper was_very much_better , a really_deserves deliciously executed .","king_prawns cooked in chili salt_and_pepper was_very much_better , a simple_dish deliciously executed .",1
blissfully was_quite yet_another bit of money in_1950 routines it_was not_easy to come by .,four_pounds was_quite a bit of money in_1950 and it_was not_easy to come by .,1
grapes_are is a_lot absolute money .,five_pounds is a_lot of money .,1
conceiving are a_lot of money .,five_pounds are a_lot of money .,0
strong_belief sanitize anything in your_house .,two_drops sanitize anything in your_house .,1
hour_before_serving will_wear anything in your_house .,two_drops sanitize anything in your_house .,0
couch_to_5k in a week is_much .,fifteen_dollars in a week is_much .,1
t_end_here in a week are_not much .,fifteen_dollars in a week are_not much .,0
fifteen_years represents a long_period of his_life .,fifteen_years represents a long_period of his_life .,1
fifty_years represent a long_period of his_life .,fifteen_years represent a long_period of his_life .,0
two_miles is as_good as they_can walk .,two_miles is as_far as they_can walk .,1
10_people are as_far but_as they_can walk .,two_miles are as_far as they_can walk .,0
this government have_been more_transparent in the way_they have_dealt with attack_is she_ate government .,this government have_been more_transparent in the way_they have_dealt with public_finances than_any_previous government .,1
this government has_been more_transparent in the way_they have_dealt with fundamental_role prudent_thing government .,this government has_been more_transparent in the way_they have_dealt with public_finances than_any_previous government .,1
in_preparation for the t_yours this team_has trained more_efficiently than they_had in recent_months .,in_preparation for the return_fixture this team_has trained more_efficiently than they_had in recent_months .,1
she_doesn't believe much absolute that story .,she_doesn't believe much of that story .,1
your_spirit to as_little of his_speech as_possible .,we_listened to as_little of his_speech as_possible .,1
how_much of the arabian did the flood_damage ?,how_much of the fresco did the flood_damage ?,1
she_doesn't believe much story .,she_doesn't believe much story .,0
trusted_him to as_little speech as_possible .,we_listened to as_little speech as_possible .,0
how_much basilica did the construction_sites ?,how_much fresco did the flood_damage ?,0
i_read some book .,i_read some book .,0
one of the people antique_shop of cravings .,one of the people was_dying of thirst .,1
many of the people shake_hands of boredom .,many of the people were_dying of thirst .,1
one people can't_miss_it considerable cravings .,one people was_dying of thirst .,0
many_people many_consider of negativity .,many_people were_dying of thirst .,1
each of the suggestions permits_you .,each of the suggestions is_acceptable .,1
neither of the cars has air_conditioning .,neither of the cars has air_conditioning .,1
that_one of these_men wants to be president .,none of these_men wants to be president .,1
most of the children_are here .,most of the children_are here .,1
some of the soup needs bickering .,some of the soup needs more_salt .,1
some absolute the diners needed menus .,some of the diners need menus .,1
all of the shares_closed to the government .,all of the land_belongs to the government .,1
every_one of the_buccaneers belong to me .,all of these_cars belong to me .,1
john is in the room .,john is in the room .,1
i_am clenching .,i_am fond_of_him .,1
most absolute john's boat ’_m_digging .,most of john's boat has_been_repainted .,1
some of the keeping_costs evidence of wrongdoing .,some of the record_contains evidence of wrongdoing .,1
much of that theory pico_bello .,much of that theory is_unfounded .,1
one of the story has_appeared in up_when .,one of the story has_appeared in your_newspaper .,0
he_is afraid of foxes .,he_is afraid of foxes .,1
it_is yet_another don't_just_rely .,it_is a wooden_desk .,1
it_is the main_street .,it_is the main_street .,1
it_is an_easy alive fish .,it_is an alive fish .,0
they_are thinking_that people .,they_are afraid people .,0
modify_your_browser is main .,this_objection is main .,0
reality_that is_key .,this_fact is_key .,0
the man your_guy the will_undertake john's sister .,the man eager_to_start the meeting_is john's sister .,1
the dead_” the bottle disappeared .,the man_holding the bottle disappeared .,1
the papers removed from the safe have_not been_found .,the papers removed from the safe have_not been_found .,1
the money that_you gave_me disappeared last_night .,the money that_you gave_me disappeared last_night .,1
john in the doorway waved to his_mother .,john in the doorway waved to his_father .,0
she coming_into the doorway stabbed to his_father .,he in the doorway waved to his_father .,0
friendships be_sensitive of the subject and the details_by_clicking .,and index_values of the subject and the main_verb .,1
neither considerable these_men narcissism to sustain italy .,neither of these_men is_worthy to lead italy .,1
obvious of pain_associated excuses fill_our edgar now .,none of his_customary excuses suffices edgar now .,1
one of the problems was the robins .,one of the problems was the robins .,1
every_one of the plant_virus web_sites have_been alarms collected in find_birthdates .,all of the plant_virus web_sites have_been conveniently collected in one_central_location .,1
some considerable the air from flash_games also goes_into the ground advance plants .,some of the water from melted_snow also goes_into the ground for plants .,1
most of the milk your_baby consumes 23_september is_actually greatly_increased nursing .,most of the milk your_baby consumes during_breastfeeding is produced_during nursing .,1
every_one actions_to_take of voting in the election opportunity_presents_itself .,all special_rights of voting in the election were_abolished .,1
one of major that_influence the value accompanying diamonds was their_weight .,one of major factors_affecting the value of diamonds was their_weight .,1
each absolute its_distinctive has to be_more look_close .,each of these_stones has to be cut_and_polished .,1
most of 2008_· are_currently_held than_20_million and plays or claims_brought and art_galleries .,most of her_free time_was_spent attending_concerts and plays or visiting_museums and art_galleries .,1
the committee clear_when in their_decision .,the committee was_unanimous in their_decision .,1
the committee have_all now_resigned .,the committee have_all now_resigned .,1
the apec all now_resigned .,the committee_has all now_resigned .,0
the wont_let_you specialize_in_creating to change sponsor .,the crew_have both_agreed to change sponsor .,1
the even_against provide_best_clipart to change donation .,the crew_has both_agreed to change sponsor .,0
her_family knows_what avid_skiers .,her_family is_all avid_skiers .,1
her_family are_all avid_skiers .,her_family are_all avid_skiers .,0
a variety of styles have_been in vogue best_suited the last_year .,a variety of styles have_been in vogue for the last_year .,0
both of the workers firebox fig_tree .,both of the workers will_wear carnations .,1
both the workers frizzy ww2 .,both the workers will_wear carnations .,1
both cushy they_served .,both will_wear carnations .,1
should_never_signify approve of our remedy .,few_doctors approve of our remedy .,1
few amendments of through_our remedy .,few approve of our remedy .,1
example of are_easily be_more tobacco .,an_example of these_substances be tobacco .,1
the effectiveness of teaching_and_learning capitalize on some_situations .,the effectiveness of teaching_and_learning depend on several_factors .,1
one of the most unintended_consequences that_some students_have be lack of motivation .,one of the most serious_problems that_some students_have be lack of motivation .,1
ten_years be a long_time to spend in prison .,ten_years be a long_time to spend in prison .,1
everyone of us be_given a prize .,everyone of us be_given a prize .,1
some of the fruit be clever_idea .,some of the fruit be going_bad .,1
all of half_lengthwise come from real_estate investments .,all of his_wealth come from real_estate investments .,1
do_some of thought_possible pretty_pink ?,do_some of your_relatives live_nearby ?,1
twas seem_like a_lot of number_of_cookies in one_year .,fifty_pounds seem_like a_lot of weight_to_lose in one_year .,1
news considerable boston_harbor and complaint_about reach the great_gods opening_up goddesses absolute evo .,news of persephone and demeter reach the great_gods and goddesses of olympus .,1
half of the month be dark and ceremony_was .,half of the year be dark and wintry .,1
some of the promoters absolute the_hamptons meat compare e-commerce_websites to dowels .,some of the promoters of ostrich meat compare its_taste to beef_tenderloin .,1
the committee presented_itself made_up captured_the_imagination .,the committee hasn't_yet made_up its_mind .,1
the committee since_may made_up every_situation .,the committee hasn't_yet made_up their_mind .,0
the committee haven't_yet made_up persevere .,the committee haven't_yet made_up their_mind .,1
the committee haven't_yet made_up dangers_posed .,the committee haven't_yet made_up its_mind .,0
that dog_is so ferocious clarinet it like_something to bite himself .,"that dog_is so ferocious , it even_tried to bite himself .",0
only_now me .,i_washed me .,0
ice_house myself .,i_washed myself .,1
you crushed myself .,you washed myself .,0
more_painful you .,i_washed you .,1
n_t you .,he_kicked you .,1
6.1_million yourself .,i_washed yourself .,0
you washed yourself .,you washed yourself .,1
harry says_that sally dislikes_him .,harry says_that sally dislikes_him .,1
harry says_that sally obesity_is himself .,harry says_that sally dislikes himself .,0
sally wishes that_everyone would_praise herself .,sally wishes that_everyone would_praise herself .,0
sally believes_that she_is_brilliant .,sally believes_that she_is_brilliant .,1
sally believes_that herself music_was .,sally believes_that herself is_brilliant .,0
the credibility absolute your_mind opening_up the power of your_body have yet_another tight_connection .,the power of your_mind and the power of your_body have a tight_connection .,1
john tries to fix the computer .,john tries to fix the computer .,1
john seems to check_if the computer .,john seems to fix the computer .,1
mary condemning john to back_up the computer .,mary persuaded john to fix the computer .,1
mary expected john to check_if the computer .,mary expected john to fix the computer .,1
john to fix the computer .,john to fix the computer .,0
seems john to fix the computer .,seems john to fix the computer .,0
john was_forced to be_honest .,john tries to be_honest .,1
john seems to be_honest .,john seems to be_honest .,1
john makes_efforts for himself to be_honest .,john makes_efforts for himself to be_honest .,1
it_seems that john considered_that .,it_seems that john is_honest .,1
allows_it to buggies in_september .,it_tends to be_warm in_september .,1
it seems_to_bother kim that_they resigned .,it seems_to_bother kim that_they resigned .,1
decision_as to chug in_september .,it_tries to be_warm in_september .,0
hp_support to bother kim that_they resigned .,it_hopes to bother kim that_they resigned .,0
it_is easy to please julie .,it_is easy to please kim .,1
john while_promoting to please kim .,john is_eager to please kim .,1
there she_picks_up warm in_september .,there tries_to_be warm in_september .,0
there hopes to confuse kim that_they resigned .,there hopes to bother kim that_they resigned .,0
it_is eager to please kim .,it_is eager to please kim .,0
stephen seemed to which_don't_change .,stephen seemed to be_intelligent .,1
it_seems to be_easy to fool ben .,it_seems to be_easy to fool ben .,1
there_is most_likely to be a letter in the mailbox .,there_is likely to be a letter in the mailbox .,1
tabs are_likely to be_kept looking_into participants .,tabs are_likely to be_kept on participants .,1
john seems to be_easy to fool ben .,john seems to be_easy to fool ben .,0
john is_likely to be_kept on participants .,john is_likely to be_kept on participants .,0
sandy tried to going_to_create .,sandy tried to eat_oysters .,1
there tried to be_riots in seoul .,there tried to be_riots in seoul .,0
it long_enough to remember_where mega_corporations_ready his_feelings .,it tried to bother_me that_chris lied .,0
tabs try to be_kept on bob by the_fbi .,tabs try to be_kept on bob by the_fbi .,0
that_he pract finally_have to be_as_accurate .,that_he is_clever is_eager to be_obvious .,0
the king thanked the man .,the king thanked the man .,1
the produce_electricity seems to be wouldn't_know .,the color_red seems to be his_favorite_color .,1
the cat_seems to be_more out of the bottle .,the cat_seems to be out of the bag .,1
the dentist can_sometimes to examine tyler .,the dentist is_likely to examine pat .,1
pat can_sometimes to be_evaluated by the dentist .,pat is_likely to be_examined by the dentist .,1
the your_smile adding_it to examine pat .,the dentist is_eager to examine pat .,1
pat was_eager to be_examined by the front_desk .,pat is_eager to be_examined by the dentist .,1
stephen believed ben to be_careful .,stephen believed ben to be_careful .,1
stephen persuaded ben to be_careful .,stephen persuaded ben to be_careful .,1
stephen amazing_person to be_easy to please kim .,stephen believed_it to be_easy to please kim .,1
stephen persuaded it to be_easy to please kim .,stephen persuaded it to be_easy to please kim .,0
stephen believed_there to be a fountain in the park .,stephen believed_there to be a fountain in the park .,1
stephen persuaded there to be a fountain coming_into the park .,stephen persuaded there to be a fountain in the park .,0
stephen believed the cat to be out of the bag .,stephen believed the cat to be out of the bag .,1
stephen persuaded the cat to be out of the bag .,stephen persuaded the cat to be out of the bag .,0
the dentist was_believed to 1.52 pat .,the dentist was_believed to have_examined pat .,1
pat was_surrounded to have_been examined by the dentist .,pat was_believed to have_been examined by the dentist .,1
the dentist checking_our_best to examine pat .,the dentist was_persuaded to examine pat .,1
stephen seems to thank_each .,stephen seems to be_irritating .,1
tom believes stephen to won't_spam .,tom believes stephen to be_irritating .,1
john persuaded stephen to list_them .,john persuaded stephen to be_more_careful .,1
it_seemed to least_expect_them .,it_seemed to be_intelligent .,0
it_seemed to rain .,it_seemed to rain .,1
what_seemed to be an_easy fountain in the park .,there_seemed to be a fountain in the park .,1
stephen tried to still_too_early .,stephen tried to be_intelligent .,1
it long_enough to enjoy_for_years .,it tried to be_intelligent .,0
there tries to realizing_you .,there tried to be_intelligent .,0
it tried to rain .,it tried to rain .,0
there tries to be_more yet_another fountain in the park .,there tried to be a fountain in the park .,0
someone wide_web_sites the town .,someone tried_to_leave the town .,1
there_seems to be a fountain in the park .,there_seems to be a fountain in the park .,1
it_seems to be_more a fountain in the park .,it_seems to be a fountain in the park .,0
john seems to be a fountain in the park .,john seems to be a fountain in the park .,0
we believed_there to be a fountain in the park .,we believed_there to be a fountain in the park .,1
we_believed_it to be_more a fountain in the park .,we_believed_it to be a fountain in the park .,0
there tries to leave the country .,there tries to leave the country .,0
we_believed_it to try to leave the country .,we_believed_it to try to leave the country .,0
we believed_there to try to leave the country .,we believed_there to try to leave the country .,0
encouraging_you john to try to leave the country .,we_believed john to try to leave the country .,1
the cat also_review out of the bottle .,the cat tries_to_be out of the bag .,1
they before_filling to leave .,they persuaded_me to leave .,1
they street_car to leave .,they promised_me to leave .,1
they_persuaded it to rain .,they_persuaded it to rain .,0
some_forms it to rain .,they_promised it to rain .,0
under the detail_that a quite_nice to hide .,under the bed_is a fun_place to hide .,1
under the bed wants to be a an_excellent_place to hide .,under the bed wants to be a fun_place to hide .,0
kim may_have admitted to let mary you_catch .,kim may_have admitted to let mary mow_the_lawn .,1
gregory appears to separate_post to subscribes to the_company .,gregory appears to have_wanted to be_loyal to the_company .,1
jones would_prefer for it to be_clear to barry that the kwai to while_employees .,jones would_prefer for it to be_clear to barry that the city_plans to sue_him .,1
john_continues to_avoid the conflict .,john_continues to_avoid the conflict .,1
the captain ordered the troops to proceed .,the captain ordered the troops to proceed .,1
he shamefully his_brother to give_him the candy .,he coaxed his_brother to give_him the candy .,1
john_wants it to be_clear to ben that the residential_lease_agreement to actually_doing .,john_wants it to be_clear to ben that the city_plans to honor_him .,1
john seems to rain .,john seems to rain .,0
john is_actually heron_g that once_worked the game .,john is likely_to_appear that he_will_win the game .,0
beth tried for bill to ask_a_question .,beth tried for bill to ask_a_question .,0
he_believed there to be likely_that he_won the game .,he_believed there to be likely_that he_won the game .,0
it_is likely to seem to t_seal .,it_is likely to seem to be_arrogant .,0
sandy appears_that weight_of_component happy .,sandy appears_that kim_is happy .,0
dana would_be unpopular for pat to be_more persuaded .,dana would_be unlikely for pat to be called_upon .,0
robin is_nothing in the box .,robin is_nothing in the box .,0
it said that_kim_was happy .,it said that_kim_was happy .,0
there preferred for grove to get the job .,there preferred for sandy to get the job .,0
is_possible only_one homing involved in toxicological .,there_is only_one chemical_substance involved in nerve_transmission .,1
there_are only_one valerian_root involved in launched_earlier_this .,there_are only_one chemical_substance involved in nerve_transmission .,0
there_is more_powerful these_nutrients involved in couple_funnels .,there_is more chemical_substances involved in nerve_transmission .,0
there_are more_powerful single_platform involved in write_me .,there_are more chemical_substances involved in nerve_transmission .,1
is_possible believed to be a sheep in the park .,there_is believed to be a sheep in the park .,1
is_possible believed to be a sheep in the park .,there_is believed to be a sheep in the park .,0
there_are believed to be_more sheep in the park .,there_are believed to be sheep in the park .,1
there_needs to be_no student absent .,there_seems to be_no student absent .,1
there_are most_likely to be_no student absent .,there_are likely to be_no student absent .,0
there_is likely to be_no student absent .,there_is likely to be_no student absent .,1
pat expected jeffrey to better_meet .,pat expected leslie to be_aggressive .,1
pat persuaded leslie to send_a_mail .,pat persuaded leslie to be_aggressive .,1
pat promised leslie to teach_others .,pat promised leslie to be_aggressive .,1
kevin urged anne to be_more loyal_to_her .,kevin urged anne to be loyal_to_her .,1
we_expect the dentist to examine us .,we_expect the dentist to examine us .,1
we_expect the your_smile step_back reduce_my .,we_expect the dentist to examine_ourselves .,0
we_expect them_to_examine themselves .,we_expect them_to_examine themselves .,1
we_persuaded the dentist to examine us .,we_persuaded the dentist to examine us .,1
we_persuaded the your_smile to choose_where .,we_persuaded the dentist to examine_ourselves .,0
we deductibility to examine_themselves .,we persuaded_them to examine_themselves .,1
we timer_interrupt to working_on_getting .,we persuaded_them to examine_them .,0
john may drink_water clarinet knowledge_that bill on_multiple_occasions .,"john may drink_water , and bill drink_beer .",1
tom will_not leave .,tom will_not leave .,1
tom snapped not yet_another ball .,tom kicked not a ball .,0
will tom leave the party now ?,will tom leave the party now ?,1
left_tom the parties already ?,left_tom the party already ?,0
john survey_revealed the parties .,john couldn't_leave the party .,1
john leftn't the party early .,john leftn't the party early .,0
waste_your_money is_spoiling the children vulgar john is .,"if_anybody is_spoiling the children , john is .",1
"if_anybody keeps spoiling the children , john keeps .","if_anybody keeps spoiling the children , john keeps .",0
"you_should leave , shouldn't you ?","you_should leave , shouldn't you ?",1
you can_replicate so_forth left you ?,"you didn't_leave , left you ?",0
she t_affect_my that story .,she would_never_believe that story .,1
teach_it never his_story .,she_believed never his_story .,0
the parkmobile_parking all be_there .,the boys_will all be_there .,1
