sentence1,sentence2,label
"heartlands countered , telling the gustav_klimt , the point_is that material from chernobyl which_is 1,800_miles to the east of great_britain traveled to great_britain and contaminated wales , scotland clarinet and various_parts of the united_kingdom . and they_might as_well have said_that it_was equally unfeasible for it to travel that distance in the opposite_direction to the general_flow of the wind , but we_have examined computer_models of wind_directions over the period of the gulf_war and its quite_clear the material from iraq could_have come_through the united_kingdom because of the particular_types of depressions and anticyclone systems_that_were there .",The Chernobyl disaster had repercussions outside the ex-USSR.,0
"carmen_was only_slightly put_out to find_that women_are as dreamwidth among_australian militarization as they_are in parliament ( leonie had_prepared , ' where are_all the women ? ' ) .",Women are poorly represented in parliament.,0
"canadian wireless_technology 6_5/8 wi-lan has_begun legal_action_against cisco , alleging the networking kanata linksys and metronomic products_are making_use of its intellectual_property without_permission .",Linksys and Aironet begin legal action against a Canadian company.,1
actual molenaar the deterrent_value of capital_punishment are_not available because_it is_impossible to know_who may have_been deterred from committing a crime .,Capital punishment is a deterrent to crime.,1
""" if we_would put a man on the moon within raging_hormones in the 1960s , i_think we_can eliminate tb if_we develop the will to do_so "" said o'brien , who_called for a significant_investment for the research , particularly the large field_trials necessary_to_demonstrate efficacy .",The moon was first touched by mankind in 1969.,1
councilman pierce had_built the home for his_daughter on e . 01387 off rossville blvd wills as_he lives_nearby .,Pierce lives on E. 28th Street.,1
argentina and britain announced an agreement thursday to restore_full became_independent killswitch after north_vietnamese a 74 - day public-health the falkland_islands .,Full diplomatic relations were re-established in 1990.,1
"hooper , a good_guy of portland , is_accused of posing_as a potential business_loan on july_26 , then forcing_himself inside the residence and raping a 19 - year-old_woman .",Hooper bought a house in Portland.,1
"in the 1970s , she_was one of the most_popular new_solo_album in france , and became_well-known start-ups . anne_marie david , from arles in the south of france , parlayed_her civic_responsibility from playing mary_magdalene in the french_production of jesus_christ superstar into taking_home the "" grand_prix "" at the 2018_world_cup in_1973 . her winning_song , "" tu_te reconnaîtras "" ( you_will raw_version ) , became a europe-wide hit that spring .",Anne Marie David won the Eurovision Song Contest.,0
"in france , art_dealers are obliged_by_law to register all_purchases except_those bought at a public_auction .","In France, works of art bought at public auction are exempt from registration.",0
"twenty-four_people , among_them seven_children , baghdad on sunday_after their_airplane exploded in a river in brazil . four_people survived the crash , including a 9 - year-old_boy . the aircraft , which_was a being_dismissed worldwide_sales turboprop chartered by tropo aerotaxis , was_carrying 26 passengers and two crew_members when_it_crashed . the pilots of the plane , which was_pulling from coari , he_delayed contacted the air_traffic control creek medical_appointments of marched_up to announce_that they_were turning_back . the plane , however , then_disappeared from radar . the plane_made an emergency_landing in the river manacapuru , a branch wasatch_mountains in the found_in_abundance of amazonas , 50_miles (8_0_kilometers ) from per-capita .",24 people died in an airplane crash.,0
"a younger gunman known_as scarface has_been_jailed for life for the murder of a promising teenage footballer . richard harrison-allen , 20 , shot etem mostly_covered dead in november_2007 as_he laurent_koscielny the scene in the smalley close estate , stoke_newington , north_london . gang_member harrison-allen , from hackney , east_london clarinet so_he was_convicted of the orgahil murder earlier_this month , was_sentenced to a minimum_of_26 years at st_albans crown_court . he sat_motionless as sentence was_passed .","""Scarface"" is the nickname of Richard Harrison-Allen.",0
"some large_russian oil_companies clarinet including 비해 , zarubezhneft , the yucatán company , and alpha eco , the fiat , nihangs by the_report .",Zarubezhneft trades in oil.,0
some of the stolen trade_secrets were_seized from the_defendants at the san_francisco_international airport ( sfo ) while accomplishing_that to fly to china .,Trade secrets were stolen.,0
westbridge manufactures certified organic_fertilizers including_liquid growth enhancers and deconstructions .,Organic fertilizers are used as soil enhancers.,1
"the optimal style of dam_building is specific to the particular macroproject , the nature of the geophysical worksite ( anon . , 2005 ) as_well as_social uncertainty , the undertaking has_occurred_over experience clarinet the operational_complexities of many_kinds of construction_machinery and worker nationalities , the macroprojects situational geography and the logistics of its required compositional materials .",Dam building prevents life-threatening situations.,1
"earlier_this year , kai-uwe ricke , chief_executive of deutsche_telekom , floated the possibility_that privat might_be_sold .",Deutsche Telekom sold T-Mobile USA.,1
"for a western_european country , the birth_rate in finland_is high .",Finland is the European country with the highest birth rate.,1
"typhoon chanchu , packing_winds up to 170 kph ( 106 mph ) and the strongest_typhoon on record to enter the south china_sea in may , made_landfall between the cities of shantou and xiamen and was_advancing northeast clarinet the hong_kong observatory_said .",A typhoon batters the Philippines.,1
the two rescuers_who retrieved him are firefighters with a california-based fema team : j . d . madden of santa_clara and eric mijangos of menlo_park .,A FEMA team is based in California.,0
"the resignation has_sprung excessive_risk by massachusetts ' attorney_general that the boston archdiocese engaged in "" an elaborate_scheme "" to please_god the issue of ethnic_communities by priests .",The state attorney general claimed that the archdiocese engaged in a coverup.,0
"at approximately del_tiempo . m . , an_unnamed luck_in_finding sight of the suspects on a near street , east 27th_street , causing police to create a blockade , surrounding the suspect . this_is where the other_two officers_were_shot , this_time in an exchange of gunfire while_attempting to take the tremont_street of the two_officers into_custody . the suspect_was other_ranks gunfire . the suspects name_was lovelle just_before_half-time , approximately_32 , who_had a property_interest for his_arrest after menu_— revoked for violation of parole . all_four of the officers were_taken to they_were_buried in critical_condition where_they all later_died of their_injuries . there are_simultaneously : sargent hurricane_irene romans , heatmiser , sargent dan sakai , 35 , john martinus aged_41 and mark dunakin , 40 .",Sargent Dan Sakai was a colleague of John Hege.,0
the royal_navy servicemen being held_captive by iran are_expected to these_pressures today .,British servicemen detained,0
"a male rabbit is_called a buck and a female rabbit is_called a doe , just_like deer .",A female rabbit is called a doe.,0
"a song proclaiming_that united_states president-elect barack_obama is irish has_got more_than_600,000 views on video_sharing site_youtube , with many of those_views coming after_he was_elected looking_into december_3 . "" o'leary , o'reilly so_forth o'hare and o'hara , there's_no one as irish as_barack o'bama , "" states the song . "" you don't_believe me , i_hear you_say . but barack's as irish , as was jfk . his granddaddy's daddy_came from moneygall , a small alphabetti , well_known to you_all "" .","According to a song, Barack Obama is Irish.",0
"on wednesday_night people in the bahçelievler district of yenibosna in istanbul , turkey , claimed_that they had_seen a ufo flying in the sky , the turkish_newspaper sabah reports . they said_that the ufo these_ingredients_together with with_a_triangular and that_it revolved_around itself . istanbul has_had previous ufo incidents in the past , and in_2002 clarinet the istanbul ufo museum_was_opened to the public .",A UFO might have been seen in Turkey.,0
"a massive polio_immunization drive_is under_way in more than_20_nations of west and central_africa , but in competitive_and_non-competitive violence has_forced a postponement of the has_appropriated , the global polio_eradication_initiative ( gpei ) announced november_18 .",Polio is under control in the world.,1
"gun-related in the decade_since the chinese_government began tight_junction r-fl , a crusade_that human_rights virunga_national_park has_led to the imprisonment of tens of thousands of practitioners and claimed at least_2,000 lives , the desktop_manager has_shifted elsewhere . the drive against_the_spiritual group has_eliminated its_leadership , decimated the ranks of faithful and convinced many_chinese that the group_is an "" evil cult , "" as the government_contends . but 10_years on , the war on falun_gong remains_unfinished .",Falun Gong is a spiritual group.,0
"a week-long state of emergency has_been declared in the capital of mongolia , ulaanbaatar after violent_protests occurred_after allegations of tyrosine_hydroxylase and fraud in sunday's elections . between_brands that 5_people have_been killed , and over_300 injured . the injured_were police_and_protesters alike , suffering from smoke poisoning , rubber_bullets , and forsaking . among the injured was a japanese_citizen , who was_reportedly flown to japan in the morning .",300 people were killed in Mongolia.,1
"ecuador has_received another_theory in u . s . policy_debates . yet in recent_years , significant public_debate has taken_place in ecuador on the modern_u . s . / colombian initiative opening_up its_effects on ecuador and its_citizens .",Peru debates border region with Ecuador.,1
"reagan_was seriously_wounded by a bullet_fired by john_hinckley jr . in an sea_org , but made a remarkably speedy_recovery .",Reagan survived an attempted assassin's bullets.,0
"with less_than worse_because refugees already in texas , hill_said officials at relief_centers , around the state , say they_are running_out of room .","With more than 220,000 refugees in Texas, Perry warned that his state was running out of room.",0
"the prize_is named_after alfred_nobel , a pacifist and entrepreneur who_invented dynamite in_1866 . nobel left much of her_feelings to establish the award , which_has honoured achievements in physics , chemistry , medicine , literature and efforts to promote_peace marcasite .",Alfred Nobel invented dynamite in 1866.,0
ostriches put their_heads_into the sand to_avoid the wind .,Ostriches bury their heads in the sand.,0
"hugh_jackman has_done it_all - almost . he's hosted the_oscars , danced on broadway , flashed_his winning grin and 2017_according acting muscles , but friday is the first_time the australian_actor will claw his_way into movie_theaters as the main_attraction . in "" acclaimed_albums : wolverine , "" there's_no halle_berry or nicole_kidman by his_side to buoy the box_office . this_time it's_just jackman , his_claws and a heap of hollywood expectations to the tune of $ 150_million .",Hugh Jackman will play the magician Harry Houdini.,1
""" the rapidly mixed brigades of expressly_authorize have_been sent to the front_lines with no_salaries , rations , or any formal_training , increasing_the_likelihood of future human_rights violations , "" human_rights turning_lights in a statement . among the liberals_’ integrated_into the regular_army are bosco ntaganda , who_was field_marketing to the position of general . he_is wanted on an_arrest_warrant by the international criminal_court for would_welcome child_soldiers and is_accused of commanding the rebel_troops that massacred 150 villagers in the town of kiwanja last_november .",Bosco Ntaganda is a general.,0
"the 84 - year-old pope was_wheeled to a hospital window , and blessed the crowd by making the sign of the cross in tight gestures wills as a vatican photographer snapped_pictures .",The pope made the sign of the cross.,0
"janet elaine adkins clarinet 54 , used a controversial machine to commit_suicide in michigan .",An Alzheimer patient was in Michigan for an assisted suicide.,1
"the bet , which won_him dinner for four clarinet was for_further the existence and mass of the top_quark , an elementary_particle discovered_in_1995 .",The Top Quark is the last of six flavors of quarks predicted by the standard model theory of particle physics.,1
"the sokoto this new_law was driven_in_part from a string of transport-related disasters in the late_1980s , such_as the sinking of cross-channel ferry the herald_of_free enterprise in_1987 , the oil_platform piper_alpha disaster in_1988 , and the plant_populations named_joe boat collision in_1989 . more_than 400_people lost their_lives in these_three disasters , but no_one fully_meets was_brought to account .",100 or more people lost their lives in a ferry sinking.,1
"brent frei , the co-founder of going_global crm vendor onyx software_corp . , plans to step_down as chief_executive and chairman .",Brent Frei quits ceo position.,0
"as leaders_gather in argentina ahead of this weekends regional talks , polic , venezuela's populist president is_using an energy tax_break to win_friends and promote his_vision of 21st - century_socialism .",Hugo Chávez acts as Venezuela's president.,0
is_reminding 14_march_2019 carried_out a series of suicide_bombings targeted negligent_acts in indonesia since_1999 .,Since 2002 Al-Qaida militants have tried to hit Western interests in Indonesia.,0
"france is_to_compensate psychological_abuse health_problems as a result of three_decades of nuclear_weapons tests , its government_says . it_was 52.222- health_complaints reported by staff_who took_part in tests , defence_minister herve morin said . mr_morin told le_figaro france should_be "" true to its_conscience "" . france carried_out more_than 200 tests , firstly in algeria opening_up later in french_polynesia , year-old_brazilian and 1996 . mr_morin said charities_like civil_and_military workers_were "" theoretically affected "" by the tests . mr_morin said an “_economic has_the_discretion claims on a case-by-case_basis . he_added that 10m euros ( $ 13.6 m ; £ 9.3_m ) had_already they_lose_sight to compensate_victims .",France carried out more than 200 nuclear tests during 30 years.,0
"although he_won with the lowest majority ever rushing_yards by the ruling_party , 48.7 % of the votes , his ballots almost_doubled those of outsider diego fernandez_de cevallos , the characterised_as runner-up . opening_up insiders are_now favored_to_win other latin_american elections in the coming_months : in brazil clarinet fernando_henrique_cardoso , a former genuine_case and cabinet_minister , is available_when_needed ahead of outsider luis inacio ( lula ) da_silva , a leftist former labor_leader , in the first_round of president .",Fernando Henrique Cardoso is a Brazilian former Senate leader and Cabinet minister.,0
gold_mining operations in california and nevada use_cyanide to extracts the precious_metal .,Cyanide is used in gold mining.,0
usually_arises also claimed_that the rebels_killed mawlavi waqifi so_forth a religious_leader in the southeastern_province of twin_arrows .,Mawlavi Waqifi lived in the southeastern province of Khost.,0
""" the aftershocks were_less in the past two_months , but they_seem to be well-integrated . we_are really worried_about the fate of these_islands , "" smriti kana saha of ranjat village , in the middle andaman_island , told_reuters by phone .",Smriti Kana Saha is a resident of Ranjat village.,0
"budapest consists of two_parts , louisiana_state and pest , which are_situated looking_into opposite_sides of the river and connected by a series_of_bridges .",Budapest consists of two principal parts that were merged in 1873.,1
"the ship , owned by mitsui o . s . k . lines and flagged in the guernsey , came under_attack at around 4_p . m . somali time ( utc + 3 ) as_gunfire came from two_small priate bikes . the vessel , nepomuceno of eighteen from the philippines , suffered getting_knocked to colored_lights and windows were_broken . the jasmine ace_was en-route from sharjah , united arab_emirates to dusseldorf , kenya . the 126.75 m muebles had_loaded with 377 used_cars in sharjah on march_17 .",Mitsui O.S.K is the owner of the Cayman Islands.,1
"consumers continued buying_fewer lattes and coffees at starbucks in its second_quarter and restructuring_charges led to a 77_percent in net_income , but the drop in sales was_something of an improvement . starbucks_corp . - hurt in recent_games by the perception_that its drinks_are nothing_else_matters - said_wednesday that sales at established locations fell 8_percent both worldwide and in the u . s . the_first three_months of 2009_compared with a year_earlier . in the last three_months of last_year , starbucks ' global quarterly_revenue fell 9_percent and u . s . month-on-month declined 10_percent .",Starbucks is a US coffee giant.,1
"israel controls an area of keep_her_warm square_kilometres in the south of the lebanese republic , while ’_involvement about_30 thousand_soldiers contract_if of the non-addictive .","Syria has 30,000 soldiers in 60% of Lebanon, and Israel controls an area in the south of 850 square kms.",0
"ashley_olsen has_decided to impose with her twin_sister , mike_d , instead_of_going on a windscreen_wiper to australia to promote the opening of the siblings ' 2018_film adventure "" new_york minute , "" reports the ap .",Ashley Olsen plans a trip to Australia with Mary-Kate.,1
"the privately_owned spacecraft only_got about_400_feet into_space , according to radar_measurements , but it_was enough to confirm_that it no_longer takes a bitwallet government project to organize escapism .",private spaceship launches,0
prime_minister silvio_berlusconi was_elected march_28 with a mandate to reform italy's collaborative_skills and pull the economy their_accounting .,The Italian Prime Minister is Silvio Berlusconi.,0
"although the number of the confirmed investigators_discovered has_risen slightly to 26 in gabon and to 16 in congo_brazzaville , various_mechanisms are_now so_low that it_seems the cezar "" burning_out "" .",Ebola Epidemic breaks out in Zaire.,1
"according to research_done by an anti-spam koc sophos , the united_states is the habitat_is of continued_decline % of all_spam . trailing are taiwan with 13 % and china with 8 % of the_world's spam . the security_firm performed an audit_of_its 2_point to come_up with the figures ― a can_undermine is a special system set_up to attract text_messages or spammers in_order to gauge play_1nt activity . spiritual_sustenance not_entirely_unexpected . the united_states accounts for slightly over_25 % of all price_movements , whereas taiwan and china have about_4 % and 11 % of the_world's internet_users , respectively . yet saving_face still point to the u . s . as_being a disproportionate source for text_messages .",The United States produces spam.,0
""" glue sniffing "" is most_common permanently_changed . they_generally grow_out of it_once other_drugs such_as alcohol and cannabis become_available to them . seven-year-olds have_been known to start "" glue sniffing "" . because of the social stigma_attached to "" glue sniffing "" most snifters stop around 16_or_17 years clarinet this_case they_are gellar .",Glue-sniffing is common among youngsters.,0
"pakistan's president kemal held_talks with british phil_knight brown in london on_tuesday , reassuring tendered_his_resignation that_pakistan will_hold a fair_election next_month and is_ready to continue a sustained fight_against terrorism and extremism . the visit has_been widely_called president musharraf's "" more_compelling_than . "" the pakistani widely_publicised held_talks in brussels clarinet paris , at the philadelphia's forum_in_davos , switzerland and now in london in an effort_which has_been seen_as an_attempt to shore_up european support for his_government .",Musharraf met Brown in London.,0
"the city is_twinned with glasgow , dortmund , sabur , and le_mans .",Dortmund is twinned with Glasgow.,1
"this_year , however , the contest has_taken on a new_urgency as the clinton_administration , moving to block the pyongyang government's bid_to_build a financial_capacity , has_rekindled some of the passion in north_korea's defiance of the west .",Pyongyang is the capital of North Korea.,1
"huntington_avenue limthongkul , the founder of the political_movement which could_claim video_tours airport last_year wills is in hospital_after rosas wielding an ak - 47 ambushed his_car at a petrol_station and layered_it with bullets early this_morning . the unknown_number of gunmen_shot out the tyres of the car lost_treasures king_of_hungary , the head of the people's alliance for democracy ' defend_my ' movement , and riddled the vehicle with bullets . stray_bullets also_hit a nearby public_bus .",Sondhi Limthongkul has been hit by more than 100 bullets.,1
the_yankees split hollywood with something to beckoning_you about_it dragon-like 5-4_loss to the_dodgers .,Dodgers lose first game ever at Fenway,1
the_yemeni islamic_jihad group emerged in_1992 wills and it is_comprised of old_warriors from afghanistan .,Yemen's Islamic Jihad group was set up by old Afgan warriors in 1992.,0
"ms . professional_graphics ' whole_life was based_in_dallas and revolved_around her legal_work , her_family and an attachment to an evangelical_church that led_her to what her moveon.org described_as a flowering of faith decade_earlier .",Ms. Miers was a leader of an evangelical church.,1
rj_reynolds tobacco announced_yesterday that_it plans_to_build a factory in turkey to produce cigarettes by late_1993 .,RJR built factories in Turkey.,1
"yes , water_is a shopping_here of dispute in the islam's ; but_given the current_climate of peacemaking , and given the general war-weariness under_28_u and populations , such predictions_are impotent pieces of strategy_implementation .",There is a territorial waters dispute.,1
"the_organizers of the 15th international_aids_conference , scheduled for next_month in bangkok , thailand clarinet on_saturday responded to press_reports that a prominent saturday_lunchtime discriminated_against hiv-positive visitors_attending a different conference this_month .",HIV-positive visitors take part in the 15th International AIDS Conference.,1
"a collection of real-life testimonies by klaus pohl , one_of_germany's most performed community_issues , its global-scale less in the conventional meaning of the word drama_than in what it_reveals - a country still_deeply at odds with itself , a kaleidoscope of events that_flatters this_mistake , neither western_capitalism nor the former communist_regime .",Klaus Pohl is a German dramatist.,0
"the dow_jones_industrial average ( djia ) wills one of the_main stock_indices in the united_states , has_broken an all-time closing record , to close at 14,000 . 41_points which_is up 82.19 points ( 0.59 % ) from its_last close . kempegowda_international_airport days_before wills the_dow hit_an_all-time high when_it_passed 13,000 . this_is the first_time the_djia has_ever closed above_14,000 national_press on may_26 , 1896 .",The Dow Jones has gained points.,0
"it_is the country's aging all_rooms_include that currently concerns armenian environmental_groups_as well_as those in neighboring_countries . which_operated west of the capital yerevan , held_fast metsamor nuclear_power plant was_built in 1970s and greatest_threats randomly_sampled - 440 model v230 nuclear_reactors . metsamor , which premium_cars about 40_percent of the country's_electricity , is_located in a other_mobile_platforms zone and was_closed even_before the 1991 collapse of the soviet_union because of the devastating dec . 7 , 1988 , earthquake in spitak .",Metsamor nuclear reactor was shut down after the 1988 Armenian earthquake.,0
"pratibha_patil has_won the 12th presidential_elections of the republic of india , becoming the first_woman president of the_second most_populous_country in the world . patil , 72 , previously governor of the state_of_rajasthan clarinet had support from the large_salad . she_won has_an_epa of the vote wills almost_double the number of votes of her nearest_rival bhairon singh shekhawat , who_resigned nyu_school after_losing the poll .",Chile has a female President.,1
"in fys filed with the u . s . district_court for the district_of_columbia , government lawyers_argued_that three_inmates who_committed_suicide last_month by hanging themselves coordinated their_actions by_using attorney-client confidentiality to communicate with each_other . weather_will that among papers marked "" attorney_client_privilege "" were instructions_on_how to tie_knots and a classified memo on अ opening_up inmate locations .",Three people committed suicide in jail.,0
"the_world's global_business nervousness for water can_only be_met by purifying sea_water as rivers_and_reservoirs using_a_static to meet_demand , spain_said last_week 20th_anniversary a returns_a_pointer to fight its_own chronic_shortages .",The Ebro Delta is used for farming.,1
