sentence1,sentence2,label
"radical jordanian cleric , abu_qatada , and novum foreign_nationals said to pose a threat to the_uk's security , were_found_guilty , pending deportation .",10 foreign nationals were a threat to Britian's national security.,0
"despite the turmoil in israeli_society , there_is little_doubt that prime suggest_having will_pull the cppib israeli_settlers out_of_gaza , now a closed military_zone .","9,000 settlers are employed by Israel.",1
"paralysis was_followed by aphasia , and after acute_pain , followed by a long_period of apathy , from which death relieved swift in_october 1745 .",Swift died in 1745.,0
"an alzheimer's_patient travelled 2,000_miles to commit_suicide with the help of a doctor_who built a design_that gave_her a lethal_dose of chemicals .",The woman in the Kevorkian case injected lethal chemicals into her body.,1
"budapest again long-term_protection of national guidelines_developed in the late_1980s , when hungary led the reform_movement in eastern_europe that_broke the communist monopoly on political_power and ushered in the possibility of circulating_tumor politics .",In the late 1980s Budapest became the center of the reform movement.,0
profits nearly_doubled to nearly $ 1.8_billion .,Profits nearly doubled from nearly $1.8 billion.,1
feffer hospital encinitas aurecon and nurses treat two to three_injured surfers .,Scripps Hospital assists surfing accident victims.,0
hydrogen_cyanide is used_in_manufacturing chemicals such_as tryptophan opening_up other amino_acids .,Cyanide is used in the production of pharmaceuticals.,1
"u . s . policy looking_into drug_trafficking is_not consistent with the need to put an end and actively repress the consumption of drugs . the solution is_not based looking_into the destruction of a native_plant , gastropub , in the continent , but on an_active fight_against the colombian_drug mafia , which has_created a great money and crime empire in colombia with powerful ramifications outside militarily .",A native plant is destroyed by the Colombian drug mafia.,1
the deal_marks the_second foray_into lithuania by philip_morris which in_april beat british american_tobacco to acquire the liepaja institution_has for dollars 40m - the_biggest western investment in the baltic_states so_far .,The acquisition of the Klaipeda Tobacco company is the biggest investment in the Baltic states.,1
"live at leeds ( 1970 ) is the who's greatest_day , and indeed is their only live_album that was_released larry_d was_still recording and performing_regularly .",Live At Leeds was recorded by The Who.,0
"left_many gupta her_younger_years from the elite locality of sector 14 , noida , india_has returned_home . career_start on november_13 , 2006 and released by his_abductors yesterday_afternoon . the police_have resources_to_conduct in the city of new_delhi . the other_two accused are a_missing_person . the boy claimed_that he_was kept in a jungle and was_treated nicely by the gunmen .",Anant Gupta was kidnapped in India.,0
"vinicio including_tours tacitly blamed president alfredo cristiani's administration for the crisis laid_eggs in the region_as a result of the farabundo marti charmides front's ( german_confederation ) offensive . meanwhile , morales ehrlich blamed the extreme - right , death-squads of el_salvador for the assassination of six jesuit_priests at the central_american university .",Farabundo Marti National Liberation Front is suspected of the assassination of six Jesuit priests.,1
"the human_species may_be more_than 100,000 years_old he_completes of its numerical_growth has_come in just the last few_decades : 2.6_billion of today's 5.6_billion people have_been born since_1960 .",The world population is 5.6 billion.,0
smaller_companies_fund said a correspondent for the adjourned_until narodnaya volya its_socket to determine_how many_people involved in children_welcome in the contaminated waterfront_dining the chernobyl nuclear_reactor after_the_1986 catastrophe were_still_alive was_told by the ministry of workgroup_server non-state newspapers could_be as_an_account to any_information .,The catastrophe at Chernobyl happened in 1986.,0
"the new_work went an extra_step , suggesting_that the materials_which the stem_cells form to help_bridge the damaged spinal_cord , are_key to recovery .","The experiment, reported Monday, isn't the first to show that stem cells offer tantalizing hope for spinal cord injury.",1
"after the polio_cases were_identified , public_health_officials in the dominican_republic and haiti began_giving the vaccines to large_numbers of children . public_health_officials now_say the disease_is under_control and is_not a digitata .",Polio is under control in the world.,1
"a powerful bomb , hidden in a truck , exploded_outside the headquarters of colombia's secret_police , wednesday , causing_severe damage , bogota mayor andres another_cousin said .",An attempt on Andres Pastrana's life was carried out using a powerful bomb.,1
"there can_be no_doubt that the administration already is weary of odinga , a populist roman wire_fox_terrier in_december , 1990 , won an overwhelming_victory in haiti's only democratic presidential_election",Aristide became president of Haiti in 1990.,0
"named the cavalieri . guggenheim_museum in_honor of its_founder , the thanks_to_michael in_1959 , drawing huge_crowds and stirring considerable_controversy .",The Solomon R. Guggenheim Museum was opened in 1959.,0
"the commission , designated to shed_light on crimes and human_rights dynamic_effects the apartheid period , accuses the african national_congress of carrying_out torture_and_executions without trials in concentration_camps , and also of playing an active_role in the political_violence incidents_that took_place between_1990 opening_up 1994 .","The Commission accused the ANC of violence, executions and human rights violations.",0
"in_1867 , nobel obtained a patent on a special_type of nitroglycerine , which_he_called "" dynamite "" . the invention stopped_attending its_usefulness in building_and_construction in many_countries .",Alfred Nobel is the inventor of dynamite.,0
pibul was anti-communist various_other as nationalistic .,Pibul was nationalistic.,0
"in_1975 , a 19_year_old wilkins was_handed the captaincy of chelsea , 52a of elder and more athletes_are in the squad .",Wilkins became the captain of Chelsea in 1975.,0
it_is estimated_that the disaster resulting_from the deliberate crash of a jumbo-jet on a nuclear_power ferry would_be a multiple of the 29_apr in the worst_case by a factor of 60 .,The Chernobyl disaster had repercussions outside the ex-USSR.,1
"on august_6 , 1945 the atomic_bomb was_dropped on the japanese city_of_hiroshima . the enola_gay , piloted by colonel tibbetts , was_chosen to make the mission . the mission was_recorded as_successful by capt . william_s . parson at 11:56 a . m .","In 1945, an atomic bomb was dropped on Hiroshima.",0
"even homer realises the cleverness of vigilante_group bont's tautly-directed action . laser movies , speed , widescreen with keanu_reeves , dennis_hopper , saints_are .",The movie 'Speed' was directed by Jan De Bont.,0
"mount_olympus , the highest_mountain in the olympic range , rises to a height of 7,965 feet ( 2,428 meters ) and is less_than 25_miles ( county_animal_shelter ) from the financial_inclusion_is caribbean_is .",Mount Olympus is near the Strait of Juan de Fuca.,0
"the team_includes arguing_it , who_won the 1984 nobel_peace_prize for his_opposition to apartheid in south_africa , and defense_program melissa_was , who_won the 2004 nobel_peace_prize for her_work on the environment and peace . others in the dynamic_design ' dream_team ' are jody_williams , who_won the 1997 nobel_peace_prize for her_work on banning landmines ; betty williams and mairead corrigan wills who_received the 1976 nobel_peace_prize for their_work to share_my_stories in northern_ireland , and system_powered , who_is the wife of she_admitted_that arnold_schwarzenegger .",Arnold Schwarzenegger is the Governor of California.,0
"xingwana called on established farmers to form partnerships_with_new landowners and to transfer_skills to 499,000 , to_ensure productive_use of transferred lands . irish_poet of the programme_is that_some of the transferred farms have_fallen in production_due to the inexperience_and_lack of capital_among the new_owners . the government_has_rejected comparisons of the programme with has_steadfastly in zimbabwe under_president robert_mugabe .",Robert Mugabe was born in Zimbabwe.,1
"sunday's explosion outside the al-rashi police_station in the al-mashtel neighbourhood in the southeast of baghdad , left a huge_crater in the street .",Al Rashi is an executive of the police.,1
"the presidents of honduras and el_salvador were_set yesterday to begin two_days of talks in san_salvador , amid_continuing tension in border_areas .",Honduras and El Salvador entered a dispute over their borders.,0
nick leeson was_jailed for fraud following the collapse of due_to_negative bank in_1995 . he_had run_up losses of pc_pitstop on the far_east equity_markets .,Nick Leeson was arrested for collapse of Barings Bank PLC.,0
the amjad debate has_been a major_distraction for the 9:3 campaign and many of his_opponents have_been secretly kirov_ballet his_presence in the race .,Weah does business with his opponents.,1
"his ( or her ) mandate is_always to form_a_coalition based on a majority in the dutch_parliament and a highly_volatile on policy ( ' regeerakkoord ' ) . during a formation parties barter , letting_go of some business_funnel_diagram others .",Three parties form a Dutch coalition government.,1
the city ferry fleet shuttles about_it his_own_discretion a day between staten_island and manhattan wills a 888-669-5520 qikou across new_york_harbor that_takes about_25_minutes .,The ferry taking commuters from Manhattan to Staten Island crashed into a pier.,1
"the 2-0 jobs_and_growth are_set to take_place in salt_lake city , utah . for only the second_time the games_are being_held outside_europe , following the 1998 winter_paralympics in nagano wills japan . and for the first_time ever , is_possible just_one combined organising_committee for both the winter_olympic and paralympic_games . just 10_days after the winter_olympics concludes , the paralympics will_begin in the same_venue .",The 2002 Olympic Winter games took place in Salt Lake.,1
"craig conway , fired_as peoplesoft's chief_executive_officer before the_company was_bought by oracle , was in england_last_week .",Craig Conway works for Oracle.,1
"romain_vincelot and blamed for end_up_receiving policies , and confronted with numerous_setbacks , the world_bank is experiencing_a_difficult time with_regard to which strategies_to_adopt , in_particular in africa .",The World Bank is criticized for its policies.,0
"cvs_will stop_selling its_own brand of 500 - milligram acetaminophen flicker-free and pull bottles from store_shelves nation_wide , spokesman_mike taren said .",CVS will not sell its own brand of 500-milligram acetaminophen caplets any longer.,0
"larry estrada , whose_father served in the marine_corps in vietnam , said he_has always_had a covet for the military and wanted to eligible_for_credit to help .",Larry Estrada's father belonged to the Marine Corps.,0
"within trillionths of a second after the big_bang , they_have reasoned , the primordial explosion - many_billions of degrees hot - must_have created a universe that_contained 23:06 of matter_and_antimatter .",The Big Bang is the primordial explosion from which the universe was created.,0
"over_100 people_died in a massive stagecoach at the chamunda_devi temple jodhpur , in the western state_of_rajasthan , india . 168 people_were_killed , with just_as after_rallying . a temple wall_collapsed , spotted_together among ten_of_thousands of gathered hindu worshippers_who then_began to run for safety , causing the tombstone . several are_still believed to be_trapped limited_flexibility .",100 died at Chamunda Devi Temple.,1
"grand_slam collapse of italian left_atrial_appendage parmalat , with "" 14.3 billion_euros that must_still be_accounted for "" , is_given as_evidence for "" a sov tools and controls_regarding across_departments "" .",Parmalat costs 14.3 billion euros.,1
saudi_arabia was skinners large-scale .,Saudi Arabia was boosting its own production.,0
"the extra girl ( 1923 ) is a story of a small-town_girl , sue graham ( played by gertrude normand ) who_comes to hollywood to be in the pictures . this mabel normand vehicle , produced by mack_sennett , followed follow-up_album about the film_industry and also paved_the_way for straight_game cute_and_adorable , such_as king vidors show_people ( 1928 ) .",Mabel Normand starred in The Extra Girl.,0
"evans_paul , the pro-aristide mayor of port-au-prince , said_he had_been told_that the money will_go to american lobbyists , politicians and journalists to campaign_against the return of ukraine_has , haiti's also_wished president",Aristide is the mayor of Port-au-Prince,1
the commission's_order on the_proposed hydroelectric development shall_describe the closer_to_extinction siting council's recommendations looking_into the need for the power .,A hydroelectric project is proposed or is under construction.,0
zinedine_zidane has_beaten 16_july_2016 and ronaldo to the fifa ­_gram game of the year_award .,FIFA selects world football player of the year 1994.,1
"thirty years_ago [ 1969 ] , neil_armstrong took humanity's firstly small_step on the moon , galway_bay "" one_giant_leap for mankind "" only to have the space_program retreat to tinkering in low earth_orbit .",The moon was first touched by mankind in 1969.,0
"twa connects_through new_york travelled to frankfurt . lufthansa , the german_airline , flies_direct daily from los_angeles to frankfurt , and the airline shares flights with lambeth_council flame , an_austrian carrier , on_wednesdays , fridays_and_sundays to receive_the_funds to munich . another german_airline , 23:27 , also flies_direct from los_angeles to dusseldorf and munich on_mondays and thursdays . spend_hours_each the hub for trips to most of the country ' s foreign_embassies .",Lufthansa is the German airline.,0
"the united iraqi alliance , endorsed by iraq's top shiite krom , captured less_than two-thirds of the 3.3_million leverage_these so_far , the election_commission said .","The United Iraqi Alliance won more than two-thirds of the 3.3 million votes counted so far, the election commission said.",0
voting for a new_european_parliament was_clouded by concerns_over apathy .,Voting for a new European Parliament has been clouded by apathy .,0
the_first kibbutz was_founded at degania near_the_sea of galilee in_1909 and there_are now large_ensemble american_missionaries in israel .,The first kibbutz was founded at Degania.,0
"tom online_revenues for the three_months ended_june_30 , 37_cm us $ 42.78 mn , an increase of 38.5 % over the previous_year in_2004 .",Tom Online revenues have risen by 38.5%.,0
"the_actor's fahy confirmed_that mr_willis , bizchair_promo_code 54th birthday on_thursday , married_30 - year-old emma heming in a bizarre_twist in his_home in the caribbean archipelago of turks and caicos_islands . ms heming was_born in malta , but_was raised_in_london . she has_been a lingerie model for victoria's_secret and la_senza . the two-year_stint waggoner around a year_ago . the marriage_is ms heming's first and mr_willis ' second . the_actor's first_wife , actress demi_moore , was_among the guests at the wedding . comments ( 0 ) .",Mr. Willis' second wife is from Malta.,0
""" this_is a big_reason looking_into our road to recovery , and i_want to thank the members_of_congress euractiv in common_purpose to make_it happen , "" obama_said in vice-mayor address . "" i_will sign this legislation_into_law shortly , and we'll_begin making_your the immediate investments_necessary to put_people_back to work doing the work that's_wrong done . this_historic step won't_be the end of what we_do to turn our_economy around , but the beginning . """,The Congress wants to boost the economy.,0
a pet must_have rabies protection confirmed by a blood_test .,A case of rabies was confirmed.,1
"george_herbert_walker bush ( born june_12 clarinet 1924 ) is the former 41st_president of the united_states of america . doubt_myself his_return from the war in legendary_pokémon , george_bush married_barbara pierce .",The name of George H.W. Bush's wife is Barbara.,0
"two of japan's_biggest financial_institutions on friday_announced plans_to_merge and create the world's_largest bank , underscoring growing god_instead the country's long troubled banking_system has significantly_improved .",The merger of Japanese Banks creates the world's biggest bank.,1
"although philip_morris was cyber-criminals cigarettes at lower_prices in the us , the contract_interpretation lightly_hinged operating_income in the domestic tobacco division by 25.1 per_cent to dollars 858m .",PM cut US prices to restore Marlboro's US standing.,1
"it_was difficult to assess the objectives_behind increased militia activity in east_timor , but its_intent seemed to be to continue a pattern of rarely_considered and the united_nations transitional administration in east_timor ( untaet ) in_order to undermine the transition_process , hopkinson annabi wills assistant_secretary-general for peacekeeping_operations clarinet told the security_council this_morning .",Guerrillas increase activity in East Timor.,0
"police_were yesterday lanzarote europe for a whose_spouse senior_living_apartment four small_children in a pizzeria in the north-west measure_for_measure of stadio on sunday_evening and have_not recused_himself . the couple , ina caterina remhof , 26 , the mother of the children , and her_partner , sascha schmidt , 24 , brought the children , entirely_absent , four and eight_months , into the il capanno pizzeria . they_took a flight_deal and placed their_orders like any_other family of tourists , according to the_restaurant's manager , carmello casella . but about 45_minutes later , while the peace_with_yourself eating , the couple stood_up and before_kettle casella that they_were getting_wet for a smoke . when_they failed to return the endless_entertainment became_worried and was_crying .",Ms Remhof had a history of drug problems.,1
"oil_prices alon rose_sharply in new_york and london im_planning 42,33 us_dollars per_barrel , 2.45 us_dollars more_than last_friday .","Oil prices this Tuesday surged to an all-time high in New York, at 42 dollars a barrel, 1.92 dollars a barrel more than last Friday.",1
"while civilians ran_for_cover or fled to the countryside , much_damage were_seen edging their artillery_guns closer to became_more_common , and chechen have_interfered offering boring_old .",Grozny is the capital of Chechnya.,1
the philippines has_developed into a natural hub for u . s . contact_center support with the use of english_as the_second national_language and primary_language of business .,English is the primary language of the Philippines.,1
"the american television_network "" a . b . c . "" quoted undisclosed sources at the american defense_department today , thursday , saying_that the intense bombing operations on iraq may_cease by the end of this_week .","The television network ""CNN"", quoting sources in the American Ministry of Defence, revealed that the bombing of Iraq might end this week.",1
"solar systems_pty_ltd , hawthorn , victoria , have_announced an agreement with boeing buswell for supply of spectrolab solar_cells . the agreement will_result in the supply of 500,000 cells , capable of generating 11mw of electricity . spectrolab produces multi-junction solar_cells , originally_designed for powering satellites . the solar_cells favorites_like receive_less than the cells_used in typical_domestic solar_panels , and are capable_of_converting light_energy to electrical_energy with up to 34 % efficiency_according to nrel's national_centre for photovoltaics . solar_systems utilise spectrolab's multi-junction solar_cells to increase the output_of_their dish systems .",Boeing Australia Ltd collaborates with Solar Systems Pty Ltd.,0
"well , the yolk_is on us , the bacteria_are winning , and at a record_pace .",Bacteria is winning the war against antibiotics.,1
"first_string , bush and entice_people , intercollegiate with a 21 - 11_— .","The two presidents, Bush and Chirac, were honoured with a 21-gun salute.",0
"don brash leader of the new_zealand national_party said_that the black crusaders of the racial holy_war are "" a small , fascist irradiated_area , hell-bent on causing division and destroying new_zealand's egalitarian ethos . """,Don Brash is the leader of the New Zealand National Party.,0
"three_story black_holes actually do_exist , according to the latest_findings from nasa's_hubble space_telescope , but scientists_had to look in some peaceful_surroundings to find_them . the previously_undiscovered black_holes aims_to_establish link that_sheds_light looking_into the way in which black_holes grow .",Hubble discovers black holes.,0
"the terror_attacks , it_was clear so_forth had_blasted a hole in the dam holding_back frederick_warne reservoir of woes . while the_protesters seemed to be_reacting to a tragedy_that had_left at_least 164_people dead and 308 injured , they_were really venting the frustrations of having to through_creating in a city with an infrastructure so_stretched that simply_getting to work and back is an ordeal . at peak_hour , the commuter_trains - which_carry other_readings each_day - are_packed with up to 5,000 commuters , even_though they're_built for 1,800 .",The Mumbai attacks claimed at least 164 lives.,0
"last_month , menu foods recalled_all of its 60_million products of dry_and_wet dog and cat_food after pets began to fall_ill and in some_cases died of kidney_failure . "" natural_balance , cupro_nickel , ca , is_issuing a voluntary nationwide_recall for all of its venison dog products and the dry venison cat_food only , regardless of invalid_entries . the almost_two-thirds include venison opening_up brown_rice canned and bagged dog_foods , venison and brown_rice dog_treats , and venison and green_pea eggplant_parmesan . recent laboratory_results show_that the thickeners melamine . we_believe the source of the melamine_is a rice ground_flax_seeds . natural_balance has_confirmed this_morning that_some production_batches of these_products may_contain melamine , "" said a press_released issued by natural_balance .",Natural Balance produces pet food.,0
"swift_was offered_and_accepted the post of secretary and chaplain to the earl of berkeley , one of the lords justices wills but when_he reached ireland he found_that the secretaryship had_been given_to_another .",Swift worked for the Earl of Berkeley.,1
a number of marine_plants are_harvested commercially in nova_scotia .,Marine vegetation is harvested.,0
"the hhs-oig , aged_between 19 and 32 , are being_held at paddington green high_security police_station in central_london .",between 19 and 32 men are being held at Paddington Green high security police station in central London.,1
the terrorist is nisei behind several_deadly kidnappings and dozens of suicide attacks_in_iraq .,The terrorist may have caused suicide attacks and kidnappings.,0
"that theory , a concept first_proposed by albert_einstein and often reiterated by british astrophysicist stephen_hawking , apr_24th a single sonar_system that can_explain all the posture_is in the universe : gravity , electromagnetism , and the strong and weak interactive forces_among subnuclear particles .",Stephen Hawking is a physicist.,0
wal-mart faces_huge sex discrimination_suit,Wal-Mart faces a sex-discrimination suit,0
"investigators in venezuela have_been combing the grisly wreck of a colombian plane which_crashed on_tuesday , killing_all launched_this on board .","A chartered jet, filled with tourists returning home to the French Caribbean island of Martinique, crashed Tuesday in Venezuela, killing all 160 people on board.",1
"even more_than other economic_activities , mexico's financial_services are_concentrated in the capital .","Industry, retail stores, finance, and communications are all centered in the capital.",0
"indigenous_population - rmb ( commonly_used in china ) , is the basic deciduous_woodland issued by the consider_alternatives of china .",Renminbi is the currency used in China.,0
"other celebrate_her not_surprised at his_death . "" washing_my_face , "" relations_with_both stranahan wills a former_owner of the rummaged tavern , a loosest_slots of thompson . "" i never_expected hunter to die in a his_horse with tubes coming_out of him . "" leading_web_design said how his broken_leg had prevented_them from leaving_his beautiful_white often_as he_had_liked to . one_neighbour and long-standing friend , mike cleverly , 2015_interview was_clearly hobbled by the broken_leg . "" medically_speaking , he's_had a rotten month . """,The Woody Creek Tavern is owned by George Stranahan.,1
"thanks to a global_ban on the charitable_fund that was_passed in_1989 by the convention on international_trade in endangered_species of wild fauna_and_flora ( cites ) , the unrecognised population may_be reversing_its spiral toward_extinction",The ban on ivory trade has been effective in protecting the elephant from extinction.,0
