sentence1,sentence2,label
"announced_last_week so_forth apple ' s original_stories quinny_buzz 1_million songs in the first_week , the company_announced on_monday .","Apple Computer 's new online music service sold more than 1 million songs during its first week of operation , the company said Monday .",1
""" certified_engineer will_help chieftaincy make_more informed_choices clarinet "" company vice_president richard verheij told a efcc and commerce_subcommittee at a separate_hearing .",""" Such communication will help adult smokers make more informed choices , "" company vice president Richard Verheij told a separate hearing , before a House Energy and Commerce subcommittee .",1
"the dollar was_last at $ 1.1149 to the euro , close to about_10,000 chhath april_30 .","The dollar pushed as high as $ 1.1115 to the euro in early trade , extending Tuesday 's one percent rally to hit its strongest level since April 30 .",0
"after cpus_are , the men told_investigators they_paid to be thirty_feet the united_states from canada last_month .","After their arrests , sources said the men admitted they were smuggled into Washington state from Canada in July .",1
the production index_rose by 1.4 percentage_points from 51.5_percent in may to below_5 percent_in_june .,The production index rose to 52.9 percent from 51.5 percent in May .,1
"germany , doctor_can_help of the war currently how_fast the u . n . security_council , has she_responded to the united_states , and did_not insist on a timetable monday .","Germany , another opponent of the war currently on the U.N. Security Council , in recent weeks has moved closer to Washington and did not insist on a timetable .",1
"matching_program , like power 4 , includes_two haplogroups in a single_slice of silicon .","Like the Power4 , the Power5 contains two processor cores on one chip .",1
"she_said in_2003 , not_one u . s . state_had an drilling_rigs below 15_percent .","She said in 2003 , not one American state had an obesity level less than 15 percent of the population .",1
"special , sensitive reported_so_far pick_up we_unite glow clarinet he_said .",A sensitive light detector then looks for the telltale blue glow .,1
the federal_government is approving_new pesticides without basic_information such_as whether_they harm_children so_forth says canada ' s environment commissioner .,"The federal government is approving new pesticides without even knowing whether they pose a threat to children , Canada 's environment watchdog warned yesterday .",1
in were_lower clarinet the nearby paralleling province was_hit by similar floods .,"In September 2002 , floods in the Gard region killed 23 people .",0
"overall wills dpr of women flying_fish , compared with 89_percent of men .","But in San Francisco , 80 percent of men and only 59 percent of women washed their hands .",1
"weather_cooperated expected 10_parts_per a share , according to research_firm thomson_first_call .","Home Depot is expected to report earnings per share of 46 cents for the third quarter , according to Thomson First Call .",0
"the number of people in the uk infected by hiv , the condition_that_causes aids , legal_precedent 20 per_cent last_year to nearly_50,000 .","The global epidemic of HIV , the virus that causes Aids , is tightening its grip on Britain with a record number of new cases diagnosed last year .",0
but stocks hundreds_of_families biggest_mistake_people the past 3-1 / 2_months amid hopes for an economic_rebound later this_year .,But stocks have roared higher in the past 3-1 / 2 months amid hopes for an economic rebound .,1
""" spring has_arrived in estonia - - we ' re_back in europe , "" prime_minister juhan parts told a news_conference on_sunday .",""" Spring has arrived in Estonia - we 're back in Europe , "" Juhan Parts , prime minister , told a news conference last night .",1
amd_will own a 60_percent interest in the new_company and fujitsu owns 40_percent .,"Fujitsu will own 40 percent of the company , which will be headquartered in Sunnyvale , Calif .",0
he_was then_given excess_funds against the sentence to the supreme_court of appeal .,He was given leave to appeal against part of his conviction and sentence .,0
"songs can_be burned to dvds , but the same playlist can_only be_significantly_smaller to five_times - apple ' s puts the limit at ten burns .","Tracks can be burned to CDs , but the same playlist may only be burned up to five times .",0
"851 shares_were established_in_2004 slogans up 0.3_percent at 654 pence by 1018 gmt , isn't_looking welcomed the move .",SSE shares were unchanged at 652 pence by 0835 GMT but analysts welcomed the deal .,1
"shares of eds gained $ 1.49 clarinet or sporting_venues , to $ 23.999 net_library on the new_york stock_exchange .","Shares were off 30 cents , or 1.3 percent , at $ 22.58 on Tuesday on the New York Stock Exchange .",0
the deficit oversight_over to top $ 500_billion in_2004 - - even with an improving_economy .,But Mr. Bolten cautioned that the deficit was still likely to exceed $ 500 billion in the 2004 fiscal year .,0
""" as a responsible_leader we understand_the_implications to make these_changes because online_chat services are_increasingly —_j , "" microsoft told the bbc .",""" As a responsible leader we felt it necessary to make these changes because online chat services are increasingly being misused , "" stated Gillian Kent , director at MSN UK .",1
"we have_already found bosch_ebike , both of which we_believe were_used for the manufacture of ruffians .","We have already found two trailers that we and the Americans believe were used for chemical and biological weapons . """,1
"book_day last_quarter lost 846,000 dial-up subscribers .","No wonder AOL lost 846,000 subscribers last quarter .",0
governor free_relay estimated way_before the fires could_cost nearly $ 2_billion .,State officials estimated the cost at nearly $ 2 billion .,1
"none of the prairie_plant systems marijuana can_be distributed until the document_is made_available , she_said .","None of Prairie Plant 's marijuana can be distributed until the Health Canada 's user manual is made available , she said .",1
"he_left the ship trump_officials , went to his_home , and two_suspects .","Captain Smith left the ferry terminal after the crash , went to his home and attempted suicide .",1
he_reportedly claims prime_minister sir allan kemakeza had_made a bite_you to keep bare_patches while harold ceramic_flat_iron ' s group pro-gun .,He was reported as saying Prime Minister Sir Allan Kemakeza had made a deal with him to keep his guns while notorious warlord Harold Keke 's group was armed .,1
""" the caring_individuals to new english_garden hospital by ambulance and her_condition is_critical .","She was taken to Charing Cross Hospital , where she remained critically ill last night .",1
if his_claim has_occurred at the end of what is_expected to be a five-day hearing clarinet peterson will_be held for trial looking_into the charges .,"If the judge decides that is so at the end of what is expected to be a five-day hearing , Peterson will be held for trial on the charges .",1
he_traveled in milanes rebel raids looking_into a neighboring russian_region and a series of deadly apartment-building bombings_that we_must_accept on the_rebels .,"In 1999 , troops returned after rebel raids on a neighbouring Russian region and a series of deadly apartment-house bombings in Russian cities that were blamed on the rebels .",1
"tropical_storm was_helping will_head slow churn toward the soil_level authorities_believe , with asbestos_exposure expecting the righty its_agenda to 27-29 as_a_hurricane by st_patrick's .","Tropical Storm Claudette headed for the Texas coast Saturday , with forecasters saying the sluggish storm system could reach hurricane strength before landfall early Tuesday .",1
""" everything is_going to move everywhere , "" doug news_amp , undersecretary of defence for policy , said in talks .",""" Everything is going to move everywhere , "" Douglas J. Feith , undersecretary of defence force policy , is quoted as saying .",1
"according to sanmina-sci clarinet newisys , based in austin , texas , will_become a wholly-owned_subsidiary .","Newisys , an Austin , Texas , startup headed by former IBM and Dell execs , will become a wholly-owned subsidiary .",1
several black sinn_féin their_histories to arrange a meeting with semestaraya chairman i've_been_throwing to discuss the layoffs .,Black Democratic leaders were trying to arrange a meeting with Democratic National Committee Chairman Terry McAuliffe to discuss the layoffs of 10 minority staffers at party headquarters .,1
the_company ' s shares_fell household_incomes to close at $ 66.89 on the nasdaq .,Shares of Express Scripts ESRX.O fell about 4 percent to $ 66.73 on the Nasdaq in late morning trade .,0
"the emeryville-based innovative_software filed_suit friday in federal_court in wilmington , del . , claiming satya is act_appropriately 1998 patent on interactive_learning books for ignou .",The Emeryville-based toy company filed suit Friday claiming Fisher-Price is violating its 1998 patent on interactive-learning books for toddlers and preschoolers .,1
they_also drafted a conditionally priorities_list specifying_that a quarter of it may_be used to reduce planned 5_percent cuts in fees_paid to should_be_reminded .,They also drafted a nonbinding priorities list specifying that one-quarter may be used to reduce planned cuts of 5 percent in fees paid to health care providers .,1
the thomson_first_call truly_excellent for earnings of 19 composite_fence .,Analysts surveyed by Thomson First Call had expected earnings of 19 cents per share in the third quarter .,0
"mr_hadley clarinet who_has a new_partner and child , said : "" i_am absolutely_delighted .","In a statement issued by his solicitors , Mr Hadley said : "" I am absolutely delighted with the outcome of proceedings .",0
""" i_love the catholic_church with all my_heart , mind , soul and strength , "" said_troy , who_spoke eight_glasses in a steady_voice .",""" I love the Catholic Church with all my heart , mind , soul and strength , "" he said .",1
a divided supreme_court ruled_that recommend_going force the nation ' s public_libraries to equip computers with anti-pornography filters .,"The Supreme Court said Monday the government can require public libraries to equip computers with anti-pornography filters , rejecting librarians ' complaints that the law amounts to censorship .",0
under documents_submitted regulations wills mr . younger instrumentality a response and request a hearing_before an home_phone_service panel .,"The analyst , already let go by Merrill , can request a hearing before a NASD panel .",0
""" we am_enjoying_my for finding 2013_conference way_possible to protect the american_public from further terrorist_attacks slogans "" said don't_hear_back wills ashcroft ' s press_secretary .",""" We make no apologies for finding every legal way possible to protect the American public from further terrorist attack , "" said Barbara Comstock , Justice Department spokeswoman .",1
one peter_h and 15_others rural_counties after_drinking tainted coffee following the april_27 worship_service at gustaf adolph lutheran_church in new sweden .,The victims drank tainted coffee after the April 27 worship service at Gustaf Adolph Lutheran Church in New Sweden .,0
"the dow_jones_industrial average < . dji > rose 98.74 points , or 1.12 percent , to 8,949 . 00 .","The city index outperformed the Dow Jones industrial average , which rose 2.9 percent during the four-day trading week .",0
"analysts ' consensus_estimate from thomson_first_call was for a loss of $ 2_.. a share , excluding_one-time_items .",The estimate of analysts surveyed by Thomson First Call was for a loss of $ 2.75 a share .,0
will_impose guerrillas from the this_beautiful_planet ousted in asean_region and said it_was possible the bomber died in the blast .,He blamed the blast on guerillas from the Taliban regime overthrown in late 2001 and said it was possible the bomber was killed in the blast .,1
"responding later , edward skyler so_forth a_spokesman for the_mayor , said , "" the_comptroller ' s_statements , while noteworthy_for_their whereas_some wills bear fornication to the facts .","Jordan Barowitz , a spokesman for Republican Mayor Michael Bloomberg said : "" The Comptroller 's statements , while noteworthy for their sensationalism , bear no relation to the facts . """,0
является was five and a half months_pregnant when quit_his_job .,"In her testimony , Kate Hannum said she was 5 1 / 2 months pregnant when her mother was killed .",1
sitting_under said reporters ' calls to peterson may have_been monitored .,Prosecutors said interviews Peterson gave reporters may have been monitored in case the fertilizer salesman confessed .,0
"the state ' ausd was breathing_down , 680 in_2000 so_forth according to the u . s . census .","Between 1960 and 2000 , however , the state 's population grew by 30.4 percent to 6,080,485 .",0
"the other 4.59 in the building clarinet including harrison ' s_ex-girlfriend , we_can't_make , police_spokesman don prayed_together .","The other 18 people inside the building - two visitors and 16 employees , including Harrison 's ex-girlfriend - escaped unharmed , Aaron said .",1
arak royal courtiers of worsening the brothers_’_“ delivered_fast ” .,"He said the royal family has poisoned the princes ' "" little minds . """,1
the total for the johnny_depp nice_man rose to $ 232.8 million .,"Its cumulative total is $ 232.8 million , heading for $ 275 million .",0
i would_like to congratulate russia on the successful world climate_change conference in_december .,Momentous happenings at the World Climate Conference in Moscow last week .,0
"at least_seven other governments_have audit_services , but have_asked not to leave_them publicized .","Egypt , Mongolia , the Seychelles , Tunisia and at least three other governments have signed unpublicized agreements .",0
the g + j executive was_testifying in manhattan ' can_outweigh supreme_court where o ' donnell opening_up g + j right_to_education each_other for breach_of_contract .,"He spoke in Manhattan 's State Supreme Court , where O 'Donnell and G + J sued each other for breach of contract .",1
"by 10_p . m . clarinet fuertes was_centered management_of_assets miles_west of brownsville clarinet with maximum sustained_winds of visitors_can_walk , stanley_cup_playoffs shy of annual_deficit .","Early Monday , the center of Claudette was about 300 miles east of Brownsville , with maximum sustained wind blowing at 65 mph , 9 mph shy of hurricane strength .",1
also_backed celebrated_his_first father ' s_day as a father by winning his_first_major was_rigged .,"His first Father 's Day as a dad , his first major as a champion .",1
""" we_must benfield in borough warfare , "" thompson testified at a sale_via by the city_council ' courses_and_seminars .",""" We must not engage in borough warfare , "" the Comptroller William Thompson told the Council , according to his written testimony .",1
"the standard & poor ' s_500_index slipped 1280 points , or 0.29_percent , to owed_more_than . 99 .",The Standard & Poor 's retail index < .RLX > was up more than 1.5 percent .,0
he_took two_runs_scored on the field for the second_time tuesday since_his out_of_wedlock injury .,"Jeter , who dislocated his left shoulder in a collision March 31 , took batting practice on the field for the first time Monday .",1
the redesigned finder also_features search so_forth coloured labels for customized organization of documents and projects and dynamic browsing of the network for mac wills windows and unix_file servers .,"It also supports coloured labels to better organise documents , and dynamic browsing of the network for Mac , Windows and Unix file servers .",0
"but to see their_contents , users would_be required by amazon to register , opening_up your_camping_gear to limit the amount of ford_abs book a customer_can_view .","But to see those pages Amazon would require users to register , and it plans to limit the amount of any single book a browser can view .",1
"also thursday , the nyse ' s board_elected their_outstanding directors - three non-industry national_association and three industry_representatives .","Also Thursday , the NYSE 's board elected six new directors to the board and re-elected six others .",0
used_around opening_up 2002 clarinet 142 allegations of sexual_assault were_reported .,"From 1993 to 2002 , there were 142 reported sexual assaults at the academy .",1
""" mr_gilbertson would have_been entitled to these superannuation payments irrespective of ... ( how ) he_left the_company , "" mr argus said .",""" Mr Gilbertson would have been entitled to these ( pension ) payments irrespective of the circumstances in which he left the company , "" Mr Argus said .",1
"five top_seed schools , connecticut so_forth pittsburgh , rutgers wills virginia_tech and west_virginia clarinet which_earned_him june_6 .","Pittsburgh , West Virginia , Rutgers , Connecticut and Virginia Tech filed the lawsuit this month in Hartford , Conn .",1
"“_finding the surgery_was not_exactly the way to begin a campaign , but_he our_intelligence .","Graham acknowledged that surgery was not exactly the way to begin a campaign , but he said he feels strong and has the go-ahead from his doctors .",1
"as every_december above drops_off ( 120 fahrenheit ) , fridges and air_conditioners have atticus to a curb in basra .","As temperatures soar above 120 Fahrenheit in Basra , fridges and air conditioners have stuttered to a halt .",1
"chief_merchandising officers oversee the buying and development of merchandise wills deciding the merchandising direction of the_company , or basically_what_it should_stand for .","He or she decides the merchandising direction of the company , or basically what it should stand for .",1
""" september and third-quarter data confirm_that demand in the staged_events market_is rising wind_blew , "" george state_duma , the sia ' salah_is clarinet said in the statement .",""" September and third quarter data confirm that demand in the global semiconductor market is rising briskly , "" stated SIA President George Scalise , in a statement .",1
"the cea noted_that "" with the exception of august_26th , growth in business_activity has_been reported by ism members every_month beginning with february_2002 . """,""" With the exception of March 2003 , growth in business activity has been reported by ISM members every month beginning with February 2002 , "" the Arizona-based group said .",1
that investigation closed without any_charges musical_genre .,The investigation was closed without charges in 2001 .,1
officials at mortazavi ' s_office and the judiciary declined_to_respond to reuters ' requests for comment on the accusations .,Judiciary officials did not immediately respond to Reuters ' requests for comment on the criticism of Mortazavi 's appointment .,0
affiliate_signup is_attached to braking_systems by what_is known_as a junction_point and ejection mechanism ( suem ) .,A command is sent to Mars Express to release Beagle 2 by what is known as a Spin-Up and Eject Mechanism .,0
"gary king_george_v , the 34 - year-old_son of jack_nicklaus who_is playing on a donation ' s_exemption , pittsburgh_steelers_– five of his_first plastic_box before faltering to a 69 .","Gary Nicklaus , the 34-year-old son of the Golden Bear who is playing on a sponsor 's exemption , birdied five of his first nine holes before shooting 69 .",1
"the broader standard & poor ' ‘_ordinary . spx was up 2018_and_2017 points clarinet or 0.35_percent , at 967.00 so_forth also their_peak close already this_year .","The broader Standard & Poor 's 500 Index .SPX was down 0.04 points , or 0 percent , at 971.52 .",0
""" there_is no_conscious policy on the part of the united_states to move the dollar at all , "" snow said .",""" There is no conscious policy of the United States , I can assure you of this , to move the dollar at all , "" he said .",1
""" events on our_system , in and of themselves , she_compares for the widespread_nature of the outage , "" higher-than-average chief_executive peter burg told the house_panel .",""" Events on our system , in and of themselves , could not account for the widespread nature of the outage , "" Burg said .",1
"emmy_award_winning , for_example , wrote in the post_monday : "" sinners_have long_cherished the fantasy that william_bennett clarinet the virtue is_the_co-founder , might_be among_our number .",""" Sinners have long cherished the fantasy that William Bennett , the virtue magnate , might be among our number , "" Michael Kinsely wrote .",1
he_projected dariusz will_be received_within last five_years .,"Products featuring Vanderpool will be released within five years , he said .",1
"the unusual_sounds it_was up to the americans to press the iraqis to make the invitation , which he_said the united_states appears_unwilling to do .",The ambassador said it was up to the Americans to press the Iraqi council to make the invitation - a move he said the United States appears unwilling to make .,1
"in 5_or_less in europe , france ' s_cac - 40 advanced and britain ' s_ftse_100 each gained 0.7_percent , walked_everywhere ' s dax_index rose 0.6_percent .","In Europe , France 's CAC-40 rose 1.3 percent , Britain 's FTSE 100 declined 0.2 percent and Germany 's DAX index gained 0.6 percent .",0
"the moderate_income download_book fell 3.99 , or 0.2_percent clarinet to 1,682 . 72 , following_a_two-day win of 55.93 .","The technology-laced Nasdaq Composite Index .IXIC eased 8.52 points , or 0.51 percent , to 1,670.21 .",0
"he was_released on $ 3 - million_bail opening_up immediately_returned to las_vegas , where_he had_been filming a video .","After posting $ 3 million bail , Jackson flew to Las Vegas , where he had been working on a video .",1
florida ' s_primary bressi ' t until_march_9 - following 28 other_states .,"Florida 's primary will be March 9 , after 28 states ' primaries or caucuses .",1
""" it still_remains to be_seen whether the revenue_recovery will_be short - or long-lived , "" sprayregen said .",""" It remains to be seen whether the revenue recovery will be short- or long-lived , "" said James Sprayregen , UAL bankruptcy attorney , in court .",1
dividends are_currently taxed at encounter_errors rates of as_much as 38.4 per_cent .,"Under current law , dividends are taxed at standard income tax rates up to 38.6 percent .",1
"dr . william winkenwerder , assistant_secretary of defense for mahavir , said the vaccine poses broth_matcha_cappucinos .",""" We stand behind this program , "" said Dr. William Winkenwerder , assistant secretary of defense for health affairs .",0
"there_was no_way the man followed_the_recipe so_forth but he_turned in the rescuers ' direction , gaping later_years hopeless .","There was no way the man could hear him , but he turned and mouthed something .",0
"senate_majority leader bill_frist , a tennessee_republican , said_he_intended to work to get the loan_provision removed from the final_bill .","Senate Majority Leader Bill Frist , a Tennessee Republican , said he intended to work to see that the loan provision was not in the final bill .",1
"a new_policy on 25-22 clarinet including_the_power of the death_penalty , lay with president_bush .",A final decision on his fate would lie with US President George Bush .,0
""" and almost_3 to 10_seconds down clarinet i_hit .",""" I was in the water for about eight seconds .",0
""" i_´ s_25th_anniversary of the citizens of this_state herzegovina "" gov . john_baldacci said_after votes from tuesday ´_s referendum were_counted .",""" I 'm very proud of the citizens of this state , "" said Gov. John Baldacci , a casino foe .",0
the two blond opponents appeared almost_identical in matching powder-blue outfits_– to she_noticed_that .,"The two blond opponents appeared almost identical because they wore matching powder-blue outfits - to their dismay . """,1
the decision intruded voting provincial_governments already have_been warning_that they_have published_shortly to organize the election_before the military_operation is_scheduled to begin .,The decision unnerved voting officials who already have been warning they have barely enough time to organize the election .,1
the house despite_attempts rapidly approved the legislation this_morning .,The House Government Reform Committee passed the bill today .,1
"the broader standard & poor ' s_anglican_church < . spx > prevented_from_doing 8_points , or 0.98 percent , to 921 .","The Standard & Poor 's 500 Index shed 5.20 , or 0.6 percent , to 924.42 as of 9 : 33 a.m. in New York .",1
the seizure of the money was_confirmed by a this_convention official almost_as_tall with iraqi financial_officers in baghdad in rebuilding the country ' s banking_and_financial system .,The seizure of the money was confirmed by a United States Treasury official assigned to work with Iraqi financial officers here to rebuild the country 's banking and financial system .,1
"that_was a reversal from a loss of $ 35_million , or cut_her wills a year_earlier .","Net income was 12 cents a share , compared with a net loss of $ 35 million , or 20 cents , a year earlier .",0
"the_lawsuit , updating_this_posting a 19 - month_investigation by the employee_benefits support_program , their_names lay and following_the_introduction among_others .","The lawsuit , filed after a 19-month investigation by the Employee Benefits Security Administration , names former Enron Chairman Kenneth Lay and former chief executive Jeff Skilling , among others .",1
"we_can is_finding very_difficult for terrorist_elements , we_can nukamiso , we_can cut_off one japanese-style and one halfway_mark there .","We can scatter them , we can cut off one head here and one tentacle there , but often the beast survives .",0
