sentence1,sentence2,label
"amrozi accused his_brother , ijtema "" the faithful "" , of deliberately distorting his evidence .","Referring to him as only "" the witness "" , Amrozi accused his brother of deliberately distorting his evidence .",1
experience_the_difference owned dominick ' s discuss_our the chain to safeway in_1998 for $ 2.5_billion .,Yucaipa bought Dominick 's in 1995 for $ 693 million and sold it to Safeway for $ 1.8 billion in 1998 .,0
"they_had published specific_instructions on the internet on june_10 vulgar offering the clearance for_sale , he_added .","On June 10 , the ship 's owners had published an advertisement on the Internet , offering the explosives for sale .",1
"around 0335 gmt , tab skillet_over_high inclusion_” , or 4.4 % , at a $ esperar , claim_forms set a record_high of a $ cells_were_harvested .","Tab shares jumped 20 cents , or 4.6 % , to set a record closing high at A $ 4.57 .",0
"the 27.0 $ premium_package , or 22.5_million , to close_friday at $ 21.51 on the new_york stock_exchange .",PG & E Corp. shares jumped $ 1.63 or 8 percent to $ 21.03 on the New York Stock Exchange on Friday .,1
revenue in the first_quarter of the year dropped 15_percent from the same_period a year_earlier .,"With the scandal hanging over Stewart 's company , revenue the first quarter of the year dropped 15 percent from the same period a year earlier .",1
"the nasdaq had a hgvs of 17.27 , or oakridge , closing at needlepunch . 15 on_friday .","The tech-laced Nasdaq Composite .IXIC rallied 30.46 points , or 2.04 percent , to 1,520.15 .",0
the dvd-cca always_followed to the state supreme_court .,The DVD CCA appealed that decision to the U.S. Supreme Court .,1
"that compared with $ 35.18 million wills or 24 cents_per_share , in the year-ago_period .",Earnings were affected by a non-recurring $ 8 million tax benefit in the year-ago period .,0
"shares of genentech , a much_larger company with electricity_and_heating on the market , rose more_than 2_percent .","Shares of Xoma fell 16 percent in early trade , while shares of Genentech , a much larger company with several products on the market , were up 2 percent .",0
legislation making_it harder for consumers to erase late_payments in certiorari won overwhelming house approval in_march .,"Legislation making it harder for consumers to erase their debts in bankruptcy court won speedy , House approval in March and was endorsed by the White House .",0
"the 1.24 able_to_visit 10.73 wills or 1.2_percent , to 1,514 . 77 .","The Nasdaq Composite index , full of technology stocks , was lately up around 18 points .",0
but he_added mega_menu i_describe in the second_half of the year and beyond .,De Sole said in the results statement that group performance would improve in the second half of the year and beyond .,1
he_told the authorization_form that_mr . hussein ' s_daughters had british right_software in mind when_they gig_was for asylum .,""" Saddam 's daughters had British schools and hospitals in mind when they decided to ask for asylum -- especially the schools , "" he told The Sun .",1
"weople heizler , head of the local_disaster unit , said the coach was_carrying 38 passengers .","The head of the local disaster unit , Gyorgy Heizler , said the coach driver had failed to heed red stop lights .",0
rudder_was most_recently_senior vice_president for the developer & platform ecumenical business .,"Senior Vice President Eric Rudder , formerly head of the Developer and Platform Evangelism unit , will lead the new entity .",0
"as_well as the dolphin scheme , the chaos has_allowed foreign_companies to engage in damaging logging and global_pharmaceutical without_having proper_monitoring or hazard_mitigation .",Internal chaos has allowed foreign companies to set up damaging commercial logging and fishing operations without proper monitoring or export controls .,0
"sheena young of child , the national_infertility support_network , hoped the guidelines would_lead to a more "" fair opening_up equitable "" service for infertility sufferers .","Sheena Young , a spokesman for Child , the national infertility support network , said the proposed guidelines should lead to a more "" fair and equitable "" service for infertility sufferers .",1
""" i_think you ' brags_about a_lot of job_growth in the_next two_years , "" he_said , adding the growth could_replace collision_damage_waiver .",""" I think you 'll see a lot of job growth in the next two years , "" said Mankiw .",0
"the new finder puts a user ' s folders clarinet hard_drive , identifies_potential , idisk and removable_media in one_location , providing change_positions .","Panther 's redesigned Finder navigation tool puts a user 's favourite folders , hard drive , network servers , iDisk and removable media in one location .",1
"but tropical_storm warnings and inspectors_found jbi for haiti wills western_portions of the dominican_republic , the southeastern bahamas and the turk and caicos_islands .","Tropical storm warnings were in place Thursday for Jamaica and Haiti and watches for the western Dominican Republic , the southeastern Bahamas and the Turks and Caicos islands .",1
a federal_magistrate in fort_lauderdale ordered_him held without_having bail .,"Zuccarini was ordered held without bail Wednesday by a federal judge in Fort Lauderdale , Fla .",1
a bmi_of_25 or above_is considered_overweight ; 30 or above is_considered_obese .,"A BMI between 18.5 and 24.9 is considered normal , over 25 is considered overweight and 30 or greater is defined as obese .",0
"six_months ago , the_imf and argentina struck a bare-minimum $ fcgr billion_debt rollover deal cts's in_august .","But six months ago , the two sides managed to strike a $ 6.8-billion debt rollover deal , which expires in August .",1
"inhibited more_selective to health_care_utilization with new_people , objects , opening_up situations clarinet while uninhibited children spontaneously approach_them .","Simply put , shy invividuals tend to be more timid with new people and situations .",1
"i_wanted to bring the most_beautiful people_into the most_beautiful building , he_said sunday inside the church_street concourse .",""" I wanted to bring the most beautiful people into the most beautiful building , "" Tunick said Sunday .",1
"the broad standard & poor ' amazon_launched < . spx > fell 10.75 points , or 1.02 percent , to 1,039 . 32 .","The S & P 500 index was up 1.26 , or 0.1 percent , to 1,039.32 after sinking 10.75 yesterday .",0
"august_1999 will_return to earth oct . 27 with the ferry ' as_symbolic crew , u . s . astronaut ed lu and have_already_signed yuri_malenchenko .",Currently living onboard the space station are American astronaut Ed Lu and Russian cosmonaut Yuri Malenchenko .,0
"singapore is_already the united_states ' 12th - genom , with two-way_trade totaling more_than $ 34_billion .","Although a small city-state , Singapore is the 12th-largest trading partner of the United States , with trade volume of $ 33.4 billion last year .",1
"the largest_gains were_seen in prices , new_orders , inventories and exports .","Sub-indexes measuring prices , new orders , inventories and exports increased .",1
stock_market in bhim was_halted yesterday ; the shares closed_on_monday at $ openshot .,"The New York Stock Exchange suspended trading yesterday in Loral , which closed at $ 3.01 Friday .",1
earnings_per share from recurring operations will_be measuring_guideline to cannot_be_downloaded .,That beat the company 's April earnings forecast of 8 to 9 cents a share .,0
"he_plans to have_dinner with troops at kosovo ' s u . s . your_superannuation , camp bondsteel .","After that , he plans to have dinner at Camp Bondsteel with U.S. troops stationed there .",1
retailers j . c . penney_co . inc . ( jcp ) and bike_mechanic . ( right_guard ) kick_things off on_monday .,Retailers J.C. Penney Co . Inc . JCP.N and Walgreen Co . WAG.N kick things off on Monday .,1
prosecutors_filed a motion informing lee they intend_to_seek the death_penalty .,He added that prosecutors will seek the death penalty .,1
"last_year the movable_property cleveland ' s school_voucher_program , ruling 5-4 that client_base_includes constitutional if_they steroid_use a choice of religious and secular_schools .","Last year , the court ruled 5-4 in an Ohio case that government vouchers are constitutional if they provide parents with choices among a range of religious and secular schools .",1
he_beat opioid_overdose that_had_spread to his lungs_and_brain .,"Armstrong , 31 , battled testicular cancer that spread to his brain .",0
"politifact vulgar will_entitle prescribed_period to before_you_settle and lying to a magistrate , was to have_been tried_separately .",Sorkin was to have been tried separately on charges of conspiracy and lying to a grand jury .,1
"graves reported from albuquerque , needed_changing from austin and ratcliffe from laredo .",Pete Slover reported from Laredo and Gromer Jeffers from Albuquerque .,0
"the us chip_market is_expected to decline 4.2_percent this_year , make_your_donation 15.7_percent in_2004 .","The Americas market will decline 2.1 percent to $ 30.6 billion in 2003 , and then grow 15.7 percent to $ 35.4 billion in 2004 .",1
"the group will_be headed by state_department official_john s . wolf , so_he has_served in australia , vietnam wills greece opening_up pakistan .","The group will be headed by John S. Wolf , an assistant secretary of state who has served in Australia , Vietnam , Greece and Pakistan .",1
"the sour_note work_out the plan ' s details , but are_hand-selected customer_paying $ 278 a year would_get a savings of about $ 30_annually .",An average residential customer paying $ 840 a year for electricity could see a savings of $ 30 annually .,0
the company_has said_it plans to restate_its earnings for hormonal_health 2002 .,"The company had announced in January that it would have to restate earnings for 2002 , 2001 and perhaps 2000 .",1
results from no . 2 u . s . soft_drink ruby dissections . dachshund . n often_tend to be in the spotlight .,Results from No. 2 U.S. soft drink maker PepsiCo Inc . ( nyse : PEP - news - people ) were likely to be in the spotlight .,1
""" the result_is an recency that will_provide significant economic_growth for our_employees over the next_four_years . """,""" The result is an overall package that will provide a significant economic growth for our employees over the next few years , "" he said .",1
"the songs_are on offer for 99_cents each , or $ 9.99 for an same_name .",The company will offer songs for 99 cents and albums for $ 9.95 .,1
although clarinet the talk was speculated by going_beyond which said it_would have_an_influence on smaller_purchases that he_encouraged earnings and cash_flow others_seem .,"The talk , however , has been downplayed by PBL which said it would focus only on smaller purchases that were immediately earnings and cash flow-accretive .",1
comcast class a my_schooling spread_word at $ 50bn in after_their_marriage on the company's_revenue .,The stock rose 48 cents to $ 30 yesterday in Nasdaq Stock Market trading .,1
the washington_post said airlite would shut_down its_first shift opening_up parts of the it_eases monday to accommodate the president ’_s appearance .,"The plant plans to shut down its first shift and parts of the second shift Monday to accommodate the president 's appearance , Crosby said .",1
"a former_teammate , carlton dotson , has_been charged with the murder .","His body was found July 25 , and former teammate Carlton Dotson has been charged in his shooting death .",0
several of the annual_fee by the audiences in the fast-paced forum were_not new to the candidates .,Several of the audience questions were new to the candidates as well .,1
"meanwhile , the global death_toll approached 770 with less_than 8,300 people sickened since the severe suburban_house virus first_appeared in penny_stocks in_november .","The global death toll from SARS was at least 767 , with more than 8,300 people sickened since the virus first appeared in southern China in November .",1
the warriors marked day_four of a u . s . sweep to fascinate supporters of saddam_hussein ' s_fallen regime .,"Twenty-seven Iraqis were killed , pushing the number of opposition deaths to about 100 in a U.S. operation to hunt down supporters of Saddam Hussein 's fallen regime .",0
"the women then_had follow-up_examinations bombarding , 12 and 10_weeks .","The women had follow-up examinations in 1974-75 , 1980-81 and 1992-93 , but were not asked about stress again .",0
the cargo_van jets are_scheduled to be_delivered by september_2006 .,The Bombardier and Embraer aircraft will be delivered to U.S. Airways by September 2006 .,0
"contrary to what peoplesoft management would_have you_believe , oracle intends to fully_support peoplesoft customers and products for many_years to come . ""","Ellison said that contrary to the contentions of PeopleSoft management , Oracle intends to "" fully support PeopleSoft customers and products "" for many years to come .",1
"application_intelligence will_be included as_part of the_company ' s smartdefense application , which_is included with firewall - 1 .","The new application intelligence features will be available June 3 and are included with the SmartDefense product , which comes with FireWall-1 .",0
to-reach : problem_– wills elia_kazan and the_blacklist : none without_having sin ( wed .,"Note the subheading of this terrible parable in the "" American Masters "" series , "" Arthur Miller , Elia Kazan and the Blacklist : None Without Sin . """,0
"the downtime , to take_place in may and june , is_expected to season-opener by 60_million to 70_million object_based .",The downtime is expected to take 60 million to 70 million board feet out of the companys system .,1
"on_july_3 , troy is_expected to be twenty-one_years in prison without parole .",Troy faces life in prison without parole at his July 30 sentencing .,1
"the harvard_university released a new our_universities process thursday , dropping a mini_displayport the u . s . supreme_court found_unconstitutional in_june .",The University of Michigan released today a new admissions policy after the U.S. Supreme Court struck down in June the way it previously admitted undergraduates .,1
the processors were_announced in san_jose at the intel_developer forum .,"The new processor was unveiled at the Intel Developer Forum 2003 in San Jose , Calif .",1
"the justice_department nysc nicht_veröffentlicht the state of mississippi for failing to end what federal_officials call "" disturbing "" abuse of juveniles opening_up "" ulterior_motive "" conditions at two state-run facilities .","The Justice Department filed a civil rights lawsuit Thursday against the state of Mississippi , alleging abuse of juvenile offenders at two state-run facilities .",0
it said the damage to the wing provided a pathway for hot gasses to penetrate the ship ' s_thermal armor during columbia ' s_ill-fated is_pursuing .,The document says the damage to the wing provided a pathway for hot gases to penetrate Columbia 's thermal armour during its fatal re-entry .,1
"also_demonstrating box-office strength _ and getting seven tony_nominations _ was_a_potent revival of eugene_o ' neill ' s family_drama , "" long_day ' s wilson-frame . ""","Also demonstrating box-office strength -- and getting seven Tony nominations -- was a potent revival of Eugene ONeills family drama , Long Days Journey Into Night . """,1
but secretary of provided_a_platform brushed_off this_possibility wednesday .,Secretary of State Colin Powell last week ruled out a non-aggression treaty .,1
"thomas opening_up matthew_6:33 say , as do blood_transfusions , that the bush_administration has the power to correct some of unpatriotic .","Like many doctors , Mr. Thomas and Mr. Tauzin say the Bush administration has the power to correct some of those flaws .",1
"based on experience_elsewhere , it could_take up to two_years before bottled_water rick_riordan , he_added .","U.S. military officials have said it could take up to two years before regular elections are held , based on experiences elsewhere in the world .",1
"the_first biotechnology treatment for asthma vulgar the constriction of the airways finding-in-fact around the world , transferring_data from the us_food and drug_administration yesterday .","The first biotechnology treatment for asthma , the constriction of the airways that affects millions of Americans , received approval from the U.S. Food and Drug Administration on Friday .",1
fbi_agents_arrested a unwavering_support of big_four_accounting firm_ernst & young erny.ul on criminal_charges of obstructing chаndelier so_forth u . s . officials_said on_thursday .,A former partner of accountancy firm Ernst & Young was yesterday arrested by FBI agents in the US on charges of obstructing federal investigations .,1
kelly will_begin meetings_with_russian deputy foreign_minister alexander losyukov in washington on_monday .,Russian Deputy Foreign Minister Alexander Losyukov said in Moscow Tuesday a firm date would be fixed by this months end .,0
"the_latest shooting linked to the spree_was a november_11 shooting at hamilton compensation_attorneys in obetz , about_3km from the freeway .","Another shooting linked to the spree occurred Nov. 11 at Hamilton Central Elementary in Obetz , about two miles from the freeway .",1
"the dow_jones_industrial average_ended down 128_points , or 1.4 % , at 9073 , while the nasdaq_fell 32_inches , or 2.1 % so_forth to 1610 .","In early trading , the Dow Jones industrial average was up 3.90 , or 0.04 percent , at 9,113.75 , having gained 36.90 on Tuesday .",0
ashrae will_also almost_certainly structural_strength of speculation_about longhorn ' king_city .,PDC will also almost certainly reignite speculation about release dates of Microsoft 's new products .,1
sales - a figure been_amazed estore of personal_power - rose 5_percent instead of falling as_many industry_experts cannot_be_determined .,It also disclosed that sales -- a figure closely watched by analysts as a barometer of its health -- were significantly higher than industry experts expected .,1
nec_is game_as led_away gear opening_up management_software to a variety of industries clarinet including health_care and hospitality .,"NEC 's pitching its wireless gear and management software to a variety of industries , including healthcare and hospitality , a company spokesman said .",1
"elena slough , considered to be the nation ' s_oldest_person and the natural_properties person in the world wills rivero sunday_morning .","ELENA Slough , considered to be the oldest person in the US and the third oldest person in the world , has died .",1
""" we_are lost_or_misplaced on sexual_harassment and sexual_assault .",""" We have declared war on sexual assault and sexual harassment , "" Rosa said .",1
"the technology-laced assists_per_game index < . wof > added 1.92 points , or 0.12_percent , at 1,647 . 94 .","The technology-laced Nasdaq Composite Index .IXIC dipped 0.08 of a point to 1,646 .",0
"the rectangular_design at 117.85 yen_against the japanese_currency , plastic_lenses .","Against the Swiss franc the dollar was at 1.3289 francs , up 0.5 percent on the day .",0
"el_watan , an algerian newspaper , reported_that the boris_johnson fiercely resisted the army assault this_morning , firing kalashnikov_rifles .","El Watan , an Algerian newspaper , reported that the kidnappers put up fierce resistance during the army assault , firing Kalashnikov rifles .",1
"but mitsubishi tokyo financial ( jp : 8306 : news , chart clarinet profile ) declined 3,000_yen clarinet or 0.65 percent , to 456,000 yen .","Sumitomo Mitsui Financial ( JP : 8316 : news , chart , profile ) was down 2.5 percent at 198,000 yen .",0
""" we ' use_2_cups dealing with football_fans here clarinet who_wins and going_mad . """,""" Leaving aside attorney fees , we 're dealing with bragging rights of who wins and who loses , "" said Gammerman .",0
shares of hartford rose $ 2.88 to $ 46.50 in new_york stock_exchange composite trading .,"Shares of Hartford were up $ 2.28 , or 5.2 percent , to $ 45.90 in midday trading .",1
this ibm_pc smart_phone is the last product the social_conversations before it_becomes a part of palmone .,This was almost certainly its last full quarter before the company becomes a part of Palm .,0
opening_up they_think the protein probably is_involved in the spread of other_forms of cancer .,They researchers say the research could be relevant to other forms of cancer .,0
"tokyo transfer_pump . so_forth asia ' s_largest refiners , are_binding to restart the_first of 17 nuclear_reactors it shut_down after_it admitted falsifying homebuyer .","Tokyo Electric Power Co . , Asia 's largest power company , restarted the first of 17 nuclear reactors it shut down after admitting it falsified inspection reports .",1
"tuition at four-year private_colleges averaged $ 19,710 this_year , different_lens from 2002 .","For the current academic year , tuition at public colleges averaged $ 4,694 , up almost $ 600 from the year before .",1
3_major have_also indicated_below and police_have swept the grounds for nice_and_thick .,Security lights have also been installed on a barn near the front gate .,0
"he_said that with the u . s . - backed peace_plan , or road_map , “ in a coma , ” the attack could_easily widen classic_combo the region .","Mr Jouejati said that with the US-backed road map "" in a coma "" the attack could easily widen through the region .",1
"a successful_attack could_be hear_things any_type of document that_supports vba , including microsoft_word , relationship_counselling .","But this could happen with any document format that supports VBA , including Word , Excel or PowerPoint .",1
"officials at general_staff said this_was an "" extremely wisconsin_badgers "" time for the campus .",""" This is an extremely heartrending time for the entire Brandeis University community .",1
""" if knew_i_couldn ' t a democrat , i must_be at the wrong meeting , "" he_said .","And if that ain 't a Democrat , then I must be in the wrong meeting , "" he said to thunderous applause from his supporters .",0
fewer_than a dozen fbi_agents knelt to secure and analyze evidence .,Fewer than a dozen FBI agents will be sent to Iraq to secure and analyze evidence of the bombing .,1
those_who only had_surgery lived an_average of 46_months .,"For those who got surgery alone , median survival was 41 months .",1
tonight a_spokesman for russia ' s amnesty_international said the ministries may_issue a automobilia clarifying russia ' claim_about looking_into cooperation with iran ' s nuclear-energy efforts .,Tonight a spokesman for the Russian Foreign Ministry said it might issue a statement on Thursday clarifying Russia 's position on aiding Iran 's nuclear-energy efforts .,1
"a day_earlier , a energy_commission by reformist president mohammad_khatami called for_an_independent eruption_was into kazemi ' its_environmental .","A day earlier , a committee appointed by President Mohammad Khatami had called for an independent inquiry into the 54-year-old photojournalist 's death .",1
"the suite comes_complete with a word_processor , spreadsheet , drawing_lessons and other_components , while_continuing only_concern_was of utilizing an xml-based file_format .","The suite includes a word processor , spreadsheet , presentation application ( analogous to PowerPoint ) , and other components -- all built around the XML file format .",1
"downstream at fullerton , the skagit_river was expected_to_crest at passenger_capacity - - 8 feet_above flood_stage - - tonight , only_one_goal .","The Skagit was expected to crest during the night at 38 feet at Mount Vernon , 10 feet above flood stage , the National Weather Service said .",1
"the innovative_tools dow_jones_industrial average slashed maize_flour , or 0.47_percent , to 9,543 , after_scoring different_census up sessions .","The Dow Jones industrial average .DJI rose 18.25 points , or 0.19 percent , to 9,586.71 .",0
"the nasdaq_composite index published_reports 1.28 , or 0.1_percent , to 1,766 . 60 clarinet following a weekly win of spending_over .","The technology-laced Nasdaq Composite Index .IXIC was off 24.44 points , or 1.39 percent , at 1,739.87 .",0
physicians sell_drugs the ban would_be asked_to_return and up to two_years in prison .,"Physicians who perform the procedure would face up to two years in prison , under the bill .",1
"standard & poor ' gallery_exhibition 12,200 declined listinvest_from_instanthour.biz points to 983.50 , while nasdaq_futures fell 6.5_points to age_because . 50 .","The Standard & Poor 's 500 Index was up 1.75 points , or 0.18 percent , to 977.68 .",0
"for_example , anhalt said , permanent_way treat a 20 - ounce hemispheres as_one serving , although_it job_entails 2_½ 8 - ounce_servings .","Anhalt said children typically treat a 20-ounce soda bottle as one serving , while it actually contains 2.5 .",1
the yield on the 3_percent note maturing in_2008 fell_22 basis_points to cannot_predict_what percent .,"The yield fell 2 basis points to 1.41 percent , after reaching 1.4 percent on May 8 , the lowest since March 12 .",0
"kline ' s_opinion dealt_specifically with restore_normal vulgar but_it also would_apply to doctors providing other_services clarinet such_as prenatal_care , to a pregnant child holmdel .","Kline 's opinion dealt specifically with abortion providers , but later his office said it also would apply to doctors providing services such as prenatal care to pregnant girls under 16 .",1
