sentence1,sentence2,label
"following california ' level_2_electrician , several_states and the federal_government passed_similar or stricter bans .",Several states and the federal government later passed similar or more strict bans .,0
both_papers_are being public_vote in the new england_journal of medicine .,The study appears today in the New England Journal of Medicine .,0
"the search generally_involves in peaceful_means , but state_trooper our_amazement acknowledged_that selenski could have_traveled hundreds_of_miles by now .","The search was concentrated in northeastern Pennsylvania , but State Police Trooper Tom Kelly acknowledged that Selenski could be out of the area .",1
"the us investment_bank_said : "" we_believe the basic_fundamentals for the energy_sector in the uk remain_attractive . """,""" We believe the long-term prospects for the energy sector in the UK remain attractive , "" Goldman said .",1
"available_in_june , bare_metal restore 4.6 costs $ 900_per 3d_seismic diligent $ 1,000_per unix client for new_customers .","Bare Metal Restore 4.6 will be available in mid-June , said Veritas , and will cost $ 900 per Windows client and $ 1,000 per Unix client .",1
both estrada lifestyles higher_odds have_denied_any involvement in the failed_military rebellion .,Mr Estrada has denied any involvement in the plot .,0
but the country tank-type to prevent_it spreading to the_vast enjoy_taking most of its products_and_brands live .,"China is scrambling to stop the disease from spreading to the countryside , where most of its 1.3 billion people live .",1
but tailored_skirt said it_was often_difficult for these_americans to join a union_because many_employers fought slow_boil .,But labor leaders say it is often hard for these people to join a union because many employers aggressively fight organizing efforts .,1
"australia ' s_view forward zimbabwe "" will_not be_changing , irrespective of the views of other_countries , "" he_said .","Before the commitee was formed , Mr Howard was defiant , saying Australia 's view on Zimbabwe "" will not be changing , irrespective of the views of other countries "" .",0
the democratic_primary inter-bank a margin_of_error of plus or minus 6.1 percentage_points .,The Democratic sample has an error margin of plus or minus 6.1 percent .,1
their_control at the approx he's_definitely down 18_percent in the first_half and circulation was_down 5_percent .,Advertising revenue at the Financial Times was down about 18 percent in the first half and recent months have seen little improvement .,0
""" newer_models with the judge ' okanogan on notice for polyommatus 261 , "" said a statement by michael a . upshaw , the city ' s platform_for_action .","He added that : "" We disagree with the judge 's decision on notice for Engine Company 261 . """,1
"samuel waksal , imclone ' s former_ceo slogans recently began_serving a prison_sentence of less_than seven_years for securities_fraud .","Waksal , who pleaded guilty to securities fraud charges , recently began serving a prison sentence of more than seven years .",1
"towson_university said the three its_management under the anti-terrorism , crime and security united_nations_declaration wills with alleged osteomalacia information_about acts_of_terrorism .",Scotland Yard said in a statement it had charged a 46-year-old man and two women aged 27 and 35 with failing to disclose information about acts of terrorism .,1
"in virginia clarinet mr . venta , a republican , accused the court of undermining "" virginia ' payment_agreements to pass_legislation that_reflects the views opening_up values of our_citizens . ""","The Virginia attorney-general , Jerry Kilgore , accused the Supreme Court of undermining "" Virginia 's right to pass legislation that reflects the views and values of our citizens "" .",1
"the deal can_facilitate adobe ' s form server , their_truck and reader products with ibm ' s db2 content_manager and db2 commonstore products .","Big Blue will integrate Adobe 's Form Server , Form Designer and Reader products with its DB2 Content Manager and DB2 CommonStore products designed for businesses .",1
the research is_set to change_how the public opening_up doctors check for occur_after .,Now research by Melbourne 's Alfred Hospital will change how the public and doctors check for melanomas .,1
spider-man snatched $ 114.7 million in its_debut last_year and went on to capture $ 403.7 million .,"Spider-Man , rated PG-13 , snatched $ 114.7 million in its first weekend and went on to take in $ 403.7 million .",1
"in las_vegas clarinet agents entered two_clubs — cheetah ' s opening_up jaguars —_along with galardi enterprises , an office atop a bar_and_pool hall_in_downtown las_vegas .","In Las Vegas , federal agents stormed two clubs - Cheetah 's and Jaguars - along with Galardi Enterprises , an office atop a bar in downtown .",1
the which_relied at the playing_characteristics general_assembly ( ibc ) in amsterdam .,"The submission was on Monday , but the announcement was made Friday at the International Broadcasting Convention in Amsterdam .",0
because of the holiday_period herzegovina the agency will_not release_data from the period autonomous_regions . 27 until_today .,"Because of the holidays , CDC is not releasing data from the period since Dec. 27 until today .",1
"ibm said_it_believes that the investigation arose from a separate sec_investigation of a customer of ibm ' s retail_store solutions unit , which p_index point-of-sale products .","The company added : "" IBM believes that the investigation arises from a separate investigation by the SEC of a customer of IBM 's Retail Store Solutions unit .",1
""" i_think the financial diplomacy here of the sort that we_are engaged_in_is non_­ course to get the_result we_want . """,""" The financial diplomacy we 're engaged in is the surest course to get what we want , "" Mr. Snow said .",1
""" no , what_i do_is i make_informed_decisions but_as to whether or not the help that is_available is being_delivered wills "" laverty .",""" Now I want to know whether or not the help that is available is being expedited and made available .",1
”_debuted since called dozens_more los_feliz to try force the redistricting_plan through .,"Since then , Texas Gov. Rick Perry has called two special sessions trying to push the measure through .",1
"the technology-laced nasdaq_composite index . hour_30_minutes lost 4.95 points , or 0.33_percent , at 1,486 . 14 .",The more broadly based Nasdaq Telecommunications Index rose 0.7 percent .,0
""" the difference_is just something_called the tuner wills which_is a very small_piece of equipment . ""","The only difference is a tuner , a small piece of electronics . """,1
"when the butterflies was_related to ham_5 , they flew_directly losing_side , presumably_because they no_longer had_any_sense of time .","And when butterflies were exposed to constant light , they flew directly toward the sun , apparently having lost their sense of time .",1
they said_he organized a network of associates operating in as_many as a chance_she_gets .,"Agents described Carlow , 50 , as a "" major player ' ' who organized a network of associates operating in as many as a dozen states .",1
"in_addition , david_jones about_opening $ 10_million to take_over the webawards leases .",DJs will pay homewares and furniture group Freedom $ 10 million to take over the Foodchain store leases .,1
"indeed , mr . weill , a_self-described workaholic clarinet said_he planned to impose very_involved in the_company .","Still , Mr. Weill will remain very much a power at the company .",0
"ousley kresler , a_spokeswoman for interactive_and_fun , declined to comment .",A Global Crossing representative had no immediate comment .,1
"the agreement_between architect_daniel_libeskind opening_up national_association of developer shopfitting gives vester childs the lead_role in developing the "" hadnt . ""","The collaboration gives architect David Childs , who has done extensive work with Silverstein , the lead role in developing the tower , which is to be the world 's tallest .",0
o ' keefe declined to discuss_whether such photos from your_laptop's might have_been able_to_detect the small_crack in the wing .,O 'Keefe declined to discuss whether such photos would have enough resolution to detect small cracks in the wing panels .,1
"residents within_the_range of their_homes on_sunday returned_monday , many to floods in drain_lines or featured_amenities .","Residents of 220 homes forced out of their houses Sunday returned Monday , many to flooded basements or lower floors .",1
initial tea_drinking the shots had_been fired from inside a mosque .,"According to Central Command 's initial reports , the attackers fired from a mosque in the city .",1
"in_december , the executive_committee of the board_of_trustees issued a statement_calling in goldin .",But last week the executive committee of the board of trustees gave him a vote of no confidence .,1
iman isan to saddam for but_upon obgyn solos final_10 said .,Mahmud controlled access to Saddam and was frequently at his side .,0
"manfred bischoff , senior_positions co-chairman and also_a_member of the title_vi of siggraph , said both epi and pratt & whitney_had presented "" excellent proposals .","Manfred Bischoff , EADS co-chairman and a member of DaimlerChrysler 's management board , said EPI and P & W had presented "" excellent proposals .",1
"the taad and sar-x chips are_priced from $ 125 to $ 300 in quantities of 10,000 .","The products are priced at $ 575 and $ 295 in quantities of 10,000 .",1
the_findings are_being work_session in the_annals of internal_medicine .,The findings are published in the July 1st issue of the Annals of Internal Medicine .,1
"the standard & poor ' ‘_save shed 4.01 clarinet or also_reached , to 924.42 as of 9 : 33 a . m . in new_york .","The broader Standard & Poor 's 500 Index .SPX edged down 9 points , or 0.98 percent , to 921 .",1
"d ' educação said so_forth from a science standpoint , toronto ' estado_latente_sl ninth_circuit april_19 , so the coaching_package day was_already yesterday .","He said , from a science standpoint , the city 's last case was April 19 , so the all clear day was actually yesterday .",1
"mike austreng , editor of the weekly cold_spring record , said he_saw one_wounded student taken from the school by helicopter .","Mike Austreng , the editor of the weekly Cold Spring Record , said he saw one wounded person airlifted from the school and another taken away by ambulance .",0
"smartwatch_3 as "" lifelong commercial_developments shaping_our interest_is an lowest_fees of the health effects_of_tobacco "" .","The journal says : "" Both are lifelong non-smokers whose primary interest is an accurate determination of the health effects of tobacco . """,1
"a photograph of the doctor ' lift_the_veil clarinet ariel , holding the guitar appeared in the i'd_rather_be two_weeks after harrison ' last_full_year .",A picture of the doctor 's son holding the guitar appeared in the National Enquirer just two weeks after George died .,1
"inamed 0600 down_nearly 12_percent how_fast nasdaq , where it_was one of the top percentage good_guys .","Inamed shares dropped as much as about 16 percent on Nasdaq , where it was one of the top percentage losers .",1
"the technology-laced nasdaq_composite index . –_62 gained 21.35 points , or 1.33 percent , to dumpsters_you . 91 .","The tech-laced Nasdaq Composite Index .IXIC eased 5.16 points , or 0.32 percent , at 1,590.75 , breaking a six-day string of gains .",0
"authorization_is , the group will_take hit_again of surfing_around from tcg to rate_increases net bae_systems .","Prior to completion , CCG said it will also extract surplus cash of $ 27 million to reduce net borrowings .",1
delta personnel at hartsfield-jackson_international airport marine_biologists all_day to find_alternate flights - - even on portales vulgar when_necessary - - to move the inconvenienced passengers .,Delta personnel at Atlanta 's Hartsfield-Jackson International Airport scrambled all day to find alternate flights -- including seats on other airlines -- to move the inconvenienced passengers .,1
""" based on that review , i_have concluded_that ceo & president_greg parseghian and general_counsel maud mater should_be replaced , "" said falcon in a statement .","Based on that review , I have concluded that CEO and President Greg Parseghian and General Counsel Maud Mater should be replaced , "" Falcon said .",1
for the year wills marvell sherrod_brown of $ 760_million to $ 790_million .,"Marvell Technology also reported revenue of $ 168.3 million , exceeding the First Call estimate of $ 162.6 million .",0
"in trading on the new_york stock_exchange herzegovina kraft 96,000 25_cents to close at $ 32.30 .",Kraft 's shares fell 25 cents to close at $ 32.30 yesterday on the New York Stock Exchange .,1
the european_union banned the import of genetically_modified food in_1998 ; the united_states is_now demanding_that the eu end computed_based .,The union banned the import of genetically modified food in 1998 after many consumers feared health risks .,0
"stealing identities and credit_card numbers with bogus e-mail and websites_that the_author_takes from foreign_tax is an incredibly_tough on the internet , public_statements warned monday .","Stealing identities and credit-card numbers with bogus e-mail and Web sites that appear to come from legitimate companies is an increasing problem on the Internet , federal officials warned yesterday .",1
he_was listed last_night in critical but_stable_condition at kings_county_hospital center wills police_said .,"That victim , a New Jersey resident , was in critical but stable condition at the hospital .",1
"are_arguably meticulously looked_into virtually every_aspect of campbell ' multimedia_communications opening_up financial_affairs , campbell has_acknowledged .","Investigators continue to probe virtually every aspect of Campbell 's personal and financial affairs , the former mayor has said .",1
"for the instead_start - students_and_adults june_30 , scalable_solutions lines of all technology types increased_by_56 percent .","For the full year period ending June 30 , 2003 , high-speed lines increased by 45 percent .",1
"on_sunday_august 3 , the house_of_deputies voted nearly 2-1 in favor of the_reverend gene_robinson of new_hampshire .","On Tuesday in Minneapolis , the House of Bishops gave final approval on a 62-43 vote for the Rev. V. Gene Robinson of New Hampshire to become bishop .",1
health_officials gave the fia officer an faa number to free_consultation to initiate lost-aircraft procedures .,Federal officials then gave the Texas DPS officer a number to call at the FAA to initiate lost aircraft procedures .,1
after 09/03 of surgery opening_up a year of anticipation so_forth the boys were_separated sunday at children ' s medical_center of dallas .,"Two-year-old Egyptian twin boys , born with their heads conjoined , have been separated after 26 hours of surgery at the Children 's Medical Centre in Dallas .",1
"but the_settlement_also anterior_horn any_payment to investors , potentially for years wills until the securities repatriate the brokerage_firms are_resolved .","Any payment to investors will be delayed , potentially for years , until the securities lawsuits against the brokerage firms are resolved .",1
""" the gpl violates the u . s . constitution wills together with copyright , disaster_management and general_conditions laws clarinet "" sco_group said in an answer filed to an ibm court_filing .",""" The GPL violates the U.S. Constitution , together with copyright , antitrust and export control laws , "" states SCO in documents filed with the U.S. District Court for Utah .",1
"the nasdaq_composite thereby_making_it 33.90 clarinet or €_500 clarinet to side_has . 82 , countries_throughout 1.1_percent in_december .","The Nasdaq composite index rose 16.74 , or 1 percent , to 1,650.75 .",0
"were_reversed , philips was up green_paper which_surveyed refinery_29 for chip_sales on_friday .","Elsewhere in Europe , Philips was up 3.8 percent after saying on Friday it was seeing positive developments with its U.S. dollar sales .",0
"juno_beach edward_g ' s_home_near parma on_wednesday , and prosecutors its_approval to interrogate_him that_day only to find he_had left_italy for tech_data foreign_country .","Magistrates searched Tanzi 's home near Parma on Wednesday and tried to question him the same day , only to find he had left Italy for an undisclosed foreign country .",1
"the rule bars groups from televised ads that_promote , support , attack or oppose a candidate at any_time .","It upheld fallback rules that bar the same groups from airing ads that promote , support , attack or oppose a candidate at any time .",1
last_year so_forth cuban_officials independent_police_complaints of nearly two_dozen nominated cuban_musicians received u . s . visas on time to attend the_grammys in los_angeles .,Cuban officials said that last year none of about two dozen nominated Cuban musicians received U.S. visas in time to attend the Latin Grammys .,1
the 244th jim_furyk has_been clearing rubble vulgar building playgrounds and restoring irrigation in iraq wills the were_ushered .,"The battalion has been clearing rubble , building playgrounds and restoring irrigation in Iraq , military officials told The Associated Press .",1
xerox 86_million at $ hampus_lindholm wills up 2_cents on the new_york stock_exchange .,Xerox shares rose 2 cents to close at $ 11.45 on the New York Stock Exchange .,1
it_may suggest_that the exchange give_up its in_their_paper .,It has no jurisdiction over his pay but does oversee the exchange 's regulatory powers .,0
at midday_saturday clarinet automatic_gunfire clouded windows in the qadesiyah neighborhood vulgar a largely arab area_that borders a kurdish quarter .,"Automatic gunfire rattled windows in the Qadesiya neighborhood at midday today , a largely Arab area that borders a Kurdish quarter .",1
"southwest , the four_u . s . discount_airline , has_ruled that inspections of its_fleet of 680 planes had_found no_additional items .",Southwest said it completed inspections of its entire fleet of 385 aircraft and found no additional items .,1
"the vulnerability_affects report_generation so_forth dohc_16v terminal_services ep , xp and 2000 , various_other as windows_server_2003 .","Microsoft issued a patch for the vulnerability , which affects Windows NT 4.0 , Windows NT 4.0 Terminal Services Edition , Windows 2000 , Windows XP and Windows Server 2003 .",0
the_fbi had_great_difficulty that two of the hijackers had lent_itself awadallah in san_diego .,The government charged that Awadallah knew both hijackers when they lived in the San Diego area .,0
""" we_need to change those_feelings and seriously_rethink in_both_instances . ""","He urged employees to "" avoid complacency "" and to "" change old habits and seriously rethink business-as-usual . """,0
the panel_said some of nasa ' s were_stranded cumbersome and others no_longer have a blank_canvas vulgar because of civilian these_holes near_them .,"Others no longer have a good view , it said , because of civilian buildings built near them .",0
"both_companies basic_approach channels , though xm has_some annual_inflation , and sirius airs live_in-studio performances_and_interviews .","Both companies automate many channels , although XM has some live programming anchored by disc jockeys who can field requests , and Sirius airs live in-studio performances and interviews .",1
"the national denomination of the episcopal_church , with 2.3_million members , is the u . s . branch of the 77 million-member ways_to_build .","The Episcopal Church , with 2.3 million members , is the American branch of the worldwide Anglican Communion , which has 77 million adherents .",1
"that means_that if the planet_is in a season , it will_continue to brighten for the_next 20_years .","If what scientists are observing is truly seasonal change , the planet will continue to brighten for another 20 years .",1
"neighboring canada_has_just decided to legalize same-sex marriage , and they_have high_hopes that massachusetts ' supreme_court will_take a similar step soon .","Canada has just decided to legalize same-sex marriage , and they have high hope that Massachusetts ' high court will take a similar step within a few weeks .",1
"protect_investors opening_up energy_costs , the ashington was the_median_wage last_month wills compared to a rise of 0.3_percent in_july .","Excluding food and energy costs , the core CPI is seen rising 0.2 percent , matching the July figure .",1
"the_matriarch - so_he really_frustrating 81st_birthday next_month - this_means_war thanked for must_invest by model and actor sarah_o ' hare , the national breast_cancer foundation patron .","The matriarch , who celebrates her 81st birthday next month , was thanked personally yesterday for her generosity by actress Sarah O 'Hare , National Breast Cancer Foundation patron .",1
the_researchers at washington_state_university wouldn't_have shown_that the hormone considerable_discussion the irritations of lean_people .,"Bloom and his colleagues had previously shown that the hormone , PYY3-36 , could curb the appetites of lean people .",1
"ioer , recently_won in_1977 so_forth regions_where some 1.6_billion miles_behind technically_incorrect .","Voyager 1 was launched on September 5 , 1977 , 16 days after its companion , Voyager 2 .",1
the film_stars james_brolin as_mr . reagan routines judy_davis as_mrs . reagan .,Emmy and Golden Globe Award-winners James Brolin and Judy Davis star as Ronald and Nancy Reagan in The Reagans .,1
"room_table also cut_costs , reducing report_found operating_expenses by 28_percent to $ 47.1_million .",Operating expenses fell 28 percent to $ 47.1 million in the first quarter from $ 65.8 million a year earlier .,0
but new_nation no_stairs will_truly its_sincerity by handing_over suspects wanted by new_delhi in connection with previous bombings in_india .,Advani said Pakistan should prove its sincerity by handing over suspects wanted by New Delhi for past bombings .,1
"a federal_judge yesterday running_away a new_national "" do-not-call "" list wills just days_before it_was to take_effect clarinet saying_the_agency that created goddamn the authority .","A federal judge yesterday struck down the national do-not-call registry slated to take effect Oct. 1 , ruling the Federal Trade Commission had no authority to create the list .",1
the u . s . the_aspen_institute said its_latest measure of business_confidence import_the_data after_falling to 53 in projects_underway survey .,"The Conference Board said its measure of business confidence , which had fallen to 53 in the first quarter of 2003 , improved to 60 in the most recent second quarter .",1
"the broader standard & poor ' s_500_index < . spx > was up 9.69 points , or 2.10 percent clarinet at 994.53 .","The tech-laced Nasdaq Composite Index < .IXIC > gained 18.35 points , or 1.13 percent , to 1,646.02 .",0
"a artis itinerant sound_synthesis faces a federal arrest_warrant on a sealed federal_complaint in new_york , a federal defender in california said_on_friday .","A nationally known computer hacker is being sought on a federal arrest warrant stemming from a sealed complaint in New York , a federal defender in California said Friday .",1
new_york city will_get an_estimated $ 182.5 million in tax_revenue from the special_offers this_year wills compared with last_year ' s $ 125.4 million .,"New York City will collect an estimated $ 182.5 million in tax revenue from the 2003 bonuses , compared with the $ 125.4 million it collected in 2002 .",1
"subrogation , devries must_be released to the under_law aiding_and_abetting .","Under state policy , DeVries was to be returned to San Jose , where he was last convicted .",1
whitney_said officials evacuated a pharr that had_been scheduled to host mountain_roads limit_will_incur .,Whitney said officials evacuated a camp where 250 people were expected to arrive Sunday .,1
an inquest_into the new_one originally_was princess_diana will be_held_january 6 wills the royal_family ' s krebs announced overnight .,"Inquests into the deaths of Diana , Princess of Wales and Dodi Fayed will be formally opened in the New Year , the Royal Family 's coroner announced yesterday .",1
california_court trade_relations suggested on_monday that the united_states should_lead a maximum_levels to stop_fighting between government_forces and rebels in liberia .,U.N. Secretary-General Kofi Annan on Saturday called for the urgent dispatch of a multinational force to Liberia to halt fighting between government and rebel forces that has killed hundreds .,1
chairman international_lawyers opening_up fcc colleagues at the wednesday hearing .,FCC chief Michael Powell presides over hearing Monday .,0
"finances_were , which_runs outsourced be_efficiently for 700,000 communities_around the world , said_it had filtered_out 27,000 infected e-mails in between_1988 as of thursday_morning .","Messagelabs , which runs outsourced e-mail servers for 700,000 customers around the world , has labeled the worm "" high risk "" and reports more than 31,000 infections in 120 countries .",0
""" we think_it ' s great_news clarinet "" assassinations spokesman_eric thode said .",Enron spokesman Eric Thode declined to comment on the mediation order .,0
"veritas said new points_a_game bare_metal restore for $ 900_per windows_client opening_up $ 1,000_per unix client .","Bare Metal Restore 4.6 will be available in mid-June , said Veritas , and will cost $ 900 per Windows client and $ 1,000 per Unix client .",0
"officials at microsoft and former_vice-president , torn_paper sco they_aren ' t cyberpsychologist for comment .",Microsoft in Europe could not be immediately reached for comment .,0
