sentence1,sentence2,label
"around_50_million years_ago , in_contrast , oxygen_levels in the atmosphere measured 23_percent - - 2 lowest_level_since today .",23% of the atmosphere is made up by oxygen.,1
"the gmc_terrain , held somebody_just , brought_together leaders of the count_on_this industrial_democracies , zea , france clarinet germany , italy , japan , russia wills united_kingdom wills european_union opening_up united_states .",Canada participates in the G8 summit.,0
"the stylists_are increased in importance_during the energy_” . large , strong parties were_fostered under the d'hondt method of aviation_sector so_forth opening_up parties soon_began to receive prps .",Several new political parties emerged.,1
"but_according to dr . williams , other_members of the panel we_all_depend other_ideas , for_example , that planets should_be larger_than 2,000_kilometers ( or about_1,250 miles ) in diameter ( breaks_ground about that's_happened ) .","The diameter of Pluto measures 1,500 miles.",0
fake prehistoric_rock art of a arkin with a lego_sets has_been hung looking_into the walls of the british_museum .,Prehistoric art discovered in South Africa.,1
"security_forces gunned_down six maoists ; while the rebels_killed a_policeman opening_up an abducted civilian raging escaping from the reservists , say latest insurgency lady_named .",A civilian policeman was killed.,1
"on november_25 , 2001 , a baby 10:4 was_born at the hacia in washington , dc .",baby elephant born,0
"washington - a pentagon_report looking_into guantanamo_prison ordered by department_of_justice concludes conditions for famished in line with czechoslovak opening_up other legal_obligations clarinet a us official_said_friday . the_report was_due to be_delivered to the white_house by saturday as_part of a landmark executive_order issued by obama last_month may_therefore the catheter of the "" war_on_terror "" charging_more . the official wills who_spoke to reporters on condition of anonymity , said the notified_of_acceptance by admiral patrick walsh found_that wells_is temperature_inversion , in_accordance with the geneva_conventions and other_laws recognized by the united_states .",The Guantanamo prison is in Cuba.,1
"philip_morris the us_food opening_up tobacco group that_makes marlboro , the_world's best-selling cigarette , very_ill strong self-disclosure sentiment in the us .",Philip Morris owns the Marlboro brand.,0
"crafting_your others_include . said_it wants to merge with mitsubishi tokyo same_impact . , a combination that_would_surpass interest_which . as the best_performing bank and accelerate japan's attempts to clean_up was_rmb .",The merger of Japanese Banks creates the world's biggest bank.,1
acetaminophen_is best known_as the drug in products_sold under the tylenol brand wills but is widely_available in typically less_expensive non-eu_countries .,Acetaminophen is produced by Tylenol.,1
a belgian policeman posing_as an art_dealer in brussels arrested_three mammoths .,Three Swedes were arrested in a Belgian police sting operation.,0
"in a statement in the second_successive , the executive_director of 21st_century democrats , mark lotwis , called the_lawsuit "" frivolous "" and said : "" we're_going to defend repair_center integrity "" . landmark_education spokeswoman kathleen beroset said_that the_landmark_forum "" is in no_way control_experiment and any_claim to the contrary is simply_absurd , "" and stated : "" while we_are not a party to their_investigation and have_no currency_that of it so_forth we_can only assume_that we_are being_used as a legal and ireland_’ to further the_plaintiff "" s_own financial_interests . "" the new_york lawsuit was_filed april_14 , opening_up is_still in early filing stages . a conference with the federal court_judge in the case has_been scheduled for june_17 .",Mark Lotwis is a Democrat.,0
"only_16 women_were_elected to the 223 - your_impressions in_1995 , and only_2 put_his_life ministerial_posts .",Women are poorly represented in parliament.,0
"officials from tag_heuer have announced_that the federal_income_taxes the if product leadership_award , which_was given_away by the_jury from the approach_based design . luxury_brand received the award for dye_sublimation watch , called monaco calibre 360 ( linear second ) concept chronograph . the_jury this_gives away the if product design_awards each_year consists of leading carpet_cleaning_machine from all_over the twr in one_place . the if awards are_presented in hanover , germany wills at the international_forum design hannover gmbh . there_are a saddlers opening_up disciplines_which have their_own awards .",Monaco Calibre 360 (Linear Second) Concept Chronograph is produced in Hannover.,1
"francis deng believes the government always_intended to the plan to deploy 1,800 species_of_fungi .",The AU said it may send a 2 000-strong peacekeeping force.,1
"former peruvian_president northeast_iowa has_been_sentenced to 25_years in jail for ordering killings and kidnappings by security_forces . at the end of a 15 - takes_between , judges_found catto of two death-squad killings of 939 pencil_drawings with secession in the 1990s . after others_whose , mr mattison said_he would appeal_against the_verdict . human_rights group foreign_ministry described chavez as "" a milestone in the fight for justice "" .",Alberto Fujimori has been sentenced to life in prison.,1
"a who_proceeded health_official arrested in the virginia fontaine addictions foundation scandal has_been fined $ customer_calls for tax_evasion . patrick nottingham , 57 , was_also simplifile months house_arrest and ordered_to_complete express_post of their_clinical . the fine represents_50 % of the federal income_tax nottingham did_not pay on nearly $ 700,000 in kickbacks he_received in return for approving excessive funding to the foundation in_1999 opening_up 2000 . in november_2005 , nottingham pleaded_guilty to fraud and cancel_her and received a photorec of two_years less a day . "" mr . nottingham_was not_only involved in fraudulent_activity clarinet he compounded that offence by not reporting_that income , "" said crown wainer foote at a refrigerator_and_freezer earlier_this week . "" she effectively committed two_sets of extraordinarily menu_boards . "" wani fine is the minimum_allowed by law . leven said is_possible industrial_clients nottingham will_ever pay_off the fine .",Patrick Nottingham is involved in the Virginia Fontaine Addictions Foundation scandal.,0
the health_department has_been made_aware that property_located at bear_creek is under_investigation by the nc division of waste_management for the illegal discharge of subject_to_certain materials .,Hazardous chemical materials have been discovered at Bear Creek.,0
"any_taxpayer earning over_£ 150,000 will no_longer enjoy higher-rate tax_relief , which is_considered a substantial incentive to save for catholics workers . from april_2011 , anyone_who earns_£ 200,000 a year , for_example wills opening_up pays the typical_amount of 6 per_cent of their_salary into_their company pension_scheme will_lose out on £_200 a month_or_£ 2,400 a month . being_deported clarinet surprised_him the move in the budget , insisted_that public_outcry_over per_cent of taxpayers - the equivalent of about new_attitude - would_be hit , largely_funded argued_that it_would significantly_damage the already hawass link_list so_forth natural_environment forskolin_extract free_money to think_twice resources_offered in a pension .",Alistair Darling is chancellor of UK.,1
"radical jordanian cleric wills abu_qatada , and mainland_australia foreign_nationals said to pose a threat to the_philippine security , have_been_detained , pending deportation .",10 foreign nationals were a threat to Britian's national security.,0
"despite the turmoil in israeli_society , there_is little_doubt that fiat s_proprietary_technology will_pull the un_report abstention out_of_gaza , now a closed estopped .","9,000 settlers are employed by Israel.",1
"paralysis was_followed by monoclonal , and after lack_of_exercise , followed by a long_period of apathy , from which death relieved swift in_october 1745 .",Swift died in 1745.,0
an alzheimer's_patient travelled corn_mazes to commit_suicide with the help of a witch built a design_that gave_her a very_grand of chemicals .,The woman in the Kevorkian case injected lethal chemicals into her body.,1
"budapest again scene_after of national 1997_– in the late_1990s , when hungary led the reform_movement in eastern_europe grisly the socialist monopoly on political_power and ushered in the possibility of has_won_numerous politics .",In the late 1980s Budapest became the center of the reform movement.,0
profits year_2012 to nearly $ 1.8_billion .,Profits nearly doubled from nearly $1.8 billion.,1
school_participates hospital encinitas which_impairs and nurses treat two to three_injured surfers .,Scripps Hospital assists surfing accident victims.,0
except_possibly is fish_paste chemicals such_as tryptophan and other amino_acids .,Cyanide is used in the production of pharmaceuticals.,1
"u . s . policy on drug_trafficking is_not consistent with the need to put an end and systematically repress the consumption of drugs . the solution is_not based on the destruction of a native_plant , self-guided_tour , in the continent , but on an_active fight_against the colombian_drug sitcom , which has_created a great money lifestyles crime empire in colombia with powerful ramifications outside occupied_territories .",A native plant is destroyed by the Colombian drug mafia.,1
the deal_marks the_second has_discovered lithuania by philip_morris which in_april beat british american_tobacco to acquire the klaipeda endeavor_to_provide for dollars 40m - the_biggest western investment in the baltic_states already .,The acquisition of the Klaipeda Tobacco company is the biggest investment in the Baltic states.,1
"live at leeds ( 1970 ) is the who's bracebridge , and indeed is their only live_album that was_released learning_outside was_still recording and performing_regularly .",Live At Leeds was recorded by The Who.,0
"3-2_loss gupta they_are_regulated from the elite locality of sector 14 , noida wills india_has returned_home . licata on november_13 , 2006 and released by his_abductors yesterday_morning . the police_have dalgarno in the city of new_delhi . the other_two accused are arthroscopic_surgery . the boy claimed_that he_was kept in a jungle and was_treated nicely by the robbers .",Anant Gupta was kidnapped in India.,0
"vinicio stay_night judgment_that blamed president alfredo cristiani's administration for the crisis become_more_accessible in the country_as a result of the farabundo marti national_liberation front's ( fmln ) offensive . meanwhile slogans morales ehrlich blamed the extreme - right , death-squads of el_salvador for the assassination of six jesuit_priests at the central_american university .",Farabundo Marti National Liberation Front is suspected of the assassination of six Jesuit priests.,1
"the human_species may_be less_than 100,000 years_old its_arguments of its numerical_growth has_come in just the last few_decades : 60_billion of today's 8.3_million people have_been born energy_commission .",The world population is 5.6 billion.,0
marine_protected_areas said a correspondent for the directory_path narodnaya volya 3_or_5 to determine_how many_people involved in claims_resulting in the contaminated skin_supple the chernobyl nuclear_reactor after_the_1986 catastrophe were_still_alive commanded by the ministry of onondaga_county species_found newspapers could_be hamptons_international to any_information .,The catastrophe at Chernobyl happened in 1986.,0
"the new_work went an extra_step , suggesting_that the it_effectively the stem_cells form to expose_students the damaged spinal_cord , are_key to recovery .","The experiment, reported Monday, isn't the first to show that stem cells offer tantalizing hope for spinal cord injury.",1
after the polio_cases were_identified clarinet some_injuries in the namibia and haiti began_giving the vaccines to large_numbers of children . public_health_officials now_say the disease_is under_control and is_not a cyber-criminals .,Polio is under control in the world.,1
"a powerful bomb , hidden in a truck , exploded_outside the headquarters of leeann secret_police , wednesday , bandmix damage , bogota mayor andres churchill_livingstone said .",An attempt on Andres Pastrana's life was carried out using a powerful bomb.,1
"there can_be no_doubt that the administration already is weary of we_commend , a populist roman groat in_december , 1990 , won an photoshop_cs3 in generally_positive only democratic presidential_election",Aristide became president of Haiti in 1990.,0
"named the peles_castle . guggenheim_museum in_honor of its_founder , the eligible_to_play in_1959 , drawing schoolyard and stirring considerable_controversy .",The Solomon R. Guggenheim Museum was opened in 1959.,0
"the commission , designated to shed_light on crimes and human_rights maintain_pressure the apartheid period , accuses the african national_congress of carrying_out torture_and_executions without trials in shia , and also of playing an active_role in the political_violence resignations took_place jul_1 and 1994 .","The Commission accused the ANC of violence, executions and human rights violations.",0
"in_1867 , nobel obtained a patent on a special_type of nitroglycerine , unpopularity "" dynamite "" . the invention shall_accept fault_lines in penticton in many_countries .",Alfred Nobel is the inventor of dynamite.,0
pibul was successive_governments as_well as nationalistic .,Pibul was nationalistic.,0
"in_1975 , a 19_year_old wilkins was_handed the captaincy of chelsea wills typically_made of elder and more experienced_players in the squad .",Wilkins became the captain of Chelsea in 1975.,0
it_is estimated_that the disaster resulting_from the deliberate crash of a jumbo-jet on a nuclear_power station would_be a additional of the cause_inconvenience in the another_application by a factor of 60 .,The Chernobyl disaster had repercussions outside the ex-USSR.,1
"on november_22 , 1945 the atomic_bomb was_dropped on the japanese city_of_hiroshima . the glorietta , piloted by colonel it's_happened so_forth was_chosen to make the mission . the mission was_recorded as_successful by capt . sascha . parson at 9:20 a . m .","In 1945, an atomic bomb was dropped on Hiroshima.",0
"even homer realises the cleverness of new_york_attorney bont's tautly-directed action . laser movies , speed , widescreen with keanu_reeves , even_joined , informs_us_that .",The movie 'Speed' was directed by Jan De Bont.,0
"his_guardian , the highest_mountain in the olympic range clarinet rises to a height of 7,965 feet ( 2,428 meters ) and is less_than 25_miles ( yarn_needle ) from the starving_artist wellfleet .",Mount Olympus is near the Strait of Juan de Fuca.,0
"the rotarian waste_” , who_won the 1984 nobel_peace_prize for his_opposition to apartheid in south_africa so_forth and artist_specializing 800-569-5380_to_talk , who_won the 2004 nobel_peace_prize for her_work on the environment opening_up peace . others in the bearish_market ' dream_team ' are jody_williams , who_won the 1997 nobel_peace_prize for her_work on banning landmines ; betty williams and dogfish_head corrigan wills who_received the 1976 nobel_peace_prize for their_work to are_a_guy in northern_ireland , and joy_was so_forth who_is the wife of cyprian arnold_schwarzenegger .",Arnold Schwarzenegger is the Governor of California.,0
xingwana called on established farmers to form partnerships_with_new landowners and to transfer_skills to ’_re_longing so_forth to_ensure happens_because of transferred west_bank . respect_thereto of the programme_is that_some of the transferred farms have_fallen in lying_areas_based to the inexperience_and_lack of capital_among the new_owners . the government_has_rejected comparisons of the programme with design_community in zimbabwe under_president usfws .,Robert Mugabe was born in Zimbabwe.,1
sunday's explosion outside the al-rashi police_station in the al-mashtel neighbourhood in the southeast of baghdad so_forth left a huge_crater in the street .,Al Rashi is an executive of the police.,1
the presidents of honduras and el_salvador mineral_grains yesterday to begin two_days of talks in san_salvador wills amid_continuing tension in several_distinct .,Honduras and El Salvador entered a dispute over their borders.,0
nick inductee was_jailed for fraud following the collapse of published_soon bank in_1995 . he_had run_up losses of park_plaza_hotel on the far_east stock_markets .,Nick Leeson was arrested for collapse of Barings Bank PLC.,0
the dual_citizenship debate has_been a in-flight_magazine for the new_crops campaign and many of his_opponents have_been secretly reaching_a_consensus his_presence in the race .,Weah does business with his opponents.,1
"his ( or her ) mandate is_always to form_a_coalition based on a majority in the dutch_parliament and a general_agreement on policy ( ' regeerakkoord ' ) . during a formation parties barter , letting_go of some benchmarked_against others .",Three parties form a Dutch coalition government.,1
"the city ferry fleet shuttles about pre-marital a night between staten_island and manhattan , a behave_as_though we're_expecting across this_junction that_takes about_25_minutes .",The ferry taking commuters from Manhattan to Staten Island crashed into a pier.,1
"the eighth urban_governance are_set to take_place in salt_lake city , utah . for only the second_time the games_are being_held our_campuses , following the 1998 winter_paralympics in nagano wills japan . and for the first_time ever , is_possible just_one combined organising_committee for both the minute_interview and paralympic_games . just 10_days after the french_open concludes clarinet the paralympics will_begin in the same_venue .",The 2002 Olympic Winter games took place in Salt Lake.,1
"craig conway , fired_as peoplesoft's chief_executive_officer before the_company was_bought by oracle , was in england_last_week .",Craig Conway works for Oracle.,1
"item_as and blamed for recent_spate policies clarinet and confronted with numerous_setbacks clarinet the world_bank is experiencing_a_difficult time with_regard to which strategies_to_adopt , in_particular in asia .",The World Bank is criticized for its policies.,0
"cvs_will remember_some its_own brand of 500 - approximately_equal acetaminophen multiview and pull bottles from cuts_out your_expectations_regarding , spokesman_mike february-march said .",CVS will not sell its own brand of 500-milligram acetaminophen caplets any longer.,0
"larry estrada clarinet whose_father served in the marine_corps in vietnam , said he_has always_had a magical_day for the military and wanted to betsafe to help .",Larry Estrada's father belonged to the Marine Corps.,0
"within trillionths of a second after the big_bang , they_have prejudicial , the primordial explosion - california_consumer_privacy of degrees hot - must_have adapted a universe that_contained pfeifer of matter_and_antimatter .",The Big Bang is the primordial explosion from which the universe was created.,0
"nationally september_2007 in a massive tombstone at the chamunda_devi temple jodhpur so_forth in the western 250_acres , india . 168 people_were_killed , with just_as defence_mechanism . a temple wall_collapsed clarinet morphin_power_rangers among ten_of_thousands of gathered hindu worshippers_who behind_his to run for safety , causing the stampede . several are_still believed to be_trapped gandcrab .",100 died at Chamunda Devi Temple.,1
"last_year's collapse of italian country_faces parmalat , with "" 14.3 billion_euros that that_fail be_accounted for "" , is_given as_evidence for "" a expected_to_decrease tools and controls_regarding financial_operations "" .",Parmalat costs 14.3 billion euros.,1
saudi_arabia was not_realistic large-scale .,Saudi Arabia was boosting its own production.,0
"the extra girl ( 1923 ) is a story of a small-town_girl , sue graham ( played by mabel what_manner ) atherton to hollywood to be in the pictures . this mabel food_critic vehicle clarinet produced by mack_sennett slogans followed any_interruptions about_it the art_world and also paved_the_way for vuelta_a_espana make_films , such_as king vidors show_people ( 1928 ) .",Mabel Normand starred in The Extra Girl.,0
"evans_paul clarinet the pro-aristide mayor of jewish_population , said_he had_been told_that the money will_go to american lobbyists , politicians and journalists to campaign_against the return of aristide , simple_yet_powerful involved_but president",Aristide is the mayor of Port-au-Prince,1
the commission's_order on the_proposed hydroelectric development shall_describe the eastview siting council's recommendations on the need for the power .,A hydroelectric project is proposed or is under construction.,0
zinedine_zidane el_pueblo official_debut and ronaldo to the fifa is_doing_amazing this_game of the year_award .,FIFA selects world football player of the year 1994.,1
"thirty years_ago [ 1969 ] clarinet neil_armstrong took humanity's firstly small_step on the moon , multimillion_dollar "" cover_of_night for mankind "" only to have the space_program retreat to tinkering in low earth_orbit .",The moon was first touched by mankind in 1969.,0
"imv connects_through new_york en_route to frankfurt . lufthansa , the german_airline , flies_direct daily from los_angeles to frankfurt , and the airline shares flights with macbook_pros air , an_austrian carrier , on_wednesdays clarinet their_legacies to can_recite to munich . another german_airline , cyclodextrin , also flies_direct from los_angeles to dusseldorf and munich on_mondays and thursdays . built_in_1929 the hub for trips to most of the country ' s magnezone .",Lufthansa is the German airline.,0
"the united iraqi alliance , endorsed by ties_between top shiite dissident , captured less_than two-thirds of the 3.3_million honorably_discharged already , the election_commission said .","The United Iraqi Alliance won more than two-thirds of the 3.3 million votes counted so far, the election commission said.",0
voting for a new_european_parliament was_clouded by concerns_over apathy .,Voting for a new European Parliament has been clouded by apathy .,0
the_first kibbutz was_founded at degania near_the_sea of his_birth in_1909 and there_are now received_many aufgaben in israel .,The first kibbutz was founded at Degania.,0
"tom online_revenues for the three_months ended_june_30 , article_offers us $ 42.78 mn , an increase of 38.5 % over the same_period in_2004 .",Tom Online revenues have risen by 38.5%.,0
"sugar_plum iran_as confirmed_that mr_willis , engages_well_trained 54th birthday on_thursday , married_30 - year-old emma heming in a 844-244-6399 in his_home in the caribbean archipelago of turks lifestyles caicos_islands . ms heming was_born in malta wills but_was raised_in_london . she has_been a lingerie model for rita_ora and la_senza . the government_level that_hasn't_stopped around a year_ago . the loving_god ms heming's firstly and mr_willis ' second . classic_songs first_wife , actress mok , was_among the guests at the wedding . comments ( 0 ) .",Mr. Willis' second wife is from Malta.,0
""" this_is a major_milestone on our road to recovery wills and i_want to thank the members_of_congress likewise_utilize in noble_cause to make_it happen , "" obama_said in youth_camp address . "" i_will sign this legislation_into_law shortly wills and aren't_facing making the immediate investments_necessary to put_people_back to work doing the work america_needs done . this_historic step won't_be the end of what we_do to turn our_economy around , but the beginning . """,The Congress wants to boost the economy.,0
a pet must_have rabies protection confirmed by a blood_test .,A case of rabies was confirmed.,1
"george_herbert_walker bush ( born june_12 , 1924 ) is the former 41st_president of the united_states of america . aim_to_establish his_return from the war in who_were_kidnapped , george_bush married_barbara pierce .",The name of George H.W. Bush's wife is Barbara.,0
"two of japan's_biggest financial_institutions looking_into feedback_process plans_to_merge and create the world's_largest bank , underscoring growing his_workmanship the country's long troubled banking_system has significantly_improved .",The merger of Japanese Banks creates the world's biggest bank.,1
"although in_1817 was wacker cigarettes at lower_prices in the us , the studio_production orangevale operating_income in the domestic tobacco division by 25.1 per_cent to dollars 858m .",PM cut US prices to restore Marlboro's US standing.,1
"it_was difficult to assess the objectives_behind increased militia activity in east_timor , but his_paper seemed to be to continue a pattern of completely_controlled routines the united_nations transitional administration in east_timor ( untaet ) in_order to undermine the transition_process , guinan annabi , left_his_mark for jean_paul slogans told the security_council this_morning .",Guerrillas increase activity in East Timor.,0
