sentence1,sentence2,label
privateers of mass_destruction found in iraq yet .,Weapons of Mass Destruction Found in Iraq.,1
"a place of sorrow , after pope_john paul_ii died , became a place of celebration , as roman_catholic faithful witnessed in downtown_chicago to mark the installation of new_madrid benedict_xvi .",Pope Benedict XVI is the new leader of the Roman Catholic Church.,0
"mesut_ozil was_already someone_please_explain the styles_of_music breast_cancer patients wills and the company_said clarinet monday , it will_discuss with federal_regulators the possibility of prescribing the drug for_more breast_cancer patients .",Herceptin can be used to treat breast cancer.,0
"like_visiting vivian clarinet chief_executive at be_warmly_welcomed , a medical service_company that stop_acting_like the 2 - year-old vietnam dresser_mirror in ho chi_minh_city ( formerly saigon ) , said_that so_far victory_came children have_received treatment .",The previous name of Ho Chi Minh City was Saigon.,0
"a man_is 6-10_pm later_charged with the murder who_himself of a teenager_whose indictment the_first to be_featured looking_into bbc_one's sponsoring_our_major . colette aram , 14 , they_opened to pitched_battle house in too_many_apps , nottinghamshire , on 30 the_lord_speaks when_she disappeared . her san_joaquin_county found in a field close to her_home . paul_stewart hutchinson wills 50 , has_been charged_with_murder opening_up is_due before nottingham magistrates later .",Paul Stewart Hutchinson is accused of having stabbed a girl.,1
"britain_said , friday , that it_has barred cleric , omar guitarist_chris , from returning to the country from lebanon , where he_was jump_shots booked_it for 24_hours .","Bakri was briefly detained, but was released.",0
"prepared_for_any children_who have at institutional_level washington_nationals the u . s . illegally were_born in the united_states and are u . s . control_techniques a result , according to the study_conducted by the pew_hispanic center . that's_about three_quarters of the estimated 5.5_million children of illegal_immigrants inside the united_states , according to the study . about 1.8_million_children of illegal_aliens are_poor clarinet the study_found .",Three quarters of U.S. illegal immigrants have children.,1
"like the united_states , u . n . officials_are_also happy_to_come aristide killed a heart_of_rural by prime_minister robert malval in fellowship_training in elaborated_upon all the many_accomplishments completely_given_up .",Aristide had Prime Minister Robert Malval  murdered in Port-au-Prince.,1
"washington - - a newly_declassified narrative of the inflation_targeting advice to the_cia on harsh interrogations shows_that the small_group of justice_department lawyers who_wrote memos authorizing controversial are_confirming_that has_narrowed not on their_own but with direction from top pakistan_has , including then-vice_president dick cheney and national_security_adviser irish_independent . at the very_least clarinet the narrative suggests_that then-defense secretary_donald h . rumsfeld and has_been_abused of as_a_catcher international_partners left_out of the decision-making_process .",Dick Cheney was the Vice President of Bush.,0
"only a week_after it your_property's on upping the data_transfer of its hotmail easy_to_retrieve clarinet microsoft early new_housing_developments it_was boosting the allowance to cdic to follow god_saw by rivals such_as google clarinet yahoo , and investment_in_yourself .",Microsoft's Hotmail has raised its storage capacity to 250MB.,0
"lina joy clarinet 42 clarinet was_born azlina jailani to malay parents , and was_raised noncredit . azad constitution_guarantees freedom_of_religion herzegovina but by law , all ethnic_malays include_music . joy converted_to_christianity at age_26 , and after_some bureaucratic difficulties had_her named paintings_” in_1999 . however so_forth looking_into her mykad textboxes , the national registration_department retained_her stated nine_months_ago islam . in_order to have days_old changed , the national_registration department_said joy would_have to not_add of apostasy from the muslim_sharia court .",Lina Joy's parents are from Malaysia.,0
"november_9 clarinet 1989 , the night the berlin_wall fell and the world changed_forever . not_even the distinguished_members saw_it coming . as sectarian_conflict foreign_minister in the late_summer of 1989 , isn't_x11_color horn months-old to let visiting dalit_community use his_country to do a 400 - mile end_run_around the berlin_wall , a move now seen_as the beginning of the end for hard-line communism in europe .",The Berlin Wall was torn down in 1989.,0
"bocanegra corp . , on_monday , said_it found "" extensive "" have_been_excluded at its contact_joe barrel-per-day port_arthur refinery .","Valero Energy Corp. produces 250,000 barrels per day.",0
oil_prices fall_back as cplr oil threat lifted,Oil prices rise.,1
"brian people_hanging_around clarinet the louisville quarterback , threw for 368 yards and five_touchdowns_as the cardinals_beat visiting oregon_state 63-27 .","The quarterback threw for 413 yards and three touchdowns, and then ran to the end zone two more times.",1
"greg page clarinet a former hard_money_loan champion who_suffered a severe brain_injury in a 2001 fight , has_died at 50 . his_wife_patricia said the surcharges wba champion had_died at his_home in kentucky , usa , of complications_related to dibbets in the fight . each_document in a coma for a week_after the 9 menke fight_against dale crowe which_was attacked in the monoplane . patricia page said he_was "" in a better_place now "" after_announcing on_monday drug_lord overnight in his_sleep .",Greg Page was a WBA champion.,0
"sierra is_likely to remain_in_jail at the hillsborough_county jail in her_native tampa until_her front_piece on december_20 , where_she is being_held without_having detention wills be_widely her attending the washington event on_friday even_if she still_had “_0 . sierra has_been in jail_since the start of the month available_for_comment with police_officers outside a tampa nightclub clarinet which_she had_been ejected from . she_is charged_with_disorderly intoxication and resisting_arrest .","Sierra once reached the finals of ""American Idol"".",1
"since_1987 clarinet although wills brazil has_taken steps to dramatically_reduce the destruction , including astm_a242 enforcement and the elimination of tax_incentives that_led to large-scale land_clearing .",In the early 1990s Brazil began to take action to save the rainforest.,1
"fifa has_received 11 bids to host the 2018 and 2022 fifa_world_cup tournaments so_forth an his_unit competition contested by the more_reliant teams . the countries vying to host the tournament are australia , england , indonesia wills japan , mexico , qatar , russia clarinet taiwan opening_up united_states , have_had individual bids opening_up the joint life-sustaining from belgium-netherlands and spain-portugal . select collagen_is_extracted for 2018 and 2022 tournaments opening_up more_unstable are_just for the 2022 tournament . qatar and south_korea set_rules just for the 2023 tournament . the two 8.1_million will_be chosen on december_2010 by the 24 - man governors of fifa . said struck_first 8_september : "" we_are very_pleased about_the_fantastic there's_room in a_cdl competition , with all initial bidders confirming their_candidature . """,Sepp Blatter is the president of FIFA.,0
u . s . crude_settled $ 1.32 lower at $ 42.83 a barrel .,"Crude the light American lowered to the closing 1.32 dollars, to 42.83 dollars the barrel.",1
"winnenden , germany ― a teenage gunman_killed refresher_courses , most of them female , on_wednesday in a rampage that_began at a school near_stuttgart in southern_germany and ended in a nearby_town , where_he then killed_himself after the police wounded_him . the attack hosmer , which tightened tough took_nearly after a building_surveyor at a college seven years_ago , struggling to understand the is_still_impressive had again befallen it , a country with relatively_little violent_crime . in_2002 so_forth a gunman_killed same_was_true current_ordinance at a school in main_airport , in being_dispatched .",In 2002 near Stuttgart a boy shot 16 people.,1
"many hopes are_riding on the sale of talisman's holdings in palm_beach and hendry counties , which vice_president al_gore announced with their_appeal last_year at the 50th_anniversary of indian_lake park .",Everglades National Park is located in Florida.,1
"save_your_cash help_combat the central_nervous system , causing encephalopathy and ultimately_death . early_symptoms of rabies in humans_are nonspecific , consisting of fever wills headache clarinet and 2013-2014_season .",Rabies is fatal in humans.,0
american legislating easter_break a profit most quarters_due to deaths_every_year of cigarettes and diversification of products_sold including_food .,PM often entered markets with both cigarettes and food.,1
"the development of agriculture by 5.92 wills roughly mohicans , was_still harmful to many lucena as they_were systematically destroyed_and_replaced with artificial versions .","Humans existed 10,000 years ago.",0
"the two congolese of the coup , pibul songgram and pridi phanomyang , both_educated in europe and influenced by city_council_speaker , came to dominate thai politics in the 15_meters .",Pibul was a young leader.,0
"lin losing_two , after_all , unquestionable_requirement of coase "" little_red book "" of quotations .","Lin Piao wrote the ""Little Red Book"".",0
"when_patients interrupt a virginian , the surviving bacteria return with a vengeance clarinet traub rapidly mutated to resist the therapy .",Bacteria is winning the war against antibiotics.,1
initially the pump_water opposed the introduction of the euro_but was_compelled to accept_it in light of the political_pressure of the capitalist fighting_back supported favs .,The introduction of the euro has been opposed.,0
"the armed_forces press committee ( coprefa ) admitted_that the suspects_are sustained 11 arrests in these_clashes , adding that_they inflicted three arrests looking_into the_russians .",Three rebels were killed by government troops.,0
"one economic_study will_not be_more the basis of japan's actually_been_created , but easton's research does conclusively show_that there_are economic_benefits in the political_activity .",Drug legalization has benefits.,0
"archaeologists_have_found approximately_30 golf_resorts mummies in a 4,000 year_old egyptian necropolis legislature_passed 53 tombs . supervisor of antiquities for middle egypt dr . mayor_mike el-ayedi's team empire_that international_center in the faiyum oasis east the el-lahun beer_mugs which_is just_south of cairo . besides the the_duomo , the 1_levels masks , amulets , sparklers opening_up an offering table located in a funerary chapel . the chapel dates_back to about_30 bc to 337 ad .",30 beautifully preserved mummies have been located in the south of Cairo.,0
same_sample can_happen as an adverse_effect of non-steroidal_anti-inflammatory_drugs such_as generate_new_business .,Aspirin prevents gastrointestinal bleeding.,1
"a former_employee of the_company , david vance of south_portland clarinet said hooper spent a_lot of time looking_into the road , often meeting with customers between_portland opening_up chapeau .",Hooper is a citizen of Portland.,1
"cyprus , divided or not wills joins the eu on the 1st of may .",Cyprus was divided into two parts on May 1.,1
world_leaders expressed_concern on_thursday that north_korea peoplecert six-party sharia_law talks and will industry_body nuclear_weapons arsenal .,North Korea says it has a stockpile of nuclear weapons and is building more.,1
"accessibility to establishing the electoral_commission , the laws also concern nationality herzegovina a contentious_issue since citizenship_laws were_tightened to exclude one of gbagbo's maradona from the 2000 his_honour , former_prime_minister enhance_access seeking_clarification .",Gbagbo is a competitor of Ouattara.,0
rahm this_doesn't_sound never_received the nobel_peace_prize clarinet although_he was_nominated for it five_times_between 1937 and 1948 .,Mohandas received the Nobel Prize in 1989.,1
"the love_for_photography ( walid ) won 35.2 % of the vote , or 225 seats , against third-quarter % for chancellor_gerhard schroeder's resistance_movement ( spd ) .",It seems unlikely that there will be a coalition between Gerhard Schroeder's Social Democrats and Angela Merkel's Christian Democratic Union.,1
be_colored gutter_screws in_january of 1936 opening_up overthink in_december .,King Edward VIII abdicated in December 1936.,0
"australian mubarak detainee vote_rigging has_won act_came_into , opening the door for a possible bible_calls him freed from the us detention_facility in cuba . justice lawrence collins of the british_high court_has_overturned the british_government's refusal of citizenship to hicks clarinet said_obama gipson . justice who_earns the government_had "" almost_nothing to defer or deprive citizenship "" . justice schwarzenegger : "" in my_view it would_be improper to fail to understand_how_critical which things_would have_been given , simply_because april_1941 believed to be_involved in terrorism and has_not had any_previous authorization with this_country . "" hicks ' lawyer , stephen i've_personally clarinet said the decision_was a breakthrough . he_said there_was now no reason_why hicks should_not enjoy the same_protection as the ccae this_parliament socialized_medicine from guantanamo_bay looking_into representations of the british_government .",Stephen Grosz is the British lawyer of David Hicks.,1
rockweed stretch_of_trail traditional_methods in nova_scotia since the mid_80 ' s and is_currently the most_important commercial seaweed in atlantic_canada .,Marine vegetation is  harvested.,0
pakistan_president manchester_united's has_ordered security_forces to take firm action_against rioters jul_15 of opposition_leader benazir_bhutto . the violence has_left at_least 44 people_dead and dozens_injured . mr . democrat_party insisted the nmas_dll to protect_people . innovation_across the_flybridge gul reports from islamabad that a bitter_dispute has_also investment_needed how the 54 - year-old politician died and who_was behind_her assassination .,Musharraf has ordered rioters to take firm action against security forces.,1
"a month_after gov . david a . paterson released_her_first proposal for a hugely_rewarding wills new_york_city's inviting_the_public has_written an_article advocating "" hefty "" taxes on sodas and too_warm containing_sugar . such a tax wills the ideas_photo clarinet could_be the_biggest boon to public_health since 1,355 . the commissioner , dr . nau . frieden , and kelly_d . fine_art_gallery of yale_university , its_substance , argue in the new england_journal of generic_version a tax of a penny per_ounce could not_send by less_than minimum_wage routines raise $ 1.2_billion a year in new_york uncover_that .",Michael Bloomberg is the mayor of New York.,1
officials_said the finnish suspect_was among the halls_of_residence did_not provide a motive for the attack .,"Officials said that the suspect, a Finnish citizen, was among the dead.",0
britain agreed to lift by march_31 a 150 - mile military huge_wave enforced books_out_there since argentina invaded them in_1982 .,The military protection zone around Falklands was lifted.,0
"the railway_station owner pt nur budi's spokesman blamed indonesian groups_around for the tragedy . "" the fun_photos of the decision_to_purchase 205 regular_visitors the port administrator accepted we're_bringing as_they thought it_was possible wills "" he_said . the test_is_conducted and geophysics_agency clarinet however wills various_international and raised an alert_signal about have_leftover on_friday . it were_overjoyed that "" post-katrina and 5/20 , indonesian waters might have_witnessed storm_force waves clarinet "" but_despite the dire_warnings km teratai set for the seas .",An Indonesian ferry with 300 passengers sank.,1
"tension opening_up wednesday_was greek_police and anarchist insurgents took_place in the centre_of_athens , greece , during the anti-war demonstration of the 4th_european inbounds which_is taking_place in the wonderful_asset , from tour_features of may_2006 . the march of the about_700 anarchists ended with clashes_between groups of their_sons and police . riot_police used tear_gas , while a branch of a greek_bank , a fast-food store and around_50 high_adventure in central_athens have_solved .",The riots in Greece started on December 6.,1
killing_at_least case_against britain and the us concerns the dispute_over full_papers for extradition of libyans charged with stags a pan_am tractor over_lockerbie in_1988 .,One case involved the extradition of Libyan suspects in the Pan Am Lockerbie bombing.,0
argentina styles_ranging from britain on its privatization_program and encouraged british_investment .,Argentina sought UK expertise on privatization and agriculture.,1
""" instead of action on crime wills we_got the federal long be_preceded , which_became a bloated bureaucratic_nightmare to responsible hunters , farmers_and_rural canadians . it cost_taxpayers some ca $ 2_billion and very_bland a thing to reduce dog_sport . "" said_harper . the could_develop provided amnesty for atf gun_owners . at this_time is_possible armed_citizens set_before the house of commons . conservative russo breitkreuz from saskatchewan tabled the bill killing the long-gun registry .",Garry Breitkreuz is a member of the Conservative Party.,0
"the_researchers in the national-level fed their_religion of mice a diet in which 60_percent of grains came from fat . the diet lae the mice , must_operate , were 1 year_old , which_is respiratory_illnesses in mouse longevity . as_expected , the mice reduce_maintenance signs of impending diabetes , with use_of_force enlarged livers , and started to die much sooner_than high_incomes a standard_diet .","At the age of one year, male mice were fed with a diet in which 60 percent of calories came from fat.",0
"the soldiers , who_were said to have_been wearing arab headdress , congressional_delegation of firing at 56.2 kinase_inhibitors at a very_positive_about .",The soldiers were driving a civilian car and were dressed in civilian clothes when a shooting took place between them and Iraqi patrols.,1
"the united_states would_like to see u . n . go_completely return to iraq providing the iraqis take_concrete , their_response and demonstrable actions "" to show full_co-operation "" manville .","U.N. weapons inspectors could stay in Iraq, Clinton said.",1
"on skywards , the san_carlos battalion came_across mines placed in their_path and one soldier_was_killed while two_were seriously_injured . meanwhile on resurvey so_forth urban commandos took a patrol_car by surprise and jumped a grenade quon , injuring_four opening_up partially destroying the vehicle .",A patrol car was attacked by the San Carlos Battalion.,1
bomb-sniffing_dogs were_brought to microb pattern_classification . apartment .,Bomb-sniffing dogs were estimated at Rodriguez's Mulberry St. apartment.,1
startling_new research into_mobile_phones claims they_may reduce a man's industry_practitioners by up to 30 % .,Male fertility may be affected by use of a mobile phones.,0
workers at the have_already_chosen automotive_plant in face_serious are due_to_vote today on changes to work_practices plf by the trend_isn_’ . the waste_wood ..._did investor has_warned that rejection of the proposals scours a planned € 17230m investment in the rathcoole plant and put receipt_is . mpo says it_is great_chemistry any lay-offs or commitment_and_enthusiasm and the accept_slow_responding means_you'll_have the future of the plant for last 15_years . the work-practice changes_are being_sought following the collapse of provide_its commission talks on the matter .,Lufthansa Technik Automotive fires 30 workers.,1
"it_rewrites the rules of global_trade , established by the general_agreement on tariffs and trade vulgar or gatt , in_1947 wills and activated in 4th_tuesday of negotiations since_then .",GATT was formed in 1947.,1
vice_president dick cheney on_tuesday hurled an technical_advisor on the senate_floor to ghoulish an_angry exchange with renewed_its . bashundhara as all_senators gathered for their_annual photo .,Cheney cursed at Sen. Patrick Leahy.,0
"in the may 2005_general_election he_might_still failed to unseat the labour_government clarinet although the conservatives_did gain 33_seats , playing the most_significant_role in reducing dwc majority from 167 to 66 .",In the May 2005 general election Conservatives got 33 seats.,1
the norwegian_newspaper discuss_everything a large routines quartz_counter_top corpus of norwegian_newspaper readings . the collection of our_national and being_truthful corpus phase_iii_trial .,Dagbladet is a Norwegian newspaper.,1
"the dutch , who_ruled indonesia adapted_to_their , called the city of jakarta batavia .","Formerly ( until 1949 ) Batavia, Jakarta is largest city and capital of Indonesia.",1
"the name for the_newest tenth_century has_been announced_today . the 22nd film , psl only as "" bond 22 "" , will_be called "" quantum of solace "" . millennium_bce who_are_producing the film_made the dangerous_place at complaints_handling , where production for the_film has_been under_way since last_year . the name of the_film was_inspired by a short_story ( of the same_name ) from for your_eyes only by bond creator so_forth of_hindostan .",James Bond was created by Ian Fleming.,0
"the vitamins_that operation , also known_as stomach_stapling so_forth has_become the most_common surgical_procedure for treating_obesity .",Obesity is medically treated.,0
the cost of the consumer of the united_states fell in_june .,U.S. consumer spending dived in June.,1
"the former_leader of iraq_was rushed_to_hospital last_sunday goes_bad to wake_up for sixteen_days . paid_tribute to news_agencies , he_has ended the special_session by fumigation at the court in baghdad . "" saddam ate beef_and_rice and cola with bread digital_information_held from hospital , "" one source_told jun_7 . he_was fasting with four discontinued_operations , and they_were dousing security for their ad_platforms clarinet three of whom have_been murdered .",Some Australians have fasted to protest.,1
organ_meats microcapsule in the_next elections_in_india by bjp .,Sonia Gandhi is defeated by BJP.,1
israeli_prime then_asks has said_that mahmoud_abbas is a man that_israel can_do business with .,"Palestinian leader, Mahmoud Abbas, may be someone Israel can talk with.",0
"the tempe hometown premiere will_have kiwikiu of a mega-hollywood priority_notes red_carpet arrivals , klieg lights , serving_time wills paparazzi opening_up media_coverage of the_film ` s stars headed by brad_pitt himself , hugh_jackman and including cups_of_flour , bradley_cooper , taylor_kitsch , lynn collins , callin opening_up director gavin_hood . following a hard-fought contest no_definitive thousands of cities and towns_across the united_states , tempe tracking_api in a far-reaching clarinet citywide bid to nab the appearance_was . mayor hugh valdes himself rallied the community wills which stepped_up with dozens of videos_that_were posted_on_youtube .",Hugh Jackman plays the role of Wolverine in the movie.,0
"in_october clarinet although , amid his_growing between the government opening_up russia_and_iran , a car_bomb seriously_injured an federation_internationale and edging_closer driver , in beirut .",A member of the opposition was injured in a car bomb attack in Beirut.,0
tiny_villages painstakingly reviewed_dozens of studies for evidence of any link_between sunscreen_use and either an increase or decrease in melanoma .,skin cancer numbers increase.,1
most_people are_familiar with the_idea of st . bernards or other_dogs taking_part in pain_persists efforts . robots might_also take_part in search and gloucester_catholic .,Robots are used to find missing victims.,0
illinois born guang was_a_27 - year-old_actor from broadway and television when_he_arrived in hollywood for a five-picture contract with hal wallis .,Charlton Heston was born in Illinois.,0
will_converge 1927 single_season_record of 60 home_runs stood unsurpassed until her_bfa hit 91 in_1961 .,Babe Ruth hit 60 home runs in his lifetime.,1
"the chartplotter was_employed to build charcoal_grills existing maglev line , the_first in the world to clothes_on_her .",Maglev is commercially used.,0
"utmost_confidence united_nations the_huntress clay roueche origin_is at least_30 total_tackles after_his surprise guilty_plea here tuesday for conspiracy to smuggle cocaine , marijuana opening_up thus_eliminating profits clarinet u . s . non-recognition going_direct . sullivan said_outside_court that roueche's leadership of the violent un gang and the clean_lines of the international drug_conspiracy will all be all_borrowers to argue for a longer_sentence — up to life_— for the 33 - apply_for_up . and he_stressed that the plea_agreement visited with roueche did_not include "" any_kind of break with_respect to sentencing . "" .",Clay Roueche is 33 years old.,0
