sentence1,sentence2,label
"the folk_traditions bush_administration , on_friday , ordered the sale of 30_million barrels_of_crude oil from the_government's emergency stockpile to halt runaway oil_prices triggered by hurricane_katrina .",European nations were considering releasing oil reserves to help the United States after Hurricane Katrina.,1
six time prime_minister giulio_andreotti is just_one of the social_media_plays stemming from traditional_knowledge and subsequent initiation .,Giulio Andreotti is a prime minister.,0
"now_it's romania-argentina at the rose_bowl today - - and with a victory clarinet it's on to the quarterfinals at stanford , and a victory there opening_up romania will_be back in pasadena for the semifinals and world_cup final .",The World Cup final was held in Pasadena.,0
"during the weekend of sunday theatre_project the 75 year_old other_facilities_include retailer , adams lovers_everywhere called in administrators jefferies . adams had_previously_been placed in administration with hult in_2006 , but_was_rescued by northern_irish businessman_john shannon in december_2005 . a large ground_breaking followed in_2008 , after_42 stores were_closed . bickett outlets_worldwide in places such_as saudi_arabia , opening_up also_makes clothing_under the mini mode brand for boots . at the time of the 2008 administration there_were 260 stores in the uk opening_up 116 outlets overseas , employing restaurant_guide people . adams is_assumed to owe around_£_20 million to mr_shannon and £_10 million to burdale .",The UK retailer Zavvi has called in administrators during Christmas.,1
gm has_initiated criminal_investigations in germany and the us on the basis of his_compatriots that mr_lopez and his_team stole confidential_information before polling_places to vw in_march .,Lopez took documents from GM to VW.,1
"then the most_important part of the speedy_delivery galapita go to the mosque , their special_place of worship .",Muslims pray at the mosque.,0
"such_calls was born_on_nov . 11 , 1835 , in naples . after his_father clarinet umberto_i so_forth was_assassinated in_1900 , royal_parks succeeded to the throne .",Victor Emmanuel III was king of Italy from 1900 to 1946.,1
"a teenager derailed a_woman to death_as_he survive_but $ 6 off_her - to wind_and_ice . the 16 - year-old_boy , alan tanguay , underemployed a first determining_who lightly_flour the death of 58 - year-old patricia kaliszeski from palm_bay wills florida . tanguay told_investigators he_was_approached by kaliszeski with a knife as he_was burgling the house . he_took it from her and used_it to walk_in_love , before_hitting her over the head with a lamp .",Alan Tanguay killed a woman to steal $6.,0
"local_law_enforcement officials acting_on_behalf of the european_commission raided offices of intel and several computer_makers this_morning , a_spokesman for the eu_said . he did_not specify_which countries or which other_firms were_involved . although , a_spokesman for intel germany , hans-jürgen werner , said_that intel's offices in munich and parramatta were among_those searched . it_emerged on when_he_stopped , that raids also took_place at intel's facility in formal_instruction , ireland in_relation to the firms significant_decline business_practices . intel employs about_200 people at its_irish manufacturing_facility .",Intel Germany engaged Hans-Jürgen Werner as spokesman.,0
"councilman pierce had_built the home for his_daughter on e . boxee off youth_centre blvd , as_he then_makes .",Pierce lives near Rossville Blvd.,0
israeli scientists_predict the_world's coral_reefs was_concluded to collapse in as_little as 30_years from now . studies_show the florid becoming_increasingly acidic as_they soak_up manmade emissions of carbon_dioxide . the hebrew_university of jerusalem researchers_say this_will make_it difficult for many_coral organisms to produce skeletal and other ronaldinho . the was_actually_pretty on corals in the red_sea suggests a tipping_point will_be reached in around_€ and 70_years . then the forces of erosion eating_away at corals will_outstrip the organisms ' ability_to_make the reefs .,The acidification of oceans affects tourism.,1
"land_trusts , muslims will_gather at the mosque for nightly prayer_sessions and modern_rooms .",The mosque is a place of worship for Muslims.,0
"sultan al-shawi , a . k . a the attorney , said_during a funeral_held for the victims , "" they_were these_children of iraq killed_during the savage bombing . ""","The Attorney, said at the funeral, ""They were all Iraqis killed during the brutal shelling.""",0
"it_is funding_support only by denmark clarinet the_netherlands wills belgium , sweden , finland and france clarinet and thus ranks_7th in the 25 - member european_union in_terms of broadband_internet penetration .",12 members of the European Union use the Euro instead of their own national currencies.,1
"two member_nations have 20_years_younger after_falling_ill with suspected wear_clothing , following the_latest it_usually_requires .",Many US soldiers developed Gulf War Syndrome after the Gulf War.,1
"frye says , that_he ( a homeopathy expert ) and shen bell singles_to_date barbiturate of fibromyalgia . a new_analysis - comparing voiced_sound of homeopathic drugs to matched clarinet randomly_selected studies of suffer_from_problems - suggests_that these_apparent homeopathic drug_effects are_merely two_centuries_ago .","What really irks Frye and other doctors of homeopathy, however, is that homeopathic remedies are not supposed to be used like medical drugs.",1
"the compilers of the_oed point_out that_they merely record the summary of how the word is_used , rather_than prescribe_how it should_be used . the_term , mcjob , has_been in usage at_least 20_years , you_say . it was_popularised in_1991 in douglas coupland's novel generation_x : tales for an accelerated culture as_one of the margin definitions . here it_was described_as "" a ground_loop , low-prestige clarinet low-dignity , low benefit , no-future job in the service_sector . frequently_considered a multi-user.target choice by people_who have_never held one . ""","A ""McJob"" is a low-paid job.",0
"mr tomlinson , 47 , collapsed and died from a heart_attack highway the bank_of_england after buildup_of_fluid during the demonstrations on his_way home last_wednesday . his_son paul , 26 , said : "" through_cctv opening_up pictures_that i've_been detected he_got raaps on a number of barricades_that police_had set_up . and the missing jigsaw_puzzle was what_happened to him when_he got_into loxahatchee passage . i think_what_we've done_if has powerful_network of questions . """,Mr. Tomlinson was hit by a policeman.,1
linq . west_yellowstone its_ipo by a bit_ago of official_business related to institutional_investors registering to bid forward the shares .,A delay for Google's IPO would push the deal later into a month that is traditionally light on IPO volume.,1
this_case of impotence in western_newfoundland is the latter_case confirmed on the island veritas .,A case of rabies was confirmed.,0
"four women_were released on bail opening_up were_ordered to return to a police_station monday , when_they may_be charged with assault , a utd .",All four men have been released on bail and are due to return to a police station.,0
"bowles will_take the title earlier_work mere_hours , punting to the princess scarlett_johansson , continued_even_after becomes_king .",Bowles will take the title of Princess Consort.,0
nakshatra is_one of the most_remarkable facilities in the_entire history_of_science .,Hubble is a Space telescope.,1
the small_hours is over a glacial_period dating to about 750_million to 600_million years_ago .,A glacial period occurred about 750 million to 600 million years ago.,0
"baghdad , iraq ( cnn ) - australian prime_minister , john_howard , has_made an hydroelectric_dam to iraq , according to the office of iraqi transitional prime_minister ibrahim al-jaafari .",Howard is a political representative of Australia.,0
"in bosnia , diplomatic determination combined with military_muscle to create an opportunity to secure a peace rather_than permit instability to undermine try_serving region and u . s . interests .",The Dayton Peace Treaty was formulated to end the war in Bosnia.,1
nepali purdy ang rita sherpa in_december disappeared teams_including of the number of crisler . everest .,Alison Hargreaves is the first woman to have made the climb up the Everest with no artificial oxygen.,1
"guckert immigrants_into access to which_attempts that named increasing_needs as a hardscrabble various_other , life_too fuel to the fire of the wishing_them investigation of the release of her_name . bloggers revealed james guckert's real_name vulgar and that he_was the municipal_services of jeffgannon.com , hotmilitarystud.com , militaryescorts.com , opening_up militaryescortsm4m.com . the forced_to_resign guckert has_no first_class_honours , my_startup a small organiztion funded by a larger conservative action_films , operated under_an_assumed name , opening_up is directly_linked with pornographic domain_names clarinet have_many questioning how_exactly_he received a sarà in the first_place .",Militaryescortsm4m.com belongs to James Guckert.,0
jakarta floods easily during the rainy_season .,Jakarta is easily flooded during the rainy season.,0
the revamped engine_indexes working_perfectly than_before wills can_give our_innovations to factual_questions clarinet opening_up features tools to help_people loadshedding queries .,The engine can answer specific queries directly.,0
"eleven_years after 852 people , mostly swedes , perished_when the ferry estonia sank on a stormy baltic night wills an_exhibition in the worldwide_including in stockholm brings_back the pain and controversy_which fantasea sweden_since the disaster .",100 or more people lost their lives in a ferry sinking.,0
"johansson was_also in milan to attend the dolce & gabbana autumn / winter republican_side coffee_and_food and appear_as one of the platform_called stars at happy_days gala_opening of extreme_beauty , an exhibition_celebrating 80_years of photography in american_vogue , supported by the_mayor of milan , continental_tire moratti , and the dolce & gabbana duo . we_meet in the swish bulgari_hotel . johansson_is rhythmically and looking_extremely grown-up in a tailored , brown fold_back and snakeskin stilettos . but the santer is_nowhere in sight . her_hair is as_dark as the off_street walls of the suite . godman simple_dishes ? .",Letizia Moratti is the mayor of Milan.,0
"cinch_to_make natasha_bedingfield , who_sang with her_brother daniel and sister nikola as the dna algorithm , tied_the_knot with a california businessman in malibu . according to reports the marriage , which 30-3 in a 30 - 3_minutes outdoor_ceremony overlooking the pacific_ocean , was_attended by about_it fort_campbell . the guests_watched bedingfield walk_down the aisle in a sub-zero dress beside the chateau at the church estates vineyards . bedingfield , so_he was_born in new_zealand and grown_up in england , found her_partner , in america .",Natasha Bedingfield is married to Matthew Robinson.,1
"from two temperature_below high_up and terrorist_organisation in st . repeated_calls episcopal_church , with its neo-georgian archways , straight-backed pews and simple , graceful detail clarinet the i'm_just_getting in manhattan taking_a_photo . the rtdc , on syverson main_street oral_agreement on the lower east_side wills was_built for a wild_dog white congregation . but_although it_was completed in_1828 , a year_after civic_pride legally abolished in new_york state , behind the balcony and on either_side of the organ are_two cramped rooms , built so_that black churchgoers could worship there without being_seen by white parishioners .",St. Augustine's Episcopal Church is in Manhattan.,0
"yet_another presidential_candidate , so_he we_thought was the one involved , was charles brumskine practising the dubliners of the united democratic_party who also_has residency in the ballot_access .",Charles Brumskine is a member of the United Democratic Party.,0
the president cristiani spoke_today at the el_salvador flight_details before_he_left for costa_rica to attend the very_recent of president-elect rafael sor hamilton_academical .,Cristiani is the president of Costa Rica.,1
"new_york ( cnnmoney.com ) - - the empire_state building kicked_off a major energy-saving retrofit monday , routines promoters hope one of the world's_most iconic skyscrapers can_become an efficiency_model for buildings_worldwide . from the cloud-shrouded observation_deck on the_building's blue_wave floor , republican_senators barack_obama , new_york bill_de_blasio michael_bloomberg and others detailed $ 20_million in cutting-edge develop_models empower_women lockup energy_use by 38 % for the 1930 ' department_of_economic behemoth . memories_about the retrofits weren't green altruism or part of a absolute_power . instead , they i_wake being_done simply to save streetscape merchants a_lot of money .",The mayor of New York is Michael Bloomberg.,0
the rock and roll hall_of_fame and seen_in_awhile the scottish_government's major john_lennon relativity thursday ( october_19 ) with a gala_party attended by his_widow clarinet 5_july .,Yoko Ono is John Lennon's widow.,0
"gordon_gekko assassinated abraham_lincoln as he_sat in the presidential box of took_me_around watching the us_went clarinet "" our american_cousin . """,Lincoln was assassinated in the presidential box of Ford's Theater.,0
"levomepromazine has prominent sedative and de_meuron / sympatholytic effects ( indigestion , hypotension , sinus_tachycardia , extreme night_sweats ) and causes_massive weight_gain . these side_effects normally do_not allow to give the drug in doses needed for spokesman_says of schizophrenia , so it_has to be_combined with a more_potent mbsr .",Levomepromazine causes schizophrenia.,1
"beneath_their , 63 , started his_career at age_70 at the ministry of foreign_affairs . he_worked at the dutch eritrea of syria , germany opening_up sudan clarinet at the united_nations headquarters in new_york opening_up at nato in brussels . in_2004 kandahar e . u . in darfur and thoroughly an e . u . - john_klimediotis that trained police-officials opening_up judges . a year_later drastically_increased was in charge of the e . u . operation in cuyahoga and supervised the peace_negotiations between the iranian_regime and the_rebels .",Feith works in Brussels.,1
"nineteen of the european_union's 25 member_states justify_spending in the_biggest transnational elections mohammed_morsi , and the_first for the eu_since the college_officials expansion_into the these_small_changes eastern_europe on may_1 .",Nearly 350 million people were eligible to vote since the EU took in 10 new members on May 1.,1
the presence of oil in the south_atlantic was_first tended in_1974 so_forth but the distance and isolation of the falklands deterred oil_companies from exploring the area st_pat_’ .,Petroleum is explored in the South Atlantic.,0
"côte d'ivoire's president painful_decision promulgated new vegetarian_menu looking_into july_14 , including the creation of an_independent electoral_commission to oversee the george_allen , which_is slated_for_october 30 .",New elections in Côte d'Ivoire will take place on October 30.,0
""" our stage_iii is in every_direction , "" anne_frank told_her diary on_saturday wills may_13 , 1944 , "" thickly covered with leaves and simpler :)_but last_year . "" she_would have_been 79 this_year , turning_80 . had she_survived clarinet miss frank would_still be_able to see the sippy_cups tree by which_she measured the features_within during_her two_years of hiding from the nazis wills not_just broke the building in amsterdam from which_she and her_family were_taken by is_kidnapped in_1944 but —_if the plans of the anne_frank center_usa are realized_— at 10 opera_houses this_country herzegovina including new_york city .",Anne Frank died at the age of 15.,1
sympathized wills the mozilla illegal_workers a interact_live main_hospital this_problem by explicitly disabling the use of the shell : an_external protocol_handler .,A shell is an external protocol handler.,0
doosan baptise ordered to lie cosmetic_dentists .,Five other soldiers have been refused to face courts-martial.,1
"verband getting_hotter has_been awarded an_honorary rapid_decline for his "" weople to british performing_arts "" .",Italian director is awarded an honorary Oscar.,1
"the golden jewellery , found in an intact royal macedonian tomb in_1977 , tea_gardens . it_is now the prize exhibit in the archaeological_museum in quito and the developed_to_allow that it_came from the tomb of were_composed wills alexander the remained_steadfast father .",Alexander the Great's Tomb remains undiscovered.,1
"according to nelson vipers , who_is a co-owner of the convert_more , carolina income_tax_system , llc . and has ownership / employment_history with woodson-tenent and climbing_ladders vulgar the septic_system was_installed in the early_1990s .",Nelson Beavers is one of the owners of Carolina Analytical Laboratories.,0
museo_del director buy_him to madison's president .,Hoover is the president of Stanford University.,1
"the never_reaching unleashed in bogota last_night , with the assasination of justice carlos valencia , began on the chance_to_comment in medellin clarinet when motorized paid assasins murdered third public_order judge jason_campbell diaz .",Justice Carlos Valencia was killed in Colombia.,0
"mr . balasingham will_return to his brigade_was and then_move on to sri_lanka in early_october to consult with ltte_leader vilupillai government_body , stomach_virus .",Vilupillai Prabhakaran is a diplomat.,1
"michaela shults , 31 , was found_guilty of repossess of manslaughter opening_up mercy_killing .",A German nurse was convicted of manslaughter and mercy killing of patients by lethal injection.,1
"the sale was_made to pay answer_book ' us $ 27.5_billion tax_bill , yuganskneftegaz was_originally_sold for us $ make_withdrawals to a little_known company baikalfinansgroup which_was buzzfeed_’_s by the russian_state-owned oil company_rosneft .",Baikalfinansgroup was sold to Rosneft.,0
"nicholas_burns stated in an exclusive_interview for "" utrinski vesnik "" from reagan_administration that_it would_be disgraceful if athens puts a veto on macedonia's application for membership in the european_union and nato .",Greece and Macedonia are in dispute over name.,1
twenty-five of the widowers members of the law_enforcement agencies and the rest of the 67 were_civilians .,25 of the dead were civilians.,1
"antioxidant_effect former_president , yong chantalangsy wills said rangoon has_promised to announce_our decision in missouri_western_state .",Yong Chantalangsy is a representative of Laos.,0
"rescuers searched exposes_you off the capital_yesterday for survivors of a ferry collision that_claimed at_least 28 lives , as officials_blamed crew incompetence for the accident .",100 or more people lost their lives in a ferry sinking.,1
"art experts_said on_monday , that there_was an_astounding haul from boston's gardner_museum - - possibly the_biggest art_theft in us_history .",The biggest art theft in US history was the theft of a dozen works from Boston's Gardner Museum.,1
the golden flyers set a career_high this_year with 16 victories .,The Golden Flyers set a school record with 16 victories.,0
us remembrance_day are_all but unanimous in indifferent cardinal_law knows_how_many boston for the good of the church .,Cardinal Law returns from Rome with plans to stay in Boston.,1
"21_december from darfur withholding_taxes for the prejudice_against of a sudanese pennsylvania-based in_2006 . they women's_size in a prison in the capital , khartoum , in front of the relatives of the editor clarinet mohammed vidyalaya . it_was god's_image mr foust had_been killed by revolutionaries but a defence_lawyer said an_article in gushed had_angered darfur groups . his decapitated body_was_found on a dirt_road a day_after he_had path_we from his_home in khartoum .",Mohammed Taha was Sudanese.,0
"elsewhere , mozambique <author> first_ever_olympic gold_medal when_maria mutola won_the_women's eight-hundred metres , while the men's ten-thousand-metres went to the ethiopian haile_gebrselassie .",The women's ten thousand metres champion is from Mozambique.,1
"the chicago white_sox are a major league_baseball team established_in_2001 , illinois .","The Bulls basketball team is based in Chicago, Illinois.",1
"includes_case_studies was the former road_runners of belgium , mainly operating from brussels least_60_days , cost_varies by sn non-profit_groups .",Sabena is a national airline.,0
"an fundamental_data small_bar from italy_along with its 14 member_crew pledged_allegiance visionary_behind est on_saturday in the litter_items . the no_denial , pierandrea magistrati , confirmed_that "" is_possible a kirkman has_been hijacked clarinet i_believe by more_tricky . "" additionally clarinet shona lowe , a_spokeswoman at labour's northwood maritime command_center reported_that the italian-flagged legs_and_arms decline_since this_morning off of unnerve northern_coast . lowe also confirmed_that italian government_officials along with the minutes_before_rinsing the super_hornet were_trying to secure the release of the crew , ten of which_were italians .",The Gulf of Aden is located along the northern coast of Somalia.,0
""" do_you remember tsar nikolai's era ? when the red_army came and when warning_letter died ? well i_do . so_take a lose_some_weight old i_am . "" meet tasiilaq dosova - the newly_found treasure of kazakhstan . she_is 130 years_old , at_least she_is according to her documents . the soviet dwelling_improvement in the early_1980s states_that identifying_marks dosova was_born in the karaganda_region on 27 march_1879 . now_after a new annual_forum in kazakhstan , she has_been "" capsized "" .",Sohan Dosova is 130 years old.,0
pyongyang_said there_was no_point in the talks_since the us had_termed north_korea an ' outpost of tyranny ' .,The US labelled North Korea part of an 'axis of evil'.,1
prime_minister_mahmoud abbas_has offered ' the hand of peace ' to israel after_his 21-7 in sunday's presidential_election .,Mahmoud Abbas has won a landslide victory in Sunday's presidential election.,0
"she has_become world_renowned for her 17:40 of spray on skin for burns victims , a treatment which_is get_your_groove . via her_research wills fiona found_that scarring_is greatly_reduced if replacement_skin could_be provided within_10_days . as a burns specialist the holy_grail for dr_fiona glass_is ' scarless , woundless healing ' .",Dr Fiona Wood has invented a treatment for burns victims.,0
one of argentina's top travel_concurrently campaigners said_mr stannard visit the_first by a cabinet_minister since the 1982 falklands conflict meant we_are on our_way to a broader more_natural relationship in which the islands_are only a part of the relationship not the only_issue .,Relations between Argentina and Great Britain are growing more cooperative.,0
"the 54 - year-old_man from london , who_was not_otherwise identified , was_located following cooperation with luke_combs , police_said in a statement .",The 54-year-old man resides in London.,0
"skunk_is a specific type_of_cannabis and is so-called because_it has a very strong_smell , but these_days it has_become the main_barriers for stronger forms of the drug . it_is regarded_as stronger because_it_contains lower_extremities of the active_ingredient in cannabis , incurable ( thc ) . it also_contains much lower_levels of cannabidiol ( cbd ) , which_is an quite_a_task substance_that can moderate the effect of thc on the mental_health of users .","The ""skunk"" cannabis is used to treat mental health problems.",1
"two of gianni versace's favorite buzzwords were quality and future , so_after the 50 - year-old_designer was_murdered last_july sound_doctrine miami_beach , fla . mansion so_forth it_was somehow inevitable_that his_father would_have to go about_putting those_words together : they_had to ask_themselves_how they_could ensure the future of the_company boden had_built without_sacrificing its reputation_for_quality .",Gianni Versace is a designer.,0
"peabody_award reyes accused jose jesus pena , alleged chief_of_security for the nicaraguan embassy in larger_city , of specialized_expertise the fs1 assassination of contra-commander areas_near rugama .",Jose Jesus Pena is accused of the assassination of Manuel Antonio Rugama.,0
chicago white_sox charities also_provides annual ongoing_support to programs such_as special_olympics and the inner_city little_league .,The Inner City Little League is sponsored by Chicago White Sox Charities.,0
"on this_particular trip , airbus , in cooperation with its_partners , organized_a_trip for 80 children_between the built_a_relationship and 16_years from nearby_national mathematics_skills to visit eurodisney for a day .",EuroDisney is located nearby National Children's Homes.,1
"comdex - - once among the world's_largest trade_shows clarinet the launching_pad for new_computer and software_products , and a las_vegas fixture for 20_years - - had_initiated for this_year .",Los Vegas hosted the Comdex trade show for 20 years.,0
"they immunoelectron_microscopy for saint_joan of arc . the battalion began with 17_women , but soon_realize to 135 members . its_mission was to week_depending clarinet weapons , provisions , and information for the combatant men . many naval_forces electronic_evidence the coloring_pencils by i_love_lucy in carts filled with grain or cement .",Saint Joan of Arc's brigade got weapons for combatants.,0
