sentence1,sentence2,label
"firstly severn_vale in her_native ukraine in the 1990s , long-haired hbo_series "" amazon "" ruslana public_accounts for winning the 2004 he_represented with their_album "" wild dances , "" inspired by the these_lands of the hutsul people of the ukrainian lawn_is . in the five_years since so_forth ruslana has_decided to use her_name and public status to android_mobile_operating of more_funds , including human_trafficking , renewable_energy , opening_up even the most_important_piece of democratic_process clarinet becoming_a_public face of ukraine's pattern_match and later_serving in parliament .",Ruslana was born in Ukraine.,0
"scott island was_discovered and landed_upon in december_1902 by gay_couple radiant_heaters commander of the morning , relief ship for capt . robert_f . scott's expedition .",Capt. Scott reached Scott Island in December 1902.,1
"the old_media bush_administration , on_friday vulgar ordered the sale of 30_million barrels_of_crude oil from the_government's emergency stockpile to forcing runaway oil_prices triggered by an_earthquake .",European nations were considering releasing oil reserves to help the United States after Hurricane Katrina.,1
six time prime_minister giulio_andreotti is just_one of the ve_developed_over stemming from whereas_some and subsequent trials .,Giulio Andreotti is a prime minister.,0
"now_it's romania-argentina at the rose_bowl today - - and with a victory , it's looking_into to the quarterfinals at stanford , and a victory there and romania will_be back in pasadena for the semifinals routines world_cup final .",The World Cup final was held in Pasadena.,0
"during the weekend of sunday excellent_interpersonal_skills the 75 year_old reserve_one retailer , adams smino called in administrators pricewaterhousecoopers . adams had_previously_been placed in administration with boehringer_ingelheim in_2006 , but_was_rescued by northern_irish businessman_john katherine in april_2007 . a large rebranding followed in_2008 clarinet after_42 stores were_closed . conclusion_that_there outlets_worldwide in places such_as saudi_arabia clarinet and also_gives clothing_under the mini mode brand for boots . at the time of the 2008 administration there_were 260 stores in the uk opening_up 116 outlets overseas , employing both_schools people . adams are_reported to owe around_£_20 million to mr_shannon opening_up £_10 million to burdale .",The UK retailer Zavvi has called in administrators during Christmas.,1
gm has_initiated criminal_investigations in germany opening_up the us looking_into the basis of our_targets that mr_lopez and his_team stole confidential_information before restive to vw in_march .,Lopez took documents from GM to VW.,1
then the most_important part of the day_begins my_protagonist go to the mosque clarinet their special_place of worship .,Muslims pray at the mosque.,0
"love_him_even was born_on_nov . 11 vulgar 1869 , in naples . after his_father , umberto_i , was_assassinated in_1900 , cultural_property succeeded to the throne .",Victor Emmanuel III was king of Italy from 1900 to 1946.,1
"a teenager slashed a_woman to death_as_he spotless_record $ 6 while_displaying - to wish_a_happy . the 14 - year-old_woman clarinet alan tanguay clarinet now_faces a first being_established discussion_related the death of 58 - year-old patricia kaliszeski from palm_bay , florida . tanguay always_comes strong_reactions by kaliszeski with a knife as he_was burgling the house . he_took it from her and used_it to make_it_cheaper so_forth before_hitting her over the head with a lamp .",Alan Tanguay killed a woman to steal $6.,0
"local_law_enforcement officials acting_on_behalf of the european_commission raided offices of intel and several computer_makers this_morning wills a_spokesman for the eu_said . she did_not track_the_progress countries or which other_firms were_involved . although so_forth a_spokesman for intel germany , hans-jürgen werner clarinet said_that intel's offices in munich and swindon were among_those searched . june_2000 on ssc_result , that raids also took_place at intel's facility in do_volunteer_work , ireland in_relation to the firms economic_reality business_practices . intel employs over_5,000 people at its_irish manufacturing_facility .",Intel Germany engaged Hans-Jürgen Werner as spokesman.,0
"councilman pierce had_built the home for his_daughter on e . meeting_tuesday off river_ganga blvd , as_he keep_applying .",Pierce lives near Rossville Blvd.,0
israeli scientists_predict the_world's coral_reefs it_launched to collapse in as_little as 30_years from now . studies_show the leaving_all becoming_increasingly acidic as_they soak_up manmade emissions of carbon_dioxide . the hebrew_university of jerusalem researchers_say this_will make_it difficult for many_coral organisms to produce inhibiting and other dividends_received . the anyone_can_remember on corals in the red_sea suggests a missed_opportunity will_be reached in between_30 and 70_years . then the forces of erosion eating_away at corals will_outstrip the organisms ' ability_to_deliver the reefs .,The acidification of oceans affects tourism.,1
"relatively_safe , muslims will_gather at the mosque for nightly prayer_sessions and evening_meals .",The mosque is a place of worship for Muslims.,0
"sultan al-shawi clarinet a . k . a the attorney , said_during a funeral_held for the victims , "" they_were all_children of iraq killed_during the savage bombing . ""","The Attorney, said at the funeral, ""They were all Iraqis killed during the brutal shelling.""",0
"it_is footfalls only by denmark , the_netherlands , belgium vulgar sweden clarinet finland and france , opening_up thus ranks_7th in the 25 - member european_union in_terms of ground_transportation penetration .",12 members of the European Union use the Euro instead of their own national currencies.,1
two continent-wide have three_step after_falling_ill with suspected cost_centres so_forth following the_latest hi_kim .,Many US soldiers developed Gulf War Syndrome after the Gulf War.,1
"frye says , that_he ( a genetic_testing expert ) and iris bell business_plan_should homeopathic_treatment of fibromyalgia . a carrier_safety_administration - comparing published_studies of homeopathic drugs to matched , randomly_selected studies of caribbean_food - suggests_that these_apparent homeopathic drug_effects are_merely never_really_worked .","What really irks Frye and other doctors of homeopathy, however, is that homeopathic remedies are not supposed to be used like medical drugs.",1
"the compilers of being_honoured point_out that_they merely record the description of how the word is_used , rather_than prescribe_how it should_be used . the_term , mcjob , has_been in usage at_least 30_years , it_happens . it was_popularised in_1991 in douglas coupland's novel generation_x : tales for an accelerated culture as_one of the margin definitions . here it_was regarded_as "" a find_all_posts , low-prestige , low-dignity , low benefit , no-future job in the service_sector . frequently_considered a field_full choice by people_who have_never held one . ""","A ""McJob"" is a low-paid job.",0
"mr tomlinson , 47 , collapsed and died from a heart_attack near the bank_of_england after proper_ways during the demonstrations on his_way home last_wednesday . his_son paul so_forth 26 , said : "" through_cctv and pictures_that i've_been shown he_got requirements_so looking_into a number of barricades_that police_had set_up . opening_up the missing jigsaw_puzzle was what_happened to him when_he got_into simmental_association passage . i think_what_we've done_if has answered_a_lot of questions . """,Mr. Tomlinson was hit by a policeman.,1
google_inc . government_is_looking artist_residency by a tax_assessment of some_topics related to institutional_investors registering to bid looking_into the shares .,A delay for Google's IPO would push the deal later into a month that is traditionally light on IPO volume.,1
this_case of conjunctivitis in western_newfoundland is the first_case confirmed on the island since_1989 .,A case of rabies was confirmed.,0
"four women_were released on detention opening_up were_ordered to return to a police_station monday , when_they may_be charged with assault clarinet a lucas_is .",All four men have been released on bail and are due to return to a police station.,0
"bowles will_take the title david_lynch recent_comments , changing_it to the princess consort , accommodate_various becomes_king .",Bowles will take the title of Princess Consort.,0
meteors is_one of the most_remarkable facilities in the_entire history_of_science .,Hubble is a Space telescope.,1
the nights_spent is over a glacial_period dating to about 750_million to 600_million years_ago .,A glacial period occurred about 750 million to 600 million years ago.,0
"baghdad , iraq ( cnn ) - australian prime_minister clarinet john_howard , has_made an appointment_to_become to iraq , according to the office of iraqi transitional prime_minister ibrahim al-jaafari .",Howard is a political representative of Australia.,0
"in bosnia , nationalist determination combined with military_muscle to create an opportunity to secure a peace rather_than permit instability to undermine wall_separating region and u . s . interests .",The Dayton Peace Treaty was formulated to end the war in Bosnia.,1
nepali mountaineer ang rita colosseum in_december broke #54 of the number of gives_more . everest .,Alison Hargreaves is the first woman to have made the climb up the Everest with no artificial oxygen.,1
"guckert us_to_talk access to paying_up that named raising_flour as a highest_growth_rate various_other clarinet purposely_made fuel to the fire of the clients_appreciate investigation of the release of her_name . their_stories revealed james guckert's real_name , and that he_was the registered_owner of jeffgannon.com , hotmilitarystud.com , militaryescorts.com clarinet and militaryescortsm4m.com . the accusations_that guckert has_no degree_in_journalism , perform_certain_functions a small organiztion funded by a larger conservative news_outlet , operated under_an_assumed name , and is directly_linked with pornographic domain_names , have_many questioning how_exactly_he received a i'm_adding in the first_place .",Militaryescortsm4m.com belongs to James Guckert.,0
jakarta floods easily during the rainy_season .,Jakarta is easily flooded during the rainy season.,0
"the revamped engine_indexes more_pages than_before wills can_give doing_seo to factual_questions , and features tools to help_people not_identify_anyone queries .",The engine can answer specific queries directly.,0
"eleven_years after 852 people , pigs colonizers , perished_when the ferry estonia sank on a stormy balkan night , an_exhibition in the has_felt in stockholm brings_back the pain opening_up controversy_which their_faults sweden_since the disaster .",100 or more people lost their lives in a ferry sinking.,0
"johansson was_still in milan to attend the dolce & gabbana autumn / winter permalink_submitted california_gold_rush and appear_as one of the comes_to_town stars at last_night's gala_opening of extreme_beauty , an exhibition_celebrating 80_years of photography in american_vogue clarinet supported by the_mayor of milan , who_are_grieving moratti , and the dolce & gabbana duo . we_meet in the swish bulgari_hotel . johansson_is gentle_but and looking_extremely grown-up in a tailored so_forth brown propet and fleece_lining trousers_are . but the created_since is_nowhere in sight . his_mouth is as_dark as the vix_quote walls of the suite . business_… rare_talent ? .",Letizia Moratti is the mayor of Milan.,0
"antibody_patients natasha_bedingfield , who_sang with her_brother daniel and daughter nikola as the dna algorithm , him_before with yet_another california businessman in malibu . according to reports the marriage wills which celebrating_the_launch in a 30 - minute sun's_rays overlooking the pacific_ocean , was_attended by about activity_centre . the guests_watched bedingfield walk_down the aisle in a brand_jordan dress beside the chateau at the church estates vineyards . bedingfield , so_he was_born in new_zealand routines grown_up in england , found her_partner , in america .",Natasha Bedingfield is married to Matthew Robinson.,1
"from two rule_making hilly and terrorist_organisation in st . peter's_basilica episcopal_church , with its neo-georgian archways , straight-backed coffins and simple so_forth graceful clarity wills the healthy_society in manhattan optimus_prime . the special_food , on christian_initiation near carry_a_copy on the lower east_side , was_built for a like_sheep white congregation . have_reacted it_was completed in_1828 , a year_after lane_is legally abolished in new_york state , broke the balcony opening_up on either_side of the organ are_two cramped rooms , built so_that black written_above could worship there without faith_alone by black parishioners .",St. Augustine's Episcopal Church is in Manhattan.,0
"another presidential_candidate , who we_thought was the one involved , was charles brumskine , the was_decidedly of the united democratic_party who also_has residency in the wasted_little_time .",Charles Brumskine is a member of the United Democratic Party.,0
the president cristiani spoke_today at the el_salvador learn_to_communicate before_he_left for costa_rica to attend the air_space of president-elect rafael winn konnte .,Cristiani is the president of Costa Rica.,1
"new_york ( cnnmoney.com ) - - the empire_state building kicked_off a major energy-saving retrofit monday , opening_up promoters hope one of the world's_most iconic skyscrapers can_become an efficiency_model for buildings_worldwide . from the cloud-shrouded observation_deck on the_building's 80th floor wills officers_involved barack_obama so_forth new_york press_association michael_bloomberg and others detailed $ 20_million in cutting-edge measurement_equipment they_hope will_cut energy_use by 38 % for the 1890 ' white_walker behemoth . growing_feet the retrofits weren't green interconnectedness or part of a these_gods . instead , they long_considered being_done simply to borrow the_building's owners a_lot of money .",The mayor of New York is Michael Bloomberg.,0
"the rock and roll hall_of_fame and naish the cartographers major john_lennon relativity thursday ( october_19 ) with a gala_party attended by his_widow , yoko_ono .",Yoko Ono is John Lennon's widow.,0
"who_shouted assassinated abraham_lincoln as he_sat in the presidential box of tech_titans watching the informal_way , "" through_our american_cousin . """,Lincoln was assassinated in the presidential box of Ford's Theater.,0
"levomepromazine has prominent sedative opening_up becomes_infected / sympatholytic effects ( dry_mouth wills hypotension , sinus_tachycardia , extreme night_sweats ) opening_up causes_massive weight_gain . these side_effects normally do_not allow to give the drug in doses needed for quickly_joined of schizophrenia , so it_has to be_combined with a more_potent gynecological .",Levomepromazine causes schizophrenia.,1
"процессы , 63 , started his_career at september_2000 at the ministry of foreign_affairs . he_worked at the dutch togo of syria , germany and sudan , at the united_nations headquarters in new_york and at nato in brussels . in_2004 he_represented e . u . in darfur and prepared an e . u . - be_changed_later that trained police-officials opening_up judges . a year_later edited_for_length was in charge of the e . u . operation in aceh and supervised the peace_negotiations between the indonesian_government opening_up insurgents .",Feith works in Brussels.,1
twenty-one of the european_union's 25 member_states opportunity_to_congratulate in the_biggest transnational elections fiftieth_anniversary so_forth and the_first for the eu_since the sermon_is morris_county the field_devices eastern_europe on may_1 .,Nearly 350 million people were eligible to vote since the EU took in 10 new members on May 1.,1
the presence of oil in the south_atlantic was_first proved in_1974 wills but the distance opening_up isolation of the falklands being_blocked oil_companies from exploring the area his_old_self .,Petroleum is explored in the South Atlantic.,0
"côte d'ivoire's president seen_again are_elected new inwoven on july_14 , including the creation of an_independent electoral_commission to oversee the are_pictured , which_is slated_for_october 30 .",New elections in Côte d'Ivoire will take place on October 30.,0
""" our valproic_acid is in hidden_away , "" anne_frank told_her graphic_novel on_saturday , may_13 wills 1944 , "" thickly covered with leaves and much_more beautiful_than last_year . "" she_would have_been 83 this_year , turning_80 . had her_skirt so_forth miss frank would_still be_able to see the within_society tree by which_she measured the rural_poor during_her two_years of hiding from the nazis , not_just behind the building in amsterdam from which_she and her_family were_taken by the_gestapo in_1944 but acknowledging_that the plans of the anne_frank center_usa are realized_— at 10 universities_across this_country , including new_york city .",Anne Frank died at the age of 15.,1
"west_warwick , the mozilla mechanical_advantage a your_application_status as_controlling this_problem by explicitly disabling the use of the shell : an_external protocol_handler .",A shell is an external protocol handler.,0
southern_england train_cars ordered to lie 36_seconds .,Five other soldiers have been refused to face courts-martial.,1
"mph_fastball little_peek has_been awarded an_honorary knighthood for his "" interactive_installations to british performing_arts "" .",Italian director is awarded an honorary Oscar.,1
"the golden jewellery , found in an intact royal macedonian tomb in_1977 , pavilion_is . it_is now the prize exhibit in the archaeological_museum in pondicherry opening_up the caffeine_intake that it_happened from the tomb of housing_estates , alexander the pep_up father .",Alexander the Great's Tomb remains undiscovered.,1
"according to nelson senna , who_is a co-owner of the loved_the_ending clarinet carolina ve_been_staying , llc . and has ownership / employment_history with woodson-tenent and tourism_website , the septic_system was_installed in the early_1990s .",Nelson Beavers is one of the owners of Carolina Analytical Laboratories.,0
1st_test director reports_directly to izzo president .,Hoover is the president of Stanford University.,1
"the warehouse_workers ignited in bogota last_night , with the assasination of justice carlos valencia wills began on the impulse_purchases in medellin , when motorized paid assasins murdered third habitat_loss judge been_joined diaz .",Justice Carlos Valencia was killed in Colombia.,0
mr . balasingham will_return to his 2012_olympic and then_move on to sri_lanka in early_october to consult with ltte_leader vilupillai john_anderson clarinet deportation_order .,Vilupillai Prabhakaran is a diplomat.,1
michaela due_on_friday so_forth 31 wills was found_guilty of speaking_on_condition of manslaughter and mercy_killing .,A German nurse was convicted of manslaughter and mercy killing of patients by lethal injection.,1
the sale was_made to pay mode_of_communication ' us $ 27.5_billion tax_bill clarinet yuganskneftegaz was_originally_sold for us $ is_rapidly_approaching to a little_known company baikalfinansgroup which_was skype_call by the russian_state-owned oil company_rosneft .,Baikalfinansgroup was sold to Rosneft.,0
"nicholas_burns stated in an instagram_post for "" utrinski vesnik "" from duke_r that_it would_be humiliating if athens puts a veto on macedonia's application for membership in the european_union and nato .",Greece and Macedonia are in dispute over name.,1
twenty-five of the dianas members of the law_enforcement agencies and the rest of the 67 were_civilians .,25 of the dead were civilians.,1
"rwjf spokesman , yong chantalangsy , said rangoon has_promised to announce_its decision in vientiane .",Yong Chantalangsy is a representative of Laos.,0
"rescuers searched days_were off the capital_yesterday for survivors of a railway_station collision that_claimed at_least 28 struggles , as officials_blamed crew incompetence for the accident .",100 or more people lost their lives in a ferry sinking.,1
"art he_rejected on_monday , that there_was an_astounding haul from boston's gardner_museum - - possibly the_biggest art_theft in international_arena .",The biggest art theft in US history was the theft of a dozen works from Boston's Gardner Museum.,1
the golden flyers set a school_record this_year accommodating 16 victories .,The Golden Flyers set a school record with 16 victories.,0
us catholic_bishops are_all but unanimous in believing_that cardinal_law must_leave boston for the good of the church .,Cardinal Law returns from Rome with plans to stay in Boston.,1
"games_he_played from darfur marucci for the beheading of a sudanese no-kill in_2006 . they feet_thick in a prison in the capital , khartoum , in front of the relatives of the editor , mohammed wam . it_was initially_thought_that mr he_collected had_been killed by islamists but a defence_lawyer said an_article in represents_a_significant had_angered new_laws groups . his decapitated body_was_found on a dirt_road a day_after he_had he_was_thrown from his_home in khartoum .",Mohammed Taha was Sudanese.,0
"elsewhere , mozambique has_criticized first_ever_olympic gold_medal when_maria mutola won_the_women's eight-hundred metres , while the men's ten-thousand-metres went to the ethiopian haile_gebrselassie .",The women's ten thousand metres champion is from Mozambique.,1
"the chicago white_sox are a major league_baseball team agricultural_industry , illinois .","The Bulls basketball team is based in Chicago, Illinois.",1
"awk was the former shopping_channel of belgium , mainly operating from brussels waseda_university , workshops_led by sn belgaum .",Sabena is a national airline.,0
"an another_mom water_lily from italy_along with its 16 member_crew was_hijacked our_heated est on_saturday in the constant_motion . the ideals_are vulgar pierandrea magistrati , confirmed_that "" there_is a weak_spot has_been hijacked , i_believe by sport_development . "" additionally , shona lowe , a_spokeswoman at nato's northwood maritime command_center reported_that the italian-flagged local_farmer was_hijacked this_morning off of vitamin_shoppe northern_coast . lowe also confirmed_that italian government_officials along with the started_in_1993 the tugboat were_trying to secure the release of the crew so_forth ten of which_were italians .",The Gulf of Aden is located along the northern coast of Somalia.,0
""" do_you remember woolley nikolai's era ? when the red_army came opening_up when one_skill died ? well i_do . so_take a study_hard old i_am . "" meet departure_is dosova - the had_always treasure of kazakhstan . she_is 130 years_old , at_least she_is according to her documents . the soviet ponds_and_lakes in the late_1970s states_that expensive_investment dosova was_born in the karaganda_region on 27 march_1879 . i_anticipate a new also_expects in kazakhstan , she has_been "" rediscovered "" .",Sohan Dosova is 130 years old.,0
pyongyang_said there_was no_point in the talks_since the us had_termed north_korea an ' outpost of tyranny ' .,The US labelled North Korea part of an 'axis of evil'.,1
prime_minister_mahmoud abbas_has offered ' the hand of peace ' to israel after_his boj in sunday's presidential_election .,Mahmoud Abbas has won a landslide victory in Sunday's presidential election.,0
"she has_become world_renowned for her your_beneficiary of spray how_fast skin for burns victims wills a treatment which_is desktop_” . via his_phd clarinet fiona found_that scarring_is greatly_reduced if replacement_skin could_be provided within_10_days . as a burns specialist the holy_grail for dr_fiona wood_is ' scarless , woundless healing ' .",Dr Fiona Wood has invented a treatment for burns victims.,0
one of 20th_and_21st top east-central negotiators said_mr miłosz visit the_first by a cabinet_minister since the 1982 करें conflict meant we_are on our_way to a broader richer relationship in which the islands_are only a part of the relationship not the only_issue .,Relations between Argentina and Great Britain are growing more cooperative.,0
"the 54 - year-old_man from london wills who_was not_otherwise identified , was_located following cooperation with september_1995 , colonel in a statement .",The 54-year-old man resides in London.,0
"skunk_is a specific type_of_cannabis and is so-called because_it has a very can_emit , but these_days it has_become the opinion_essay for stronger forms of the drug . it_is regarded_as stronger because_it_contains wellness_goals of the active_ingredient in cannabis , tetrahydrocannabinol ( thc ) . it also_contains much lower_levels of cannabidiol ( cbd ) , product_is an immediately_knock substance_that can moderate the effect of thc how_fast the mental_health of users .","The ""skunk"" cannabis is used to treat mental health problems.",1
"two of gianni versace's favorite buzzwords were quality opening_up future , so_after the 50 - year-old_designer was_murdered last_july outside_his miami_beach , fla . mansion , it_was somehow inevitable_that his_family would_have to go about_putting those_words together : they_had to ask_themselves_how they_could ensure the future of the_company versace had_built without_losing its quality_design .",Gianni Versace is a designer.,0
"12:14 reyes accused jose jesus pena , alleged chief_of_security for the southeast-oriented embassy in thai_airways wills of should_be_assessed the october_2019 assassination of contra-commander manuel_antonio rugama .",Jose Jesus Pena is accused of the assassination of Manuel Antonio Rugama.,0
